, Dolphins, Cowboys, Dolphins, Cowboys, Dolphins, Cowboys, Dolphins, Cowboys, Dolphins, Cowboys, Dolphins, Cowboys, Dolphins, Cowboys, Dolphins, Cowboys, Dolphins, Cowboys, Dolphins, Cowboys, Dolphins, Cowboys, Dolphins, Cowboys, Dolphins, Cowboys, Dolphins, Cowboys, Dolphins, Cowboys, Dolphins, Cowboys, Dolphins, Cowboys, Dolphins, Cowboys, Dolphins, Cowboys, Dolphins, Cowboys, Dolphins, Cowboys, Dolphins, Cowboys, Dolphins, Cowboys, Dolphins, Cowboys, Dolphins, Cowboys, Dolphins, Cowboys, Dolphins, Cowboys, Dolphins, Cowboys, Dolphins, Cowboys, Dolphins, Cowboys, Dolphins, Cowboys, Dolphins, Cowboys, Dolphins, Cowboys, Dolphins, Cowboys, Dolphins, Cowboys, Dolphins, Cowboys, Dolphins, Cowboys, Dolphins, Cowboys, Dolphins, Cowboys, Dolphins, Cowboys, Dolphins, Cowboys, Dolphins, Cowboys, Dolphins, Cowboys, Dolphins, Cowboys, Dolphins, Cowboys, Dolphins, Cowboys, Dolphins, Cowboys, Dolphins, Cowboys, Dolphins, Cowboys, Dolphins, Cowboys, Dolphins, Cowboys, Dolphins, Cowboys, Dolphins, Cowboys, Dolphins, Cowboys, Dolphins, Cowboys, Dolphins, Cowboys, Dolphins, Cowboys, Dolphins, Cowboys, Dolphins, Cowboys, Dolphins, Cowboys, Dolphins, Cowboys, Dolphins, Cowboys, Dolphins, Cowboys, Dolphins, Cowboys, Dolphins, Cowboys, Dolphins, Cowboys, Dolphins, Cowboys, Dolphins, Cowboys, Dolphins, Cowboys, Dolphins, Cowboys, Dolphins, Cowboys, Dolphins, Cowboys, Dolphins, Cowboys, Dolphins, Cowboys, Dolphins, Cowboys, Dolphins, Cowboys, Dolphins, Cowboys, Dolphins, Cowboys, Dolphins, Cowboys, Dolphins, Cowboys, Dolphins, Cowboys, Dolphins, Cowboys, Dolphins, Cowboys, Dolphins, Cowboys, Dolphins, Cowboys, Dolphins, Cowboys, Dolphins, Cowboys, Dolphins, Cowboys, Dolphins, Cowboys, Dolphins, Cowboys, Dolphins, Cowboys, Dolphins, Cowboys, Dolphins, Cowboys, Dolphins, Cowboys, Dolphins, Cowboys, Dolphins, Cowboys, Dolphins, Cowboys, Dolphins, Cowboys, Dolphins, Cowboys, Dolphins, Cowboys, Dolphins, Cowboys, Dolphins, Cowboys, Dolphins, Cowboys, Dolphins, Cowboys, Dolphins, Cowboys, Dolphins, Cowboys, Dolphins, Cowboys, Dolphins, Cowboys, Dolphins, Cowboys, Dolphins, Cowboys, Dolphins, Cowboys, Dolphins, Cowboys, Dolphins, Cowboys, Dolphins, Cowboys, Dolphins, Cowboys, Dolphins, Cowboys, Dolphins, Cowboys, Dolphins, Cowboys, Dolphins, Cowboys, Dolphins, Cowboys, Dolphins, Cowboys, Dolphins, Cowboys, Dolphins, Cowboys, Dolphins, Cowboys, Dolphins, Cowboys, Dolphins, Cowboys, Dolphins, Cowboys, Dolphins, Cowboys
, Sharks, Sharks, Roosters, Roosters, Sharks, Sharks, Roosters, Roosters, Sharks, Sharks, Roosters, Roosters, Sharks, Sharks, Roosters, Roosters, Sharks, Sharks, Roosters, Roosters, Sharks, Sharks, Roosters, Roosters, Sharks, Sharks, Roosters, Roosters, Sharks, Sharks, Roosters, Roosters, Sharks, Sharks, Roosters, Roosters, Sharks, Sharks, Roosters, Roosters, Sharks, Sharks, Roosters, Roosters, Sharks, Sharks, Roosters, Roosters, Sharks, Sharks, Roosters, Roosters, Sharks, Sharks, Roosters, Roosters, Sharks, Sharks, Roosters, Roosters, Sharks, Sharks, Roosters, Roosters, Sharks, Sharks, Roosters, Roosters, Sharks, Sharks, Roosters, Roosters, Sharks, Sharks, Roosters, Roosters, Sharks, Sharks, Roosters, Roosters, Sharks, Sharks, Roosters, Roosters, Sharks, Sharks, Roosters, Roosters, Sharks, Sharks, Roosters, Roosters, Sharks, Sharks, Roosters, Roosters, Sharks, Sharks, Roosters, Roosters, Sharks, Sharks, Roosters, Roosters, Sharks, Sharks, Roosters, Roosters, Sharks, Sharks, Roosters, Roosters, Sharks, Sharks, Roosters, Roosters, Sharks, Sharks, Roosters, Roosters, Sharks, Sharks, Roosters, Roosters, Sharks, Sharks, Roosters, Roosters, Sharks, Sharks, Roosters, Roosters, Sharks, Sharks, Roosters, Roosters, Sharks, Sharks, Roosters, Roosters, Sharks, Sharks, Roosters, Roosters, Sharks, Sharks, Roosters, Roosters, Sharks, Sharks, Roosters, Roosters, Sharks, Sharks, Roosters, Roosters, Sharks, Sharks, Roosters, Roosters, Sharks, Sharks, Roosters, Roosters, Sharks, Sharks, Roosters, Roosters, Sharks, Sharks, Roosters, Roosters, Sharks, Sharks, Roosters, Roosters, Sharks, Sharks, Roosters, Roosters, Sharks, Sharks, Roosters, Roosters, Sharks, Sharks, Roosters, Roosters, Sharks, Sharks, Roosters, Roosters, Sharks, Sharks, Roosters, Roosters, Sharks, Sharks, Roosters, Roosters, Sharks, Sharks, Roosters, Roosters, Sharks, Sharks, Roosters, Roosters, Sharks, Sharks, Roosters, Roosters, Sharks, Sharks, Roosters, Roosters, Sharks, Sharks, Roosters, Roosters, Sharks, Sharks, Roosters, Roosters, Sharks, Sharks, Roosters, Roosters, Sharks, Sharks, Roosters, Roosters, Sharks, Sharks, Roosters, Roosters, Sharks, Sharks, Roosters, Roosters, Sharks, Sharks, Roosters, Roosters, Sharks, Sharks, Roosters, Roosters, Sharks, Sharks, Roosters, Roosters, Sharks, Sharks, Roosters, Roosters
, Panthers, Panthers, Panthers, Panthers, Rabbitohs, Rabbitohs, Rabbitohs, Rabbitohs, Panthers, Panthers, Panthers, Panthers, Rabbitohs, Rabbitohs, Rabbitohs, Rabbitohs, Panthers, Panthers, Panthers, Panthers, Rabbitohs, Rabbitohs, Rabbitohs, Rabbitohs, Panthers, Panthers, Panthers, Panthers, Rabbitohs, Rabbitohs, Rabbitohs, Rabbitohs, Panthers, Panthers, Panthers, Panthers, Rabbitohs, Rabbitohs, Rabbitohs, Rabbitohs, Panthers, Panthers, Panthers, Panthers, Rabbitohs, Rabbitohs, Rabbitohs, Rabbitohs, Panthers, Panthers, Panthers, Panthers, Rabbitohs, Rabbitohs, Rabbitohs, Rabbitohs, Panthers, Panthers, Panthers, Panthers, Rabbitohs, Rabbitohs, Rabbitohs, Rabbitohs, Panthers, Panthers, Panthers, Panthers, Rabbitohs, Rabbitohs, Rabbitohs, Rabbitohs, Panthers, Panthers, Panthers, Panthers, Rabbitohs, Rabbitohs, Rabbitohs, Rabbitohs, Panthers, Panthers, Panthers, Panthers, Rabbitohs, Rabbitohs, Rabbitohs, Rabbitohs, Panthers, Panthers, Panthers, Panthers, Rabbitohs, Rabbitohs, Rabbitohs, Rabbitohs, Panthers, Panthers, Panthers, Panthers, Rabbitohs, Rabbitohs, Rabbitohs, Rabbitohs, Panthers, Panthers, Panthers, Panthers, Rabbitohs, Rabbitohs, Rabbitohs, Rabbitohs, Panthers, Panthers, Panthers, Panthers, Rabbitohs, Rabbitohs, Rabbitohs, Rabbitohs, Panthers, Panthers, Panthers, Panthers, Rabbitohs, Rabbitohs, Rabbitohs, Rabbitohs, Panthers, Panthers, Panthers, Panthers, Rabbitohs, Rabbitohs, Rabbitohs, Rabbitohs, Panthers, Panthers, Panthers, Panthers, Rabbitohs, Rabbitohs, Rabbitohs, Rabbitohs, Panthers, Panthers, Panthers, Panthers, Rabbitohs, Rabbitohs, Rabbitohs, Rabbitohs, Panthers, Panthers, Panthers, Panthers, Rabbitohs, Rabbitohs, Rabbitohs, Rabbitohs, Panthers, Panthers, Panthers, Panthers, Rabbitohs, Rabbitohs, Rabbitohs, Rabbitohs, Panthers, Panthers, Panthers, Panthers, Rabbitohs, Rabbitohs, Rabbitohs, Rabbitohs, Panthers, Panthers, Panthers, Panthers, Rabbitohs, Rabbitohs, Rabbitohs, Rabbitohs, Panthers, Panthers, Panthers, Panthers, Rabbitohs, Rabbitohs, Rabbitohs, Rabbitohs, Panthers, Panthers, Panthers, Panthers, Rabbitohs, Rabbitohs, Rabbitohs, Rabbitohs, Panthers, Panthers, Panthers, Panthers, Rabbitohs, Rabbitohs, Rabbitohs, Rabbitohs, Panthers, Panthers, Panthers, Panthers, Rabbitohs, Rabbitohs, Rabbitohs, Rabbitohs, Panthers, Panthers, Panthers, Panthers, Rabbitohs, Rabbitohs, Rabbitohs, Rabbitohs, Panthers, Panthers, Panthers, Panthers, Rabbitohs, Rabbitohs, Rabbitohs, Rabbitohs, Panthers, Panthers, Panthers, Panthers, Rabbitohs, Rabbitohs, Rabbitohs, Rabbitohs, Panthers, Panthers, Panthers, Panthers, Rabbitohs, Rabbitohs, Rabbitohs, Rabbitohs, Panthers, Panthers, Panthers, Panthers, Rabbitohs, Rabbitohs, Rabbitohs, Rabbitohs
, Raiders, Raiders, Raiders, Raiders, Raiders, Raiders, Raiders, Raiders, Eels, Eels, Eels, Eels, Eels, Eels, Eels, Eels, Raiders, Raiders, Raiders, Raiders, Raiders, Raiders, Raiders, Raiders, Eels, Eels, Eels, Eels, Eels, Eels, Eels, Eels, Raiders, Raiders, Raiders, Raiders, Raiders, Raiders, Raiders, Raiders, Eels, Eels, Eels, Eels, Eels, Eels, Eels, Eels, Raiders, Raiders, Raiders, Raiders, Raiders, Raiders, Raiders, Raiders, Eels, Eels, Eels, Eels, Eels, Eels, Eels, Eels, Raiders, Raiders, Raiders, Raiders, Raiders, Raiders, Raiders, Raiders, Eels, Eels, Eels, Eels, Eels, Eels, Eels, Eels, Raiders, Raiders, Raiders, Raiders, Raiders, Raiders, Raiders, Raiders, Eels, Eels, Eels, Eels, Eels, Eels, Eels, Eels, Raiders, Raiders, Raiders, Raiders, Raiders, Raiders, Raiders, Raiders, Eels, Eels, Eels, Eels, Eels, Eels, Eels, Eels, Raiders, Raiders, Raiders, Raiders, Raiders, Raiders, Raiders, Raiders, Eels, Eels, Eels, Eels, Eels, Eels, Eels, Eels, Raiders, Raiders, Raiders, Raiders, Raiders, Raiders, Raiders, Raiders, Eels, Eels, Eels, Eels, Eels, Eels, Eels, Eels, Raiders, Raiders, Raiders, Raiders, Raiders, Raiders, Raiders, Raiders, Eels, Eels, Eels, Eels, Eels, Eels, Eels, Eels, Raiders, Raiders, Raiders, Raiders, Raiders, Raiders, Raiders, Raiders, Eels, Eels, Eels, Eels, Eels, Eels, Eels, Eels, Raiders, Raiders, Raiders, Raiders, Raiders, Raiders, Raiders, Raiders, Eels, Eels, Eels, Eels, Eels, Eels, Eels, Eels, Raiders, Raiders, Raiders, Raiders, Raiders, Raiders, Raiders, Raiders, Eels, Eels, Eels, Eels, Eels, Eels, Eels, Eels, Raiders, Raiders, Raiders, Raiders, Raiders, Raiders, Raiders, Raiders, Eels, Eels, Eels, Eels, Eels, Eels, Eels, Eels, Raiders, Raiders, Raiders, Raiders, Raiders, Raiders, Raiders, Raiders, Eels, Eels, Eels, Eels, Eels, Eels, Eels, Eels, Raiders, Raiders, Raiders, Raiders, Raiders, Raiders, Raiders, Raiders, Eels, Eels, Eels, Eels, Eels, Eels, Eels, Eels
, Bulldogs, Bulldogs, Bulldogs, Bulldogs, Bulldogs, Bulldogs, Bulldogs, Bulldogs, Bulldogs, Bulldogs, Bulldogs, Bulldogs, Bulldogs, Bulldogs, Bulldogs, Bulldogs, Dragons, Dragons, Dragons, Dragons, Dragons, Dragons, Dragons, Dragons, Dragons, Dragons, Dragons, Dragons, Dragons, Dragons, Dragons, Dragons, Bulldogs, Bulldogs, Bulldogs, Bulldogs, Bulldogs, Bulldogs, Bulldogs, Bulldogs, Bulldogs, Bulldogs, Bulldogs, Bulldogs, Bulldogs, Bulldogs, Bulldogs, Bulldogs, Dragons, Dragons, Dragons, Dragons, Dragons, Dragons, Dragons, Dragons, Dragons, Dragons, Dragons, Dragons, Dragons, Dragons, Dragons, Dragons, Bulldogs, Bulldogs, Bulldogs, Bulldogs, Bulldogs, Bulldogs, Bulldogs, Bulldogs, Bulldogs, Bulldogs, Bulldogs, Bulldogs, Bulldogs, Bulldogs, Bulldogs, Bulldogs, Dragons, Dragons, Dragons, Dragons, Dragons, Dragons, Dragons, Dragons, Dragons, Dragons, Dragons, Dragons, Dragons, Dragons, Dragons, Dragons, Bulldogs, Bulldogs, Bulldogs, Bulldogs, Bulldogs, Bulldogs, Bulldogs, Bulldogs, Bulldogs, Bulldogs, Bulldogs, Bulldogs, Bulldogs, Bulldogs, Bulldogs, Bulldogs, Dragons, Dragons, Dragons, Dragons, Dragons, Dragons, Dragons, Dragons, Dragons, Dragons, Dragons, Dragons, Dragons, Dragons, Dragons, Dragons, Bulldogs, Bulldogs, Bulldogs, Bulldogs, Bulldogs, Bulldogs, Bulldogs, Bulldogs, Bulldogs, Bulldogs, Bulldogs, Bulldogs, Bulldogs, Bulldogs, Bulldogs, Bulldogs, Dragons, Dragons, Dragons, Dragons, Dragons, Dragons, Dragons, Dragons, Dragons, Dragons, Dragons, Dragons, Dragons, Dragons, Dragons, Dragons, Bulldogs, Bulldogs, Bulldogs, Bulldogs, Bulldogs, Bulldogs, Bulldogs, Bulldogs, Bulldogs, Bulldogs, Bulldogs, Bulldogs, Bulldogs, Bulldogs, Bulldogs, Bulldogs, Dragons, Dragons, Dragons, Dragons, Dragons, Dragons, Dragons, Dragons, Dragons, Dragons, Dragons, Dragons, Dragons, Dragons, Dragons, Dragons, Bulldogs, Bulldogs, Bulldogs, Bulldogs, Bulldogs, Bulldogs, Bulldogs, Bulldogs, Bulldogs, Bulldogs, Bulldogs, Bulldogs, Bulldogs, Bulldogs, Bulldogs, Bulldogs, Dragons, Dragons, Dragons, Dragons, Dragons, Dragons, Dragons, Dragons, Dragons, Dragons, Dragons, Dragons, Dragons, Dragons, Dragons, Dragons, Bulldogs, Bulldogs, Bulldogs, Bulldogs, Bulldogs, Bulldogs, Bulldogs, Bulldogs, Bulldogs, Bulldogs, Bulldogs, Bulldogs, Bulldogs, Bulldogs, Bulldogs, Bulldogs, Dragons, Dragons, Dragons, Dragons, Dragons, Dragons, Dragons, Dragons, Dragons, Dragons, Dragons, Dragons, Dragons, Dragons, Dragons, Dragons
, Storm, Storm, Storm, Storm, Storm, Storm, Storm, Storm, Storm, Storm, Storm, Storm, Storm, Storm, Storm, Storm, Storm, Storm, Storm, Storm, Storm, Storm, Storm, Storm, Storm, Storm, Storm, Storm, Storm, Storm, Storm, Storm, Manly, Manly, Manly, Manly, Manly, Manly, Manly, Manly, Manly, Manly, Manly, Manly, Manly, Manly, Manly, Manly, Manly, Manly, Manly, Manly, Manly, Manly, Manly, Manly, Manly, Manly, Manly, Manly, Manly, Manly, Manly, Manly, Storm, Storm, Storm, Storm, Storm, Storm, Storm, Storm, Storm, Storm, Storm, Storm, Storm, Storm, Storm, Storm, Storm, Storm, Storm, Storm, Storm, Storm, Storm, Storm, Storm, Storm, Storm, Storm, Storm, Storm, Storm, Storm, Manly, Manly, Manly, Manly, Manly, Manly, Manly, Manly, Manly, Manly, Manly, Manly, Manly, Manly, Manly, Manly, Manly, Manly, Manly, Manly, Manly, Manly, Manly, Manly, Manly, Manly, Manly, Manly, Manly, Manly, Manly, Manly, Storm, Storm, Storm, Storm, Storm, Storm, Storm, Storm, Storm, Storm, Storm, Storm, Storm, Storm, Storm, Storm, Storm, Storm, Storm, Storm, Storm, Storm, Storm, Storm, Storm, Storm, Storm, Storm, Storm, Storm, Storm, Storm, Manly, Manly, Manly, Manly, Manly, Manly, Manly, Manly, Manly, Manly, Manly, Manly, Manly, Manly, Manly, Manly, Manly, Manly, Manly, Manly, Manly, Manly, Manly, Manly, Manly, Manly, Manly, Manly, Manly, Manly, Manly, Manly, Storm, Storm, Storm, Storm, Storm, Storm, Storm, Storm, Storm, Storm, Storm, Storm, Storm, Storm, Storm, Storm, Storm, Storm, Storm, Storm, Storm, Storm, Storm, Storm, Storm, Storm, Storm, Storm, Storm, Storm, Storm, Storm, Manly, Manly, Manly, Manly, Manly, Manly, Manly, Manly, Manly, Manly, Manly, Manly, Manly, Manly, Manly, Manly, Manly, Manly, Manly, Manly, Manly, Manly, Manly, Manly, Manly, Manly, Manly, Manly, Manly, Manly, Manly, Manly
, Tigers, Tigers, Tigers, Tigers, Tigers, Tigers, Tigers, Tigers, Tigers, Tigers, Tigers, Tigers, Tigers, Tigers, Tigers, Tigers, Tigers, Tigers, Tigers, Tigers, Tigers, Tigers, Tigers, Tigers, Tigers, Tigers, Tigers, Tigers, Tigers, Tigers, Tigers, Tigers, Tigers, Tigers, Tigers, Tigers, Tigers, Tigers, Tigers, Tigers, Tigers, Tigers, Tigers, Tigers, Tigers, Tigers, Tigers, Tigers, Tigers, Tigers, Tigers, Tigers, Tigers, Tigers, Tigers, Tigers, Tigers, Tigers, Tigers, Tigers, Tigers, Tigers, Tigers, Tigers, Titans, Titans, Titans, Titans, Titans, Titans, Titans, Titans, Titans, Titans, Titans, Titans, Titans, Titans, Titans, Titans, Titans, Titans, Titans, Titans, Titans, Titans, Titans, Titans, Titans, Titans, Titans, Titans, Titans, Titans, Titans, Titans, Titans, Titans, Titans, Titans, Titans, Titans, Titans, Titans, Titans, Titans, Titans, Titans, Titans, Titans, Titans, Titans, Titans, Titans, Titans, Titans, Titans, Titans, Titans, Titans, Titans, Titans, Titans, Titans, Titans, Titans, Titans, Titans, Tigers, Tigers, Tigers, Tigers, Tigers, Tigers, Tigers, Tigers, Tigers, Tigers, Tigers, Tigers, Tigers, Tigers, Tigers, Tigers, Tigers, Tigers, Tigers, Tigers, Tigers, Tigers, Tigers, Tigers, Tigers, Tigers, Tigers, Tigers, Tigers, Tigers, Tigers, Tigers, Tigers, Tigers, Tigers, Tigers, Tigers, Tigers, Tigers, Tigers, Tigers, Tigers, Tigers, Tigers, Tigers, Tigers, Tigers, Tigers, Tigers, Tigers, Tigers, Tigers, Tigers, Tigers, Tigers, Tigers, Tigers, Tigers, Tigers, Tigers, Tigers, Tigers, Tigers, Tigers, Titans, Titans, Titans, Titans, Titans, Titans, Titans, Titans, Titans, Titans, Titans, Titans, Titans, Titans, Titans, Titans, Titans, Titans, Titans, Titans, Titans, Titans, Titans, Titans, Titans, Titans, Titans, Titans, Titans, Titans, Titans, Titans, Titans, Titans, Titans, Titans, Titans, Titans, Titans, Titans, Titans, Titans, Titans, Titans, Titans, Titans, Titans, Titans, Titans, Titans, Titans, Titans, Titans, Titans, Titans, Titans, Titans, Titans, Titans, Titans, Titans, Titans, Titans, Titans
, Knights, Knights, Knights, Knights, Knights, Knights, Knights, Knights, Knights, Knights, Knights, Knights, Knights, Knights, Knights, Knights, Knights, Knights, Knights, Knights, Knights, Knights, Knights, Knights, Knights, Knights, Knights, Knights, Knights, Knights, Knights, Knights, Knights, Knights, Knights, Knights, Knights, Knights, Knights, Knights, Knights, Knights, Knights, Knights, Knights, Knights, Knights, Knights, Knights, Knights, Knights, Knights, Knights, Knights, Knights, Knights, Knights, Knights, Knights, Knights, Knights, Knights, Knights, Knights, Knights, Knights, Knights, Knights, Knights, Knights, Knights, Knights, Knights, Knights, Knights, Knights, Knights, Knights, Knights, Knights, Knights, Knights, Knights, Knights, Knights, Knights, Knights, Knights, Knights, Knights, Knights, Knights, Knights, Knights, Knights, Knights, Knights, Knights, Knights, Knights, Knights, Knights, Knights, Knights, Knights, Knights, Knights, Knights, Knights, Knights, Knights, Knights, Knights, Knights, Knights, Knights, Knights, Knights, Knights, Knights, Knights, Knights, Knights, Knights, Knights, Knights, Knights, Knights, Warriors, Warriors, Warriors, Warriors, Warriors, Warriors, Warriors, Warriors, Warriors, Warriors, Warriors, Warriors, Warriors, Warriors, Warriors, Warriors, Warriors, Warriors, Warriors, Warriors, Warriors, Warriors, Warriors, Warriors, Warriors, Warriors, Warriors, Warriors, Warriors, Warriors, Warriors, Warriors, Warriors, Warriors, Warriors, Warriors, Warriors, Warriors, Warriors, Warriors, Warriors, Warriors, Warriors, Warriors, Warriors, Warriors, Warriors, Warriors, Warriors, Warriors, Warriors, Warriors, Warriors, Warriors, Warriors, Warriors, Warriors, Warriors, Warriors, Warriors, Warriors, Warriors, Warriors, Warriors, Warriors, Warriors, Warriors, Warriors, Warriors, Warriors, Warriors, Warriors, Warriors, Warriors, Warriors, Warriors, Warriors, Warriors, Warriors, Warriors, Warriors, Warriors, Warriors, Warriors, Warriors, Warriors, Warriors, Warriors, Warriors, Warriors, Warriors, Warriors, Warriors, Warriors, Warriors, Warriors, Warriors, Warriors, Warriors, Warriors, Warriors, Warriors, Warriors, Warriors, Warriors, Warriors, Warriors, Warriors, Warriors, Warriors, Warriors, Warriors, Warriors, Warriors, Warriors, Warriors, Warriors, Warriors, Warriors, Warriors, Warriors, Warriors, Warriors, Warriors, Warriors, Warriors, Warriors, Warriors
Storm, 0.0, 0.0, 0.0, 0.0, 0.0, 0.0, 0.0, 0.0, 0.0, 0.0, 0.0, 0.0, 0.0, 0.0, 0.0, 0.0, 0.0, 0.0, 0.0, 0.0, 0.0, 0.0, 0.0, 0.0, 0.0, 0.0, 0.0, 0.0, 0.0, 0.0, 0.0, 0.0, 0.0, 0.0, 0.0, 0.0, 0.0, 0.0, 0.0, 0.0, 0.0, 0.0, 0.0, 0.0, 0.0, 0.0, 0.0, 0.0, 0.0, 0.0, 0.0, 0.0, 0.0, 0.0, 0.0, 0.0, 0.0, 0.0, 0.0, 0.0, 0.0, 0.0, 0.0, 0.0, 0.0, 0.0, 0.0, 0.0, 0.0, 0.0, 0.0, 0.0, 0.0, 0.0, 0.0, 0.0, 0.0, 0.0, 0.0, 0.0, 0.0, 0.0, 0.0, 0.0, 0.0, 0.0, 0.0, 0.0, 0.0, 0.0, 0.0, 0.0, 0.0, 0.0, 0.0, 0.0, 0.0, 0.0, 0.0, 0.0, 0.0, 0.0, 0.0, 0.0, 0.0, 0.0, 0.0, 0.0, 0.0, 0.0, 0.0, 0.0, 0.0, 0.0, 0.0, 0.0, 0.0, 0.0, 0.0, 0.0, 0.0, 0.0, 0.0, 0.0, 0.0, 0.0, 0.0, 0.0, 0.0, 0.0, 0.0, 0.0, 0.0, 0.0, 0.0, 0.0, 0.0, 0.0, 0.0, 0.0, 0.0, 0.0, 0.0, 0.0, 0.0, 0.0, 0.0, 0.0, 0.0, 0.0, 0.0, 0.0, 0.0, 0.0, 0.0, 0.0, 0.0, 0.0, 0.0, 0.0, 0.0, 0.0, 0.0, 0.0, 0.0, 0.0, 0.0, 0.0, 0.0, 0.0, 0.0, 0.0, 0.0, 0.0, 0.0, 0.0, 0.0, 0.0, 0.0, 0.0, 0.0, 0.0, 0.0, 0.0, 0.0, 0.0, 0.0, 0.0, 0.0, 0.0, 0.0, 0.0, 0.0, 0.0, 0.0, 0.0, 0.0, 0.0, 0.0, 0.0, 0.0, 0.0, 0.0, 0.0, 0.0, 0.0, 0.0, 0.0, 0.0, 0.0, 0.0, 0.0, 0.0, 0.0, 0.0, 0.0, 0.0, 0.0, 0.0, 0.0, 0.0, 0.0, 0.0, 0.0, 0.0, 0.0, 0.0, 0.0, 0.0, 0.0, 0.0, 0.0, 0.0, 0.0, 0.0, 0.0, 0.0, 0.0, 0.0, 0.0, 0.0, 0.0, 0.0, 0.0, 0.0, 0.0, 0.0, 0.0, 0.0, 0.0, 0.0, 0.0, 0.0, 0.0, 0.0, 0.0
Panthers, 0.0, 0.0, 0.0, 0.0, 0.0, 0.0, 0.0, 0.027314941272876262, 0.0, 0.0, 0.0, 0.0, 0.0, 0.10319917440660474, 0.0, 0.0, 0.0, 0.0, 0.0, 0.0, 0.03210272873194221, 0.0, 0.0, 0.0, 0.0, 0.0, 0.0, 0.0, 0.0, 0.2288329519450801, 0.08190008190008191, 0.0, 0.0, 0.0, 0.0, 0.0, 0.0, 0.0, 0.0, 0.0, 0.0, 0.0, 0.0, 0.0, 0.0, 0.0, 0.0, 0.0, 0.0, 0.0, 0.0, 0.0, 0.0, 0.0, 0.0, 0.0, 0.0, 0.0, 0.0, 0.0, 0.0, 0.0, 0.0, 0.0, 0.0, 0.0, 0.0, 0.0, 0.0, 0.0, 0.025393600812595223, 0.0, 0.0, 0.0, 0.0, 0.0, 0.0, 0.0, 0.0, 0.0, 0.0, 0.0, 0.0, 0.0, 0.0, 0.0, 0.0, 0.0, 0.0, 0.0, 0.0, 0.0, 0.0, 0.0, 0.0, 0.0, 0.0, 0.0, 0.0, 0.0, 0.0, 0.0, 0.0, 0.0, 0.0, 0.0, 0.0, 0.0, 0.0, 0.0, 0.0, 0.0, 0.0, 0.0, 0.0, 0.0, 0.0, 0.0, 0.0, 0.0, 0.0, 0.0, 0.0, 0.0, 0.0, 0.0, 0.0, 0.0, 0.0, 0.0, 0.0, 0.0, 0.0, 0.0, 0.0, 0.0, 0.0, 0.0, 0.0, 0.0, 0.0, 0.0, 0.033772374197906116, 0.0, 0.0, 0.0, 0.0, 0.0, 0.0, 0.0, 0.0, 0.0, 0.0, 0.0, 0.0, 0.0, 0.08326394671107411, 0.0, 0.0, 0.0, 0.0, 0.0, 0.0, 0.0, 0.0, 0.0, 0.0, 0.0, 0.0, 0.0, 0.0, 0.0, 0.0, 0.0, 0.0, 0.0, 0.0, 0.0, 0.0, 0.0, 0.0, 0.0, 0.0, 0.0, 0.0, 0.0, 0.0, 0.0, 0.0, 0.0, 0.0, 0.0, 0.0, 0.0, 0.0, 0.0, 0.0, 0.0, 0.0, 0.0, 0.0, 0.0, 0.0, 0.0, 0.0, 0.0, 0.0, 0.0, 0.0, 0.0, 0.0, 0.0, 0.0, 0.0, 0.0, 0.0, 0.0, 0.0, 0.0, 0.0, 0.0, 0.0, 0.0, 0.303951367781155, 0.0, 0.0, 0.0, 0.0, 0.0, 0.0, 0.0, 0.0, 0.0, 0.0, 0.0, 0.0, 0.0, 0.0, 0.1798561151079137, 0.0, 0.0, 0.0, 0.0, 0.0, 0.0, 0.0, 0.0, 0.0, 0.0, 0.0, 0.0, 0.0, 0.0, 0.0, 0.0, 0.0
Roosters, 0.017626736233519, 0.030147723846849564, 0.0, 0.0, 0.032399157621901827, 0.0, 0.0, 0.0, 0.022172949002217293, 0.023326335432703522, 0.0, 0.0, 0.05022601707684581, 0.0, 0.0, 0.0, 0.028669724770642203, 0.060994205550472705, 0.0, 0.0, 0.03210272873194221, 0.0, 0.0, 0.055991041433370664, 0.022197558268590455, 0.0, 0.0, 0.0, 0.21344717182497333, 0.2288329519450801, 0.0, 0.0, 0.04049402713099817, 0.04287245444801715, 0.0, 0.0, 0.043402777777777776, 0.0, 0.0, 0.0, 0.0, 0.0, 0.0, 0.0, 0.0, 0.0, 0.0, 0.0, 0.06175380815150268, 0.0, 0.0, 0.0, 0.0, 0.0, 0.0, 0.0, 0.0, 0.0, 0.0, 0.0, 0.0, 0.0, 0.0, 0.0, 0.02064267529071768, 0.0, 0.0, 0.0, 0.09612303748798462, 0.07042253521126761, 0.0, 0.0, 0.0437636761487965, 0.09685230024213075, 0.0, 0.0, 0.0, 0.22271714922048996, 0.0, 0.0, 0.0, 0.030376670716889428, 0.0, 0.0, 0.0, 0.0, 0.0, 0.0, 0.09144947416552354, 0.0, 0.0, 0.0, 0.211864406779661, 0.0, 0.0, 0.0, 0.04004004004004004, 0.04233700254022015, 0.0, 0.0, 0.0, 0.0, 0.0, 0.0, 0.06313131313131314, 0.0, 0.0, 0.0, 0.0, 0.0, 0.0, 0.0, 0.04152823920265781, 0.0, 0.0, 0.0, 0.1841620626151013, 0.4166666666666667, 0.0, 0.0, 0.0, 0.2717391304347826, 0.0, 0.0, 0.5555555555555556, 0.0, 0.0, 0.0, 0.008718649190618733, 0.006274706657463764, 0.002338470172812946, 0.0, 0.013404825737265418, 0.0, 0.0, 0.0, 0.01838404265097895, 0.0, 0.00735456350665588, 0.0, 0.0, 0.0881057268722467, 0.0, 0.0, 0.0, 0.0, 0.0, 0.0, 0.027122321670735017, 0.05730659025787965, 0.0, 0.0, 0.0, 0.0, 0.0, 0.0, 0.0, 0.1724137931034483, 0.0, 0.0, 0.0, 0.0, 0.0, 0.0, 0.0, 0.0, 0.0, 0.0, 0.02675943270002676, 0.0, 0.0, 0.0, 0.0, 0.0, 0.0, 0.0, 0.017455053237912375, 0.0, 0.0, 0.0, 0.0, 0.0, 0.0, 0.0, 0.05353319057815846, 0.0, 0.0, 0.0, 0.0, 0.0, 0.0, 0.0, 0.011487650775416428, 0.0, 0.0, 0.0, 0.02598752598752599, 0.1176470588235294, 0.0, 0.0, 0.018453589223103892, 0.038669760247486466, 0.0, 0.0, 0.0, 0.0, 0.0, 0.0, 0.011712344811431248, 0.025621316935690495, 0.0, 0.0, 0.05200208008320333, 0.0, 0.0, 0.0, 0.037064492216456635, 0.0, 0.0, 0.0, 0.0, 0.0, 0.0, 0.0, 0.0, 0.035842293906810034, 0.0, 0.0, 0.0755287009063444, 0.0, 0.0, 0.0, 0.0, 0.0, 0.0, 0.0, 0.0, 0.0, 0.0, 0.0, 0.03363605785401951, 0.0, 0.0, 0.0, 0.0, 0.0, 0.0, 0.0, 0.0, 0.0, 0.0, 0.0, 0.0, 0.0, 0.0, 0.0
Raiders, 0.0, 0.0, 0.0, 0.0, 0.0, 0.0, 0.0, 0.0, 0.0, 0.0, 0.0, 0.0, 0.0, 0.0, 0.0, 0.0, 0.0, 0.0, 0.0, 0.0, 0.0, 0.0, 0.0, 0.0, 0.0, 0.0, 0.0, 0.0, 0.0, 0.0, 0.0, 0.0, 0.0, 0.0, 0.0, 0.0, 0.0, 0.0, 0.0, 0.0, 0.0, 0.0, 0.0, 0.0, 0.0, 0.0, 0.0, 0.0, 0.0, 0.0, 0.0, 0.0, 0.0, 0.0, 0.0, 0.0, 0.0, 0.0, 0.0, 0.0, 0.0, 0.0, 0.0, 0.0, 0.0, 0.0, 0.0, 0.0, 0.0, 0.0, 0.0, 0.0, 0.0, 0.0, 0.0, 0.0, 0.0, 0.0, 0.0, 0.0, 0.0, 0.0, 0.0, 0.0, 0.0, 0.0, 0.0, 0.0, 0.0, 0.0, 0.0, 0.0, 0.0, 0.0, 0.0, 0.0, 0.0, 0.0, 0.0, 0.0, 0.0, 0.0, 0.0, 0.0, 0.0, 0.0, 0.0, 0.0, 0.0, 0.0, 0.0, 0.0, 0.0, 0.0, 0.0, 0.0, 0.0, 0.0, 0.0, 0.0, 0.0, 0.0, 0.0, 0.0, 0.0, 0.0, 0.0, 0.0, 0.0, 0.0, 0.0, 0.0, 0.0, 0.0, 0.0, 0.0, 0.0, 0.0, 0.0, 0.0, 0.0, 0.0, 0.0, 0.0, 0.0, 0.0, 0.0, 0.0, 0.0, 0.0, 0.0, 0.0, 0.0, 0.0, 0.0, 0.0, 0.0, 0.0, 0.0, 0.0, 0.0, 0.0, 0.0, 0.0, 0.0, 0.0, 0.0, 0.0, 0.0, 0.0, 0.0, 0.0, 0.0, 0.0, 0.0, 0.0, 0.0, 0.0, 0.0, 0.0, 0.0, 0.0, 0.0, 0.0, 0.0, 0.0, 0.0, 0.0, 0.0, 0.0, 0.0, 0.0, 0.0, 0.0, 0.0, 0.0, 0.0, 0.0, 0.0, 0.0, 0.0, 0.0, 0.0, 0.0, 0.0, 0.0, 0.0, 0.0, 0.0, 0.0, 0.0, 0.0, 0.0, 0.0, 0.0, 0.0, 0.0, 0.0, 0.0, 0.0, 0.0, 0.0, 0.0, 0.0, 0.0, 0.0, 0.0, 0.0, 0.0, 0.0, 0.0, 0.0, 0.0, 0.0, 0.0, 0.0, 0.0, 0.0, 0.0, 0.0, 0.0, 0.0, 0.0, 0.0, 0.0, 0.0, 0.0, 0.0, 0.0, 0.0, 0.0, 0.0, 0.0, 0.0, 0.0, 0.0
Dolphins, 0.0, 0.0, 0.0, 0.006108362348054486, 0.0, 0.0, 0.0, 0.027314941272876262, 0.0, 0.0, 0.0, 0.039580447259054026, 0.0, 0.0, 0.0, 0.0, 0.0, 0.0, 0.0, 0.0, 0.0, 0.0, 0.0, 0.0, 0.0, 0.0, 0.0, 0.0, 0.0, 0.2288329519450801, 0.0, 0.0, 0.0, 0.0, 0.0, 0.0, 0.0, 0.0, 0.0, 0.07955449482895784, 0.0, 0.0, 0.0, 0.0, 0.0, 0.0, 0.0, 0.0, 0.0, 0.0, 0.0, 0.0, 0.0, 0.0, 0.0, 0.0, 0.0, 0.0, 0.0, 0.0, 0.0, 0.0, 0.0, 0.0, 0.0, 0.014997000599880022, 0.0, 0.01203659123736158, 0.0, 0.0, 0.0, 0.05524861878453039, 0.0, 0.048426150121065374, 0.0, 0.03913894324853229, 0.0, 0.22271714922048996, 0.0, 0.0, 0.0, 0.0, 0.0, 0.0, 0.0, 0.0, 0.0, 0.0, 0.0, 0.0, 0.0, 0.0, 0.0, 0.0, 0.0, 0.0, 0.0, 0.0, 0.0, 0.0, 0.0, 0.0, 0.0, 0.0, 0.0, 0.0, 0.0, 0.0, 0.0, 0.0, 0.0, 0.0, 0.0, 0.0, 0.0, 0.06925207756232687, 0.0, 0.0, 0.0, 0.0, 0.0, 0.0, 0.0, 0.0, 0.0, 0.0, 0.0, 0.0, 0.0, 0.0, 0.0, 0.0, 0.0, 0.0, 0.0, 0.0, 0.0, 0.0, 0.0, 0.0, 0.0, 0.0, 0.0, 0.0, 0.0, 0.012781186094069532, 0.0, 0.0, 0.0, 0.0, 0.0, 0.048285852245292124, 0.0, 0.0, 0.0, 0.0, 0.0, 0.0, 0.0, 0.0, 0.0, 0.0, 0.0, 0.0, 0.0, 0.0, 0.0, 0.06779661016949153, 0.0, 0.0, 0.0, 0.0, 0.0, 0.0, 0.0, 0.0, 0.0, 0.0, 0.0, 0.0, 0.0, 0.0, 0.0, 0.0, 0.0, 0.0, 0.0, 0.0, 0.0, 0.0, 0.0, 0.0, 0.0, 0.0, 0.0, 0.0, 0.0, 0.0, 0.0, 0.09306654257794324, 0.0, 0.0, 0.0, 0.0, 0.0, 0.0, 0.0, 0.0, 0.0, 0.0, 0.0, 0.0, 0.0, 0.0, 0.0, 0.0, 0.0, 0.07898894154818326, 0.0, 0.0, 0.0, 0.0, 0.0, 0.0, 0.0, 0.0, 0.0, 0.0, 0.0, 0.0, 0.0, 0.0, 0.0, 0.0, 0.0, 0.0, 0.0, 0.0, 0.0, 0.0, 0.0, 0.0, 0.0, 0.0, 0.0, 0.0, 0.0, 0.0, 0.0, 0.0, 0.0, 0.0, 0.0, 0.0, 0.0, 0.0
