, Broncos, Bulldogs, Broncos, Bulldogs, Broncos, Bulldogs, Broncos, Bulldogs, Broncos, Bulldogs, Broncos, Bulldogs, Broncos, Bulldogs, Broncos, Bulldogs, Broncos, Bulldogs, Broncos, Bulldogs, Broncos, Bulldogs, Broncos, Bulldogs, Broncos, Bulldogs, Broncos, Bulldogs, Broncos, Bulldogs, Broncos, Bulldogs, Broncos, Bulldogs, Broncos, Bulldogs, Broncos, Bulldogs, Broncos, Bulldogs, Broncos, Bulldogs, Broncos, Bulldogs, Broncos, Bulldogs, Broncos, Bulldogs, Broncos, Bulldogs, Broncos, Bulldogs, Broncos, Bulldogs, Broncos, Bulldogs, Broncos, Bulldogs, Broncos, Bulldogs, Broncos, Bulldogs, Broncos, Bulldogs, Broncos, Bulldogs, Broncos, Bulldogs, Broncos, Bulldogs, Broncos, Bulldogs, Broncos, Bulldogs, Broncos, Bulldogs, Broncos, Bulldogs, Broncos, Bulldogs, Broncos, Bulldogs, Broncos, Bulldogs, Broncos, Bulldogs, Broncos, Bulldogs, Broncos, Bulldogs, Broncos, Bulldogs, Broncos, Bulldogs, Broncos, Bulldogs, Broncos, Bulldogs, Broncos, Bulldogs, Broncos, Bulldogs, Broncos, Bulldogs, Broncos, Bulldogs, Broncos, Bulldogs, Broncos, Bulldogs, Broncos, Bulldogs, Broncos, Bulldogs, Broncos, Bulldogs, Broncos, Bulldogs, Broncos, Bulldogs, Broncos, Bulldogs, Broncos, Bulldogs, Broncos, Bulldogs, Broncos, Bulldogs, Broncos, Bulldogs, Broncos, Bulldogs, Broncos, Bulldogs, Broncos, Bulldogs, Broncos, Bulldogs, Broncos, Bulldogs, Broncos, Bulldogs, Broncos, Bulldogs, Broncos, Bulldogs, Broncos, Bulldogs, Broncos, Bulldogs, Broncos, Bulldogs, Broncos, Bulldogs, Broncos, Bulldogs, Broncos, Bulldogs, Broncos, Bulldogs, Broncos, Bulldogs, Broncos, Bulldogs, Broncos, Bulldogs, Broncos, Bulldogs, Broncos, Bulldogs, Broncos, Bulldogs, Broncos, Bulldogs, Broncos, Bulldogs, Broncos, Bulldogs, Broncos, Bulldogs, Broncos, Bulldogs, Broncos, Bulldogs, Broncos, Bulldogs, Broncos, Bulldogs, Broncos, Bulldogs, Broncos, Bulldogs, Broncos, Bulldogs, Broncos, Bulldogs, Broncos, Bulldogs, Broncos, Bulldogs, Broncos, Bulldogs, Broncos, Bulldogs, Broncos, Bulldogs, Broncos, Bulldogs, Broncos, Bulldogs, Broncos, Bulldogs, Broncos, Bulldogs, Broncos, Bulldogs, Broncos, Bulldogs, Broncos, Bulldogs, Broncos, Bulldogs, Broncos, Bulldogs, Broncos, Bulldogs, Broncos, Bulldogs, Broncos, Bulldogs, Broncos, Bulldogs, Broncos, Bulldogs, Broncos, Bulldogs, Broncos, Bulldogs, Broncos, Bulldogs, Broncos, Bulldogs, Broncos, Bulldogs, Broncos, Bulldogs, Broncos, Bulldogs, Broncos, Bulldogs, Broncos, Bulldogs, Broncos, Bulldogs, Broncos, Bulldogs
, Roosters, Roosters, Dragons, Dragons, Roosters, Roosters, Dragons, Dragons, Roosters, Roosters, Dragons, Dragons, Roosters, Roosters, Dragons, Dragons, Roosters, Roosters, Dragons, Dragons, Roosters, Roosters, Dragons, Dragons, Roosters, Roosters, Dragons, Dragons, Roosters, Roosters, Dragons, Dragons, Roosters, Roosters, Dragons, Dragons, Roosters, Roosters, Dragons, Dragons, Roosters, Roosters, Dragons, Dragons, Roosters, Roosters, Dragons, Dragons, Roosters, Roosters, Dragons, Dragons, Roosters, Roosters, Dragons, Dragons, Roosters, Roosters, Dragons, Dragons, Roosters, Roosters, Dragons, Dragons, Roosters, Roosters, Dragons, Dragons, Roosters, Roosters, Dragons, Dragons, Roosters, Roosters, Dragons, Dragons, Roosters, Roosters, Dragons, Dragons, Roosters, Roosters, Dragons, Dragons, Roosters, Roosters, Dragons, Dragons, Roosters, Roosters, Dragons, Dragons, Roosters, Roosters, Dragons, Dragons, Roosters, Roosters, Dragons, Dragons, Roosters, Roosters, Dragons, Dragons, Roosters, Roosters, Dragons, Dragons, Roosters, Roosters, Dragons, Dragons, Roosters, Roosters, Dragons, Dragons, Roosters, Roosters, Dragons, Dragons, Roosters, Roosters, Dragons, Dragons, Roosters, Roosters, Dragons, Dragons, Roosters, Roosters, Dragons, Dragons, Roosters, Roosters, Dragons, Dragons, Roosters, Roosters, Dragons, Dragons, Roosters, Roosters, Dragons, Dragons, Roosters, Roosters, Dragons, Dragons, Roosters, Roosters, Dragons, Dragons, Roosters, Roosters, Dragons, Dragons, Roosters, Roosters, Dragons, Dragons, Roosters, Roosters, Dragons, Dragons, Roosters, Roosters, Dragons, Dragons, Roosters, Roosters, Dragons, Dragons, Roosters, Roosters, Dragons, Dragons, Roosters, Roosters, Dragons, Dragons, Roosters, Roosters, Dragons, Dragons, Roosters, Roosters, Dragons, Dragons, Roosters, Roosters, Dragons, Dragons, Roosters, Roosters, Dragons, Dragons, Roosters, Roosters, Dragons, Dragons, Roosters, Roosters, Dragons, Dragons, Roosters, Roosters, Dragons, Dragons, Roosters, Roosters, Dragons, Dragons, Roosters, Roosters, Dragons, Dragons, Roosters, Roosters, Dragons, Dragons, Roosters, Roosters, Dragons, Dragons, Roosters, Roosters, Dragons, Dragons, Roosters, Roosters, Dragons, Dragons, Roosters, Roosters, Dragons, Dragons, Roosters, Roosters, Dragons, Dragons, Roosters, Roosters, Dragons, Dragons, Roosters, Roosters, Dragons, Dragons, Roosters, Roosters, Dragons, Dragons, Roosters, Roosters, Dragons, Dragons
, Warriors, Warriors, Warriors, Warriors, Knights, Knights, Knights, Knights, Warriors, Warriors, Warriors, Warriors, Knights, Knights, Knights, Knights, Warriors, Warriors, Warriors, Warriors, Knights, Knights, Knights, Knights, Warriors, Warriors, Warriors, Warriors, Knights, Knights, Knights, Knights, Warriors, Warriors, Warriors, Warriors, Knights, Knights, Knights, Knights, Warriors, Warriors, Warriors, Warriors, Knights, Knights, Knights, Knights, Warriors, Warriors, Warriors, Warriors, Knights, Knights, Knights, Knights, Warriors, Warriors, Warriors, Warriors, Knights, Knights, Knights, Knights, Warriors, Warriors, Warriors, Warriors, Knights, Knights, Knights, Knights, Warriors, Warriors, Warriors, Warriors, Knights, Knights, Knights, Knights, Warriors, Warriors, Warriors, Warriors, Knights, Knights, Knights, Knights, Warriors, Warriors, Warriors, Warriors, Knights, Knights, Knights, Knights, Warriors, Warriors, Warriors, Warriors, Knights, Knights, Knights, Knights, Warriors, Warriors, Warriors, Warriors, Knights, Knights, Knights, Knights, Warriors, Warriors, Warriors, Warriors, Knights, Knights, Knights, Knights, Warriors, Warriors, Warriors, Warriors, Knights, Knights, Knights, Knights, Warriors, Warriors, Warriors, Warriors, Knights, Knights, Knights, Knights, Warriors, Warriors, Warriors, Warriors, Knights, Knights, Knights, Knights, Warriors, Warriors, Warriors, Warriors, Knights, Knights, Knights, Knights, Warriors, Warriors, Warriors, Warriors, Knights, Knights, Knights, Knights, Warriors, Warriors, Warriors, Warriors, Knights, Knights, Knights, Knights, Warriors, Warriors, Warriors, Warriors, Knights, Knights, Knights, Knights, Warriors, Warriors, Warriors, Warriors, Knights, Knights, Knights, Knights, Warriors, Warriors, Warriors, Warriors, Knights, Knights, Knights, Knights, Warriors, Warriors, Warriors, Warriors, Knights, Knights, Knights, Knights, Warriors, Warriors, Warriors, Warriors, Knights, Knights, Knights, Knights, Warriors, Warriors, Warriors, Warriors, Knights, Knights, Knights, Knights, Warriors, Warriors, Warriors, Warriors, Knights, Knights, Knights, Knights, Warriors, Warriors, Warriors, Warriors, Knights, Knights, Knights, Knights, Warriors, Warriors, Warriors, Warriors, Knights, Knights, Knights, Knights, Warriors, Warriors, Warriors, Warriors, Knights, Knights, Knights, Knights, Warriors, Warriors, Warriors, Warriors, Knights, Knights, Knights, Knights
, Storm, Storm, Storm, Storm, Storm, Storm, Storm, Storm, Rabbitohs, Rabbitohs, Rabbitohs, Rabbitohs, Rabbitohs, Rabbitohs, Rabbitohs, Rabbitohs, Storm, Storm, Storm, Storm, Storm, Storm, Storm, Storm, Rabbitohs, Rabbitohs, Rabbitohs, Rabbitohs, Rabbitohs, Rabbitohs, Rabbitohs, Rabbitohs, Storm, Storm, Storm, Storm, Storm, Storm, Storm, Storm, Rabbitohs, Rabbitohs, Rabbitohs, Rabbitohs, Rabbitohs, Rabbitohs, Rabbitohs, Rabbitohs, Storm, Storm, Storm, Storm, Storm, Storm, Storm, Storm, Rabbitohs, Rabbitohs, Rabbitohs, Rabbitohs, Rabbitohs, Rabbitohs, Rabbitohs, Rabbitohs, Storm, Storm, Storm, Storm, Storm, Storm, Storm, Storm, Rabbitohs, Rabbitohs, Rabbitohs, Rabbitohs, Rabbitohs, Rabbitohs, Rabbitohs, Rabbitohs, Storm, Storm, Storm, Storm, Storm, Storm, Storm, Storm, Rabbitohs, Rabbitohs, Rabbitohs, Rabbitohs, Rabbitohs, Rabbitohs, Rabbitohs, Rabbitohs, Storm, Storm, Storm, Storm, Storm, Storm, Storm, Storm, Rabbitohs, Rabbitohs, Rabbitohs, Rabbitohs, Rabbitohs, Rabbitohs, Rabbitohs, Rabbitohs, Storm, Storm, Storm, Storm, Storm, Storm, Storm, Storm, Rabbitohs, Rabbitohs, Rabbitohs, Rabbitohs, Rabbitohs, Rabbitohs, Rabbitohs, Rabbitohs, Storm, Storm, Storm, Storm, Storm, Storm, Storm, Storm, Rabbitohs, Rabbitohs, Rabbitohs, Rabbitohs, Rabbitohs, Rabbitohs, Rabbitohs, Rabbitohs, Storm, Storm, Storm, Storm, Storm, Storm, Storm, Storm, Rabbitohs, Rabbitohs, Rabbitohs, Rabbitohs, Rabbitohs, Rabbitohs, Rabbitohs, Rabbitohs, Storm, Storm, Storm, Storm, Storm, Storm, Storm, Storm, Rabbitohs, Rabbitohs, Rabbitohs, Rabbitohs, Rabbitohs, Rabbitohs, Rabbitohs, Rabbitohs, Storm, Storm, Storm, Storm, Storm, Storm, Storm, Storm, Rabbitohs, Rabbitohs, Rabbitohs, Rabbitohs, Rabbitohs, Rabbitohs, Rabbitohs, Rabbitohs, Storm, Storm, Storm, Storm, Storm, Storm, Storm, Storm, Rabbitohs, Rabbitohs, Rabbitohs, Rabbitohs, Rabbitohs, Rabbitohs, Rabbitohs, Rabbitohs, Storm, Storm, Storm, Storm, Storm, Storm, Storm, Storm, Rabbitohs, Rabbitohs, Rabbitohs, Rabbitohs, Rabbitohs, Rabbitohs, Rabbitohs, Rabbitohs, Storm, Storm, Storm, Storm, Storm, Storm, Storm, Storm, Rabbitohs, Rabbitohs, Rabbitohs, Rabbitohs, Rabbitohs, Rabbitohs, Rabbitohs, Rabbitohs, Storm, Storm, Storm, Storm, Storm, Storm, Storm, Storm, Rabbitohs, Rabbitohs, Rabbitohs, Rabbitohs, Rabbitohs, Rabbitohs, Rabbitohs, Rabbitohs
, Cowboys, Cowboys, Cowboys, Cowboys, Cowboys, Cowboys, Cowboys, Cowboys, Cowboys, Cowboys, Cowboys, Cowboys, Cowboys, Cowboys, Cowboys, Cowboys, Titans, Titans, Titans, Titans, Titans, Titans, Titans, Titans, Titans, Titans, Titans, Titans, Titans, Titans, Titans, Titans, Cowboys, Cowboys, Cowboys, Cowboys, Cowboys, Cowboys, Cowboys, Cowboys, Cowboys, Cowboys, Cowboys, Cowboys, Cowboys, Cowboys, Cowboys, Cowboys, Titans, Titans, Titans, Titans, Titans, Titans, Titans, Titans, Titans, Titans, Titans, Titans, Titans, Titans, Titans, Titans, Cowboys, Cowboys, Cowboys, Cowboys, Cowboys, Cowboys, Cowboys, Cowboys, Cowboys, Cowboys, Cowboys, Cowboys, Cowboys, Cowboys, Cowboys, Cowboys, Titans, Titans, Titans, Titans, Titans, Titans, Titans, Titans, Titans, Titans, Titans, Titans, Titans, Titans, Titans, Titans, Cowboys, Cowboys, Cowboys, Cowboys, Cowboys, Cowboys, Cowboys, Cowboys, Cowboys, Cowboys, Cowboys, Cowboys, Cowboys, Cowboys, Cowboys, Cowboys, Titans, Titans, Titans, Titans, Titans, Titans, Titans, Titans, Titans, Titans, Titans, Titans, Titans, Titans, Titans, Titans, Cowboys, Cowboys, Cowboys, Cowboys, Cowboys, Cowboys, Cowboys, Cowboys, Cowboys, Cowboys, Cowboys, Cowboys, Cowboys, Cowboys, Cowboys, Cowboys, Titans, Titans, Titans, Titans, Titans, Titans, Titans, Titans, Titans, Titans, Titans, Titans, Titans, Titans, Titans, Titans, Cowboys, Cowboys, Cowboys, Cowboys, Cowboys, Cowboys, Cowboys, Cowboys, Cowboys, Cowboys, Cowboys, Cowboys, Cowboys, Cowboys, Cowboys, Cowboys, Titans, Titans, Titans, Titans, Titans, Titans, Titans, Titans, Titans, Titans, Titans, Titans, Titans, Titans, Titans, Titans, Cowboys, Cowboys, Cowboys, Cowboys, Cowboys, Cowboys, Cowboys, Cowboys, Cowboys, Cowboys, Cowboys, Cowboys, Cowboys, Cowboys, Cowboys, Cowboys, Titans, Titans, Titans, Titans, Titans, Titans, Titans, Titans, Titans, Titans, Titans, Titans, Titans, Titans, Titans, Titans, Cowboys, Cowboys, Cowboys, Cowboys, Cowboys, Cowboys, Cowboys, Cowboys, Cowboys, Cowboys, Cowboys, Cowboys, Cowboys, Cowboys, Cowboys, Cowboys, Titans, Titans, Titans, Titans, Titans, Titans, Titans, Titans, Titans, Titans, Titans, Titans, Titans, Titans, Titans, Titans
, Panthers, Panthers, Panthers, Panthers, Panthers, Panthers, Panthers, Panthers, Panthers, Panthers, Panthers, Panthers, Panthers, Panthers, Panthers, Panthers, Panthers, Panthers, Panthers, Panthers, Panthers, Panthers, Panthers, Panthers, Panthers, Panthers, Panthers, Panthers, Panthers, Panthers, Panthers, Panthers, Manly, Manly, Manly, Manly, Manly, Manly, Manly, Manly, Manly, Manly, Manly, Manly, Manly, Manly, Manly, Manly, Manly, Manly, Manly, Manly, Manly, Manly, Manly, Manly, Manly, Manly, Manly, Manly, Manly, Manly, Manly, Manly, Panthers, Panthers, Panthers, Panthers, Panthers, Panthers, Panthers, Panthers, Panthers, Panthers, Panthers, Panthers, Panthers, Panthers, Panthers, Panthers, Panthers, Panthers, Panthers, Panthers, Panthers, Panthers, Panthers, Panthers, Panthers, Panthers, Panthers, Panthers, Panthers, Panthers, Panthers, Panthers, Manly, Manly, Manly, Manly, Manly, Manly, Manly, Manly, Manly, Manly, Manly, Manly, Manly, Manly, Manly, Manly, Manly, Manly, Manly, Manly, Manly, Manly, Manly, Manly, Manly, Manly, Manly, Manly, Manly, Manly, Manly, Manly, Panthers, Panthers, Panthers, Panthers, Panthers, Panthers, Panthers, Panthers, Panthers, Panthers, Panthers, Panthers, Panthers, Panthers, Panthers, Panthers, Panthers, Panthers, Panthers, Panthers, Panthers, Panthers, Panthers, Panthers, Panthers, Panthers, Panthers, Panthers, Panthers, Panthers, Panthers, Panthers, Manly, Manly, Manly, Manly, Manly, Manly, Manly, Manly, Manly, Manly, Manly, Manly, Manly, Manly, Manly, Manly, Manly, Manly, Manly, Manly, Manly, Manly, Manly, Manly, Manly, Manly, Manly, Manly, Manly, Manly, Manly, Manly, Panthers, Panthers, Panthers, Panthers, Panthers, Panthers, Panthers, Panthers, Panthers, Panthers, Panthers, Panthers, Panthers, Panthers, Panthers, Panthers, Panthers, Panthers, Panthers, Panthers, Panthers, Panthers, Panthers, Panthers, Panthers, Panthers, Panthers, Panthers, Panthers, Panthers, Panthers, Panthers, Manly, Manly, Manly, Manly, Manly, Manly, Manly, Manly, Manly, Manly, Manly, Manly, Manly, Manly, Manly, Manly, Manly, Manly, Manly, Manly, Manly, Manly, Manly, Manly, Manly, Manly, Manly, Manly, Manly, Manly, Manly, Manly
, Raiders, Raiders, Raiders, Raiders, Raiders, Raiders, Raiders, Raiders, Raiders, Raiders, Raiders, Raiders, Raiders, Raiders, Raiders, Raiders, Raiders, Raiders, Raiders, Raiders, Raiders, Raiders, Raiders, Raiders, Raiders, Raiders, Raiders, Raiders, Raiders, Raiders, Raiders, Raiders, Raiders, Raiders, Raiders, Raiders, Raiders, Raiders, Raiders, Raiders, Raiders, Raiders, Raiders, Raiders, Raiders, Raiders, Raiders, Raiders, Raiders, Raiders, Raiders, Raiders, Raiders, Raiders, Raiders, Raiders, Raiders, Raiders, Raiders, Raiders, Raiders, Raiders, Raiders, Raiders, Dolphins, Dolphins, Dolphins, Dolphins, Dolphins, Dolphins, Dolphins, Dolphins, Dolphins, Dolphins, Dolphins, Dolphins, Dolphins, Dolphins, Dolphins, Dolphins, Dolphins, Dolphins, Dolphins, Dolphins, Dolphins, Dolphins, Dolphins, Dolphins, Dolphins, Dolphins, Dolphins, Dolphins, Dolphins, Dolphins, Dolphins, Dolphins, Dolphins, Dolphins, Dolphins, Dolphins, Dolphins, Dolphins, Dolphins, Dolphins, Dolphins, Dolphins, Dolphins, Dolphins, Dolphins, Dolphins, Dolphins, Dolphins, Dolphins, Dolphins, Dolphins, Dolphins, Dolphins, Dolphins, Dolphins, Dolphins, Dolphins, Dolphins, Dolphins, Dolphins, Dolphins, Dolphins, Dolphins, Dolphins, Raiders, Raiders, Raiders, Raiders, Raiders, Raiders, Raiders, Raiders, Raiders, Raiders, Raiders, Raiders, Raiders, Raiders, Raiders, Raiders, Raiders, Raiders, Raiders, Raiders, Raiders, Raiders, Raiders, Raiders, Raiders, Raiders, Raiders, Raiders, Raiders, Raiders, Raiders, Raiders, Raiders, Raiders, Raiders, Raiders, Raiders, Raiders, Raiders, Raiders, Raiders, Raiders, Raiders, Raiders, Raiders, Raiders, Raiders, Raiders, Raiders, Raiders, Raiders, Raiders, Raiders, Raiders, Raiders, Raiders, Raiders, Raiders, Raiders, Raiders, Raiders, Raiders, Raiders, Raiders, Dolphins, Dolphins, Dolphins, Dolphins, Dolphins, Dolphins, Dolphins, Dolphins, Dolphins, Dolphins, Dolphins, Dolphins, Dolphins, Dolphins, Dolphins, Dolphins, Dolphins, Dolphins, Dolphins, Dolphins, Dolphins, Dolphins, Dolphins, Dolphins, Dolphins, Dolphins, Dolphins, Dolphins, Dolphins, Dolphins, Dolphins, Dolphins, Dolphins, Dolphins, Dolphins, Dolphins, Dolphins, Dolphins, Dolphins, Dolphins, Dolphins, Dolphins, Dolphins, Dolphins, Dolphins, Dolphins, Dolphins, Dolphins, Dolphins, Dolphins, Dolphins, Dolphins, Dolphins, Dolphins, Dolphins, Dolphins, Dolphins, Dolphins, Dolphins, Dolphins, Dolphins, Dolphins, Dolphins, Dolphins
, Tigers, Tigers, Tigers, Tigers, Tigers, Tigers, Tigers, Tigers, Tigers, Tigers, Tigers, Tigers, Tigers, Tigers, Tigers, Tigers, Tigers, Tigers, Tigers, Tigers, Tigers, Tigers, Tigers, Tigers, Tigers, Tigers, Tigers, Tigers, Tigers, Tigers, Tigers, Tigers, Tigers, Tigers, Tigers, Tigers, Tigers, Tigers, Tigers, Tigers, Tigers, Tigers, Tigers, Tigers, Tigers, Tigers, Tigers, Tigers, Tigers, Tigers, Tigers, Tigers, Tigers, Tigers, Tigers, Tigers, Tigers, Tigers, Tigers, Tigers, Tigers, Tigers, Tigers, Tigers, Tigers, Tigers, Tigers, Tigers, Tigers, Tigers, Tigers, Tigers, Tigers, Tigers, Tigers, Tigers, Tigers, Tigers, Tigers, Tigers, Tigers, Tigers, Tigers, Tigers, Tigers, Tigers, Tigers, Tigers, Tigers, Tigers, Tigers, Tigers, Tigers, Tigers, Tigers, Tigers, Tigers, Tigers, Tigers, Tigers, Tigers, Tigers, Tigers, Tigers, Tigers, Tigers, Tigers, Tigers, Tigers, Tigers, Tigers, Tigers, Tigers, Tigers, Tigers, Tigers, Tigers, Tigers, Tigers, Tigers, Tigers, Tigers, Tigers, Tigers, Tigers, Tigers, Tigers, Tigers, Sharks, Sharks, Sharks, Sharks, Sharks, Sharks, Sharks, Sharks, Sharks, Sharks, Sharks, Sharks, Sharks, Sharks, Sharks, Sharks, Sharks, Sharks, Sharks, Sharks, Sharks, Sharks, Sharks, Sharks, Sharks, Sharks, Sharks, Sharks, Sharks, Sharks, Sharks, Sharks, Sharks, Sharks, Sharks, Sharks, Sharks, Sharks, Sharks, Sharks, Sharks, Sharks, Sharks, Sharks, Sharks, Sharks, Sharks, Sharks, Sharks, Sharks, Sharks, Sharks, Sharks, Sharks, Sharks, Sharks, Sharks, Sharks, Sharks, Sharks, Sharks, Sharks, Sharks, Sharks, Sharks, Sharks, Sharks, Sharks, Sharks, Sharks, Sharks, Sharks, Sharks, Sharks, Sharks, Sharks, Sharks, Sharks, Sharks, Sharks, Sharks, Sharks, Sharks, Sharks, Sharks, Sharks, Sharks, Sharks, Sharks, Sharks, Sharks, Sharks, Sharks, Sharks, Sharks, Sharks, Sharks, Sharks, Sharks, Sharks, Sharks, Sharks, Sharks, Sharks, Sharks, Sharks, Sharks, Sharks, Sharks, Sharks, Sharks, Sharks, Sharks, Sharks, Sharks, Sharks, Sharks, Sharks, Sharks, Sharks, Sharks, Sharks, Sharks, Sharks, Sharks, Sharks, Sharks, Sharks
Storm, 0.0, 0.005246039240373518, 0.016592002654720425, 0.0057650178715554015, 0.0, 0.0, 0.0, 0.0, 0.14104372355430184, 0.0, 0.0, 0.0, 0.0, 0.15337423312883436, 0.0, 0.1597444089456869, 0.0, 0.0, 0.0, 0.03861003861003861, 0.0, 0.0, 0.0, 0.0, 0.9803921568627451, 0.3703703703703704, 0.0, 0.0, 0.0, 0.0, 0.0, 0.0, 0.0, 0.021701388888888888, 0.0, 0.011841326228537596, 0.0, 0.0, 0.0, 0.0, 0.3225806451612903, 0.0, 0.0, 0.0, 0.0, 0.0, 0.0, 0.35211267605633806, 0.0, 0.07639419404125286, 0.0, 0.0, 0.0, 0.0, 0.0, 0.0, 0.0, 0.0, 0.0, 0.0, 0.0, 0.0, 0.0, 0.0, 0.0, 0.0, 0.023518344308560677, 0.0, 0.0, 0.0, 0.0, 0.041050903119868636, 0.0, 0.0, 0.0, 0.08643042350907519, 0.0, 0.0, 0.0, 0.0, 0.0, 0.0, 0.0, 0.0, 0.0, 0.0, 0.0, 0.0, 0.0, 0.0, 0.0, 0.0, 0.0, 0.0, 0.0, 0.0, 0.0, 0.01538935056940597, 0.04814636494944632, 0.0, 0.0, 0.0, 0.0, 0.0, 0.0, 0.0, 0.0, 0.0, 0.0, 0.0, 0.0, 0.0, 0.0, 0.0, 0.0, 0.0, 0.0, 0.0, 0.0, 0.0, 0.0, 0.0, 0.0, 0.0, 0.0, 0.0, 0.0, 0.0, 0.004201857220891634, 0.005807538184563563, 0.004642094513044285, 0.006361626667938993, 0.0, 0.014857185306243732, 0.012100677637947725, 0.00829393713195654, 0.09070294784580499, 0.015878056525881232, 0.0, 0.01701258931609391, 0.23148148148148145, 0.08247422680412371, 0.12547051442910914, 0.04317789291882556, 0.028918449971081547, 0.0, 0.0, 0.0, 0.0, 0.02538715410002539, 0.0, 0.027570995312930797, 0.0, 0.10090817356205853, 0.0, 0.10905125408942204, 0.0, 0.0, 0.0, 0.0, 0.0, 0.0030039050765995794, 0.0, 0.0032848273823210586, 0.0, 0.023304591004427874, 0.0, 0.008613264427217915, 0.0, 0.0952683391552874, 0.11049723756906078, 0.07155635062611806, 0.0, 0.0, 0.0, 0.0, 0.0, 0.0, 0.0, 0.04590314436538903, 0.0, 0.0, 0.0, 0.058445353594389245, 0.0, 0.4454342984409799, 0.0, 0.0, 0.0, 0.6060606060606061, 0.0, 0.0, 0.011684973124561814, 0.0020328508700601725, 0.0, 0.0022238035936666075, 0.0, 0.010580890911014709, 0.0, 0.0, 0.06605019815059446, 0.0, 0.07107320540156362, 0.09376465072667604, 0.0, 0.0, 0.0, 0.0, 0.0, 0.0, 0.0, 0.03046458492003046, 0.0, 0.0, 0.0, 0.0, 0.0, 0.2949852507374631, 0.0, 0.0, 0.0, 0.39370078740157477, 0.0, 0.0, 0.0, 0.016638243001539037, 0.0, 0.004642741074330285, 0.03132832080200501, 0.0, 0.0, 0.0, 0.0, 0.08912655971479501, 0.0, 0.048285852245292124, 0.0, 0.11778563015312131, 0.0, 0.13054830287206268, 0.0, 0.0, 0.0, 0.0, 0.0, 0.0, 0.0, 0.0, 0.0, 0.0, 0.0, 0.31545741324921134, 0.0, 0.0, 0.0, 0.0
Bulldogs, 0.0, 0.005246039240373518, 0.0, 0.0, 0.04088307440719542, 0.0, 0.0, 0.0, 0.14104372355430184, 0.0, 0.0, 0.0, 0.0, 0.0, 0.0, 0.0, 0.0, 0.0, 0.0, 0.0, 0.0, 0.0, 0.0, 0.0, 0.0, 0.0, 0.0, 0.0, 0.0, 0.0, 0.0, 0.0, 0.0, 0.0, 0.0, 0.0, 0.0, 0.0, 0.0, 0.0, 0.0, 0.0, 0.0, 0.0, 0.0, 0.0, 0.0, 0.0, 0.0, 0.0, 0.0, 0.0, 0.0, 0.0, 0.0, 0.0, 0.0, 0.0, 0.0, 0.0, 0.0, 0.0, 0.0, 0.0, 0.02104377104377104, 0.0, 0.0, 0.0, 0.05750431282346176, 0.0, 0.0, 0.0, 0.0, 0.0, 0.0, 0.0, 0.0, 0.0, 0.0, 0.0, 0.0, 0.0, 0.0, 0.0, 0.0, 0.0, 0.0, 0.0, 0.0, 0.0, 0.0, 0.0, 0.0, 0.0, 0.0, 0.0, 0.04401408450704226, 0.0, 0.04814636494944632, 0.0, 0.0, 0.0, 0.0, 0.0, 0.0, 0.0, 0.0, 0.0, 0.0, 0.0, 0.0, 0.0, 0.0, 0.0, 0.0, 0.0, 0.0, 0.0, 0.0, 0.0, 0.0, 0.0, 0.0, 0.0, 0.0, 0.0, 0.0, 0.0, 0.008403714441783268, 0.0014518845461408908, 0.00928418902608857, 0.0, 0.010790978741771878, 0.0, 0.012100677637947725, 0.0, 0.0, 0.0, 0.0, 0.0, 0.0, 0.0, 0.0, 0.0, 0.057836899942163095, 0.0, 0.0, 0.0, 0.0, 0.0, 0.1694915254237288, 0.0, 0.0, 0.0, 0.0, 0.0, 0.0, 0.0, 0.0, 0.0, 0.017582417582417582, 0.0, 0.009722897423432183, 0.0, 0.0, 0.0, 0.02463054187192118, 0.0, 0.0, 0.0, 0.0, 0.0, 0.0, 0.0, 0.0, 0.0, 0.0, 0.0, 0.0, 0.0, 0.0, 0.0, 0.0, 0.0, 0.0, 0.0, 0.0, 0.0, 1.4925373134328357, 0.0, 0.0, 0.0, 0.005842486562280907, 0.0020328508700601725, 0.0064796215900991385, 0.0022238035936666075, 0.014940983116689076, 0.0, 0.0, 0.0, 0.0, 0.0, 0.07107320540156362, 0.0, 0.0, 0.0, 0.0, 0.0, 0.040783034257748776, 0.0, 0.0, 0.0, 0.0, 0.0, 0.0, 0.0, 0.0, 0.0, 0.0, 0.0, 0.0, 0.0, 0.0, 0.0, 0.0, 0.0, 0.0, 0.0, 0.0, 0.0, 0.0, 0.0, 0.0, 0.0, 0.0, 0.0, 0.0, 0.0, 0.0, 0.0, 0.0, 0.0, 0.0, 0.0, 0.0, 0.0, 0.0, 0.0, 0.0, 0.0, 0.0, 0.0, 0.0, 0.0, 0.0, 0.0
