, Broncos, Bulldogs, Broncos, Bulldogs, Broncos, Bulldogs, Broncos, Bulldogs, Broncos, Bulldogs, Broncos, Bulldogs, Broncos, Bulldogs, Broncos, Bulldogs, Broncos, Bulldogs, Broncos, Bulldogs, Broncos, Bulldogs, Broncos, Bulldogs, Broncos, Bulldogs, Broncos, Bulldogs, Broncos, Bulldogs, Broncos, Bulldogs, Broncos, Bulldogs, Broncos, Bulldogs, Broncos, Bulldogs, Broncos, Bulldogs, Broncos, Bulldogs, Broncos, Bulldogs, Broncos, Bulldogs, Broncos, Bulldogs, Broncos, Bulldogs, Broncos, Bulldogs, Broncos, Bulldogs, Broncos, Bulldogs, Broncos, Bulldogs, Broncos, Bulldogs, Broncos, Bulldogs, Broncos, Bulldogs, Broncos, Bulldogs, Broncos, Bulldogs, Broncos, Bulldogs, Broncos, Bulldogs, Broncos, Bulldogs, Broncos, Bulldogs, Broncos, Bulldogs, Broncos, Bulldogs, Broncos, Bulldogs, Broncos, Bulldogs, Broncos, Bulldogs, Broncos, Bulldogs, Broncos, Bulldogs, Broncos, Bulldogs, Broncos, Bulldogs, Broncos, Bulldogs, Broncos, Bulldogs, Broncos, Bulldogs, Broncos, Bulldogs, Broncos, Bulldogs, Broncos, Bulldogs, Broncos, Bulldogs, Broncos, Bulldogs, Broncos, Bulldogs, Broncos, Bulldogs, Broncos, Bulldogs, Broncos, Bulldogs, Broncos, Bulldogs, Broncos, Bulldogs, Broncos, Bulldogs, Broncos, Bulldogs, Broncos, Bulldogs, Broncos, Bulldogs, Broncos, Bulldogs, Broncos, Bulldogs, Broncos, Bulldogs, Broncos, Bulldogs, Broncos, Bulldogs, Broncos, Bulldogs, Broncos, Bulldogs, Broncos, Bulldogs, Broncos, Bulldogs, Broncos, Bulldogs, Broncos, Bulldogs, Broncos, Bulldogs, Broncos, Bulldogs, Broncos, Bulldogs, Broncos, Bulldogs, Broncos, Bulldogs, Broncos, Bulldogs, Broncos, Bulldogs, Broncos, Bulldogs, Broncos, Bulldogs, Broncos, Bulldogs, Broncos, Bulldogs, Broncos, Bulldogs, Broncos, Bulldogs, Broncos, Bulldogs, Broncos, Bulldogs, Broncos, Bulldogs, Broncos, Bulldogs, Broncos, Bulldogs, Broncos, Bulldogs, Broncos, Bulldogs, Broncos, Bulldogs, Broncos, Bulldogs, Broncos, Bulldogs, Broncos, Bulldogs, Broncos, Bulldogs, Broncos, Bulldogs, Broncos, Bulldogs, Broncos, Bulldogs, Broncos, Bulldogs, Broncos, Bulldogs, Broncos, Bulldogs, Broncos, Bulldogs, Broncos, Bulldogs, Broncos, Bulldogs, Broncos, Bulldogs, Broncos, Bulldogs, Broncos, Bulldogs, Broncos, Bulldogs, Broncos, Bulldogs, Broncos, Bulldogs, Broncos, Bulldogs, Broncos, Bulldogs, Broncos, Bulldogs, Broncos, Bulldogs, Broncos, Bulldogs, Broncos, Bulldogs, Broncos, Bulldogs, Broncos, Bulldogs, Broncos, Bulldogs, Broncos, Bulldogs, Broncos, Bulldogs, Broncos, Bulldogs
, Roosters, Roosters, Dragons, Dragons, Roosters, Roosters, Dragons, Dragons, Roosters, Roosters, Dragons, Dragons, Roosters, Roosters, Dragons, Dragons, Roosters, Roosters, Dragons, Dragons, Roosters, Roosters, Dragons, Dragons, Roosters, Roosters, Dragons, Dragons, Roosters, Roosters, Dragons, Dragons, Roosters, Roosters, Dragons, Dragons, Roosters, Roosters, Dragons, Dragons, Roosters, Roosters, Dragons, Dragons, Roosters, Roosters, Dragons, Dragons, Roosters, Roosters, Dragons, Dragons, Roosters, Roosters, Dragons, Dragons, Roosters, Roosters, Dragons, Dragons, Roosters, Roosters, Dragons, Dragons, Roosters, Roosters, Dragons, Dragons, Roosters, Roosters, Dragons, Dragons, Roosters, Roosters, Dragons, Dragons, Roosters, Roosters, Dragons, Dragons, Roosters, Roosters, Dragons, Dragons, Roosters, Roosters, Dragons, Dragons, Roosters, Roosters, Dragons, Dragons, Roosters, Roosters, Dragons, Dragons, Roosters, Roosters, Dragons, Dragons, Roosters, Roosters, Dragons, Dragons, Roosters, Roosters, Dragons, Dragons, Roosters, Roosters, Dragons, Dragons, Roosters, Roosters, Dragons, Dragons, Roosters, Roosters, Dragons, Dragons, Roosters, Roosters, Dragons, Dragons, Roosters, Roosters, Dragons, Dragons, Roosters, Roosters, Dragons, Dragons, Roosters, Roosters, Dragons, Dragons, Roosters, Roosters, Dragons, Dragons, Roosters, Roosters, Dragons, Dragons, Roosters, Roosters, Dragons, Dragons, Roosters, Roosters, Dragons, Dragons, Roosters, Roosters, Dragons, Dragons, Roosters, Roosters, Dragons, Dragons, Roosters, Roosters, Dragons, Dragons, Roosters, Roosters, Dragons, Dragons, Roosters, Roosters, Dragons, Dragons, Roosters, Roosters, Dragons, Dragons, Roosters, Roosters, Dragons, Dragons, Roosters, Roosters, Dragons, Dragons, Roosters, Roosters, Dragons, Dragons, Roosters, Roosters, Dragons, Dragons, Roosters, Roosters, Dragons, Dragons, Roosters, Roosters, Dragons, Dragons, Roosters, Roosters, Dragons, Dragons, Roosters, Roosters, Dragons, Dragons, Roosters, Roosters, Dragons, Dragons, Roosters, Roosters, Dragons, Dragons, Roosters, Roosters, Dragons, Dragons, Roosters, Roosters, Dragons, Dragons, Roosters, Roosters, Dragons, Dragons, Roosters, Roosters, Dragons, Dragons, Roosters, Roosters, Dragons, Dragons, Roosters, Roosters, Dragons, Dragons, Roosters, Roosters, Dragons, Dragons, Roosters, Roosters, Dragons, Dragons, Roosters, Roosters, Dragons, Dragons, Roosters, Roosters, Dragons, Dragons
, Warriors, Warriors, Warriors, Warriors, Knights, Knights, Knights, Knights, Warriors, Warriors, Warriors, Warriors, Knights, Knights, Knights, Knights, Warriors, Warriors, Warriors, Warriors, Knights, Knights, Knights, Knights, Warriors, Warriors, Warriors, Warriors, Knights, Knights, Knights, Knights, Warriors, Warriors, Warriors, Warriors, Knights, Knights, Knights, Knights, Warriors, Warriors, Warriors, Warriors, Knights, Knights, Knights, Knights, Warriors, Warriors, Warriors, Warriors, Knights, Knights, Knights, Knights, Warriors, Warriors, Warriors, Warriors, Knights, Knights, Knights, Knights, Warriors, Warriors, Warriors, Warriors, Knights, Knights, Knights, Knights, Warriors, Warriors, Warriors, Warriors, Knights, Knights, Knights, Knights, Warriors, Warriors, Warriors, Warriors, Knights, Knights, Knights, Knights, Warriors, Warriors, Warriors, Warriors, Knights, Knights, Knights, Knights, Warriors, Warriors, Warriors, Warriors, Knights, Knights, Knights, Knights, Warriors, Warriors, Warriors, Warriors, Knights, Knights, Knights, Knights, Warriors, Warriors, Warriors, Warriors, Knights, Knights, Knights, Knights, Warriors, Warriors, Warriors, Warriors, Knights, Knights, Knights, Knights, Warriors, Warriors, Warriors, Warriors, Knights, Knights, Knights, Knights, Warriors, Warriors, Warriors, Warriors, Knights, Knights, Knights, Knights, Warriors, Warriors, Warriors, Warriors, Knights, Knights, Knights, Knights, Warriors, Warriors, Warriors, Warriors, Knights, Knights, Knights, Knights, Warriors, Warriors, Warriors, Warriors, Knights, Knights, Knights, Knights, Warriors, Warriors, Warriors, Warriors, Knights, Knights, Knights, Knights, Warriors, Warriors, Warriors, Warriors, Knights, Knights, Knights, Knights, Warriors, Warriors, Warriors, Warriors, Knights, Knights, Knights, Knights, Warriors, Warriors, Warriors, Warriors, Knights, Knights, Knights, Knights, Warriors, Warriors, Warriors, Warriors, Knights, Knights, Knights, Knights, Warriors, Warriors, Warriors, Warriors, Knights, Knights, Knights, Knights, Warriors, Warriors, Warriors, Warriors, Knights, Knights, Knights, Knights, Warriors, Warriors, Warriors, Warriors, Knights, Knights, Knights, Knights, Warriors, Warriors, Warriors, Warriors, Knights, Knights, Knights, Knights, Warriors, Warriors, Warriors, Warriors, Knights, Knights, Knights, Knights, Warriors, Warriors, Warriors, Warriors, Knights, Knights, Knights, Knights
, Storm, Storm, Storm, Storm, Storm, Storm, Storm, Storm, Rabbitohs, Rabbitohs, Rabbitohs, Rabbitohs, Rabbitohs, Rabbitohs, Rabbitohs, Rabbitohs, Storm, Storm, Storm, Storm, Storm, Storm, Storm, Storm, Rabbitohs, Rabbitohs, Rabbitohs, Rabbitohs, Rabbitohs, Rabbitohs, Rabbitohs, Rabbitohs, Storm, Storm, Storm, Storm, Storm, Storm, Storm, Storm, Rabbitohs, Rabbitohs, Rabbitohs, Rabbitohs, Rabbitohs, Rabbitohs, Rabbitohs, Rabbitohs, Storm, Storm, Storm, Storm, Storm, Storm, Storm, Storm, Rabbitohs, Rabbitohs, Rabbitohs, Rabbitohs, Rabbitohs, Rabbitohs, Rabbitohs, Rabbitohs, Storm, Storm, Storm, Storm, Storm, Storm, Storm, Storm, Rabbitohs, Rabbitohs, Rabbitohs, Rabbitohs, Rabbitohs, Rabbitohs, Rabbitohs, Rabbitohs, Storm, Storm, Storm, Storm, Storm, Storm, Storm, Storm, Rabbitohs, Rabbitohs, Rabbitohs, Rabbitohs, Rabbitohs, Rabbitohs, Rabbitohs, Rabbitohs, Storm, Storm, Storm, Storm, Storm, Storm, Storm, Storm, Rabbitohs, Rabbitohs, Rabbitohs, Rabbitohs, Rabbitohs, Rabbitohs, Rabbitohs, Rabbitohs, Storm, Storm, Storm, Storm, Storm, Storm, Storm, Storm, Rabbitohs, Rabbitohs, Rabbitohs, Rabbitohs, Rabbitohs, Rabbitohs, Rabbitohs, Rabbitohs, Storm, Storm, Storm, Storm, Storm, Storm, Storm, Storm, Rabbitohs, Rabbitohs, Rabbitohs, Rabbitohs, Rabbitohs, Rabbitohs, Rabbitohs, Rabbitohs, Storm, Storm, Storm, Storm, Storm, Storm, Storm, Storm, Rabbitohs, Rabbitohs, Rabbitohs, Rabbitohs, Rabbitohs, Rabbitohs, Rabbitohs, Rabbitohs, Storm, Storm, Storm, Storm, Storm, Storm, Storm, Storm, Rabbitohs, Rabbitohs, Rabbitohs, Rabbitohs, Rabbitohs, Rabbitohs, Rabbitohs, Rabbitohs, Storm, Storm, Storm, Storm, Storm, Storm, Storm, Storm, Rabbitohs, Rabbitohs, Rabbitohs, Rabbitohs, Rabbitohs, Rabbitohs, Rabbitohs, Rabbitohs, Storm, Storm, Storm, Storm, Storm, Storm, Storm, Storm, Rabbitohs, Rabbitohs, Rabbitohs, Rabbitohs, Rabbitohs, Rabbitohs, Rabbitohs, Rabbitohs, Storm, Storm, Storm, Storm, Storm, Storm, Storm, Storm, Rabbitohs, Rabbitohs, Rabbitohs, Rabbitohs, Rabbitohs, Rabbitohs, Rabbitohs, Rabbitohs, Storm, Storm, Storm, Storm, Storm, Storm, Storm, Storm, Rabbitohs, Rabbitohs, Rabbitohs, Rabbitohs, Rabbitohs, Rabbitohs, Rabbitohs, Rabbitohs, Storm, Storm, Storm, Storm, Storm, Storm, Storm, Storm, Rabbitohs, Rabbitohs, Rabbitohs, Rabbitohs, Rabbitohs, Rabbitohs, Rabbitohs, Rabbitohs
, Cowboys, Cowboys, Cowboys, Cowboys, Cowboys, Cowboys, Cowboys, Cowboys, Cowboys, Cowboys, Cowboys, Cowboys, Cowboys, Cowboys, Cowboys, Cowboys, Titans, Titans, Titans, Titans, Titans, Titans, Titans, Titans, Titans, Titans, Titans, Titans, Titans, Titans, Titans, Titans, Cowboys, Cowboys, Cowboys, Cowboys, Cowboys, Cowboys, Cowboys, Cowboys, Cowboys, Cowboys, Cowboys, Cowboys, Cowboys, Cowboys, Cowboys, Cowboys, Titans, Titans, Titans, Titans, Titans, Titans, Titans, Titans, Titans, Titans, Titans, Titans, Titans, Titans, Titans, Titans, Cowboys, Cowboys, Cowboys, Cowboys, Cowboys, Cowboys, Cowboys, Cowboys, Cowboys, Cowboys, Cowboys, Cowboys, Cowboys, Cowboys, Cowboys, Cowboys, Titans, Titans, Titans, Titans, Titans, Titans, Titans, Titans, Titans, Titans, Titans, Titans, Titans, Titans, Titans, Titans, Cowboys, Cowboys, Cowboys, Cowboys, Cowboys, Cowboys, Cowboys, Cowboys, Cowboys, Cowboys, Cowboys, Cowboys, Cowboys, Cowboys, Cowboys, Cowboys, Titans, Titans, Titans, Titans, Titans, Titans, Titans, Titans, Titans, Titans, Titans, Titans, Titans, Titans, Titans, Titans, Cowboys, Cowboys, Cowboys, Cowboys, Cowboys, Cowboys, Cowboys, Cowboys, Cowboys, Cowboys, Cowboys, Cowboys, Cowboys, Cowboys, Cowboys, Cowboys, Titans, Titans, Titans, Titans, Titans, Titans, Titans, Titans, Titans, Titans, Titans, Titans, Titans, Titans, Titans, Titans, Cowboys, Cowboys, Cowboys, Cowboys, Cowboys, Cowboys, Cowboys, Cowboys, Cowboys, Cowboys, Cowboys, Cowboys, Cowboys, Cowboys, Cowboys, Cowboys, Titans, Titans, Titans, Titans, Titans, Titans, Titans, Titans, Titans, Titans, Titans, Titans, Titans, Titans, Titans, Titans, Cowboys, Cowboys, Cowboys, Cowboys, Cowboys, Cowboys, Cowboys, Cowboys, Cowboys, Cowboys, Cowboys, Cowboys, Cowboys, Cowboys, Cowboys, Cowboys, Titans, Titans, Titans, Titans, Titans, Titans, Titans, Titans, Titans, Titans, Titans, Titans, Titans, Titans, Titans, Titans, Cowboys, Cowboys, Cowboys, Cowboys, Cowboys, Cowboys, Cowboys, Cowboys, Cowboys, Cowboys, Cowboys, Cowboys, Cowboys, Cowboys, Cowboys, Cowboys, Titans, Titans, Titans, Titans, Titans, Titans, Titans, Titans, Titans, Titans, Titans, Titans, Titans, Titans, Titans, Titans
, Panthers, Panthers, Panthers, Panthers, Panthers, Panthers, Panthers, Panthers, Panthers, Panthers, Panthers, Panthers, Panthers, Panthers, Panthers, Panthers, Panthers, Panthers, Panthers, Panthers, Panthers, Panthers, Panthers, Panthers, Panthers, Panthers, Panthers, Panthers, Panthers, Panthers, Panthers, Panthers, Manly, Manly, Manly, Manly, Manly, Manly, Manly, Manly, Manly, Manly, Manly, Manly, Manly, Manly, Manly, Manly, Manly, Manly, Manly, Manly, Manly, Manly, Manly, Manly, Manly, Manly, Manly, Manly, Manly, Manly, Manly, Manly, Panthers, Panthers, Panthers, Panthers, Panthers, Panthers, Panthers, Panthers, Panthers, Panthers, Panthers, Panthers, Panthers, Panthers, Panthers, Panthers, Panthers, Panthers, Panthers, Panthers, Panthers, Panthers, Panthers, Panthers, Panthers, Panthers, Panthers, Panthers, Panthers, Panthers, Panthers, Panthers, Manly, Manly, Manly, Manly, Manly, Manly, Manly, Manly, Manly, Manly, Manly, Manly, Manly, Manly, Manly, Manly, Manly, Manly, Manly, Manly, Manly, Manly, Manly, Manly, Manly, Manly, Manly, Manly, Manly, Manly, Manly, Manly, Panthers, Panthers, Panthers, Panthers, Panthers, Panthers, Panthers, Panthers, Panthers, Panthers, Panthers, Panthers, Panthers, Panthers, Panthers, Panthers, Panthers, Panthers, Panthers, Panthers, Panthers, Panthers, Panthers, Panthers, Panthers, Panthers, Panthers, Panthers, Panthers, Panthers, Panthers, Panthers, Manly, Manly, Manly, Manly, Manly, Manly, Manly, Manly, Manly, Manly, Manly, Manly, Manly, Manly, Manly, Manly, Manly, Manly, Manly, Manly, Manly, Manly, Manly, Manly, Manly, Manly, Manly, Manly, Manly, Manly, Manly, Manly, Panthers, Panthers, Panthers, Panthers, Panthers, Panthers, Panthers, Panthers, Panthers, Panthers, Panthers, Panthers, Panthers, Panthers, Panthers, Panthers, Panthers, Panthers, Panthers, Panthers, Panthers, Panthers, Panthers, Panthers, Panthers, Panthers, Panthers, Panthers, Panthers, Panthers, Panthers, Panthers, Manly, Manly, Manly, Manly, Manly, Manly, Manly, Manly, Manly, Manly, Manly, Manly, Manly, Manly, Manly, Manly, Manly, Manly, Manly, Manly, Manly, Manly, Manly, Manly, Manly, Manly, Manly, Manly, Manly, Manly, Manly, Manly
, Raiders, Raiders, Raiders, Raiders, Raiders, Raiders, Raiders, Raiders, Raiders, Raiders, Raiders, Raiders, Raiders, Raiders, Raiders, Raiders, Raiders, Raiders, Raiders, Raiders, Raiders, Raiders, Raiders, Raiders, Raiders, Raiders, Raiders, Raiders, Raiders, Raiders, Raiders, Raiders, Raiders, Raiders, Raiders, Raiders, Raiders, Raiders, Raiders, Raiders, Raiders, Raiders, Raiders, Raiders, Raiders, Raiders, Raiders, Raiders, Raiders, Raiders, Raiders, Raiders, Raiders, Raiders, Raiders, Raiders, Raiders, Raiders, Raiders, Raiders, Raiders, Raiders, Raiders, Raiders, Dolphins, Dolphins, Dolphins, Dolphins, Dolphins, Dolphins, Dolphins, Dolphins, Dolphins, Dolphins, Dolphins, Dolphins, Dolphins, Dolphins, Dolphins, Dolphins, Dolphins, Dolphins, Dolphins, Dolphins, Dolphins, Dolphins, Dolphins, Dolphins, Dolphins, Dolphins, Dolphins, Dolphins, Dolphins, Dolphins, Dolphins, Dolphins, Dolphins, Dolphins, Dolphins, Dolphins, Dolphins, Dolphins, Dolphins, Dolphins, Dolphins, Dolphins, Dolphins, Dolphins, Dolphins, Dolphins, Dolphins, Dolphins, Dolphins, Dolphins, Dolphins, Dolphins, Dolphins, Dolphins, Dolphins, Dolphins, Dolphins, Dolphins, Dolphins, Dolphins, Dolphins, Dolphins, Dolphins, Dolphins, Raiders, Raiders, Raiders, Raiders, Raiders, Raiders, Raiders, Raiders, Raiders, Raiders, Raiders, Raiders, Raiders, Raiders, Raiders, Raiders, Raiders, Raiders, Raiders, Raiders, Raiders, Raiders, Raiders, Raiders, Raiders, Raiders, Raiders, Raiders, Raiders, Raiders, Raiders, Raiders, Raiders, Raiders, Raiders, Raiders, Raiders, Raiders, Raiders, Raiders, Raiders, Raiders, Raiders, Raiders, Raiders, Raiders, Raiders, Raiders, Raiders, Raiders, Raiders, Raiders, Raiders, Raiders, Raiders, Raiders, Raiders, Raiders, Raiders, Raiders, Raiders, Raiders, Raiders, Raiders, Dolphins, Dolphins, Dolphins, Dolphins, Dolphins, Dolphins, Dolphins, Dolphins, Dolphins, Dolphins, Dolphins, Dolphins, Dolphins, Dolphins, Dolphins, Dolphins, Dolphins, Dolphins, Dolphins, Dolphins, Dolphins, Dolphins, Dolphins, Dolphins, Dolphins, Dolphins, Dolphins, Dolphins, Dolphins, Dolphins, Dolphins, Dolphins, Dolphins, Dolphins, Dolphins, Dolphins, Dolphins, Dolphins, Dolphins, Dolphins, Dolphins, Dolphins, Dolphins, Dolphins, Dolphins, Dolphins, Dolphins, Dolphins, Dolphins, Dolphins, Dolphins, Dolphins, Dolphins, Dolphins, Dolphins, Dolphins, Dolphins, Dolphins, Dolphins, Dolphins, Dolphins, Dolphins, Dolphins, Dolphins
, Tigers, Tigers, Tigers, Tigers, Tigers, Tigers, Tigers, Tigers, Tigers, Tigers, Tigers, Tigers, Tigers, Tigers, Tigers, Tigers, Tigers, Tigers, Tigers, Tigers, Tigers, Tigers, Tigers, Tigers, Tigers, Tigers, Tigers, Tigers, Tigers, Tigers, Tigers, Tigers, Tigers, Tigers, Tigers, Tigers, Tigers, Tigers, Tigers, Tigers, Tigers, Tigers, Tigers, Tigers, Tigers, Tigers, Tigers, Tigers, Tigers, Tigers, Tigers, Tigers, Tigers, Tigers, Tigers, Tigers, Tigers, Tigers, Tigers, Tigers, Tigers, Tigers, Tigers, Tigers, Tigers, Tigers, Tigers, Tigers, Tigers, Tigers, Tigers, Tigers, Tigers, Tigers, Tigers, Tigers, Tigers, Tigers, Tigers, Tigers, Tigers, Tigers, Tigers, Tigers, Tigers, Tigers, Tigers, Tigers, Tigers, Tigers, Tigers, Tigers, Tigers, Tigers, Tigers, Tigers, Tigers, Tigers, Tigers, Tigers, Tigers, Tigers, Tigers, Tigers, Tigers, Tigers, Tigers, Tigers, Tigers, Tigers, Tigers, Tigers, Tigers, Tigers, Tigers, Tigers, Tigers, Tigers, Tigers, Tigers, Tigers, Tigers, Tigers, Tigers, Tigers, Tigers, Tigers, Tigers, Sharks, Sharks, Sharks, Sharks, Sharks, Sharks, Sharks, Sharks, Sharks, Sharks, Sharks, Sharks, Sharks, Sharks, Sharks, Sharks, Sharks, Sharks, Sharks, Sharks, Sharks, Sharks, Sharks, Sharks, Sharks, Sharks, Sharks, Sharks, Sharks, Sharks, Sharks, Sharks, Sharks, Sharks, Sharks, Sharks, Sharks, Sharks, Sharks, Sharks, Sharks, Sharks, Sharks, Sharks, Sharks, Sharks, Sharks, Sharks, Sharks, Sharks, Sharks, Sharks, Sharks, Sharks, Sharks, Sharks, Sharks, Sharks, Sharks, Sharks, Sharks, Sharks, Sharks, Sharks, Sharks, Sharks, Sharks, Sharks, Sharks, Sharks, Sharks, Sharks, Sharks, Sharks, Sharks, Sharks, Sharks, Sharks, Sharks, Sharks, Sharks, Sharks, Sharks, Sharks, Sharks, Sharks, Sharks, Sharks, Sharks, Sharks, Sharks, Sharks, Sharks, Sharks, Sharks, Sharks, Sharks, Sharks, Sharks, Sharks, Sharks, Sharks, Sharks, Sharks, Sharks, Sharks, Sharks, Sharks, Sharks, Sharks, Sharks, Sharks, Sharks, Sharks, Sharks, Sharks, Sharks, Sharks, Sharks, Sharks, Sharks, Sharks, Sharks, Sharks, Sharks, Sharks, Sharks, Sharks
Storm, 95.53965595981123, 96.45892351274787, 96.36635141861622, 96.58134440216764, 96.11610793131644, 96.47328038766994, 95.63684442485678, 96.5142598460842, 87.30606488011283, 87.37864077669903, 87.9864636209814, 89.0, 85.8974358974359, 88.03680981595092, 89.50276243093923, 89.45686900958466, 96.42857142857143, 96.92144373673037, 95.7396449704142, 97.1042471042471, 96.3254593175853, 97.53424657534246, 96.996996996997, 95.91419816138918, 87.25490196078431, 86.29629629629629, 92.47311827956989, 88.42592592592592, 87.5, 90.0, 96.29629629629629, 86.66666666666667, 95.41547277936962, 96.20225694444444, 95.94594594594594, 96.82652457075193, 96.5964343598055, 96.03310502283105, 96.09895337773548, 96.87020558453513, 86.7741935483871, 85.49528301886792, 88.44621513944223, 88.45208845208845, 86.79245283018868, 86.52037617554859, 85.98130841121495, 88.02816901408451, 96.92622950819673, 96.02750190985485, 95.79207920792079, 96.0285941223193, 95.71428571428572, 96.21928166351607, 99.40828402366864, 95.90643274853801, 97.5609756097561, 90.2439024390244, 88.09523809523809, 84.90566037735849, 85.71428571428571, 91.04477611940298, 70.0, 95.74468085106383, 95.68602693602693, 96.66299154722529, 96.3546566321731, 96.58395101514662, 95.05462909718229, 96.4100666173205, 96.25537139349294, 96.77750410509032, 89.1156462585034, 89.20367534456355, 89.28571428571429, 87.55401901469317, 90.78014184397163, 88.60759493670885, 88.09523809523809, 91.61147902869757, 95.87765957446808, 97.19101123595506, 97.03459637561778, 97.42489270386267, 95.61752988047809, 96.49561952440551, 97.23320158102767, 97.36070381231671, 85.07462686567165, 90.5027932960894, 93.54838709677419, 86.93181818181817, 93.75, 93.33333333333333, 88.0, 89.39393939393939, 95.55457746478874, 95.8756540473992, 96.10014443909485, 96.50008413259297, 96.08501118568232, 96.72630376855729, 95.51122194513717, 96.4332892998679, 87.11340206185567, 87.53943217665615, 89.84771573604061, 89.20353982300885, 94.18604651162791, 87.37864077669903, 88.73239436619718, 86.34146341463415, 95.76271186440678, 96.91160809371672, 96.29629629629629, 96.92118226600985, 96.68874172185431, 94.85094850948511, 96.63865546218487, 94.35028248587571, 83.78378378378379, 89.8876404494382, 96.15384615384616, 93.15068493150685, 95.0, 90.9090909090909, 100.0, 100.0, 95.42417748644901, 95.94343457808236, 95.71998885897317, 96.34365507260206, 95.4677889284558, 95.98113137466106, 95.34123910939013, 96.35066766193913, 85.80498866213152, 88.37726262305495, 86.94362017804154, 88.2783259612113, 86.92129629629629, 87.21649484536083, 85.82183186951067, 89.07599309153713, 95.66223250433777, 96.09785084678617, 95.62182741116752, 96.49048625792813, 95.94689028651293, 95.96344249809596, 96.01694915254238, 96.71905155776123, 88.66279069767442, 88.7991927346115, 91.00719424460432, 89.96728462377317, 84.0909090909091, 85.71428571428571, 82.85714285714286, 91.21212121212122, 95.66593406593407, 95.92370081105437, 95.43023821098687, 96.37026574253524, 95.71524213345235, 95.92169657422512, 96.50246305418719, 96.16709732988802, 83.84845463609173, 88.1549698316926, 85.0828729281768, 88.1216457960644, 85.92592592592592, 86.7595818815331, 87.77777777777777, 87.78696051423324, 96.32701421800948, 96.1712153936776, 96.23655913978494, 96.53431260041313, 96.07201309328968, 96.18112384069832, 95.47738693467338, 96.49327878433664, 87.32394366197182, 87.97327394209354, 87.93103448275862, 88.50267379679144, 83.5820895522388, 84.84848484848484, 87.5, 87.5, 95.64734751110072, 96.36526264433242, 95.93727726300784, 96.50195694716243, 95.80158374421038, 96.28081684477833, 95.90901652757323, 96.43003213555362, 86.19550858652576, 87.70806658130603, 86.9225302061123, 88.77168307548054, 88.32752613240417, 87.14750542299349, 85.35353535353535, 89.2416225749559, 94.65742251223492, 96.22200851765352, 96.17996604414262, 96.67936024371669, 95.49098196392785, 96.77068214804065, 97.20930232558139, 96.8895800933126, 81.01851851851852, 88.20058997050147, 91.1214953271028, 90.45454545454545, 92.94117647058823, 86.61417322834646, 90.9090909090909, 89.23076923076924, 95.66686783343393, 96.25223576390333, 96.254780429909, 96.56901434606992, 95.48872180451127, 96.26913952986845, 96.52173913043478, 96.3439323567941, 87.43243243243242, 88.32442067736186, 87.88819875776397, 88.07339449541286, 86.19528619528619, 87.51472320376914, 88.56088560885608, 86.94516971279373, 96.65236051502146, 96.68259769468654, 96.40883977900553, 96.87010954616588, 95.13274336283186, 96.89306358381504, 96.95550351288055, 95.98689598689599, 90.81632653061224, 87.00906344410876, 85.45454545454545, 86.1198738170347, 85.1063829787234, 92.3076923076923, 84.84848484848484, 89.47368421052632
