, Eels, Dolphins, Eels, Dolphins, Eels, Dolphins, Eels, Dolphins, Eels, Dolphins, Eels, Dolphins, Eels, Dolphins, Eels, Dolphins, Eels, Dolphins, Eels, Dolphins, Eels, Dolphins, Eels, Dolphins, Eels, Dolphins, Eels, Dolphins, Eels, Dolphins, Eels, Dolphins, Eels, Dolphins, Eels, Dolphins, Eels, Dolphins, Eels, Dolphins, Eels, Dolphins, Eels, Dolphins, Eels, Dolphins, Eels, Dolphins, Eels, Dolphins, Eels, Dolphins, Eels, Dolphins, Eels, Dolphins, Eels, Dolphins, Eels, Dolphins, Eels, Dolphins, Eels, Dolphins, Eels, Dolphins, Eels, Dolphins, Eels, Dolphins, Eels, Dolphins, Eels, Dolphins, Eels, Dolphins, Eels, Dolphins, Eels, Dolphins, Eels, Dolphins, Eels, Dolphins, Eels, Dolphins, Eels, Dolphins, Eels, Dolphins, Eels, Dolphins, Eels, Dolphins, Eels, Dolphins, Eels, Dolphins, Eels, Dolphins, Eels, Dolphins, Eels, Dolphins, Eels, Dolphins, Eels, Dolphins, Eels, Dolphins, Eels, Dolphins, Eels, Dolphins, Eels, Dolphins, Eels, Dolphins, Eels, Dolphins, Eels, Dolphins, Eels, Dolphins, Eels, Dolphins, Eels, Dolphins, Eels, Dolphins, Eels, Dolphins, Eels, Dolphins, Eels, Dolphins, Eels, Dolphins, Eels, Dolphins, Eels, Dolphins, Eels, Dolphins, Eels, Dolphins, Eels, Dolphins, Eels, Dolphins, Eels, Dolphins, Eels, Dolphins, Eels, Dolphins, Eels, Dolphins, Eels, Dolphins, Eels, Dolphins, Eels, Dolphins, Eels, Dolphins, Eels, Dolphins, Eels, Dolphins, Eels, Dolphins, Eels, Dolphins, Eels, Dolphins, Eels, Dolphins, Eels, Dolphins, Eels, Dolphins, Eels, Dolphins, Eels, Dolphins, Eels, Dolphins, Eels, Dolphins, Eels, Dolphins, Eels, Dolphins, Eels, Dolphins, Eels, Dolphins, Eels, Dolphins, Eels, Dolphins, Eels, Dolphins, Eels, Dolphins, Eels, Dolphins, Eels, Dolphins, Eels, Dolphins, Eels, Dolphins, Eels, Dolphins, Eels, Dolphins, Eels, Dolphins, Eels, Dolphins, Eels, Dolphins, Eels, Dolphins, Eels, Dolphins, Eels, Dolphins, Eels, Dolphins, Eels, Dolphins, Eels, Dolphins, Eels, Dolphins, Eels, Dolphins, Eels, Dolphins, Eels, Dolphins, Eels, Dolphins, Eels, Dolphins, Eels, Dolphins, Eels, Dolphins, Eels, Dolphins, Eels, Dolphins
, Knights, Knights, Titans, Titans, Knights, Knights, Titans, Titans, Knights, Knights, Titans, Titans, Knights, Knights, Titans, Titans, Knights, Knights, Titans, Titans, Knights, Knights, Titans, Titans, Knights, Knights, Titans, Titans, Knights, Knights, Titans, Titans, Knights, Knights, Titans, Titans, Knights, Knights, Titans, Titans, Knights, Knights, Titans, Titans, Knights, Knights, Titans, Titans, Knights, Knights, Titans, Titans, Knights, Knights, Titans, Titans, Knights, Knights, Titans, Titans, Knights, Knights, Titans, Titans, Knights, Knights, Titans, Titans, Knights, Knights, Titans, Titans, Knights, Knights, Titans, Titans, Knights, Knights, Titans, Titans, Knights, Knights, Titans, Titans, Knights, Knights, Titans, Titans, Knights, Knights, Titans, Titans, Knights, Knights, Titans, Titans, Knights, Knights, Titans, Titans, Knights, Knights, Titans, Titans, Knights, Knights, Titans, Titans, Knights, Knights, Titans, Titans, Knights, Knights, Titans, Titans, Knights, Knights, Titans, Titans, Knights, Knights, Titans, Titans, Knights, Knights, Titans, Titans, Knights, Knights, Titans, Titans, Knights, Knights, Titans, Titans, Knights, Knights, Titans, Titans, Knights, Knights, Titans, Titans, Knights, Knights, Titans, Titans, Knights, Knights, Titans, Titans, Knights, Knights, Titans, Titans, Knights, Knights, Titans, Titans, Knights, Knights, Titans, Titans, Knights, Knights, Titans, Titans, Knights, Knights, Titans, Titans, Knights, Knights, Titans, Titans, Knights, Knights, Titans, Titans, Knights, Knights, Titans, Titans, Knights, Knights, Titans, Titans, Knights, Knights, Titans, Titans, Knights, Knights, Titans, Titans, Knights, Knights, Titans, Titans, Knights, Knights, Titans, Titans, Knights, Knights, Titans, Titans, Knights, Knights, Titans, Titans, Knights, Knights, Titans, Titans, Knights, Knights, Titans, Titans, Knights, Knights, Titans, Titans, Knights, Knights, Titans, Titans, Knights, Knights, Titans, Titans, Knights, Knights, Titans, Titans, Knights, Knights, Titans, Titans, Knights, Knights, Titans, Titans, Knights, Knights, Titans, Titans, Knights, Knights, Titans, Titans, Knights, Knights, Titans, Titans
, Rabbitohs, Rabbitohs, Rabbitohs, Rabbitohs, Broncos, Broncos, Broncos, Broncos, Rabbitohs, Rabbitohs, Rabbitohs, Rabbitohs, Broncos, Broncos, Broncos, Broncos, Rabbitohs, Rabbitohs, Rabbitohs, Rabbitohs, Broncos, Broncos, Broncos, Broncos, Rabbitohs, Rabbitohs, Rabbitohs, Rabbitohs, Broncos, Broncos, Broncos, Broncos, Rabbitohs, Rabbitohs, Rabbitohs, Rabbitohs, Broncos, Broncos, Broncos, Broncos, Rabbitohs, Rabbitohs, Rabbitohs, Rabbitohs, Broncos, Broncos, Broncos, Broncos, Rabbitohs, Rabbitohs, Rabbitohs, Rabbitohs, Broncos, Broncos, Broncos, Broncos, Rabbitohs, Rabbitohs, Rabbitohs, Rabbitohs, Broncos, Broncos, Broncos, Broncos, Rabbitohs, Rabbitohs, Rabbitohs, Rabbitohs, Broncos, Broncos, Broncos, Broncos, Rabbitohs, Rabbitohs, Rabbitohs, Rabbitohs, Broncos, Broncos, Broncos, Broncos, Rabbitohs, Rabbitohs, Rabbitohs, Rabbitohs, Broncos, Broncos, Broncos, Broncos, Rabbitohs, Rabbitohs, Rabbitohs, Rabbitohs, Broncos, Broncos, Broncos, Broncos, Rabbitohs, Rabbitohs, Rabbitohs, Rabbitohs, Broncos, Broncos, Broncos, Broncos, Rabbitohs, Rabbitohs, Rabbitohs, Rabbitohs, Broncos, Broncos, Broncos, Broncos, Rabbitohs, Rabbitohs, Rabbitohs, Rabbitohs, Broncos, Broncos, Broncos, Broncos, Rabbitohs, Rabbitohs, Rabbitohs, Rabbitohs, Broncos, Broncos, Broncos, Broncos, Rabbitohs, Rabbitohs, Rabbitohs, Rabbitohs, Broncos, Broncos, Broncos, Broncos, Rabbitohs, Rabbitohs, Rabbitohs, Rabbitohs, Broncos, Broncos, Broncos, Broncos, Rabbitohs, Rabbitohs, Rabbitohs, Rabbitohs, Broncos, Broncos, Broncos, Broncos, Rabbitohs, Rabbitohs, Rabbitohs, Rabbitohs, Broncos, Broncos, Broncos, Broncos, Rabbitohs, Rabbitohs, Rabbitohs, Rabbitohs, Broncos, Broncos, Broncos, Broncos, Rabbitohs, Rabbitohs, Rabbitohs, Rabbitohs, Broncos, Broncos, Broncos, Broncos, Rabbitohs, Rabbitohs, Rabbitohs, Rabbitohs, Broncos, Broncos, Broncos, Broncos, Rabbitohs, Rabbitohs, Rabbitohs, Rabbitohs, Broncos, Broncos, Broncos, Broncos, Rabbitohs, Rabbitohs, Rabbitohs, Rabbitohs, Broncos, Broncos, Broncos, Broncos, Rabbitohs, Rabbitohs, Rabbitohs, Rabbitohs, Broncos, Broncos, Broncos, Broncos, Rabbitohs, Rabbitohs, Rabbitohs, Rabbitohs, Broncos, Broncos, Broncos, Broncos, Rabbitohs, Rabbitohs, Rabbitohs, Rabbitohs, Broncos, Broncos, Broncos, Broncos, Rabbitohs, Rabbitohs, Rabbitohs, Rabbitohs, Broncos, Broncos, Broncos, Broncos, Rabbitohs, Rabbitohs, Rabbitohs, Rabbitohs, Broncos, Broncos, Broncos, Broncos, Rabbitohs, Rabbitohs, Rabbitohs, Rabbitohs, Broncos, Broncos, Broncos, Broncos, Rabbitohs, Rabbitohs, Rabbitohs, Rabbitohs, Broncos, Broncos, Broncos, Broncos
, Raiders, Raiders, Raiders, Raiders, Raiders, Raiders, Raiders, Raiders, Bulldogs, Bulldogs, Bulldogs, Bulldogs, Bulldogs, Bulldogs, Bulldogs, Bulldogs, Raiders, Raiders, Raiders, Raiders, Raiders, Raiders, Raiders, Raiders, Bulldogs, Bulldogs, Bulldogs, Bulldogs, Bulldogs, Bulldogs, Bulldogs, Bulldogs, Raiders, Raiders, Raiders, Raiders, Raiders, Raiders, Raiders, Raiders, Bulldogs, Bulldogs, Bulldogs, Bulldogs, Bulldogs, Bulldogs, Bulldogs, Bulldogs, Raiders, Raiders, Raiders, Raiders, Raiders, Raiders, Raiders, Raiders, Bulldogs, Bulldogs, Bulldogs, Bulldogs, Bulldogs, Bulldogs, Bulldogs, Bulldogs, Raiders, Raiders, Raiders, Raiders, Raiders, Raiders, Raiders, Raiders, Bulldogs, Bulldogs, Bulldogs, Bulldogs, Bulldogs, Bulldogs, Bulldogs, Bulldogs, Raiders, Raiders, Raiders, Raiders, Raiders, Raiders, Raiders, Raiders, Bulldogs, Bulldogs, Bulldogs, Bulldogs, Bulldogs, Bulldogs, Bulldogs, Bulldogs, Raiders, Raiders, Raiders, Raiders, Raiders, Raiders, Raiders, Raiders, Bulldogs, Bulldogs, Bulldogs, Bulldogs, Bulldogs, Bulldogs, Bulldogs, Bulldogs, Raiders, Raiders, Raiders, Raiders, Raiders, Raiders, Raiders, Raiders, Bulldogs, Bulldogs, Bulldogs, Bulldogs, Bulldogs, Bulldogs, Bulldogs, Bulldogs, Raiders, Raiders, Raiders, Raiders, Raiders, Raiders, Raiders, Raiders, Bulldogs, Bulldogs, Bulldogs, Bulldogs, Bulldogs, Bulldogs, Bulldogs, Bulldogs, Raiders, Raiders, Raiders, Raiders, Raiders, Raiders, Raiders, Raiders, Bulldogs, Bulldogs, Bulldogs, Bulldogs, Bulldogs, Bulldogs, Bulldogs, Bulldogs, Raiders, Raiders, Raiders, Raiders, Raiders, Raiders, Raiders, Raiders, Bulldogs, Bulldogs, Bulldogs, Bulldogs, Bulldogs, Bulldogs, Bulldogs, Bulldogs, Raiders, Raiders, Raiders, Raiders, Raiders, Raiders, Raiders, Raiders, Bulldogs, Bulldogs, Bulldogs, Bulldogs, Bulldogs, Bulldogs, Bulldogs, Bulldogs, Raiders, Raiders, Raiders, Raiders, Raiders, Raiders, Raiders, Raiders, Bulldogs, Bulldogs, Bulldogs, Bulldogs, Bulldogs, Bulldogs, Bulldogs, Bulldogs, Raiders, Raiders, Raiders, Raiders, Raiders, Raiders, Raiders, Raiders, Bulldogs, Bulldogs, Bulldogs, Bulldogs, Bulldogs, Bulldogs, Bulldogs, Bulldogs, Raiders, Raiders, Raiders, Raiders, Raiders, Raiders, Raiders, Raiders, Bulldogs, Bulldogs, Bulldogs, Bulldogs, Bulldogs, Bulldogs, Bulldogs, Bulldogs, Raiders, Raiders, Raiders, Raiders, Raiders, Raiders, Raiders, Raiders, Bulldogs, Bulldogs, Bulldogs, Bulldogs, Bulldogs, Bulldogs, Bulldogs, Bulldogs
, Dragons, Dragons, Dragons, Dragons, Dragons, Dragons, Dragons, Dragons, Dragons, Dragons, Dragons, Dragons, Dragons, Dragons, Dragons, Dragons, Warriors, Warriors, Warriors, Warriors, Warriors, Warriors, Warriors, Warriors, Warriors, Warriors, Warriors, Warriors, Warriors, Warriors, Warriors, Warriors, Dragons, Dragons, Dragons, Dragons, Dragons, Dragons, Dragons, Dragons, Dragons, Dragons, Dragons, Dragons, Dragons, Dragons, Dragons, Dragons, Warriors, Warriors, Warriors, Warriors, Warriors, Warriors, Warriors, Warriors, Warriors, Warriors, Warriors, Warriors, Warriors, Warriors, Warriors, Warriors, Dragons, Dragons, Dragons, Dragons, Dragons, Dragons, Dragons, Dragons, Dragons, Dragons, Dragons, Dragons, Dragons, Dragons, Dragons, Dragons, Warriors, Warriors, Warriors, Warriors, Warriors, Warriors, Warriors, Warriors, Warriors, Warriors, Warriors, Warriors, Warriors, Warriors, Warriors, Warriors, Dragons, Dragons, Dragons, Dragons, Dragons, Dragons, Dragons, Dragons, Dragons, Dragons, Dragons, Dragons, Dragons, Dragons, Dragons, Dragons, Warriors, Warriors, Warriors, Warriors, Warriors, Warriors, Warriors, Warriors, Warriors, Warriors, Warriors, Warriors, Warriors, Warriors, Warriors, Warriors, Dragons, Dragons, Dragons, Dragons, Dragons, Dragons, Dragons, Dragons, Dragons, Dragons, Dragons, Dragons, Dragons, Dragons, Dragons, Dragons, Warriors, Warriors, Warriors, Warriors, Warriors, Warriors, Warriors, Warriors, Warriors, Warriors, Warriors, Warriors, Warriors, Warriors, Warriors, Warriors, Dragons, Dragons, Dragons, Dragons, Dragons, Dragons, Dragons, Dragons, Dragons, Dragons, Dragons, Dragons, Dragons, Dragons, Dragons, Dragons, Warriors, Warriors, Warriors, Warriors, Warriors, Warriors, Warriors, Warriors, Warriors, Warriors, Warriors, Warriors, Warriors, Warriors, Warriors, Warriors, Dragons, Dragons, Dragons, Dragons, Dragons, Dragons, Dragons, Dragons, Dragons, Dragons, Dragons, Dragons, Dragons, Dragons, Dragons, Dragons, Warriors, Warriors, Warriors, Warriors, Warriors, Warriors, Warriors, Warriors, Warriors, Warriors, Warriors, Warriors, Warriors, Warriors, Warriors, Warriors, Dragons, Dragons, Dragons, Dragons, Dragons, Dragons, Dragons, Dragons, Dragons, Dragons, Dragons, Dragons, Dragons, Dragons, Dragons, Dragons, Warriors, Warriors, Warriors, Warriors, Warriors, Warriors, Warriors, Warriors, Warriors, Warriors, Warriors, Warriors, Warriors, Warriors, Warriors, Warriors
, Cowboys, Cowboys, Cowboys, Cowboys, Cowboys, Cowboys, Cowboys, Cowboys, Cowboys, Cowboys, Cowboys, Cowboys, Cowboys, Cowboys, Cowboys, Cowboys, Cowboys, Cowboys, Cowboys, Cowboys, Cowboys, Cowboys, Cowboys, Cowboys, Cowboys, Cowboys, Cowboys, Cowboys, Cowboys, Cowboys, Cowboys, Cowboys, Panthers, Panthers, Panthers, Panthers, Panthers, Panthers, Panthers, Panthers, Panthers, Panthers, Panthers, Panthers, Panthers, Panthers, Panthers, Panthers, Panthers, Panthers, Panthers, Panthers, Panthers, Panthers, Panthers, Panthers, Panthers, Panthers, Panthers, Panthers, Panthers, Panthers, Panthers, Panthers, Cowboys, Cowboys, Cowboys, Cowboys, Cowboys, Cowboys, Cowboys, Cowboys, Cowboys, Cowboys, Cowboys, Cowboys, Cowboys, Cowboys, Cowboys, Cowboys, Cowboys, Cowboys, Cowboys, Cowboys, Cowboys, Cowboys, Cowboys, Cowboys, Cowboys, Cowboys, Cowboys, Cowboys, Cowboys, Cowboys, Cowboys, Cowboys, Panthers, Panthers, Panthers, Panthers, Panthers, Panthers, Panthers, Panthers, Panthers, Panthers, Panthers, Panthers, Panthers, Panthers, Panthers, Panthers, Panthers, Panthers, Panthers, Panthers, Panthers, Panthers, Panthers, Panthers, Panthers, Panthers, Panthers, Panthers, Panthers, Panthers, Panthers, Panthers, Cowboys, Cowboys, Cowboys, Cowboys, Cowboys, Cowboys, Cowboys, Cowboys, Cowboys, Cowboys, Cowboys, Cowboys, Cowboys, Cowboys, Cowboys, Cowboys, Cowboys, Cowboys, Cowboys, Cowboys, Cowboys, Cowboys, Cowboys, Cowboys, Cowboys, Cowboys, Cowboys, Cowboys, Cowboys, Cowboys, Cowboys, Cowboys, Panthers, Panthers, Panthers, Panthers, Panthers, Panthers, Panthers, Panthers, Panthers, Panthers, Panthers, Panthers, Panthers, Panthers, Panthers, Panthers, Panthers, Panthers, Panthers, Panthers, Panthers, Panthers, Panthers, Panthers, Panthers, Panthers, Panthers, Panthers, Panthers, Panthers, Panthers, Panthers, Cowboys, Cowboys, Cowboys, Cowboys, Cowboys, Cowboys, Cowboys, Cowboys, Cowboys, Cowboys, Cowboys, Cowboys, Cowboys, Cowboys, Cowboys, Cowboys, Cowboys, Cowboys, Cowboys, Cowboys, Cowboys, Cowboys, Cowboys, Cowboys, Cowboys, Cowboys, Cowboys, Cowboys, Cowboys, Cowboys, Cowboys, Cowboys, Panthers, Panthers, Panthers, Panthers, Panthers, Panthers, Panthers, Panthers, Panthers, Panthers, Panthers, Panthers, Panthers, Panthers, Panthers, Panthers, Panthers, Panthers, Panthers, Panthers, Panthers, Panthers, Panthers, Panthers, Panthers, Panthers, Panthers, Panthers, Panthers, Panthers, Panthers, Panthers
, Storm, Storm, Storm, Storm, Storm, Storm, Storm, Storm, Storm, Storm, Storm, Storm, Storm, Storm, Storm, Storm, Storm, Storm, Storm, Storm, Storm, Storm, Storm, Storm, Storm, Storm, Storm, Storm, Storm, Storm, Storm, Storm, Storm, Storm, Storm, Storm, Storm, Storm, Storm, Storm, Storm, Storm, Storm, Storm, Storm, Storm, Storm, Storm, Storm, Storm, Storm, Storm, Storm, Storm, Storm, Storm, Storm, Storm, Storm, Storm, Storm, Storm, Storm, Storm, Tigers, Tigers, Tigers, Tigers, Tigers, Tigers, Tigers, Tigers, Tigers, Tigers, Tigers, Tigers, Tigers, Tigers, Tigers, Tigers, Tigers, Tigers, Tigers, Tigers, Tigers, Tigers, Tigers, Tigers, Tigers, Tigers, Tigers, Tigers, Tigers, Tigers, Tigers, Tigers, Tigers, Tigers, Tigers, Tigers, Tigers, Tigers, Tigers, Tigers, Tigers, Tigers, Tigers, Tigers, Tigers, Tigers, Tigers, Tigers, Tigers, Tigers, Tigers, Tigers, Tigers, Tigers, Tigers, Tigers, Tigers, Tigers, Tigers, Tigers, Tigers, Tigers, Tigers, Tigers, Storm, Storm, Storm, Storm, Storm, Storm, Storm, Storm, Storm, Storm, Storm, Storm, Storm, Storm, Storm, Storm, Storm, Storm, Storm, Storm, Storm, Storm, Storm, Storm, Storm, Storm, Storm, Storm, Storm, Storm, Storm, Storm, Storm, Storm, Storm, Storm, Storm, Storm, Storm, Storm, Storm, Storm, Storm, Storm, Storm, Storm, Storm, Storm, Storm, Storm, Storm, Storm, Storm, Storm, Storm, Storm, Storm, Storm, Storm, Storm, Storm, Storm, Storm, Storm, Tigers, Tigers, Tigers, Tigers, Tigers, Tigers, Tigers, Tigers, Tigers, Tigers, Tigers, Tigers, Tigers, Tigers, Tigers, Tigers, Tigers, Tigers, Tigers, Tigers, Tigers, Tigers, Tigers, Tigers, Tigers, Tigers, Tigers, Tigers, Tigers, Tigers, Tigers, Tigers, Tigers, Tigers, Tigers, Tigers, Tigers, Tigers, Tigers, Tigers, Tigers, Tigers, Tigers, Tigers, Tigers, Tigers, Tigers, Tigers, Tigers, Tigers, Tigers, Tigers, Tigers, Tigers, Tigers, Tigers, Tigers, Tigers, Tigers, Tigers, Tigers, Tigers, Tigers, Tigers
, Manly, Manly, Manly, Manly, Manly, Manly, Manly, Manly, Manly, Manly, Manly, Manly, Manly, Manly, Manly, Manly, Manly, Manly, Manly, Manly, Manly, Manly, Manly, Manly, Manly, Manly, Manly, Manly, Manly, Manly, Manly, Manly, Manly, Manly, Manly, Manly, Manly, Manly, Manly, Manly, Manly, Manly, Manly, Manly, Manly, Manly, Manly, Manly, Manly, Manly, Manly, Manly, Manly, Manly, Manly, Manly, Manly, Manly, Manly, Manly, Manly, Manly, Manly, Manly, Manly, Manly, Manly, Manly, Manly, Manly, Manly, Manly, Manly, Manly, Manly, Manly, Manly, Manly, Manly, Manly, Manly, Manly, Manly, Manly, Manly, Manly, Manly, Manly, Manly, Manly, Manly, Manly, Manly, Manly, Manly, Manly, Manly, Manly, Manly, Manly, Manly, Manly, Manly, Manly, Manly, Manly, Manly, Manly, Manly, Manly, Manly, Manly, Manly, Manly, Manly, Manly, Manly, Manly, Manly, Manly, Manly, Manly, Manly, Manly, Manly, Manly, Manly, Manly, Sharks, Sharks, Sharks, Sharks, Sharks, Sharks, Sharks, Sharks, Sharks, Sharks, Sharks, Sharks, Sharks, Sharks, Sharks, Sharks, Sharks, Sharks, Sharks, Sharks, Sharks, Sharks, Sharks, Sharks, Sharks, Sharks, Sharks, Sharks, Sharks, Sharks, Sharks, Sharks, Sharks, Sharks, Sharks, Sharks, Sharks, Sharks, Sharks, Sharks, Sharks, Sharks, Sharks, Sharks, Sharks, Sharks, Sharks, Sharks, Sharks, Sharks, Sharks, Sharks, Sharks, Sharks, Sharks, Sharks, Sharks, Sharks, Sharks, Sharks, Sharks, Sharks, Sharks, Sharks, Sharks, Sharks, Sharks, Sharks, Sharks, Sharks, Sharks, Sharks, Sharks, Sharks, Sharks, Sharks, Sharks, Sharks, Sharks, Sharks, Sharks, Sharks, Sharks, Sharks, Sharks, Sharks, Sharks, Sharks, Sharks, Sharks, Sharks, Sharks, Sharks, Sharks, Sharks, Sharks, Sharks, Sharks, Sharks, Sharks, Sharks, Sharks, Sharks, Sharks, Sharks, Sharks, Sharks, Sharks, Sharks, Sharks, Sharks, Sharks, Sharks, Sharks, Sharks, Sharks, Sharks, Sharks, Sharks, Sharks, Sharks, Sharks, Sharks, Sharks, Sharks, Sharks, Sharks, Sharks
Storm, 69.25711275026345, 68.89091619966115, 70.55027173913044, 69.42372881355932, 66.0617059891107, 66.57790836470481, 66.7878237164925, 67.27871939736346, 68.7081190587502, 69.35734244023595, 70.39937353171496, 69.65329178028827, 66.83283835383963, 66.40515851692639, 66.45333333333333, 67.02761234434217, 67.14253342397461, 67.94716064378986, 66.67320133307196, 68.25742574257426, 64.11570853167338, 64.58615304528891, 65.34457767821847, 64.888238424694, 67.25784447476126, 66.74171469740634, 66.62143826322931, 65.95106186518929, 63.63300492610837, 64.85897515721312, 63.89159363842908, 65.91086786551995, 71.57644663159681, 71.65847873962392, 70.7874682472481, 70.4635761589404, 69.4773519163763, 68.56202474180002, 66.76393346950685, 69.34763181411975, 70.63492063492063, 71.4314638590808, 69.8692152917505, 73.27405857740585, 68.04501084598698, 69.49579831932773, 67.97091412742382, 69.25601750547045, 69.07587548638132, 70.22209234365869, 68.0695564516129, 70.07150153217569, 66.46547721695298, 66.78335801804228, 66.72932330827066, 68.1203007518797, 69.37832216316154, 69.95009505703422, 67.92564178223664, 69.16866028708134, 66.02980814967496, 66.0926939169617, 64.8129625925185, 66.15415739429497, 45.53376906318083, 44.23913043478261, 47.1671388101983, 47.482014388489205, 42.1822272215973, 45.1564266867697, 41.03286384976526, 44.287063267233236, 46.37592137592137, 46.61071659134925, 44.00684931506849, 49.00990099009901, 44.71544715447154, 44.03669724770643, 43.65079365079365, 43.60730593607306, 44.35001573811772, 42.99212598425196, 43.96853146853147, 42.99674267100978, 40.501404797925225, 40.78114771983417, 40.53610503282275, 45.690140845070424, 44.95622382946326, 44.635514018691595, 43.87755102040816, 43.977591036414566, 40.439180853688626, 42.44604316546763, 40.55415617128463, 38.0564263322884, 50.604982206405694, 47.93103448275862, 49.910554561717355, 47.50430292598967, 44.88479262672811, 45.19607843137255, 44.17767106842737, 44.43231441048035, 47.3257698541329, 48.99034240561896, 51.45228215767634, 47.71784232365145, 45.93088071348941, 44.71126357918811, 46.24505928853755, 45.06627393225332, 44.90777866880513, 47.12084347120843, 44.71458773784355, 45.260915867944625, 42.66029246344207, 43.131340828077875, 43.50877192982456, 44.749485243651336, 45.70411794611083, 43.42688330871492, 43.075117370892016, 44.12470023980815, 43.6269764440142, 44.230769230769226, 41.01307189542484, 43.09906858594412, 67.4934036939314, 67.20228530619532, 65.96426935409986, 67.78868630201028, 65.74972368905809, 66.14280410840243, 66.44961240310077, 65.06849315068493, 67.13826366559485, 68.21722198182604, 67.76947705442903, 67.22192369693714, 64.63642908567314, 66.04637424309556, 63.53491720662346, 66.44493717664449, 64.66791588590465, 65.15453116815087, 65.71504097277293, 64.85411140583554, 62.505344164172726, 63.82766955779895, 61.65655123170296, 63.772399778311474, 64.59076923076923, 66.50782013685239, 66.17363344051446, 65.60025340513145, 63.47487734731856, 63.22094814307718, 62.97527529607313, 62.88927335640139, 69.65851407475773, 69.43458717766737, 70.79178885630498, 69.98202516476933, 68.6082059533387, 67.01545396007727, 66.76124847993515, 68.14663951120164, 68.91416192797183, 69.40852819807428, 68.6932215234102, 69.3891557995882, 66.85093053252257, 66.68575792287132, 66.76470588235294, 66.63336663336663, 67.39579034255055, 67.63542093054987, 67.12744436952124, 67.29067392784206, 64.68096611391493, 64.9217085147781, 64.2544365061074, 64.36219739292365, 66.9162377164249, 67.96272493573264, 64.73308112652376, 66.63920922570017, 63.678618857901725, 64.8654561365128, 63.37871631008613, 63.91192450672004, 43.83358098068351, 44.74650991917707, 42.018348623853214, 42.5414364640884, 42.17821782178218, 42.26856561546287, 43.31742243436754, 41.97860962566845, 42.63157894736842, 43.19526627218935, 43.27354260089686, 43.333333333333336, 39.56574185765983, 42.36153377967133, 42.99212598425196, 40.915593705293276, 43.0401366353544, 41.335044929396666, 41.33476856835307, 43.387978142076506, 39.365725923770725, 39.63397197597941, 40.47442550037065, 39.76435935198822, 40.93186372745491, 39.625506072874494, 41.3265306122449, 41.9397116644823, 39.26186291739894, 40.23668639053255, 43.24324324324324, 38.00170794192997, 45.83761562178829, 45.44564152791381, 49.74226804123711, 48.58611825192802, 42.07723035952064, 46.206425153793575, 45.68690095846645, 45.68807339449542, 48.945615982241954, 45.22727272727273, 46.72364672364672, 46.45892351274787, 45.12779552715655, 43.82440476190476, 44.11764705882353, 42.71653543307087, 43.00225733634311, 44.010840108401084, 43.84508990318119, 45.2513966480447, 40.51398337112623, 42.28796844181459, 41.99424736337488, 42.61363636363637, 44.22827496757458, 44.30628272251309, 43.78283712784589, 45.744680851063826, 39.96358670914884, 39.59484346224678, 40.804597701149426, 41.46341463414634
