, Raiders, Warriors, Raiders, Warriors, Raiders, Warriors, Raiders, Warriors, Raiders, Warriors, Raiders, Warriors, Raiders, Warriors, Raiders, Warriors, Raiders, Warriors, Raiders, Warriors, Raiders, Warriors, Raiders, Warriors, Raiders, Warriors, Raiders, Warriors, Raiders, Warriors, Raiders, Warriors, Raiders, Warriors, Raiders, Warriors, Raiders, Warriors, Raiders, Warriors, Raiders, Warriors, Raiders, Warriors, Raiders, Warriors, Raiders, Warriors, Raiders, Warriors, Raiders, Warriors, Raiders, Warriors, Raiders, Warriors, Raiders, Warriors, Raiders, Warriors, Raiders, Warriors, Raiders, Warriors, Raiders, Warriors, Raiders, Warriors, Raiders, Warriors, Raiders, Warriors, Raiders, Warriors, Raiders, Warriors, Raiders, Warriors, Raiders, Warriors, Raiders, Warriors, Raiders, Warriors, Raiders, Warriors, Raiders, Warriors, Raiders, Warriors, Raiders, Warriors, Raiders, Warriors, Raiders, Warriors, Raiders, Warriors, Raiders, Warriors, Raiders, Warriors, Raiders, Warriors, Raiders, Warriors, Raiders, Warriors, Raiders, Warriors, Raiders, Warriors, Raiders, Warriors, Raiders, Warriors, Raiders, Warriors, Raiders, Warriors, Raiders, Warriors, Raiders, Warriors, Raiders, Warriors, Raiders, Warriors, Raiders, Warriors, Raiders, Warriors, Raiders, Warriors, Raiders, Warriors, Raiders, Warriors, Raiders, Warriors, Raiders, Warriors, Raiders, Warriors, Raiders, Warriors, Raiders, Warriors, Raiders, Warriors, Raiders, Warriors, Raiders, Warriors, Raiders, Warriors, Raiders, Warriors, Raiders, Warriors, Raiders, Warriors, Raiders, Warriors, Raiders, Warriors, Raiders, Warriors, Raiders, Warriors, Raiders, Warriors, Raiders, Warriors, Raiders, Warriors, Raiders, Warriors, Raiders, Warriors, Raiders, Warriors, Raiders, Warriors, Raiders, Warriors, Raiders, Warriors, Raiders, Warriors, Raiders, Warriors, Raiders, Warriors, Raiders, Warriors, Raiders, Warriors, Raiders, Warriors, Raiders, Warriors, Raiders, Warriors, Raiders, Warriors, Raiders, Warriors, Raiders, Warriors, Raiders, Warriors, Raiders, Warriors, Raiders, Warriors, Raiders, Warriors, Raiders, Warriors, Raiders, Warriors, Raiders, Warriors, Raiders, Warriors, Raiders, Warriors, Raiders, Warriors, Raiders, Warriors, Raiders, Warriors, Raiders, Warriors, Raiders, Warriors, Raiders, Warriors, Raiders, Warriors, Raiders, Warriors, Raiders, Warriors, Raiders, Warriors, Raiders, Warriors, Raiders, Warriors, Raiders, Warriors, Raiders, Warriors
, Panthers, Panthers, Sharks, Sharks, Panthers, Panthers, Sharks, Sharks, Panthers, Panthers, Sharks, Sharks, Panthers, Panthers, Sharks, Sharks, Panthers, Panthers, Sharks, Sharks, Panthers, Panthers, Sharks, Sharks, Panthers, Panthers, Sharks, Sharks, Panthers, Panthers, Sharks, Sharks, Panthers, Panthers, Sharks, Sharks, Panthers, Panthers, Sharks, Sharks, Panthers, Panthers, Sharks, Sharks, Panthers, Panthers, Sharks, Sharks, Panthers, Panthers, Sharks, Sharks, Panthers, Panthers, Sharks, Sharks, Panthers, Panthers, Sharks, Sharks, Panthers, Panthers, Sharks, Sharks, Panthers, Panthers, Sharks, Sharks, Panthers, Panthers, Sharks, Sharks, Panthers, Panthers, Sharks, Sharks, Panthers, Panthers, Sharks, Sharks, Panthers, Panthers, Sharks, Sharks, Panthers, Panthers, Sharks, Sharks, Panthers, Panthers, Sharks, Sharks, Panthers, Panthers, Sharks, Sharks, Panthers, Panthers, Sharks, Sharks, Panthers, Panthers, Sharks, Sharks, Panthers, Panthers, Sharks, Sharks, Panthers, Panthers, Sharks, Sharks, Panthers, Panthers, Sharks, Sharks, Panthers, Panthers, Sharks, Sharks, Panthers, Panthers, Sharks, Sharks, Panthers, Panthers, Sharks, Sharks, Panthers, Panthers, Sharks, Sharks, Panthers, Panthers, Sharks, Sharks, Panthers, Panthers, Sharks, Sharks, Panthers, Panthers, Sharks, Sharks, Panthers, Panthers, Sharks, Sharks, Panthers, Panthers, Sharks, Sharks, Panthers, Panthers, Sharks, Sharks, Panthers, Panthers, Sharks, Sharks, Panthers, Panthers, Sharks, Sharks, Panthers, Panthers, Sharks, Sharks, Panthers, Panthers, Sharks, Sharks, Panthers, Panthers, Sharks, Sharks, Panthers, Panthers, Sharks, Sharks, Panthers, Panthers, Sharks, Sharks, Panthers, Panthers, Sharks, Sharks, Panthers, Panthers, Sharks, Sharks, Panthers, Panthers, Sharks, Sharks, Panthers, Panthers, Sharks, Sharks, Panthers, Panthers, Sharks, Sharks, Panthers, Panthers, Sharks, Sharks, Panthers, Panthers, Sharks, Sharks, Panthers, Panthers, Sharks, Sharks, Panthers, Panthers, Sharks, Sharks, Panthers, Panthers, Sharks, Sharks, Panthers, Panthers, Sharks, Sharks, Panthers, Panthers, Sharks, Sharks, Panthers, Panthers, Sharks, Sharks, Panthers, Panthers, Sharks, Sharks, Panthers, Panthers, Sharks, Sharks, Panthers, Panthers, Sharks, Sharks, Panthers, Panthers, Sharks, Sharks, Panthers, Panthers, Sharks, Sharks
, Roosters, Roosters, Roosters, Roosters, Broncos, Broncos, Broncos, Broncos, Roosters, Roosters, Roosters, Roosters, Broncos, Broncos, Broncos, Broncos, Roosters, Roosters, Roosters, Roosters, Broncos, Broncos, Broncos, Broncos, Roosters, Roosters, Roosters, Roosters, Broncos, Broncos, Broncos, Broncos, Roosters, Roosters, Roosters, Roosters, Broncos, Broncos, Broncos, Broncos, Roosters, Roosters, Roosters, Roosters, Broncos, Broncos, Broncos, Broncos, Roosters, Roosters, Roosters, Roosters, Broncos, Broncos, Broncos, Broncos, Roosters, Roosters, Roosters, Roosters, Broncos, Broncos, Broncos, Broncos, Roosters, Roosters, Roosters, Roosters, Broncos, Broncos, Broncos, Broncos, Roosters, Roosters, Roosters, Roosters, Broncos, Broncos, Broncos, Broncos, Roosters, Roosters, Roosters, Roosters, Broncos, Broncos, Broncos, Broncos, Roosters, Roosters, Roosters, Roosters, Broncos, Broncos, Broncos, Broncos, Roosters, Roosters, Roosters, Roosters, Broncos, Broncos, Broncos, Broncos, Roosters, Roosters, Roosters, Roosters, Broncos, Broncos, Broncos, Broncos, Roosters, Roosters, Roosters, Roosters, Broncos, Broncos, Broncos, Broncos, Roosters, Roosters, Roosters, Roosters, Broncos, Broncos, Broncos, Broncos, Roosters, Roosters, Roosters, Roosters, Broncos, Broncos, Broncos, Broncos, Roosters, Roosters, Roosters, Roosters, Broncos, Broncos, Broncos, Broncos, Roosters, Roosters, Roosters, Roosters, Broncos, Broncos, Broncos, Broncos, Roosters, Roosters, Roosters, Roosters, Broncos, Broncos, Broncos, Broncos, Roosters, Roosters, Roosters, Roosters, Broncos, Broncos, Broncos, Broncos, Roosters, Roosters, Roosters, Roosters, Broncos, Broncos, Broncos, Broncos, Roosters, Roosters, Roosters, Roosters, Broncos, Broncos, Broncos, Broncos, Roosters, Roosters, Roosters, Roosters, Broncos, Broncos, Broncos, Broncos, Roosters, Roosters, Roosters, Roosters, Broncos, Broncos, Broncos, Broncos, Roosters, Roosters, Roosters, Roosters, Broncos, Broncos, Broncos, Broncos, Roosters, Roosters, Roosters, Roosters, Broncos, Broncos, Broncos, Broncos, Roosters, Roosters, Roosters, Roosters, Broncos, Broncos, Broncos, Broncos, Roosters, Roosters, Roosters, Roosters, Broncos, Broncos, Broncos, Broncos, Roosters, Roosters, Roosters, Roosters, Broncos, Broncos, Broncos, Broncos, Roosters, Roosters, Roosters, Roosters, Broncos, Broncos, Broncos, Broncos, Roosters, Roosters, Roosters, Roosters, Broncos, Broncos, Broncos, Broncos
, Tigers, Tigers, Tigers, Tigers, Tigers, Tigers, Tigers, Tigers, Knights, Knights, Knights, Knights, Knights, Knights, Knights, Knights, Tigers, Tigers, Tigers, Tigers, Tigers, Tigers, Tigers, Tigers, Knights, Knights, Knights, Knights, Knights, Knights, Knights, Knights, Tigers, Tigers, Tigers, Tigers, Tigers, Tigers, Tigers, Tigers, Knights, Knights, Knights, Knights, Knights, Knights, Knights, Knights, Tigers, Tigers, Tigers, Tigers, Tigers, Tigers, Tigers, Tigers, Knights, Knights, Knights, Knights, Knights, Knights, Knights, Knights, Tigers, Tigers, Tigers, Tigers, Tigers, Tigers, Tigers, Tigers, Knights, Knights, Knights, Knights, Knights, Knights, Knights, Knights, Tigers, Tigers, Tigers, Tigers, Tigers, Tigers, Tigers, Tigers, Knights, Knights, Knights, Knights, Knights, Knights, Knights, Knights, Tigers, Tigers, Tigers, Tigers, Tigers, Tigers, Tigers, Tigers, Knights, Knights, Knights, Knights, Knights, Knights, Knights, Knights, Tigers, Tigers, Tigers, Tigers, Tigers, Tigers, Tigers, Tigers, Knights, Knights, Knights, Knights, Knights, Knights, Knights, Knights, Tigers, Tigers, Tigers, Tigers, Tigers, Tigers, Tigers, Tigers, Knights, Knights, Knights, Knights, Knights, Knights, Knights, Knights, Tigers, Tigers, Tigers, Tigers, Tigers, Tigers, Tigers, Tigers, Knights, Knights, Knights, Knights, Knights, Knights, Knights, Knights, Tigers, Tigers, Tigers, Tigers, Tigers, Tigers, Tigers, Tigers, Knights, Knights, Knights, Knights, Knights, Knights, Knights, Knights, Tigers, Tigers, Tigers, Tigers, Tigers, Tigers, Tigers, Tigers, Knights, Knights, Knights, Knights, Knights, Knights, Knights, Knights, Tigers, Tigers, Tigers, Tigers, Tigers, Tigers, Tigers, Tigers, Knights, Knights, Knights, Knights, Knights, Knights, Knights, Knights, Tigers, Tigers, Tigers, Tigers, Tigers, Tigers, Tigers, Tigers, Knights, Knights, Knights, Knights, Knights, Knights, Knights, Knights, Tigers, Tigers, Tigers, Tigers, Tigers, Tigers, Tigers, Tigers, Knights, Knights, Knights, Knights, Knights, Knights, Knights, Knights, Tigers, Tigers, Tigers, Tigers, Tigers, Tigers, Tigers, Tigers, Knights, Knights, Knights, Knights, Knights, Knights, Knights, Knights
, Dolphins, Dolphins, Dolphins, Dolphins, Dolphins, Dolphins, Dolphins, Dolphins, Dolphins, Dolphins, Dolphins, Dolphins, Dolphins, Dolphins, Dolphins, Dolphins, Rabbitohs, Rabbitohs, Rabbitohs, Rabbitohs, Rabbitohs, Rabbitohs, Rabbitohs, Rabbitohs, Rabbitohs, Rabbitohs, Rabbitohs, Rabbitohs, Rabbitohs, Rabbitohs, Rabbitohs, Rabbitohs, Dolphins, Dolphins, Dolphins, Dolphins, Dolphins, Dolphins, Dolphins, Dolphins, Dolphins, Dolphins, Dolphins, Dolphins, Dolphins, Dolphins, Dolphins, Dolphins, Rabbitohs, Rabbitohs, Rabbitohs, Rabbitohs, Rabbitohs, Rabbitohs, Rabbitohs, Rabbitohs, Rabbitohs, Rabbitohs, Rabbitohs, Rabbitohs, Rabbitohs, Rabbitohs, Rabbitohs, Rabbitohs, Dolphins, Dolphins, Dolphins, Dolphins, Dolphins, Dolphins, Dolphins, Dolphins, Dolphins, Dolphins, Dolphins, Dolphins, Dolphins, Dolphins, Dolphins, Dolphins, Rabbitohs, Rabbitohs, Rabbitohs, Rabbitohs, Rabbitohs, Rabbitohs, Rabbitohs, Rabbitohs, Rabbitohs, Rabbitohs, Rabbitohs, Rabbitohs, Rabbitohs, Rabbitohs, Rabbitohs, Rabbitohs, Dolphins, Dolphins, Dolphins, Dolphins, Dolphins, Dolphins, Dolphins, Dolphins, Dolphins, Dolphins, Dolphins, Dolphins, Dolphins, Dolphins, Dolphins, Dolphins, Rabbitohs, Rabbitohs, Rabbitohs, Rabbitohs, Rabbitohs, Rabbitohs, Rabbitohs, Rabbitohs, Rabbitohs, Rabbitohs, Rabbitohs, Rabbitohs, Rabbitohs, Rabbitohs, Rabbitohs, Rabbitohs, Dolphins, Dolphins, Dolphins, Dolphins, Dolphins, Dolphins, Dolphins, Dolphins, Dolphins, Dolphins, Dolphins, Dolphins, Dolphins, Dolphins, Dolphins, Dolphins, Rabbitohs, Rabbitohs, Rabbitohs, Rabbitohs, Rabbitohs, Rabbitohs, Rabbitohs, Rabbitohs, Rabbitohs, Rabbitohs, Rabbitohs, Rabbitohs, Rabbitohs, Rabbitohs, Rabbitohs, Rabbitohs, Dolphins, Dolphins, Dolphins, Dolphins, Dolphins, Dolphins, Dolphins, Dolphins, Dolphins, Dolphins, Dolphins, Dolphins, Dolphins, Dolphins, Dolphins, Dolphins, Rabbitohs, Rabbitohs, Rabbitohs, Rabbitohs, Rabbitohs, Rabbitohs, Rabbitohs, Rabbitohs, Rabbitohs, Rabbitohs, Rabbitohs, Rabbitohs, Rabbitohs, Rabbitohs, Rabbitohs, Rabbitohs, Dolphins, Dolphins, Dolphins, Dolphins, Dolphins, Dolphins, Dolphins, Dolphins, Dolphins, Dolphins, Dolphins, Dolphins, Dolphins, Dolphins, Dolphins, Dolphins, Rabbitohs, Rabbitohs, Rabbitohs, Rabbitohs, Rabbitohs, Rabbitohs, Rabbitohs, Rabbitohs, Rabbitohs, Rabbitohs, Rabbitohs, Rabbitohs, Rabbitohs, Rabbitohs, Rabbitohs, Rabbitohs, Dolphins, Dolphins, Dolphins, Dolphins, Dolphins, Dolphins, Dolphins, Dolphins, Dolphins, Dolphins, Dolphins, Dolphins, Dolphins, Dolphins, Dolphins, Dolphins, Rabbitohs, Rabbitohs, Rabbitohs, Rabbitohs, Rabbitohs, Rabbitohs, Rabbitohs, Rabbitohs, Rabbitohs, Rabbitohs, Rabbitohs, Rabbitohs, Rabbitohs, Rabbitohs, Rabbitohs, Rabbitohs
, Dragons, Dragons, Dragons, Dragons, Dragons, Dragons, Dragons, Dragons, Dragons, Dragons, Dragons, Dragons, Dragons, Dragons, Dragons, Dragons, Dragons, Dragons, Dragons, Dragons, Dragons, Dragons, Dragons, Dragons, Dragons, Dragons, Dragons, Dragons, Dragons, Dragons, Dragons, Dragons, Bulldogs, Bulldogs, Bulldogs, Bulldogs, Bulldogs, Bulldogs, Bulldogs, Bulldogs, Bulldogs, Bulldogs, Bulldogs, Bulldogs, Bulldogs, Bulldogs, Bulldogs, Bulldogs, Bulldogs, Bulldogs, Bulldogs, Bulldogs, Bulldogs, Bulldogs, Bulldogs, Bulldogs, Bulldogs, Bulldogs, Bulldogs, Bulldogs, Bulldogs, Bulldogs, Bulldogs, Bulldogs, Dragons, Dragons, Dragons, Dragons, Dragons, Dragons, Dragons, Dragons, Dragons, Dragons, Dragons, Dragons, Dragons, Dragons, Dragons, Dragons, Dragons, Dragons, Dragons, Dragons, Dragons, Dragons, Dragons, Dragons, Dragons, Dragons, Dragons, Dragons, Dragons, Dragons, Dragons, Dragons, Bulldogs, Bulldogs, Bulldogs, Bulldogs, Bulldogs, Bulldogs, Bulldogs, Bulldogs, Bulldogs, Bulldogs, Bulldogs, Bulldogs, Bulldogs, Bulldogs, Bulldogs, Bulldogs, Bulldogs, Bulldogs, Bulldogs, Bulldogs, Bulldogs, Bulldogs, Bulldogs, Bulldogs, Bulldogs, Bulldogs, Bulldogs, Bulldogs, Bulldogs, Bulldogs, Bulldogs, Bulldogs, Dragons, Dragons, Dragons, Dragons, Dragons, Dragons, Dragons, Dragons, Dragons, Dragons, Dragons, Dragons, Dragons, Dragons, Dragons, Dragons, Dragons, Dragons, Dragons, Dragons, Dragons, Dragons, Dragons, Dragons, Dragons, Dragons, Dragons, Dragons, Dragons, Dragons, Dragons, Dragons, Bulldogs, Bulldogs, Bulldogs, Bulldogs, Bulldogs, Bulldogs, Bulldogs, Bulldogs, Bulldogs, Bulldogs, Bulldogs, Bulldogs, Bulldogs, Bulldogs, Bulldogs, Bulldogs, Bulldogs, Bulldogs, Bulldogs, Bulldogs, Bulldogs, Bulldogs, Bulldogs, Bulldogs, Bulldogs, Bulldogs, Bulldogs, Bulldogs, Bulldogs, Bulldogs, Bulldogs, Bulldogs, Dragons, Dragons, Dragons, Dragons, Dragons, Dragons, Dragons, Dragons, Dragons, Dragons, Dragons, Dragons, Dragons, Dragons, Dragons, Dragons, Dragons, Dragons, Dragons, Dragons, Dragons, Dragons, Dragons, Dragons, Dragons, Dragons, Dragons, Dragons, Dragons, Dragons, Dragons, Dragons, Bulldogs, Bulldogs, Bulldogs, Bulldogs, Bulldogs, Bulldogs, Bulldogs, Bulldogs, Bulldogs, Bulldogs, Bulldogs, Bulldogs, Bulldogs, Bulldogs, Bulldogs, Bulldogs, Bulldogs, Bulldogs, Bulldogs, Bulldogs, Bulldogs, Bulldogs, Bulldogs, Bulldogs, Bulldogs, Bulldogs, Bulldogs, Bulldogs, Bulldogs, Bulldogs, Bulldogs, Bulldogs
, Manly, Manly, Manly, Manly, Manly, Manly, Manly, Manly, Manly, Manly, Manly, Manly, Manly, Manly, Manly, Manly, Manly, Manly, Manly, Manly, Manly, Manly, Manly, Manly, Manly, Manly, Manly, Manly, Manly, Manly, Manly, Manly, Manly, Manly, Manly, Manly, Manly, Manly, Manly, Manly, Manly, Manly, Manly, Manly, Manly, Manly, Manly, Manly, Manly, Manly, Manly, Manly, Manly, Manly, Manly, Manly, Manly, Manly, Manly, Manly, Manly, Manly, Manly, Manly, Cowboys, Cowboys, Cowboys, Cowboys, Cowboys, Cowboys, Cowboys, Cowboys, Cowboys, Cowboys, Cowboys, Cowboys, Cowboys, Cowboys, Cowboys, Cowboys, Cowboys, Cowboys, Cowboys, Cowboys, Cowboys, Cowboys, Cowboys, Cowboys, Cowboys, Cowboys, Cowboys, Cowboys, Cowboys, Cowboys, Cowboys, Cowboys, Cowboys, Cowboys, Cowboys, Cowboys, Cowboys, Cowboys, Cowboys, Cowboys, Cowboys, Cowboys, Cowboys, Cowboys, Cowboys, Cowboys, Cowboys, Cowboys, Cowboys, Cowboys, Cowboys, Cowboys, Cowboys, Cowboys, Cowboys, Cowboys, Cowboys, Cowboys, Cowboys, Cowboys, Cowboys, Cowboys, Cowboys, Cowboys, Manly, Manly, Manly, Manly, Manly, Manly, Manly, Manly, Manly, Manly, Manly, Manly, Manly, Manly, Manly, Manly, Manly, Manly, Manly, Manly, Manly, Manly, Manly, Manly, Manly, Manly, Manly, Manly, Manly, Manly, Manly, Manly, Manly, Manly, Manly, Manly, Manly, Manly, Manly, Manly, Manly, Manly, Manly, Manly, Manly, Manly, Manly, Manly, Manly, Manly, Manly, Manly, Manly, Manly, Manly, Manly, Manly, Manly, Manly, Manly, Manly, Manly, Manly, Manly, Cowboys, Cowboys, Cowboys, Cowboys, Cowboys, Cowboys, Cowboys, Cowboys, Cowboys, Cowboys, Cowboys, Cowboys, Cowboys, Cowboys, Cowboys, Cowboys, Cowboys, Cowboys, Cowboys, Cowboys, Cowboys, Cowboys, Cowboys, Cowboys, Cowboys, Cowboys, Cowboys, Cowboys, Cowboys, Cowboys, Cowboys, Cowboys, Cowboys, Cowboys, Cowboys, Cowboys, Cowboys, Cowboys, Cowboys, Cowboys, Cowboys, Cowboys, Cowboys, Cowboys, Cowboys, Cowboys, Cowboys, Cowboys, Cowboys, Cowboys, Cowboys, Cowboys, Cowboys, Cowboys, Cowboys, Cowboys, Cowboys, Cowboys, Cowboys, Cowboys, Cowboys, Cowboys, Cowboys, Cowboys
, Storm, Storm, Storm, Storm, Storm, Storm, Storm, Storm, Storm, Storm, Storm, Storm, Storm, Storm, Storm, Storm, Storm, Storm, Storm, Storm, Storm, Storm, Storm, Storm, Storm, Storm, Storm, Storm, Storm, Storm, Storm, Storm, Storm, Storm, Storm, Storm, Storm, Storm, Storm, Storm, Storm, Storm, Storm, Storm, Storm, Storm, Storm, Storm, Storm, Storm, Storm, Storm, Storm, Storm, Storm, Storm, Storm, Storm, Storm, Storm, Storm, Storm, Storm, Storm, Storm, Storm, Storm, Storm, Storm, Storm, Storm, Storm, Storm, Storm, Storm, Storm, Storm, Storm, Storm, Storm, Storm, Storm, Storm, Storm, Storm, Storm, Storm, Storm, Storm, Storm, Storm, Storm, Storm, Storm, Storm, Storm, Storm, Storm, Storm, Storm, Storm, Storm, Storm, Storm, Storm, Storm, Storm, Storm, Storm, Storm, Storm, Storm, Storm, Storm, Storm, Storm, Storm, Storm, Storm, Storm, Storm, Storm, Storm, Storm, Storm, Storm, Storm, Storm, Eels, Eels, Eels, Eels, Eels, Eels, Eels, Eels, Eels, Eels, Eels, Eels, Eels, Eels, Eels, Eels, Eels, Eels, Eels, Eels, Eels, Eels, Eels, Eels, Eels, Eels, Eels, Eels, Eels, Eels, Eels, Eels, Eels, Eels, Eels, Eels, Eels, Eels, Eels, Eels, Eels, Eels, Eels, Eels, Eels, Eels, Eels, Eels, Eels, Eels, Eels, Eels, Eels, Eels, Eels, Eels, Eels, Eels, Eels, Eels, Eels, Eels, Eels, Eels, Eels, Eels, Eels, Eels, Eels, Eels, Eels, Eels, Eels, Eels, Eels, Eels, Eels, Eels, Eels, Eels, Eels, Eels, Eels, Eels, Eels, Eels, Eels, Eels, Eels, Eels, Eels, Eels, Eels, Eels, Eels, Eels, Eels, Eels, Eels, Eels, Eels, Eels, Eels, Eels, Eels, Eels, Eels, Eels, Eels, Eels, Eels, Eels, Eels, Eels, Eels, Eels, Eels, Eels, Eels, Eels, Eels, Eels, Eels, Eels, Eels, Eels, Eels, Eels
Storm, 0.0, 0.030854674483184203, 0.0482392667631452, 0.024545900834560628, 0.0, 0.0, 0.0, 0.0, 0.022394410355175347, 0.008743169398907104, 0.020498804236419543, 0.006825006825006826, 0.0, 0.0, 0.0, 0.03947887879984208, 0.0, 0.0, 0.0, 0.06097560975609756, 0.0, 0.0, 0.0, 0.0, 0.02346316283435007, 0.0, 0.03658982802780827, 0.018040772145047807, 0.0, 0.14144271570014144, 0.0, 0.0, 0.01754232084904833, 0.0, 0.01355197181189863, 0.026392187912377938, 0.05125576627370579, 0.0, 0.0, 0.0, 0.022399761069215263, 0.009838646202282565, 0.011499540018399264, 0.0037670458826188505, 0.029511583296443857, 0.0, 0.021616947686986597, 0.021944261575597982, 0.02346316283435007, 0.0, 0.036337209302325583, 0.0, 0.0, 0.25673940949935814, 0.0, 0.211864406779661, 0.006624710168930109, 0.0394192234412982, 0.0, 0.02975304968759298, 0.0, 0.0, 0.06027727546714888, 0.0, 0.01537042729787888, 0.0449842555105713, 0.022789425706472195, 0.0, 0.0, 0.0, 0.13245033112582782, 0.145985401459854, 0.00429202970084553, 0.0, 0.0, 0.019507120098836074, 0.025406504065040653, 0.02460024600246002, 0.03824091778202677, 0.0, 0.0, 0.0, 0.0, 0.0, 0.0, 0.0, 0.0, 0.0, 0.011523392486748099, 0.0, 0.017073587160662457, 0.05247507433968865, 0.06868131868131869, 0.0, 0.09765625, 0.0, 0.01678133915086424, 0.016680567139282735, 0.025957170668397145, 0.013222266296443212, 0.0, 0.04935834155972359, 0.0, 0.0, 0.01203919963400833, 0.004741246473697935, 0.003642058491459373, 0.0, 0.0, 0.013728720483250962, 0.04328067517853278, 0.0, 0.0, 0.022311468094600623, 0.0, 0.0, 0.0, 0.0, 0.0, 0.0, 0.006382842918235782, 0.012591286829513975, 0.0, 0.009679605072113058, 0.03688675765400221, 0.0, 0.0, 0.0, 0.11876484560570072, 0.0, 0.0, 0.53475935828877, 0.0, 0.0, 1.282051282051282, 0.0, 0.03094059405940594, 0.06339144215530904, 0.04830917874396135, 0.0, 0.0, 0.0, 0.273224043715847, 0.2785515320334262, 0.0, 0.0, 0.0, 0.0, 0.0, 0.0, 2.941176470588235, 0.0, 0.0, 0.08460236886632826, 0.0, 0.12853470437017994, 0.0, 0.0, 0.0, 0.0, 0.0, 0.1926782273603083, 0.0, 0.18726591760299627, 0.3676470588235294, 0.0, 0.0, 0.0, 0.07021239248727401, 0.07000350017500875, 0.08190008190008191, 0.1610305958132045, 0.0, 0.09765625, 0.0, 0.1736111111111111, 0.16051364365971107, 0.0, 0.0, 0.0, 0.0, 0.0, 0.0, 0.0, 0.09017132551848511, 0.09237875288683603, 0.0731528895391368, 0.0, 0.0, 0.0, 1.185770750988142, 0.0, 0.1183431952662722, 0.0, 0.17421602787456447, 0.0, 0.0, 0.0, 0.0, 0.0, 0.12590494176896444, 0.09071666162685213, 0.0, 0.04748338081671415, 0.17574692442882248, 0.35778175313059035, 0.0, 0.2724795640326975, 0.0, 0.0, 0.0, 0.4016064257028112, 0.0, 0.0, 0.0, 0.0, 0.0, 0.0, 0.0, 0.0, 0.0, 0.0, 0.0, 0.0, 0.24798512089274644, 0.1772002362669817, 0.38424591738712777, 0.0927643784786642, 0.0, 0.0, 0.0, 0.0, 0.08344459279038718, 0.0676246830092984, 0.026205450733752623, 0.0784313725490196, 0.0, 0.2, 0.0, 0.0, 0.0, 0.0, 0.0, 0.2304147465437788, 0.0, 0.0, 0.0, 0.0, 0.04677268475210477, 0.2346316283435007, 0.06609385327164573, 0.0, 0.0, 0.0, 0.0, 0.0
Panthers, 0.01588814744200826, 0.1697007096575131, 0.4582730342498794, 0.5400098183603338, 0.0, 0.08818342151675485, 0.29806259314456035, 0.544959128065395, 0.03583105656828056, 0.05683060109289617, 0.38264434574649814, 0.3071253071253071, 0.18177096857958971, 0.07639419404125286, 0.3201280512204882, 0.2763521515988946, 0.21240441801189466, 0.040950040950040956, 0.3976143141153081, 0.4878048780487805, 0.0, 0.4608294930875576, 0.7326007326007326, 0.7220216606498195, 0.04692632566870014, 0.05927682276229994, 0.49396267837541163, 0.469060075771243, 0.0, 0.14144271570014144, 0.3508771929824561, 0.22446689113355783, 0.07016928339619331, 0.0776598498576236, 0.35235126710936443, 0.5014515703351808, 0.05125576627370579, 0.04995004995004995, 0.32441200324412006, 0.40453074433656955, 0.03982179745638269, 0.05903187721369539, 0.36415210058264336, 0.33903412943569655, 0.04426737494466578, 0.08517887563884156, 0.25940337224383914, 0.39499670836076367, 0.07038948850305021, 0.15963511972633979, 0.39970930232558144, 0.5649717514124294, 0.0, 0.0, 0.4273504273504274, 0.847457627118644, 0.07949652202716131, 0.0459890940148479, 0.3932640919632953, 0.41654269562630164, 0.12043356081894822, 0.0, 0.3616636528028933, 0.5319148936170213, 0.10759299108515216, 0.05997900734742839, 0.5697356426618049, 0.34965034965034963, 0.08992805755395684, 0.08718395815170009, 0.3973509933774834, 0.8759124087591241, 0.0429202970084553, 0.09873787241349705, 0.3343385341549758, 0.422654268808115, 0.10162601626016261, 0.04920049200492004, 0.5353728489483747, 0.4693140794223827, 0.16597510373443983, 0.20064205457463882, 0.5044136191677175, 0.42971147943523635, 0.0, 0.0, 0.7194244604316548, 1.1235955056179776, 0.09218713989398479, 0.13179571663920922, 0.3073245688919242, 0.3148504460381319, 0.06868131868131869, 0.1989389920424403, 0.78125, 0.4036326942482341, 0.09229736532975331, 0.041701417848206836, 0.4023361453601558, 0.5288906518577284, 0.0, 0.14807502467917077, 0.46367851622874806, 0.6069802731411229, 0.06501167802364498, 0.07111869710546903, 0.38605820009469355, 0.31439722463139635, 0.056457304163726185, 0.04118616144975289, 0.3678857390175287, 0.4186728072011723, 0.1583710407239819, 0.06693440428380187, 0.6353688669255206, 0.6425431180250254, 0.7947019867549668, 0.13280212483399734, 0.5791505791505791, 0.3780718336483932, 0.1085083296100083, 0.06295643414756988, 0.3998439633313829, 0.3871842028845223, 0.03688675765400221, 0.03567606136282554, 0.497787610619469, 0.7278835386338186, 0.11876484560570072, 0.11574074074074073, 0.6557377049180327, 0.53475935828877, 0.0, 0.684931506849315, 0.0, 1.0, 0.06188118811881188, 0.0, 0.6280193236714976, 0.3424657534246575, 0.17667844522968199, 0.3552397868561279, 0.273224043715847, 0.5571030640668524, 0.28735632183908044, 0.0, 1.4705882352941175, 1.4285714285714286, 0.0, 0.0, 2.941176470588235, 0.0, 0.08196721311475409, 0.08460236886632826, 0.13157894736842105, 0.3856041131105398, 0.0, 0.0, 0.0, 1.7241379310344827, 0.06510416666666666, 0.12845215157353884, 0.39643211100099107, 0.6554307116104869, 0.0, 0.33783783783783783, 1.6129032258064515, 0.5714285714285714, 0.035106196243637006, 0.01750087504375219, 0.46410046410046407, 0.4294149221685454, 0.10570824524312897, 0.1953125, 0.7949125596184419, 0.6944444444444444, 0.16051364365971107, 0.0, 0.25773195876288657, 0.24937655860349126, 0.0, 0.0, 2.941176470588235, 1.5151515151515151, 0.2254283137962128, 0.046189376443418015, 0.5852231163130944, 0.2181818181818182, 0.0, 0.0, 0.3952569169960474, 0.36363636363636365, 0.1183431952662722, 0.0, 1.2195121951219512, 0.32733224222585927, 0.0, 0.0, 0.9708737864077669, 0.0, 0.06295247088448222, 0.12095554883580284, 0.42674253200568996, 0.23741690408357075, 0.17574692442882248, 0.0, 0.8086253369272237, 0.8174386920980926, 0.5235602094240838, 0.0, 1.3100436681222707, 0.4016064257028112, 0.0, 0.0, 2.380952380952381, 2.857142857142857, 0.08058017727639001, 0.0, 0.38022813688212925, 0.5006257822277848, 0.0, 0.0, 0.6622516556291391, 0.9803921568627451, 0.12399256044637322, 0.05906674542232723, 0.09606147934678194, 0.27829313543599254, 0.0, 0.6802721088435374, 1.5544041450777202, 0.0, 0.10013351134846463, 0.1014370245139476, 0.3668763102725367, 0.49673202614379086, 0.09910802775024777, 0.1, 0.6546644844517185, 0.3067484662576687, 0.0, 0.0, 0.0, 0.6912442396313364, 0.0, 0.0, 0.0, 0.0, 0.09354536950420954, 0.04692632566870014, 0.3304692663582287, 0.34891835310537334, 0.0, 0.0, 0.34965034965034963, 0.35714285714285715
