, Raiders, Bulldogs, Raiders, Bulldogs, Raiders, Bulldogs, Raiders, Bulldogs, Raiders, Bulldogs, Raiders, Bulldogs, Raiders, Bulldogs, Raiders, Bulldogs, Raiders, Bulldogs, Raiders, Bulldogs, Raiders, Bulldogs, Raiders, Bulldogs, Raiders, Bulldogs, Raiders, Bulldogs, Raiders, Bulldogs, Raiders, Bulldogs, Raiders, Bulldogs, Raiders, Bulldogs, Raiders, Bulldogs, Raiders, Bulldogs, Raiders, Bulldogs, Raiders, Bulldogs, Raiders, Bulldogs, Raiders, Bulldogs, Raiders, Bulldogs, Raiders, Bulldogs, Raiders, Bulldogs, Raiders, Bulldogs, Raiders, Bulldogs, Raiders, Bulldogs, Raiders, Bulldogs, Raiders, Bulldogs, Raiders, Bulldogs, Raiders, Bulldogs, Raiders, Bulldogs, Raiders, Bulldogs, Raiders, Bulldogs, Raiders, Bulldogs, Raiders, Bulldogs, Raiders, Bulldogs, Raiders, Bulldogs, Raiders, Bulldogs, Raiders, Bulldogs, Raiders, Bulldogs, Raiders, Bulldogs, Raiders, Bulldogs, Raiders, Bulldogs, Raiders, Bulldogs, Raiders, Bulldogs, Raiders, Bulldogs, Raiders, Bulldogs, Raiders, Bulldogs, Raiders, Bulldogs, Raiders, Bulldogs, Raiders, Bulldogs, Raiders, Bulldogs, Raiders, Bulldogs, Raiders, Bulldogs, Raiders, Bulldogs, Raiders, Bulldogs, Raiders, Bulldogs, Raiders, Bulldogs, Raiders, Bulldogs, Raiders, Bulldogs, Raiders, Bulldogs, Raiders, Bulldogs, Raiders, Bulldogs, Raiders, Bulldogs, Raiders, Bulldogs, Raiders, Bulldogs, Raiders, Bulldogs, Raiders, Bulldogs, Raiders, Bulldogs, Raiders, Bulldogs, Raiders, Bulldogs, Raiders, Bulldogs, Raiders, Bulldogs, Raiders, Bulldogs, Raiders, Bulldogs, Raiders, Bulldogs, Raiders, Bulldogs, Raiders, Bulldogs, Raiders, Bulldogs, Raiders, Bulldogs, Raiders, Bulldogs, Raiders, Bulldogs, Raiders, Bulldogs, Raiders, Bulldogs, Raiders, Bulldogs, Raiders, Bulldogs, Raiders, Bulldogs, Raiders, Bulldogs, Raiders, Bulldogs, Raiders, Bulldogs, Raiders, Bulldogs, Raiders, Bulldogs, Raiders, Bulldogs, Raiders, Bulldogs, Raiders, Bulldogs, Raiders, Bulldogs, Raiders, Bulldogs, Raiders, Bulldogs, Raiders, Bulldogs, Raiders, Bulldogs, Raiders, Bulldogs, Raiders, Bulldogs, Raiders, Bulldogs, Raiders, Bulldogs, Raiders, Bulldogs, Raiders, Bulldogs, Raiders, Bulldogs, Raiders, Bulldogs, Raiders, Bulldogs, Raiders, Bulldogs, Raiders, Bulldogs, Raiders, Bulldogs, Raiders, Bulldogs, Raiders, Bulldogs, Raiders, Bulldogs, Raiders, Bulldogs, Raiders, Bulldogs, Raiders, Bulldogs, Raiders, Bulldogs, Raiders, Bulldogs, Raiders, Bulldogs, Raiders, Bulldogs, Raiders, Bulldogs, Raiders, Bulldogs
, Roosters, Roosters, Panthers, Panthers, Roosters, Roosters, Panthers, Panthers, Roosters, Roosters, Panthers, Panthers, Roosters, Roosters, Panthers, Panthers, Roosters, Roosters, Panthers, Panthers, Roosters, Roosters, Panthers, Panthers, Roosters, Roosters, Panthers, Panthers, Roosters, Roosters, Panthers, Panthers, Roosters, Roosters, Panthers, Panthers, Roosters, Roosters, Panthers, Panthers, Roosters, Roosters, Panthers, Panthers, Roosters, Roosters, Panthers, Panthers, Roosters, Roosters, Panthers, Panthers, Roosters, Roosters, Panthers, Panthers, Roosters, Roosters, Panthers, Panthers, Roosters, Roosters, Panthers, Panthers, Roosters, Roosters, Panthers, Panthers, Roosters, Roosters, Panthers, Panthers, Roosters, Roosters, Panthers, Panthers, Roosters, Roosters, Panthers, Panthers, Roosters, Roosters, Panthers, Panthers, Roosters, Roosters, Panthers, Panthers, Roosters, Roosters, Panthers, Panthers, Roosters, Roosters, Panthers, Panthers, Roosters, Roosters, Panthers, Panthers, Roosters, Roosters, Panthers, Panthers, Roosters, Roosters, Panthers, Panthers, Roosters, Roosters, Panthers, Panthers, Roosters, Roosters, Panthers, Panthers, Roosters, Roosters, Panthers, Panthers, Roosters, Roosters, Panthers, Panthers, Roosters, Roosters, Panthers, Panthers, Roosters, Roosters, Panthers, Panthers, Roosters, Roosters, Panthers, Panthers, Roosters, Roosters, Panthers, Panthers, Roosters, Roosters, Panthers, Panthers, Roosters, Roosters, Panthers, Panthers, Roosters, Roosters, Panthers, Panthers, Roosters, Roosters, Panthers, Panthers, Roosters, Roosters, Panthers, Panthers, Roosters, Roosters, Panthers, Panthers, Roosters, Roosters, Panthers, Panthers, Roosters, Roosters, Panthers, Panthers, Roosters, Roosters, Panthers, Panthers, Roosters, Roosters, Panthers, Panthers, Roosters, Roosters, Panthers, Panthers, Roosters, Roosters, Panthers, Panthers, Roosters, Roosters, Panthers, Panthers, Roosters, Roosters, Panthers, Panthers, Roosters, Roosters, Panthers, Panthers, Roosters, Roosters, Panthers, Panthers, Roosters, Roosters, Panthers, Panthers, Roosters, Roosters, Panthers, Panthers, Roosters, Roosters, Panthers, Panthers, Roosters, Roosters, Panthers, Panthers, Roosters, Roosters, Panthers, Panthers, Roosters, Roosters, Panthers, Panthers, Roosters, Roosters, Panthers, Panthers, Roosters, Roosters, Panthers, Panthers, Roosters, Roosters, Panthers, Panthers, Roosters, Roosters, Panthers, Panthers, Roosters, Roosters, Panthers, Panthers, Roosters, Roosters, Panthers, Panthers, Roosters, Roosters, Panthers, Panthers
, Storm, Storm, Storm, Storm, Broncos, Broncos, Broncos, Broncos, Storm, Storm, Storm, Storm, Broncos, Broncos, Broncos, Broncos, Storm, Storm, Storm, Storm, Broncos, Broncos, Broncos, Broncos, Storm, Storm, Storm, Storm, Broncos, Broncos, Broncos, Broncos, Storm, Storm, Storm, Storm, Broncos, Broncos, Broncos, Broncos, Storm, Storm, Storm, Storm, Broncos, Broncos, Broncos, Broncos, Storm, Storm, Storm, Storm, Broncos, Broncos, Broncos, Broncos, Storm, Storm, Storm, Storm, Broncos, Broncos, Broncos, Broncos, Storm, Storm, Storm, Storm, Broncos, Broncos, Broncos, Broncos, Storm, Storm, Storm, Storm, Broncos, Broncos, Broncos, Broncos, Storm, Storm, Storm, Storm, Broncos, Broncos, Broncos, Broncos, Storm, Storm, Storm, Storm, Broncos, Broncos, Broncos, Broncos, Storm, Storm, Storm, Storm, Broncos, Broncos, Broncos, Broncos, Storm, Storm, Storm, Storm, Broncos, Broncos, Broncos, Broncos, Storm, Storm, Storm, Storm, Broncos, Broncos, Broncos, Broncos, Storm, Storm, Storm, Storm, Broncos, Broncos, Broncos, Broncos, Storm, Storm, Storm, Storm, Broncos, Broncos, Broncos, Broncos, Storm, Storm, Storm, Storm, Broncos, Broncos, Broncos, Broncos, Storm, Storm, Storm, Storm, Broncos, Broncos, Broncos, Broncos, Storm, Storm, Storm, Storm, Broncos, Broncos, Broncos, Broncos, Storm, Storm, Storm, Storm, Broncos, Broncos, Broncos, Broncos, Storm, Storm, Storm, Storm, Broncos, Broncos, Broncos, Broncos, Storm, Storm, Storm, Storm, Broncos, Broncos, Broncos, Broncos, Storm, Storm, Storm, Storm, Broncos, Broncos, Broncos, Broncos, Storm, Storm, Storm, Storm, Broncos, Broncos, Broncos, Broncos, Storm, Storm, Storm, Storm, Broncos, Broncos, Broncos, Broncos, Storm, Storm, Storm, Storm, Broncos, Broncos, Broncos, Broncos, Storm, Storm, Storm, Storm, Broncos, Broncos, Broncos, Broncos, Storm, Storm, Storm, Storm, Broncos, Broncos, Broncos, Broncos, Storm, Storm, Storm, Storm, Broncos, Broncos, Broncos, Broncos, Storm, Storm, Storm, Storm, Broncos, Broncos, Broncos, Broncos, Storm, Storm, Storm, Storm, Broncos, Broncos, Broncos, Broncos
, Knights, Knights, Knights, Knights, Knights, Knights, Knights, Knights, Warriors, Warriors, Warriors, Warriors, Warriors, Warriors, Warriors, Warriors, Knights, Knights, Knights, Knights, Knights, Knights, Knights, Knights, Warriors, Warriors, Warriors, Warriors, Warriors, Warriors, Warriors, Warriors, Knights, Knights, Knights, Knights, Knights, Knights, Knights, Knights, Warriors, Warriors, Warriors, Warriors, Warriors, Warriors, Warriors, Warriors, Knights, Knights, Knights, Knights, Knights, Knights, Knights, Knights, Warriors, Warriors, Warriors, Warriors, Warriors, Warriors, Warriors, Warriors, Knights, Knights, Knights, Knights, Knights, Knights, Knights, Knights, Warriors, Warriors, Warriors, Warriors, Warriors, Warriors, Warriors, Warriors, Knights, Knights, Knights, Knights, Knights, Knights, Knights, Knights, Warriors, Warriors, Warriors, Warriors, Warriors, Warriors, Warriors, Warriors, Knights, Knights, Knights, Knights, Knights, Knights, Knights, Knights, Warriors, Warriors, Warriors, Warriors, Warriors, Warriors, Warriors, Warriors, Knights, Knights, Knights, Knights, Knights, Knights, Knights, Knights, Warriors, Warriors, Warriors, Warriors, Warriors, Warriors, Warriors, Warriors, Knights, Knights, Knights, Knights, Knights, Knights, Knights, Knights, Warriors, Warriors, Warriors, Warriors, Warriors, Warriors, Warriors, Warriors, Knights, Knights, Knights, Knights, Knights, Knights, Knights, Knights, Warriors, Warriors, Warriors, Warriors, Warriors, Warriors, Warriors, Warriors, Knights, Knights, Knights, Knights, Knights, Knights, Knights, Knights, Warriors, Warriors, Warriors, Warriors, Warriors, Warriors, Warriors, Warriors, Knights, Knights, Knights, Knights, Knights, Knights, Knights, Knights, Warriors, Warriors, Warriors, Warriors, Warriors, Warriors, Warriors, Warriors, Knights, Knights, Knights, Knights, Knights, Knights, Knights, Knights, Warriors, Warriors, Warriors, Warriors, Warriors, Warriors, Warriors, Warriors, Knights, Knights, Knights, Knights, Knights, Knights, Knights, Knights, Warriors, Warriors, Warriors, Warriors, Warriors, Warriors, Warriors, Warriors, Knights, Knights, Knights, Knights, Knights, Knights, Knights, Knights, Warriors, Warriors, Warriors, Warriors, Warriors, Warriors, Warriors, Warriors, Knights, Knights, Knights, Knights, Knights, Knights, Knights, Knights, Warriors, Warriors, Warriors, Warriors, Warriors, Warriors, Warriors, Warriors
, Sharks, Sharks, Sharks, Sharks, Sharks, Sharks, Sharks, Sharks, Sharks, Sharks, Sharks, Sharks, Sharks, Sharks, Sharks, Sharks, Dolphins, Dolphins, Dolphins, Dolphins, Dolphins, Dolphins, Dolphins, Dolphins, Dolphins, Dolphins, Dolphins, Dolphins, Dolphins, Dolphins, Dolphins, Dolphins, Sharks, Sharks, Sharks, Sharks, Sharks, Sharks, Sharks, Sharks, Sharks, Sharks, Sharks, Sharks, Sharks, Sharks, Sharks, Sharks, Dolphins, Dolphins, Dolphins, Dolphins, Dolphins, Dolphins, Dolphins, Dolphins, Dolphins, Dolphins, Dolphins, Dolphins, Dolphins, Dolphins, Dolphins, Dolphins, Sharks, Sharks, Sharks, Sharks, Sharks, Sharks, Sharks, Sharks, Sharks, Sharks, Sharks, Sharks, Sharks, Sharks, Sharks, Sharks, Dolphins, Dolphins, Dolphins, Dolphins, Dolphins, Dolphins, Dolphins, Dolphins, Dolphins, Dolphins, Dolphins, Dolphins, Dolphins, Dolphins, Dolphins, Dolphins, Sharks, Sharks, Sharks, Sharks, Sharks, Sharks, Sharks, Sharks, Sharks, Sharks, Sharks, Sharks, Sharks, Sharks, Sharks, Sharks, Dolphins, Dolphins, Dolphins, Dolphins, Dolphins, Dolphins, Dolphins, Dolphins, Dolphins, Dolphins, Dolphins, Dolphins, Dolphins, Dolphins, Dolphins, Dolphins, Sharks, Sharks, Sharks, Sharks, Sharks, Sharks, Sharks, Sharks, Sharks, Sharks, Sharks, Sharks, Sharks, Sharks, Sharks, Sharks, Dolphins, Dolphins, Dolphins, Dolphins, Dolphins, Dolphins, Dolphins, Dolphins, Dolphins, Dolphins, Dolphins, Dolphins, Dolphins, Dolphins, Dolphins, Dolphins, Sharks, Sharks, Sharks, Sharks, Sharks, Sharks, Sharks, Sharks, Sharks, Sharks, Sharks, Sharks, Sharks, Sharks, Sharks, Sharks, Dolphins, Dolphins, Dolphins, Dolphins, Dolphins, Dolphins, Dolphins, Dolphins, Dolphins, Dolphins, Dolphins, Dolphins, Dolphins, Dolphins, Dolphins, Dolphins, Sharks, Sharks, Sharks, Sharks, Sharks, Sharks, Sharks, Sharks, Sharks, Sharks, Sharks, Sharks, Sharks, Sharks, Sharks, Sharks, Dolphins, Dolphins, Dolphins, Dolphins, Dolphins, Dolphins, Dolphins, Dolphins, Dolphins, Dolphins, Dolphins, Dolphins, Dolphins, Dolphins, Dolphins, Dolphins, Sharks, Sharks, Sharks, Sharks, Sharks, Sharks, Sharks, Sharks, Sharks, Sharks, Sharks, Sharks, Sharks, Sharks, Sharks, Sharks, Dolphins, Dolphins, Dolphins, Dolphins, Dolphins, Dolphins, Dolphins, Dolphins, Dolphins, Dolphins, Dolphins, Dolphins, Dolphins, Dolphins, Dolphins, Dolphins
, Rabbitohs, Rabbitohs, Rabbitohs, Rabbitohs, Rabbitohs, Rabbitohs, Rabbitohs, Rabbitohs, Rabbitohs, Rabbitohs, Rabbitohs, Rabbitohs, Rabbitohs, Rabbitohs, Rabbitohs, Rabbitohs, Rabbitohs, Rabbitohs, Rabbitohs, Rabbitohs, Rabbitohs, Rabbitohs, Rabbitohs, Rabbitohs, Rabbitohs, Rabbitohs, Rabbitohs, Rabbitohs, Rabbitohs, Rabbitohs, Rabbitohs, Rabbitohs, Tigers, Tigers, Tigers, Tigers, Tigers, Tigers, Tigers, Tigers, Tigers, Tigers, Tigers, Tigers, Tigers, Tigers, Tigers, Tigers, Tigers, Tigers, Tigers, Tigers, Tigers, Tigers, Tigers, Tigers, Tigers, Tigers, Tigers, Tigers, Tigers, Tigers, Tigers, Tigers, Rabbitohs, Rabbitohs, Rabbitohs, Rabbitohs, Rabbitohs, Rabbitohs, Rabbitohs, Rabbitohs, Rabbitohs, Rabbitohs, Rabbitohs, Rabbitohs, Rabbitohs, Rabbitohs, Rabbitohs, Rabbitohs, Rabbitohs, Rabbitohs, Rabbitohs, Rabbitohs, Rabbitohs, Rabbitohs, Rabbitohs, Rabbitohs, Rabbitohs, Rabbitohs, Rabbitohs, Rabbitohs, Rabbitohs, Rabbitohs, Rabbitohs, Rabbitohs, Tigers, Tigers, Tigers, Tigers, Tigers, Tigers, Tigers, Tigers, Tigers, Tigers, Tigers, Tigers, Tigers, Tigers, Tigers, Tigers, Tigers, Tigers, Tigers, Tigers, Tigers, Tigers, Tigers, Tigers, Tigers, Tigers, Tigers, Tigers, Tigers, Tigers, Tigers, Tigers, Rabbitohs, Rabbitohs, Rabbitohs, Rabbitohs, Rabbitohs, Rabbitohs, Rabbitohs, Rabbitohs, Rabbitohs, Rabbitohs, Rabbitohs, Rabbitohs, Rabbitohs, Rabbitohs, Rabbitohs, Rabbitohs, Rabbitohs, Rabbitohs, Rabbitohs, Rabbitohs, Rabbitohs, Rabbitohs, Rabbitohs, Rabbitohs, Rabbitohs, Rabbitohs, Rabbitohs, Rabbitohs, Rabbitohs, Rabbitohs, Rabbitohs, Rabbitohs, Tigers, Tigers, Tigers, Tigers, Tigers, Tigers, Tigers, Tigers, Tigers, Tigers, Tigers, Tigers, Tigers, Tigers, Tigers, Tigers, Tigers, Tigers, Tigers, Tigers, Tigers, Tigers, Tigers, Tigers, Tigers, Tigers, Tigers, Tigers, Tigers, Tigers, Tigers, Tigers, Rabbitohs, Rabbitohs, Rabbitohs, Rabbitohs, Rabbitohs, Rabbitohs, Rabbitohs, Rabbitohs, Rabbitohs, Rabbitohs, Rabbitohs, Rabbitohs, Rabbitohs, Rabbitohs, Rabbitohs, Rabbitohs, Rabbitohs, Rabbitohs, Rabbitohs, Rabbitohs, Rabbitohs, Rabbitohs, Rabbitohs, Rabbitohs, Rabbitohs, Rabbitohs, Rabbitohs, Rabbitohs, Rabbitohs, Rabbitohs, Rabbitohs, Rabbitohs, Tigers, Tigers, Tigers, Tigers, Tigers, Tigers, Tigers, Tigers, Tigers, Tigers, Tigers, Tigers, Tigers, Tigers, Tigers, Tigers, Tigers, Tigers, Tigers, Tigers, Tigers, Tigers, Tigers, Tigers, Tigers, Tigers, Tigers, Tigers, Tigers, Tigers, Tigers, Tigers
, Eels, Eels, Eels, Eels, Eels, Eels, Eels, Eels, Eels, Eels, Eels, Eels, Eels, Eels, Eels, Eels, Eels, Eels, Eels, Eels, Eels, Eels, Eels, Eels, Eels, Eels, Eels, Eels, Eels, Eels, Eels, Eels, Eels, Eels, Eels, Eels, Eels, Eels, Eels, Eels, Eels, Eels, Eels, Eels, Eels, Eels, Eels, Eels, Eels, Eels, Eels, Eels, Eels, Eels, Eels, Eels, Eels, Eels, Eels, Eels, Eels, Eels, Eels, Eels, Dragons, Dragons, Dragons, Dragons, Dragons, Dragons, Dragons, Dragons, Dragons, Dragons, Dragons, Dragons, Dragons, Dragons, Dragons, Dragons, Dragons, Dragons, Dragons, Dragons, Dragons, Dragons, Dragons, Dragons, Dragons, Dragons, Dragons, Dragons, Dragons, Dragons, Dragons, Dragons, Dragons, Dragons, Dragons, Dragons, Dragons, Dragons, Dragons, Dragons, Dragons, Dragons, Dragons, Dragons, Dragons, Dragons, Dragons, Dragons, Dragons, Dragons, Dragons, Dragons, Dragons, Dragons, Dragons, Dragons, Dragons, Dragons, Dragons, Dragons, Dragons, Dragons, Dragons, Dragons, Eels, Eels, Eels, Eels, Eels, Eels, Eels, Eels, Eels, Eels, Eels, Eels, Eels, Eels, Eels, Eels, Eels, Eels, Eels, Eels, Eels, Eels, Eels, Eels, Eels, Eels, Eels, Eels, Eels, Eels, Eels, Eels, Eels, Eels, Eels, Eels, Eels, Eels, Eels, Eels, Eels, Eels, Eels, Eels, Eels, Eels, Eels, Eels, Eels, Eels, Eels, Eels, Eels, Eels, Eels, Eels, Eels, Eels, Eels, Eels, Eels, Eels, Eels, Eels, Dragons, Dragons, Dragons, Dragons, Dragons, Dragons, Dragons, Dragons, Dragons, Dragons, Dragons, Dragons, Dragons, Dragons, Dragons, Dragons, Dragons, Dragons, Dragons, Dragons, Dragons, Dragons, Dragons, Dragons, Dragons, Dragons, Dragons, Dragons, Dragons, Dragons, Dragons, Dragons, Dragons, Dragons, Dragons, Dragons, Dragons, Dragons, Dragons, Dragons, Dragons, Dragons, Dragons, Dragons, Dragons, Dragons, Dragons, Dragons, Dragons, Dragons, Dragons, Dragons, Dragons, Dragons, Dragons, Dragons, Dragons, Dragons, Dragons, Dragons, Dragons, Dragons, Dragons, Dragons
, Cowboys, Cowboys, Cowboys, Cowboys, Cowboys, Cowboys, Cowboys, Cowboys, Cowboys, Cowboys, Cowboys, Cowboys, Cowboys, Cowboys, Cowboys, Cowboys, Cowboys, Cowboys, Cowboys, Cowboys, Cowboys, Cowboys, Cowboys, Cowboys, Cowboys, Cowboys, Cowboys, Cowboys, Cowboys, Cowboys, Cowboys, Cowboys, Cowboys, Cowboys, Cowboys, Cowboys, Cowboys, Cowboys, Cowboys, Cowboys, Cowboys, Cowboys, Cowboys, Cowboys, Cowboys, Cowboys, Cowboys, Cowboys, Cowboys, Cowboys, Cowboys, Cowboys, Cowboys, Cowboys, Cowboys, Cowboys, Cowboys, Cowboys, Cowboys, Cowboys, Cowboys, Cowboys, Cowboys, Cowboys, Cowboys, Cowboys, Cowboys, Cowboys, Cowboys, Cowboys, Cowboys, Cowboys, Cowboys, Cowboys, Cowboys, Cowboys, Cowboys, Cowboys, Cowboys, Cowboys, Cowboys, Cowboys, Cowboys, Cowboys, Cowboys, Cowboys, Cowboys, Cowboys, Cowboys, Cowboys, Cowboys, Cowboys, Cowboys, Cowboys, Cowboys, Cowboys, Cowboys, Cowboys, Cowboys, Cowboys, Cowboys, Cowboys, Cowboys, Cowboys, Cowboys, Cowboys, Cowboys, Cowboys, Cowboys, Cowboys, Cowboys, Cowboys, Cowboys, Cowboys, Cowboys, Cowboys, Cowboys, Cowboys, Cowboys, Cowboys, Cowboys, Cowboys, Cowboys, Cowboys, Cowboys, Cowboys, Cowboys, Cowboys, Titans, Titans, Titans, Titans, Titans, Titans, Titans, Titans, Titans, Titans, Titans, Titans, Titans, Titans, Titans, Titans, Titans, Titans, Titans, Titans, Titans, Titans, Titans, Titans, Titans, Titans, Titans, Titans, Titans, Titans, Titans, Titans, Titans, Titans, Titans, Titans, Titans, Titans, Titans, Titans, Titans, Titans, Titans, Titans, Titans, Titans, Titans, Titans, Titans, Titans, Titans, Titans, Titans, Titans, Titans, Titans, Titans, Titans, Titans, Titans, Titans, Titans, Titans, Titans, Titans, Titans, Titans, Titans, Titans, Titans, Titans, Titans, Titans, Titans, Titans, Titans, Titans, Titans, Titans, Titans, Titans, Titans, Titans, Titans, Titans, Titans, Titans, Titans, Titans, Titans, Titans, Titans, Titans, Titans, Titans, Titans, Titans, Titans, Titans, Titans, Titans, Titans, Titans, Titans, Titans, Titans, Titans, Titans, Titans, Titans, Titans, Titans, Titans, Titans, Titans, Titans, Titans, Titans, Titans, Titans, Titans, Titans, Titans, Titans, Titans, Titans, Titans, Titans
Storm, 83.53356890459364, 83.26012689116642, 83.79428306372122, 83.46579716051899, 65.83442838370564, 67.53822291158875, 67.72311573636077, 66.5294433506354, 81.80401584969502, 81.85961236249345, 82.49868014179049, 82.33506944444444, 65.35907525823905, 64.85875706214689, 66.22934401602404, 65.24797748856841, 83.93356969583877, 83.24994561670654, 83.82559774964838, 84.45896877269426, 66.61409043112513, 68.50629874025195, 67.6458067262665, 68.46762925011645, 83.24823729637734, 82.62800055501596, 83.31854480922803, 83.55115977864124, 66.2439024390244, 66.07828089025325, 67.4812030075188, 66.98847710993459, 83.95908543922984, 83.53828954723309, 83.99755998373323, 83.50597609561753, 65.46933242968485, 66.69216061185469, 69.56402522621332, 68.04089709762533, 82.24561403508773, 82.53982871350954, 83.61867704280156, 82.72652203288041, 65.58023666182271, 65.73597844722018, 65.89595375722543, 66.43440175194108, 84.85321673953779, 84.11073189230186, 84.3936922240348, 83.51376430559851, 67.03296703296702, 68.57440166493237, 68.81405563689604, 66.1512027491409, 83.23639385126714, 82.60660081907974, 83.71457835438716, 83.10209153033755, 67.4457429048414, 68.21808510638297, 66.21751684311839, 67.68631813125695, 84.71337579617835, 84.24657534246576, 84.267746749094, 84.48729184925504, 66.19718309859155, 67.17927964386888, 68.2790970389915, 67.42034943473793, 82.68017270009963, 83.36087083292837, 83.61929208322076, 83.25294536253656, 65.47095070422534, 66.38500132030632, 67.14206334506389, 66.83960224816255, 83.87968908415006, 84.75390156062424, 84.34982738780207, 83.77483443708608, 69.18714555765595, 69.2972972972973, 65.84, 65.68807339449542, 85.20098809791152, 83.2074521651561, 83.65737344093911, 83.34420526201349, 67.53246753246754, 65.09831460674157, 70.14492753623188, 66.33892423366107, 83.54058331449242, 84.29841098841906, 84.82309124767225, 85.01988510826337, 68.14859926918392, 66.43307638402243, 69.6969696969697, 67.4392312040701, 83.17194835680752, 82.22633260467462, 83.67273598466699, 82.91174044542205, 67.33358984224702, 66.52986776105791, 67.47064423992384, 65.84804297774367, 84.71223021582733, 83.64864864864865, 83.98378104409528, 84.79906814210833, 69.73886328725038, 70.48543689320388, 71.23473541383989, 67.92738275340393, 84.45998445998445, 84.7032967032967, 83.66034094564169, 83.78582202111615, 67.88793103448276, 67.24137931034483, 69.83857264231096, 70.05128205128204, 82.7549628731626, 84.01777777777778, 84.55021181161226, 83.44644437887283, 66.49810366624526, 66.10169491525424, 68.00278842802369, 67.36083299959952, 82.91108285239167, 82.90215016672416, 83.14229572621582, 82.78719756144028, 64.86415193880242, 65.74876237623762, 67.17391304347827, 66.33842964498575, 83.65271802894017, 84.1486359360301, 84.8105548037889, 84.11949685534591, 66.89265536723164, 67.64705882352942, 70.5161854768154, 69.27138331573389, 81.95862791306625, 83.55461677730838, 83.36970755128765, 83.68462138953943, 65.60283687943263, 63.94611727416799, 66.20813397129187, 65.33613445378151, 83.93381371764079, 82.93809670465045, 84.23924907225496, 83.56378815549178, 71.24912770411723, 65.19198664440734, 69.41838649155723, 69.12983425414365, 82.31245698554714, 81.79678305217732, 83.0890642615558, 83.2183908045977, 65.5473781048758, 66.3157894736842, 67.86534047436878, 64.54585344449319, 84.48023426061494, 83.26596604688763, 83.73063170441, 85.88709677419355, 68.31501831501832, 69.44444444444444, 67.32673267326733, 65.25911708253359, 82.87292817679558, 83.61408882082695, 84.02214022140222, 83.8209982788296, 66.54719235364396, 70.49645390070923, 68.30708661417323, 66.11661166116612, 84.34782608695653, 85.23290386521309, 85.26513374002815, 84.59670892905315, 66.07142857142857, 68.13852813852814, 67.7359654534238, 67.69683590875644, 82.80911062906723, 82.42784380305602, 83.51533283470457, 83.20704845814979, 65.47788873038516, 66.29464285714286, 66.40284922833399, 66.20689655172414, 85.77745025792188, 85.77441077441077, 83.86904761904762, 85.36776212832551, 68.24457593688363, 70.15590200445433, 74.35508345978755, 72.64325323475046, 83.19691863264323, 83.31491712707182, 84.35946462715106, 84.28835489833642, 71.14093959731544, 68.47662141779789, 71.64835164835165, 70.40690505548706, 83.25947808961102, 85.67399887196842, 86.16978876046234, 85.54857419043016, 66.75392670157068, 67.6948051948052, 70.64732142857143, 66.66666666666666, 83.71594735231099, 82.6134699853587, 83.56382978723404, 83.0829326923077, 64.76987447698744, 65.61264822134387, 67.9523141654979, 69.2432872253865, 84.59530026109661, 85.24355300859598, 85.04464285714286, 85.86810228802153, 68.36363636363636, 72.68722466960352, 74.58745874587459, 69.52054794520548, 83.84094754653131, 84.8780487804878, 86.2730627306273, 85.91318591318591, 65.01182033096927, 65.87926509186352, 70.39848197343453, 68.07095343680709
