, Knights, Dolphins, Knights, Dolphins, Knights, Dolphins, Knights, Dolphins, Knights, Dolphins, Knights, Dolphins, Knights, Dolphins, Knights, Dolphins, Knights, Dolphins, Knights, Dolphins, Knights, Dolphins, Knights, Dolphins, Knights, Dolphins, Knights, Dolphins, Knights, Dolphins, Knights, Dolphins, Knights, Dolphins, Knights, Dolphins, Knights, Dolphins, Knights, Dolphins, Knights, Dolphins, Knights, Dolphins, Knights, Dolphins, Knights, Dolphins, Knights, Dolphins, Knights, Dolphins, Knights, Dolphins, Knights, Dolphins, Knights, Dolphins, Knights, Dolphins, Knights, Dolphins, Knights, Dolphins, Knights, Dolphins, Knights, Dolphins, Knights, Dolphins, Knights, Dolphins, Knights, Dolphins, Knights, Dolphins, Knights, Dolphins, Knights, Dolphins, Knights, Dolphins, Knights, Dolphins, Knights, Dolphins, Knights, Dolphins, Knights, Dolphins, Knights, Dolphins, Knights, Dolphins, Knights, Dolphins, Knights, Dolphins, Knights, Dolphins, Knights, Dolphins, Knights, Dolphins, Knights, Dolphins, Knights, Dolphins, Knights, Dolphins, Knights, Dolphins, Knights, Dolphins, Knights, Dolphins, Knights, Dolphins, Knights, Dolphins, Knights, Dolphins, Knights, Dolphins, Knights, Dolphins, Knights, Dolphins, Knights, Dolphins, Knights, Dolphins, Knights, Dolphins, Knights, Dolphins, Knights, Dolphins, Knights, Dolphins, Knights, Dolphins, Knights, Dolphins, Knights, Dolphins, Knights, Dolphins, Knights, Dolphins, Knights, Dolphins, Knights, Dolphins, Knights, Dolphins, Knights, Dolphins, Knights, Dolphins, Knights, Dolphins, Knights, Dolphins, Knights, Dolphins, Knights, Dolphins, Knights, Dolphins, Knights, Dolphins, Knights, Dolphins, Knights, Dolphins, Knights, Dolphins, Knights, Dolphins, Knights, Dolphins, Knights, Dolphins, Knights, Dolphins, Knights, Dolphins, Knights, Dolphins, Knights, Dolphins, Knights, Dolphins, Knights, Dolphins, Knights, Dolphins, Knights, Dolphins, Knights, Dolphins, Knights, Dolphins, Knights, Dolphins, Knights, Dolphins, Knights, Dolphins, Knights, Dolphins, Knights, Dolphins, Knights, Dolphins, Knights, Dolphins, Knights, Dolphins, Knights, Dolphins, Knights, Dolphins, Knights, Dolphins, Knights, Dolphins, Knights, Dolphins, Knights, Dolphins, Knights, Dolphins, Knights, Dolphins, Knights, Dolphins, Knights, Dolphins, Knights, Dolphins, Knights, Dolphins, Knights, Dolphins, Knights, Dolphins, Knights, Dolphins, Knights, Dolphins, Knights, Dolphins, Knights, Dolphins
, Warriors, Warriors, Manly, Manly, Warriors, Warriors, Manly, Manly, Warriors, Warriors, Manly, Manly, Warriors, Warriors, Manly, Manly, Warriors, Warriors, Manly, Manly, Warriors, Warriors, Manly, Manly, Warriors, Warriors, Manly, Manly, Warriors, Warriors, Manly, Manly, Warriors, Warriors, Manly, Manly, Warriors, Warriors, Manly, Manly, Warriors, Warriors, Manly, Manly, Warriors, Warriors, Manly, Manly, Warriors, Warriors, Manly, Manly, Warriors, Warriors, Manly, Manly, Warriors, Warriors, Manly, Manly, Warriors, Warriors, Manly, Manly, Warriors, Warriors, Manly, Manly, Warriors, Warriors, Manly, Manly, Warriors, Warriors, Manly, Manly, Warriors, Warriors, Manly, Manly, Warriors, Warriors, Manly, Manly, Warriors, Warriors, Manly, Manly, Warriors, Warriors, Manly, Manly, Warriors, Warriors, Manly, Manly, Warriors, Warriors, Manly, Manly, Warriors, Warriors, Manly, Manly, Warriors, Warriors, Manly, Manly, Warriors, Warriors, Manly, Manly, Warriors, Warriors, Manly, Manly, Warriors, Warriors, Manly, Manly, Warriors, Warriors, Manly, Manly, Warriors, Warriors, Manly, Manly, Warriors, Warriors, Manly, Manly, Warriors, Warriors, Manly, Manly, Warriors, Warriors, Manly, Manly, Warriors, Warriors, Manly, Manly, Warriors, Warriors, Manly, Manly, Warriors, Warriors, Manly, Manly, Warriors, Warriors, Manly, Manly, Warriors, Warriors, Manly, Manly, Warriors, Warriors, Manly, Manly, Warriors, Warriors, Manly, Manly, Warriors, Warriors, Manly, Manly, Warriors, Warriors, Manly, Manly, Warriors, Warriors, Manly, Manly, Warriors, Warriors, Manly, Manly, Warriors, Warriors, Manly, Manly, Warriors, Warriors, Manly, Manly, Warriors, Warriors, Manly, Manly, Warriors, Warriors, Manly, Manly, Warriors, Warriors, Manly, Manly, Warriors, Warriors, Manly, Manly, Warriors, Warriors, Manly, Manly, Warriors, Warriors, Manly, Manly, Warriors, Warriors, Manly, Manly, Warriors, Warriors, Manly, Manly, Warriors, Warriors, Manly, Manly, Warriors, Warriors, Manly, Manly, Warriors, Warriors, Manly, Manly, Warriors, Warriors, Manly, Manly, Warriors, Warriors, Manly, Manly, Warriors, Warriors, Manly, Manly, Warriors, Warriors, Manly, Manly, Warriors, Warriors, Manly, Manly
, Panthers, Panthers, Panthers, Panthers, Roosters, Roosters, Roosters, Roosters, Panthers, Panthers, Panthers, Panthers, Roosters, Roosters, Roosters, Roosters, Panthers, Panthers, Panthers, Panthers, Roosters, Roosters, Roosters, Roosters, Panthers, Panthers, Panthers, Panthers, Roosters, Roosters, Roosters, Roosters, Panthers, Panthers, Panthers, Panthers, Roosters, Roosters, Roosters, Roosters, Panthers, Panthers, Panthers, Panthers, Roosters, Roosters, Roosters, Roosters, Panthers, Panthers, Panthers, Panthers, Roosters, Roosters, Roosters, Roosters, Panthers, Panthers, Panthers, Panthers, Roosters, Roosters, Roosters, Roosters, Panthers, Panthers, Panthers, Panthers, Roosters, Roosters, Roosters, Roosters, Panthers, Panthers, Panthers, Panthers, Roosters, Roosters, Roosters, Roosters, Panthers, Panthers, Panthers, Panthers, Roosters, Roosters, Roosters, Roosters, Panthers, Panthers, Panthers, Panthers, Roosters, Roosters, Roosters, Roosters, Panthers, Panthers, Panthers, Panthers, Roosters, Roosters, Roosters, Roosters, Panthers, Panthers, Panthers, Panthers, Roosters, Roosters, Roosters, Roosters, Panthers, Panthers, Panthers, Panthers, Roosters, Roosters, Roosters, Roosters, Panthers, Panthers, Panthers, Panthers, Roosters, Roosters, Roosters, Roosters, Panthers, Panthers, Panthers, Panthers, Roosters, Roosters, Roosters, Roosters, Panthers, Panthers, Panthers, Panthers, Roosters, Roosters, Roosters, Roosters, Panthers, Panthers, Panthers, Panthers, Roosters, Roosters, Roosters, Roosters, Panthers, Panthers, Panthers, Panthers, Roosters, Roosters, Roosters, Roosters, Panthers, Panthers, Panthers, Panthers, Roosters, Roosters, Roosters, Roosters, Panthers, Panthers, Panthers, Panthers, Roosters, Roosters, Roosters, Roosters, Panthers, Panthers, Panthers, Panthers, Roosters, Roosters, Roosters, Roosters, Panthers, Panthers, Panthers, Panthers, Roosters, Roosters, Roosters, Roosters, Panthers, Panthers, Panthers, Panthers, Roosters, Roosters, Roosters, Roosters, Panthers, Panthers, Panthers, Panthers, Roosters, Roosters, Roosters, Roosters, Panthers, Panthers, Panthers, Panthers, Roosters, Roosters, Roosters, Roosters, Panthers, Panthers, Panthers, Panthers, Roosters, Roosters, Roosters, Roosters, Panthers, Panthers, Panthers, Panthers, Roosters, Roosters, Roosters, Roosters, Panthers, Panthers, Panthers, Panthers, Roosters, Roosters, Roosters, Roosters, Panthers, Panthers, Panthers, Panthers, Roosters, Roosters, Roosters, Roosters, Panthers, Panthers, Panthers, Panthers, Roosters, Roosters, Roosters, Roosters
, Dragons, Dragons, Dragons, Dragons, Dragons, Dragons, Dragons, Dragons, Rabbitohs, Rabbitohs, Rabbitohs, Rabbitohs, Rabbitohs, Rabbitohs, Rabbitohs, Rabbitohs, Dragons, Dragons, Dragons, Dragons, Dragons, Dragons, Dragons, Dragons, Rabbitohs, Rabbitohs, Rabbitohs, Rabbitohs, Rabbitohs, Rabbitohs, Rabbitohs, Rabbitohs, Dragons, Dragons, Dragons, Dragons, Dragons, Dragons, Dragons, Dragons, Rabbitohs, Rabbitohs, Rabbitohs, Rabbitohs, Rabbitohs, Rabbitohs, Rabbitohs, Rabbitohs, Dragons, Dragons, Dragons, Dragons, Dragons, Dragons, Dragons, Dragons, Rabbitohs, Rabbitohs, Rabbitohs, Rabbitohs, Rabbitohs, Rabbitohs, Rabbitohs, Rabbitohs, Dragons, Dragons, Dragons, Dragons, Dragons, Dragons, Dragons, Dragons, Rabbitohs, Rabbitohs, Rabbitohs, Rabbitohs, Rabbitohs, Rabbitohs, Rabbitohs, Rabbitohs, Dragons, Dragons, Dragons, Dragons, Dragons, Dragons, Dragons, Dragons, Rabbitohs, Rabbitohs, Rabbitohs, Rabbitohs, Rabbitohs, Rabbitohs, Rabbitohs, Rabbitohs, Dragons, Dragons, Dragons, Dragons, Dragons, Dragons, Dragons, Dragons, Rabbitohs, Rabbitohs, Rabbitohs, Rabbitohs, Rabbitohs, Rabbitohs, Rabbitohs, Rabbitohs, Dragons, Dragons, Dragons, Dragons, Dragons, Dragons, Dragons, Dragons, Rabbitohs, Rabbitohs, Rabbitohs, Rabbitohs, Rabbitohs, Rabbitohs, Rabbitohs, Rabbitohs, Dragons, Dragons, Dragons, Dragons, Dragons, Dragons, Dragons, Dragons, Rabbitohs, Rabbitohs, Rabbitohs, Rabbitohs, Rabbitohs, Rabbitohs, Rabbitohs, Rabbitohs, Dragons, Dragons, Dragons, Dragons, Dragons, Dragons, Dragons, Dragons, Rabbitohs, Rabbitohs, Rabbitohs, Rabbitohs, Rabbitohs, Rabbitohs, Rabbitohs, Rabbitohs, Dragons, Dragons, Dragons, Dragons, Dragons, Dragons, Dragons, Dragons, Rabbitohs, Rabbitohs, Rabbitohs, Rabbitohs, Rabbitohs, Rabbitohs, Rabbitohs, Rabbitohs, Dragons, Dragons, Dragons, Dragons, Dragons, Dragons, Dragons, Dragons, Rabbitohs, Rabbitohs, Rabbitohs, Rabbitohs, Rabbitohs, Rabbitohs, Rabbitohs, Rabbitohs, Dragons, Dragons, Dragons, Dragons, Dragons, Dragons, Dragons, Dragons, Rabbitohs, Rabbitohs, Rabbitohs, Rabbitohs, Rabbitohs, Rabbitohs, Rabbitohs, Rabbitohs, Dragons, Dragons, Dragons, Dragons, Dragons, Dragons, Dragons, Dragons, Rabbitohs, Rabbitohs, Rabbitohs, Rabbitohs, Rabbitohs, Rabbitohs, Rabbitohs, Rabbitohs, Dragons, Dragons, Dragons, Dragons, Dragons, Dragons, Dragons, Dragons, Rabbitohs, Rabbitohs, Rabbitohs, Rabbitohs, Rabbitohs, Rabbitohs, Rabbitohs, Rabbitohs, Dragons, Dragons, Dragons, Dragons, Dragons, Dragons, Dragons, Dragons, Rabbitohs, Rabbitohs, Rabbitohs, Rabbitohs, Rabbitohs, Rabbitohs, Rabbitohs, Rabbitohs
, Cowboys, Cowboys, Cowboys, Cowboys, Cowboys, Cowboys, Cowboys, Cowboys, Cowboys, Cowboys, Cowboys, Cowboys, Cowboys, Cowboys, Cowboys, Cowboys, Sharks, Sharks, Sharks, Sharks, Sharks, Sharks, Sharks, Sharks, Sharks, Sharks, Sharks, Sharks, Sharks, Sharks, Sharks, Sharks, Cowboys, Cowboys, Cowboys, Cowboys, Cowboys, Cowboys, Cowboys, Cowboys, Cowboys, Cowboys, Cowboys, Cowboys, Cowboys, Cowboys, Cowboys, Cowboys, Sharks, Sharks, Sharks, Sharks, Sharks, Sharks, Sharks, Sharks, Sharks, Sharks, Sharks, Sharks, Sharks, Sharks, Sharks, Sharks, Cowboys, Cowboys, Cowboys, Cowboys, Cowboys, Cowboys, Cowboys, Cowboys, Cowboys, Cowboys, Cowboys, Cowboys, Cowboys, Cowboys, Cowboys, Cowboys, Sharks, Sharks, Sharks, Sharks, Sharks, Sharks, Sharks, Sharks, Sharks, Sharks, Sharks, Sharks, Sharks, Sharks, Sharks, Sharks, Cowboys, Cowboys, Cowboys, Cowboys, Cowboys, Cowboys, Cowboys, Cowboys, Cowboys, Cowboys, Cowboys, Cowboys, Cowboys, Cowboys, Cowboys, Cowboys, Sharks, Sharks, Sharks, Sharks, Sharks, Sharks, Sharks, Sharks, Sharks, Sharks, Sharks, Sharks, Sharks, Sharks, Sharks, Sharks, Cowboys, Cowboys, Cowboys, Cowboys, Cowboys, Cowboys, Cowboys, Cowboys, Cowboys, Cowboys, Cowboys, Cowboys, Cowboys, Cowboys, Cowboys, Cowboys, Sharks, Sharks, Sharks, Sharks, Sharks, Sharks, Sharks, Sharks, Sharks, Sharks, Sharks, Sharks, Sharks, Sharks, Sharks, Sharks, Cowboys, Cowboys, Cowboys, Cowboys, Cowboys, Cowboys, Cowboys, Cowboys, Cowboys, Cowboys, Cowboys, Cowboys, Cowboys, Cowboys, Cowboys, Cowboys, Sharks, Sharks, Sharks, Sharks, Sharks, Sharks, Sharks, Sharks, Sharks, Sharks, Sharks, Sharks, Sharks, Sharks, Sharks, Sharks, Cowboys, Cowboys, Cowboys, Cowboys, Cowboys, Cowboys, Cowboys, Cowboys, Cowboys, Cowboys, Cowboys, Cowboys, Cowboys, Cowboys, Cowboys, Cowboys, Sharks, Sharks, Sharks, Sharks, Sharks, Sharks, Sharks, Sharks, Sharks, Sharks, Sharks, Sharks, Sharks, Sharks, Sharks, Sharks, Cowboys, Cowboys, Cowboys, Cowboys, Cowboys, Cowboys, Cowboys, Cowboys, Cowboys, Cowboys, Cowboys, Cowboys, Cowboys, Cowboys, Cowboys, Cowboys, Sharks, Sharks, Sharks, Sharks, Sharks, Sharks, Sharks, Sharks, Sharks, Sharks, Sharks, Sharks, Sharks, Sharks, Sharks, Sharks
, Raiders, Raiders, Raiders, Raiders, Raiders, Raiders, Raiders, Raiders, Raiders, Raiders, Raiders, Raiders, Raiders, Raiders, Raiders, Raiders, Raiders, Raiders, Raiders, Raiders, Raiders, Raiders, Raiders, Raiders, Raiders, Raiders, Raiders, Raiders, Raiders, Raiders, Raiders, Raiders, Broncos, Broncos, Broncos, Broncos, Broncos, Broncos, Broncos, Broncos, Broncos, Broncos, Broncos, Broncos, Broncos, Broncos, Broncos, Broncos, Broncos, Broncos, Broncos, Broncos, Broncos, Broncos, Broncos, Broncos, Broncos, Broncos, Broncos, Broncos, Broncos, Broncos, Broncos, Broncos, Raiders, Raiders, Raiders, Raiders, Raiders, Raiders, Raiders, Raiders, Raiders, Raiders, Raiders, Raiders, Raiders, Raiders, Raiders, Raiders, Raiders, Raiders, Raiders, Raiders, Raiders, Raiders, Raiders, Raiders, Raiders, Raiders, Raiders, Raiders, Raiders, Raiders, Raiders, Raiders, Broncos, Broncos, Broncos, Broncos, Broncos, Broncos, Broncos, Broncos, Broncos, Broncos, Broncos, Broncos, Broncos, Broncos, Broncos, Broncos, Broncos, Broncos, Broncos, Broncos, Broncos, Broncos, Broncos, Broncos, Broncos, Broncos, Broncos, Broncos, Broncos, Broncos, Broncos, Broncos, Raiders, Raiders, Raiders, Raiders, Raiders, Raiders, Raiders, Raiders, Raiders, Raiders, Raiders, Raiders, Raiders, Raiders, Raiders, Raiders, Raiders, Raiders, Raiders, Raiders, Raiders, Raiders, Raiders, Raiders, Raiders, Raiders, Raiders, Raiders, Raiders, Raiders, Raiders, Raiders, Broncos, Broncos, Broncos, Broncos, Broncos, Broncos, Broncos, Broncos, Broncos, Broncos, Broncos, Broncos, Broncos, Broncos, Broncos, Broncos, Broncos, Broncos, Broncos, Broncos, Broncos, Broncos, Broncos, Broncos, Broncos, Broncos, Broncos, Broncos, Broncos, Broncos, Broncos, Broncos, Raiders, Raiders, Raiders, Raiders, Raiders, Raiders, Raiders, Raiders, Raiders, Raiders, Raiders, Raiders, Raiders, Raiders, Raiders, Raiders, Raiders, Raiders, Raiders, Raiders, Raiders, Raiders, Raiders, Raiders, Raiders, Raiders, Raiders, Raiders, Raiders, Raiders, Raiders, Raiders, Broncos, Broncos, Broncos, Broncos, Broncos, Broncos, Broncos, Broncos, Broncos, Broncos, Broncos, Broncos, Broncos, Broncos, Broncos, Broncos, Broncos, Broncos, Broncos, Broncos, Broncos, Broncos, Broncos, Broncos, Broncos, Broncos, Broncos, Broncos, Broncos, Broncos, Broncos, Broncos
, Eels, Eels, Eels, Eels, Eels, Eels, Eels, Eels, Eels, Eels, Eels, Eels, Eels, Eels, Eels, Eels, Eels, Eels, Eels, Eels, Eels, Eels, Eels, Eels, Eels, Eels, Eels, Eels, Eels, Eels, Eels, Eels, Eels, Eels, Eels, Eels, Eels, Eels, Eels, Eels, Eels, Eels, Eels, Eels, Eels, Eels, Eels, Eels, Eels, Eels, Eels, Eels, Eels, Eels, Eels, Eels, Eels, Eels, Eels, Eels, Eels, Eels, Eels, Eels, Tigers, Tigers, Tigers, Tigers, Tigers, Tigers, Tigers, Tigers, Tigers, Tigers, Tigers, Tigers, Tigers, Tigers, Tigers, Tigers, Tigers, Tigers, Tigers, Tigers, Tigers, Tigers, Tigers, Tigers, Tigers, Tigers, Tigers, Tigers, Tigers, Tigers, Tigers, Tigers, Tigers, Tigers, Tigers, Tigers, Tigers, Tigers, Tigers, Tigers, Tigers, Tigers, Tigers, Tigers, Tigers, Tigers, Tigers, Tigers, Tigers, Tigers, Tigers, Tigers, Tigers, Tigers, Tigers, Tigers, Tigers, Tigers, Tigers, Tigers, Tigers, Tigers, Tigers, Tigers, Eels, Eels, Eels, Eels, Eels, Eels, Eels, Eels, Eels, Eels, Eels, Eels, Eels, Eels, Eels, Eels, Eels, Eels, Eels, Eels, Eels, Eels, Eels, Eels, Eels, Eels, Eels, Eels, Eels, Eels, Eels, Eels, Eels, Eels, Eels, Eels, Eels, Eels, Eels, Eels, Eels, Eels, Eels, Eels, Eels, Eels, Eels, Eels, Eels, Eels, Eels, Eels, Eels, Eels, Eels, Eels, Eels, Eels, Eels, Eels, Eels, Eels, Eels, Eels, Tigers, Tigers, Tigers, Tigers, Tigers, Tigers, Tigers, Tigers, Tigers, Tigers, Tigers, Tigers, Tigers, Tigers, Tigers, Tigers, Tigers, Tigers, Tigers, Tigers, Tigers, Tigers, Tigers, Tigers, Tigers, Tigers, Tigers, Tigers, Tigers, Tigers, Tigers, Tigers, Tigers, Tigers, Tigers, Tigers, Tigers, Tigers, Tigers, Tigers, Tigers, Tigers, Tigers, Tigers, Tigers, Tigers, Tigers, Tigers, Tigers, Tigers, Tigers, Tigers, Tigers, Tigers, Tigers, Tigers, Tigers, Tigers, Tigers, Tigers, Tigers, Tigers, Tigers, Tigers
, Bulldogs, Bulldogs, Bulldogs, Bulldogs, Bulldogs, Bulldogs, Bulldogs, Bulldogs, Bulldogs, Bulldogs, Bulldogs, Bulldogs, Bulldogs, Bulldogs, Bulldogs, Bulldogs, Bulldogs, Bulldogs, Bulldogs, Bulldogs, Bulldogs, Bulldogs, Bulldogs, Bulldogs, Bulldogs, Bulldogs, Bulldogs, Bulldogs, Bulldogs, Bulldogs, Bulldogs, Bulldogs, Bulldogs, Bulldogs, Bulldogs, Bulldogs, Bulldogs, Bulldogs, Bulldogs, Bulldogs, Bulldogs, Bulldogs, Bulldogs, Bulldogs, Bulldogs, Bulldogs, Bulldogs, Bulldogs, Bulldogs, Bulldogs, Bulldogs, Bulldogs, Bulldogs, Bulldogs, Bulldogs, Bulldogs, Bulldogs, Bulldogs, Bulldogs, Bulldogs, Bulldogs, Bulldogs, Bulldogs, Bulldogs, Bulldogs, Bulldogs, Bulldogs, Bulldogs, Bulldogs, Bulldogs, Bulldogs, Bulldogs, Bulldogs, Bulldogs, Bulldogs, Bulldogs, Bulldogs, Bulldogs, Bulldogs, Bulldogs, Bulldogs, Bulldogs, Bulldogs, Bulldogs, Bulldogs, Bulldogs, Bulldogs, Bulldogs, Bulldogs, Bulldogs, Bulldogs, Bulldogs, Bulldogs, Bulldogs, Bulldogs, Bulldogs, Bulldogs, Bulldogs, Bulldogs, Bulldogs, Bulldogs, Bulldogs, Bulldogs, Bulldogs, Bulldogs, Bulldogs, Bulldogs, Bulldogs, Bulldogs, Bulldogs, Bulldogs, Bulldogs, Bulldogs, Bulldogs, Bulldogs, Bulldogs, Bulldogs, Bulldogs, Bulldogs, Bulldogs, Bulldogs, Bulldogs, Bulldogs, Bulldogs, Bulldogs, Bulldogs, Bulldogs, Bulldogs, Titans, Titans, Titans, Titans, Titans, Titans, Titans, Titans, Titans, Titans, Titans, Titans, Titans, Titans, Titans, Titans, Titans, Titans, Titans, Titans, Titans, Titans, Titans, Titans, Titans, Titans, Titans, Titans, Titans, Titans, Titans, Titans, Titans, Titans, Titans, Titans, Titans, Titans, Titans, Titans, Titans, Titans, Titans, Titans, Titans, Titans, Titans, Titans, Titans, Titans, Titans, Titans, Titans, Titans, Titans, Titans, Titans, Titans, Titans, Titans, Titans, Titans, Titans, Titans, Titans, Titans, Titans, Titans, Titans, Titans, Titans, Titans, Titans, Titans, Titans, Titans, Titans, Titans, Titans, Titans, Titans, Titans, Titans, Titans, Titans, Titans, Titans, Titans, Titans, Titans, Titans, Titans, Titans, Titans, Titans, Titans, Titans, Titans, Titans, Titans, Titans, Titans, Titans, Titans, Titans, Titans, Titans, Titans, Titans, Titans, Titans, Titans, Titans, Titans, Titans, Titans, Titans, Titans, Titans, Titans, Titans, Titans, Titans, Titans, Titans, Titans, Titans, Titans
Storm, 43.12056737588652, 43.21547698465643, 39.05448290180028, 40.310118825598124, 45.679886685552404, 47.54996776273372, 41.88256829062236, 42.81182591041746, 42.74777570866956, 42.88969052591608, 39.636108589817646, 39.50169875424688, 45.435294117647054, 47.22966934763181, 42.50513347022588, 42.23525230987917, 42.92956041461754, 43.21941958231625, 39.48029424077507, 40.244559362206424, 45.77301161751564, 47.05882352941176, 43.01423939094882, 43.353200310961384, 42.976429552901386, 42.87601434232874, 39.3504244625586, 39.36042136945071, 46.55770183259039, 45.604137282557595, 41.32263744864019, 43.52266618885504, 44.387077740079654, 45.06631299734748, 40.0306838968549, 40.228910555320056, 46.73684210526316, 47.5609756097561, 42.62572193266657, 42.89308176100629, 43.375, 43.63843524496772, 39.484765915283624, 39.89883963106218, 45.598771750255885, 47.47386759581882, 42.554814108674925, 42.73318872017354, 42.606592077411555, 44.37729900157646, 39.95611173714489, 40.443125198770275, 45.79305406373075, 48.56770833333333, 42.96514069718606, 43.71584699453552, 42.073550799916895, 44.65386009423704, 39.800995024875625, 39.878211792663, 44.608341810783315, 47.69765421372719, 42.512363996043526, 43.1344864101659, 41.978691019786915, 42.620763277288496, 39.98167938931298, 40.58355437665783, 45.365677045619115, 46.18447246184472, 42.63710954368792, 42.09284028324154, 43.8600124249327, 43.28416149068323, 38.83677298311445, 40.76768302120415, 45.99391480730223, 47.23481414324569, 42.52211479119523, 43.37722695584818, 43.5518621114189, 44.5822994210091, 39.8375484585564, 40.11842252262317, 47.68261030774935, 46.588693957115005, 40.92023654983413, 43.21223709369025, 42.42358551918491, 44.895545920378396, 40.1316359227505, 40.00627549419517, 46.25573102394294, 46.73721340388007, 43.305481964540455, 42.68336314847942, 45.0030284675954, 44.076655052264805, 39.948135342059764, 40.832788314802706, 47.013888888888886, 45.79081632653062, 42.78350515463917, 41.6919959473151, 44.14775255896751, 44.26100628930818, 40.18596787827557, 40.243902439024396, 43.904958677685954, 48.148148148148145, 41.93944353518822, 43.78219278881531, 43.61341951369652, 43.62050163576881, 39.790192729934134, 40.33003300330033, 46.86809137803979, 49.73045822102426, 42.79859484777517, 42.87268770402611, 43.18084651560496, 43.871975019516, 40.00339155502798, 40.04256612952265, 44.188376753507015, 46.50735294117647, 41.317608784058564, 42.9920116194626, 44.54597372929754, 44.432605221097496, 41.20649651972158, 41.053286336305206, 45.95890410958904, 48.531139835487664, 44.500264410364885, 43.65234375, 45.49707602339181, 44.80286738351255, 40.24828487422411, 41.852387843704776, 46.4816650148662, 47.863247863247864, 42.005218039508016, 47.47814391392065, 44.659904534606206, 45.81178903826267, 40.18087855297158, 41.93141173995371, 47.93672627235213, 47.688564476885645, 43.3677743647026, 45.52804446690248, 45.38021259198692, 43.76750700280112, 40.24889471098739, 39.87414187643021, 47.74951076320939, 44.34470377019748, 42.867839760389366, 44.90358126721763, 45.42920847268673, 48.31013916500994, 39.793766112022496, 42.47824285122254, 48.99713467048711, 50.0, 45.01905280348394, 47.25050916496945, 44.0884820747521, 43.267776096823, 40.325552825552826, 41.723356009070294, 49.72477064220184, 48.754448398576514, 46.71253822629969, 46.51162790697674, 44.487968662562956, 44.32882414151925, 40.78679629210943, 40.921843687374746, 48.94810659186536, 46.493506493506494, 43.42607746863066, 46.43564356435644, 41.77918983320095, 46.13095238095239, 40.76555023923445, 42.42768009075439, 48.25581395348838, 50.88967971530249, 43.81679389312977, 41.607898448519045, 44.976905311778296, 45.376344086021504, 41.90861494526416, 41.87741105872267, 43.7246963562753, 50.0, 42.516016307513105, 44.50489662676823, 45.09480626545754, 43.108974358974365, 40.08592200925314, 39.040284360189574, 47.50499001996008, 50.78125, 45.92240696753761, 42.83727399165508, 44.97607655502392, 43.87646432374867, 41.00309008794866, 41.76013805004314, 47.360912981455066, 48.19277108433735, 41.90919674039581, 44.93307839388145, 43.06382978723404, 45.05494505494506, 41.38048282896974, 39.624924379915306, 45.102040816326536, 47.05882352941176, 44.27001569858713, 43.45403899721448, 45.80246913580247, 48.95591647331787, 42.558250118877794, 42.75244299674267, 52.14899713467048, 51.28205128205128, 44.41913439635535, 47.42268041237113, 48.704663212435236, 46.646341463414636, 40.625, 40.39167686658507, 51.13636363636363, 52.44755244755245, 44.642857142857146, 47.353760445682454, 44.0, 51.21457489878543, 41.54478976234003, 42.39036973344798, 46.59400544959128, 50.93457943925234, 41.55405405405405, 43.93638170974155, 40.59900166389351, 43.804034582132566, 39.85788113695091, 42.251815980629544, 45.13618677042802, 47.794117647058826, 46.463022508038584, 41.32231404958678
