, Knights, Dolphins, Knights, Dolphins, Knights, Dolphins, Knights, Dolphins, Knights, Dolphins, Knights, Dolphins, Knights, Dolphins, Knights, Dolphins, Knights, Dolphins, Knights, Dolphins, Knights, Dolphins, Knights, Dolphins, Knights, Dolphins, Knights, Dolphins, Knights, Dolphins, Knights, Dolphins, Knights, Dolphins, Knights, Dolphins, Knights, Dolphins, Knights, Dolphins, Knights, Dolphins, Knights, Dolphins, Knights, Dolphins, Knights, Dolphins, Knights, Dolphins, Knights, Dolphins, Knights, Dolphins, Knights, Dolphins, Knights, Dolphins, Knights, Dolphins, Knights, Dolphins, Knights, Dolphins, Knights, Dolphins, Knights, Dolphins, Knights, Dolphins, Knights, Dolphins, Knights, Dolphins, Knights, Dolphins, Knights, Dolphins, Knights, Dolphins, Knights, Dolphins, Knights, Dolphins, Knights, Dolphins, Knights, Dolphins, Knights, Dolphins, Knights, Dolphins, Knights, Dolphins, Knights, Dolphins, Knights, Dolphins, Knights, Dolphins, Knights, Dolphins, Knights, Dolphins, Knights, Dolphins, Knights, Dolphins, Knights, Dolphins, Knights, Dolphins, Knights, Dolphins, Knights, Dolphins, Knights, Dolphins, Knights, Dolphins, Knights, Dolphins, Knights, Dolphins, Knights, Dolphins, Knights, Dolphins, Knights, Dolphins, Knights, Dolphins, Knights, Dolphins, Knights, Dolphins, Knights, Dolphins, Knights, Dolphins, Knights, Dolphins, Knights, Dolphins, Knights, Dolphins, Knights, Dolphins, Knights, Dolphins, Knights, Dolphins, Knights, Dolphins, Knights, Dolphins, Knights, Dolphins, Knights, Dolphins, Knights, Dolphins, Knights, Dolphins, Knights, Dolphins, Knights, Dolphins, Knights, Dolphins, Knights, Dolphins, Knights, Dolphins, Knights, Dolphins, Knights, Dolphins, Knights, Dolphins, Knights, Dolphins, Knights, Dolphins, Knights, Dolphins, Knights, Dolphins, Knights, Dolphins, Knights, Dolphins, Knights, Dolphins, Knights, Dolphins, Knights, Dolphins, Knights, Dolphins, Knights, Dolphins, Knights, Dolphins, Knights, Dolphins, Knights, Dolphins, Knights, Dolphins, Knights, Dolphins, Knights, Dolphins, Knights, Dolphins, Knights, Dolphins, Knights, Dolphins, Knights, Dolphins, Knights, Dolphins, Knights, Dolphins, Knights, Dolphins, Knights, Dolphins, Knights, Dolphins, Knights, Dolphins, Knights, Dolphins, Knights, Dolphins, Knights, Dolphins, Knights, Dolphins, Knights, Dolphins, Knights, Dolphins, Knights, Dolphins, Knights, Dolphins, Knights, Dolphins, Knights, Dolphins, Knights, Dolphins
, Warriors, Warriors, Manly, Manly, Warriors, Warriors, Manly, Manly, Warriors, Warriors, Manly, Manly, Warriors, Warriors, Manly, Manly, Warriors, Warriors, Manly, Manly, Warriors, Warriors, Manly, Manly, Warriors, Warriors, Manly, Manly, Warriors, Warriors, Manly, Manly, Warriors, Warriors, Manly, Manly, Warriors, Warriors, Manly, Manly, Warriors, Warriors, Manly, Manly, Warriors, Warriors, Manly, Manly, Warriors, Warriors, Manly, Manly, Warriors, Warriors, Manly, Manly, Warriors, Warriors, Manly, Manly, Warriors, Warriors, Manly, Manly, Warriors, Warriors, Manly, Manly, Warriors, Warriors, Manly, Manly, Warriors, Warriors, Manly, Manly, Warriors, Warriors, Manly, Manly, Warriors, Warriors, Manly, Manly, Warriors, Warriors, Manly, Manly, Warriors, Warriors, Manly, Manly, Warriors, Warriors, Manly, Manly, Warriors, Warriors, Manly, Manly, Warriors, Warriors, Manly, Manly, Warriors, Warriors, Manly, Manly, Warriors, Warriors, Manly, Manly, Warriors, Warriors, Manly, Manly, Warriors, Warriors, Manly, Manly, Warriors, Warriors, Manly, Manly, Warriors, Warriors, Manly, Manly, Warriors, Warriors, Manly, Manly, Warriors, Warriors, Manly, Manly, Warriors, Warriors, Manly, Manly, Warriors, Warriors, Manly, Manly, Warriors, Warriors, Manly, Manly, Warriors, Warriors, Manly, Manly, Warriors, Warriors, Manly, Manly, Warriors, Warriors, Manly, Manly, Warriors, Warriors, Manly, Manly, Warriors, Warriors, Manly, Manly, Warriors, Warriors, Manly, Manly, Warriors, Warriors, Manly, Manly, Warriors, Warriors, Manly, Manly, Warriors, Warriors, Manly, Manly, Warriors, Warriors, Manly, Manly, Warriors, Warriors, Manly, Manly, Warriors, Warriors, Manly, Manly, Warriors, Warriors, Manly, Manly, Warriors, Warriors, Manly, Manly, Warriors, Warriors, Manly, Manly, Warriors, Warriors, Manly, Manly, Warriors, Warriors, Manly, Manly, Warriors, Warriors, Manly, Manly, Warriors, Warriors, Manly, Manly, Warriors, Warriors, Manly, Manly, Warriors, Warriors, Manly, Manly, Warriors, Warriors, Manly, Manly, Warriors, Warriors, Manly, Manly, Warriors, Warriors, Manly, Manly, Warriors, Warriors, Manly, Manly, Warriors, Warriors, Manly, Manly, Warriors, Warriors, Manly, Manly
, Panthers, Panthers, Panthers, Panthers, Roosters, Roosters, Roosters, Roosters, Panthers, Panthers, Panthers, Panthers, Roosters, Roosters, Roosters, Roosters, Panthers, Panthers, Panthers, Panthers, Roosters, Roosters, Roosters, Roosters, Panthers, Panthers, Panthers, Panthers, Roosters, Roosters, Roosters, Roosters, Panthers, Panthers, Panthers, Panthers, Roosters, Roosters, Roosters, Roosters, Panthers, Panthers, Panthers, Panthers, Roosters, Roosters, Roosters, Roosters, Panthers, Panthers, Panthers, Panthers, Roosters, Roosters, Roosters, Roosters, Panthers, Panthers, Panthers, Panthers, Roosters, Roosters, Roosters, Roosters, Panthers, Panthers, Panthers, Panthers, Roosters, Roosters, Roosters, Roosters, Panthers, Panthers, Panthers, Panthers, Roosters, Roosters, Roosters, Roosters, Panthers, Panthers, Panthers, Panthers, Roosters, Roosters, Roosters, Roosters, Panthers, Panthers, Panthers, Panthers, Roosters, Roosters, Roosters, Roosters, Panthers, Panthers, Panthers, Panthers, Roosters, Roosters, Roosters, Roosters, Panthers, Panthers, Panthers, Panthers, Roosters, Roosters, Roosters, Roosters, Panthers, Panthers, Panthers, Panthers, Roosters, Roosters, Roosters, Roosters, Panthers, Panthers, Panthers, Panthers, Roosters, Roosters, Roosters, Roosters, Panthers, Panthers, Panthers, Panthers, Roosters, Roosters, Roosters, Roosters, Panthers, Panthers, Panthers, Panthers, Roosters, Roosters, Roosters, Roosters, Panthers, Panthers, Panthers, Panthers, Roosters, Roosters, Roosters, Roosters, Panthers, Panthers, Panthers, Panthers, Roosters, Roosters, Roosters, Roosters, Panthers, Panthers, Panthers, Panthers, Roosters, Roosters, Roosters, Roosters, Panthers, Panthers, Panthers, Panthers, Roosters, Roosters, Roosters, Roosters, Panthers, Panthers, Panthers, Panthers, Roosters, Roosters, Roosters, Roosters, Panthers, Panthers, Panthers, Panthers, Roosters, Roosters, Roosters, Roosters, Panthers, Panthers, Panthers, Panthers, Roosters, Roosters, Roosters, Roosters, Panthers, Panthers, Panthers, Panthers, Roosters, Roosters, Roosters, Roosters, Panthers, Panthers, Panthers, Panthers, Roosters, Roosters, Roosters, Roosters, Panthers, Panthers, Panthers, Panthers, Roosters, Roosters, Roosters, Roosters, Panthers, Panthers, Panthers, Panthers, Roosters, Roosters, Roosters, Roosters, Panthers, Panthers, Panthers, Panthers, Roosters, Roosters, Roosters, Roosters, Panthers, Panthers, Panthers, Panthers, Roosters, Roosters, Roosters, Roosters, Panthers, Panthers, Panthers, Panthers, Roosters, Roosters, Roosters, Roosters
, Dragons, Dragons, Dragons, Dragons, Dragons, Dragons, Dragons, Dragons, Rabbitohs, Rabbitohs, Rabbitohs, Rabbitohs, Rabbitohs, Rabbitohs, Rabbitohs, Rabbitohs, Dragons, Dragons, Dragons, Dragons, Dragons, Dragons, Dragons, Dragons, Rabbitohs, Rabbitohs, Rabbitohs, Rabbitohs, Rabbitohs, Rabbitohs, Rabbitohs, Rabbitohs, Dragons, Dragons, Dragons, Dragons, Dragons, Dragons, Dragons, Dragons, Rabbitohs, Rabbitohs, Rabbitohs, Rabbitohs, Rabbitohs, Rabbitohs, Rabbitohs, Rabbitohs, Dragons, Dragons, Dragons, Dragons, Dragons, Dragons, Dragons, Dragons, Rabbitohs, Rabbitohs, Rabbitohs, Rabbitohs, Rabbitohs, Rabbitohs, Rabbitohs, Rabbitohs, Dragons, Dragons, Dragons, Dragons, Dragons, Dragons, Dragons, Dragons, Rabbitohs, Rabbitohs, Rabbitohs, Rabbitohs, Rabbitohs, Rabbitohs, Rabbitohs, Rabbitohs, Dragons, Dragons, Dragons, Dragons, Dragons, Dragons, Dragons, Dragons, Rabbitohs, Rabbitohs, Rabbitohs, Rabbitohs, Rabbitohs, Rabbitohs, Rabbitohs, Rabbitohs, Dragons, Dragons, Dragons, Dragons, Dragons, Dragons, Dragons, Dragons, Rabbitohs, Rabbitohs, Rabbitohs, Rabbitohs, Rabbitohs, Rabbitohs, Rabbitohs, Rabbitohs, Dragons, Dragons, Dragons, Dragons, Dragons, Dragons, Dragons, Dragons, Rabbitohs, Rabbitohs, Rabbitohs, Rabbitohs, Rabbitohs, Rabbitohs, Rabbitohs, Rabbitohs, Dragons, Dragons, Dragons, Dragons, Dragons, Dragons, Dragons, Dragons, Rabbitohs, Rabbitohs, Rabbitohs, Rabbitohs, Rabbitohs, Rabbitohs, Rabbitohs, Rabbitohs, Dragons, Dragons, Dragons, Dragons, Dragons, Dragons, Dragons, Dragons, Rabbitohs, Rabbitohs, Rabbitohs, Rabbitohs, Rabbitohs, Rabbitohs, Rabbitohs, Rabbitohs, Dragons, Dragons, Dragons, Dragons, Dragons, Dragons, Dragons, Dragons, Rabbitohs, Rabbitohs, Rabbitohs, Rabbitohs, Rabbitohs, Rabbitohs, Rabbitohs, Rabbitohs, Dragons, Dragons, Dragons, Dragons, Dragons, Dragons, Dragons, Dragons, Rabbitohs, Rabbitohs, Rabbitohs, Rabbitohs, Rabbitohs, Rabbitohs, Rabbitohs, Rabbitohs, Dragons, Dragons, Dragons, Dragons, Dragons, Dragons, Dragons, Dragons, Rabbitohs, Rabbitohs, Rabbitohs, Rabbitohs, Rabbitohs, Rabbitohs, Rabbitohs, Rabbitohs, Dragons, Dragons, Dragons, Dragons, Dragons, Dragons, Dragons, Dragons, Rabbitohs, Rabbitohs, Rabbitohs, Rabbitohs, Rabbitohs, Rabbitohs, Rabbitohs, Rabbitohs, Dragons, Dragons, Dragons, Dragons, Dragons, Dragons, Dragons, Dragons, Rabbitohs, Rabbitohs, Rabbitohs, Rabbitohs, Rabbitohs, Rabbitohs, Rabbitohs, Rabbitohs, Dragons, Dragons, Dragons, Dragons, Dragons, Dragons, Dragons, Dragons, Rabbitohs, Rabbitohs, Rabbitohs, Rabbitohs, Rabbitohs, Rabbitohs, Rabbitohs, Rabbitohs
, Cowboys, Cowboys, Cowboys, Cowboys, Cowboys, Cowboys, Cowboys, Cowboys, Cowboys, Cowboys, Cowboys, Cowboys, Cowboys, Cowboys, Cowboys, Cowboys, Sharks, Sharks, Sharks, Sharks, Sharks, Sharks, Sharks, Sharks, Sharks, Sharks, Sharks, Sharks, Sharks, Sharks, Sharks, Sharks, Cowboys, Cowboys, Cowboys, Cowboys, Cowboys, Cowboys, Cowboys, Cowboys, Cowboys, Cowboys, Cowboys, Cowboys, Cowboys, Cowboys, Cowboys, Cowboys, Sharks, Sharks, Sharks, Sharks, Sharks, Sharks, Sharks, Sharks, Sharks, Sharks, Sharks, Sharks, Sharks, Sharks, Sharks, Sharks, Cowboys, Cowboys, Cowboys, Cowboys, Cowboys, Cowboys, Cowboys, Cowboys, Cowboys, Cowboys, Cowboys, Cowboys, Cowboys, Cowboys, Cowboys, Cowboys, Sharks, Sharks, Sharks, Sharks, Sharks, Sharks, Sharks, Sharks, Sharks, Sharks, Sharks, Sharks, Sharks, Sharks, Sharks, Sharks, Cowboys, Cowboys, Cowboys, Cowboys, Cowboys, Cowboys, Cowboys, Cowboys, Cowboys, Cowboys, Cowboys, Cowboys, Cowboys, Cowboys, Cowboys, Cowboys, Sharks, Sharks, Sharks, Sharks, Sharks, Sharks, Sharks, Sharks, Sharks, Sharks, Sharks, Sharks, Sharks, Sharks, Sharks, Sharks, Cowboys, Cowboys, Cowboys, Cowboys, Cowboys, Cowboys, Cowboys, Cowboys, Cowboys, Cowboys, Cowboys, Cowboys, Cowboys, Cowboys, Cowboys, Cowboys, Sharks, Sharks, Sharks, Sharks, Sharks, Sharks, Sharks, Sharks, Sharks, Sharks, Sharks, Sharks, Sharks, Sharks, Sharks, Sharks, Cowboys, Cowboys, Cowboys, Cowboys, Cowboys, Cowboys, Cowboys, Cowboys, Cowboys, Cowboys, Cowboys, Cowboys, Cowboys, Cowboys, Cowboys, Cowboys, Sharks, Sharks, Sharks, Sharks, Sharks, Sharks, Sharks, Sharks, Sharks, Sharks, Sharks, Sharks, Sharks, Sharks, Sharks, Sharks, Cowboys, Cowboys, Cowboys, Cowboys, Cowboys, Cowboys, Cowboys, Cowboys, Cowboys, Cowboys, Cowboys, Cowboys, Cowboys, Cowboys, Cowboys, Cowboys, Sharks, Sharks, Sharks, Sharks, Sharks, Sharks, Sharks, Sharks, Sharks, Sharks, Sharks, Sharks, Sharks, Sharks, Sharks, Sharks, Cowboys, Cowboys, Cowboys, Cowboys, Cowboys, Cowboys, Cowboys, Cowboys, Cowboys, Cowboys, Cowboys, Cowboys, Cowboys, Cowboys, Cowboys, Cowboys, Sharks, Sharks, Sharks, Sharks, Sharks, Sharks, Sharks, Sharks, Sharks, Sharks, Sharks, Sharks, Sharks, Sharks, Sharks, Sharks
, Raiders, Raiders, Raiders, Raiders, Raiders, Raiders, Raiders, Raiders, Raiders, Raiders, Raiders, Raiders, Raiders, Raiders, Raiders, Raiders, Raiders, Raiders, Raiders, Raiders, Raiders, Raiders, Raiders, Raiders, Raiders, Raiders, Raiders, Raiders, Raiders, Raiders, Raiders, Raiders, Broncos, Broncos, Broncos, Broncos, Broncos, Broncos, Broncos, Broncos, Broncos, Broncos, Broncos, Broncos, Broncos, Broncos, Broncos, Broncos, Broncos, Broncos, Broncos, Broncos, Broncos, Broncos, Broncos, Broncos, Broncos, Broncos, Broncos, Broncos, Broncos, Broncos, Broncos, Broncos, Raiders, Raiders, Raiders, Raiders, Raiders, Raiders, Raiders, Raiders, Raiders, Raiders, Raiders, Raiders, Raiders, Raiders, Raiders, Raiders, Raiders, Raiders, Raiders, Raiders, Raiders, Raiders, Raiders, Raiders, Raiders, Raiders, Raiders, Raiders, Raiders, Raiders, Raiders, Raiders, Broncos, Broncos, Broncos, Broncos, Broncos, Broncos, Broncos, Broncos, Broncos, Broncos, Broncos, Broncos, Broncos, Broncos, Broncos, Broncos, Broncos, Broncos, Broncos, Broncos, Broncos, Broncos, Broncos, Broncos, Broncos, Broncos, Broncos, Broncos, Broncos, Broncos, Broncos, Broncos, Raiders, Raiders, Raiders, Raiders, Raiders, Raiders, Raiders, Raiders, Raiders, Raiders, Raiders, Raiders, Raiders, Raiders, Raiders, Raiders, Raiders, Raiders, Raiders, Raiders, Raiders, Raiders, Raiders, Raiders, Raiders, Raiders, Raiders, Raiders, Raiders, Raiders, Raiders, Raiders, Broncos, Broncos, Broncos, Broncos, Broncos, Broncos, Broncos, Broncos, Broncos, Broncos, Broncos, Broncos, Broncos, Broncos, Broncos, Broncos, Broncos, Broncos, Broncos, Broncos, Broncos, Broncos, Broncos, Broncos, Broncos, Broncos, Broncos, Broncos, Broncos, Broncos, Broncos, Broncos, Raiders, Raiders, Raiders, Raiders, Raiders, Raiders, Raiders, Raiders, Raiders, Raiders, Raiders, Raiders, Raiders, Raiders, Raiders, Raiders, Raiders, Raiders, Raiders, Raiders, Raiders, Raiders, Raiders, Raiders, Raiders, Raiders, Raiders, Raiders, Raiders, Raiders, Raiders, Raiders, Broncos, Broncos, Broncos, Broncos, Broncos, Broncos, Broncos, Broncos, Broncos, Broncos, Broncos, Broncos, Broncos, Broncos, Broncos, Broncos, Broncos, Broncos, Broncos, Broncos, Broncos, Broncos, Broncos, Broncos, Broncos, Broncos, Broncos, Broncos, Broncos, Broncos, Broncos, Broncos
, Eels, Eels, Eels, Eels, Eels, Eels, Eels, Eels, Eels, Eels, Eels, Eels, Eels, Eels, Eels, Eels, Eels, Eels, Eels, Eels, Eels, Eels, Eels, Eels, Eels, Eels, Eels, Eels, Eels, Eels, Eels, Eels, Eels, Eels, Eels, Eels, Eels, Eels, Eels, Eels, Eels, Eels, Eels, Eels, Eels, Eels, Eels, Eels, Eels, Eels, Eels, Eels, Eels, Eels, Eels, Eels, Eels, Eels, Eels, Eels, Eels, Eels, Eels, Eels, Tigers, Tigers, Tigers, Tigers, Tigers, Tigers, Tigers, Tigers, Tigers, Tigers, Tigers, Tigers, Tigers, Tigers, Tigers, Tigers, Tigers, Tigers, Tigers, Tigers, Tigers, Tigers, Tigers, Tigers, Tigers, Tigers, Tigers, Tigers, Tigers, Tigers, Tigers, Tigers, Tigers, Tigers, Tigers, Tigers, Tigers, Tigers, Tigers, Tigers, Tigers, Tigers, Tigers, Tigers, Tigers, Tigers, Tigers, Tigers, Tigers, Tigers, Tigers, Tigers, Tigers, Tigers, Tigers, Tigers, Tigers, Tigers, Tigers, Tigers, Tigers, Tigers, Tigers, Tigers, Eels, Eels, Eels, Eels, Eels, Eels, Eels, Eels, Eels, Eels, Eels, Eels, Eels, Eels, Eels, Eels, Eels, Eels, Eels, Eels, Eels, Eels, Eels, Eels, Eels, Eels, Eels, Eels, Eels, Eels, Eels, Eels, Eels, Eels, Eels, Eels, Eels, Eels, Eels, Eels, Eels, Eels, Eels, Eels, Eels, Eels, Eels, Eels, Eels, Eels, Eels, Eels, Eels, Eels, Eels, Eels, Eels, Eels, Eels, Eels, Eels, Eels, Eels, Eels, Tigers, Tigers, Tigers, Tigers, Tigers, Tigers, Tigers, Tigers, Tigers, Tigers, Tigers, Tigers, Tigers, Tigers, Tigers, Tigers, Tigers, Tigers, Tigers, Tigers, Tigers, Tigers, Tigers, Tigers, Tigers, Tigers, Tigers, Tigers, Tigers, Tigers, Tigers, Tigers, Tigers, Tigers, Tigers, Tigers, Tigers, Tigers, Tigers, Tigers, Tigers, Tigers, Tigers, Tigers, Tigers, Tigers, Tigers, Tigers, Tigers, Tigers, Tigers, Tigers, Tigers, Tigers, Tigers, Tigers, Tigers, Tigers, Tigers, Tigers, Tigers, Tigers, Tigers, Tigers
, Bulldogs, Bulldogs, Bulldogs, Bulldogs, Bulldogs, Bulldogs, Bulldogs, Bulldogs, Bulldogs, Bulldogs, Bulldogs, Bulldogs, Bulldogs, Bulldogs, Bulldogs, Bulldogs, Bulldogs, Bulldogs, Bulldogs, Bulldogs, Bulldogs, Bulldogs, Bulldogs, Bulldogs, Bulldogs, Bulldogs, Bulldogs, Bulldogs, Bulldogs, Bulldogs, Bulldogs, Bulldogs, Bulldogs, Bulldogs, Bulldogs, Bulldogs, Bulldogs, Bulldogs, Bulldogs, Bulldogs, Bulldogs, Bulldogs, Bulldogs, Bulldogs, Bulldogs, Bulldogs, Bulldogs, Bulldogs, Bulldogs, Bulldogs, Bulldogs, Bulldogs, Bulldogs, Bulldogs, Bulldogs, Bulldogs, Bulldogs, Bulldogs, Bulldogs, Bulldogs, Bulldogs, Bulldogs, Bulldogs, Bulldogs, Bulldogs, Bulldogs, Bulldogs, Bulldogs, Bulldogs, Bulldogs, Bulldogs, Bulldogs, Bulldogs, Bulldogs, Bulldogs, Bulldogs, Bulldogs, Bulldogs, Bulldogs, Bulldogs, Bulldogs, Bulldogs, Bulldogs, Bulldogs, Bulldogs, Bulldogs, Bulldogs, Bulldogs, Bulldogs, Bulldogs, Bulldogs, Bulldogs, Bulldogs, Bulldogs, Bulldogs, Bulldogs, Bulldogs, Bulldogs, Bulldogs, Bulldogs, Bulldogs, Bulldogs, Bulldogs, Bulldogs, Bulldogs, Bulldogs, Bulldogs, Bulldogs, Bulldogs, Bulldogs, Bulldogs, Bulldogs, Bulldogs, Bulldogs, Bulldogs, Bulldogs, Bulldogs, Bulldogs, Bulldogs, Bulldogs, Bulldogs, Bulldogs, Bulldogs, Bulldogs, Bulldogs, Bulldogs, Bulldogs, Bulldogs, Titans, Titans, Titans, Titans, Titans, Titans, Titans, Titans, Titans, Titans, Titans, Titans, Titans, Titans, Titans, Titans, Titans, Titans, Titans, Titans, Titans, Titans, Titans, Titans, Titans, Titans, Titans, Titans, Titans, Titans, Titans, Titans, Titans, Titans, Titans, Titans, Titans, Titans, Titans, Titans, Titans, Titans, Titans, Titans, Titans, Titans, Titans, Titans, Titans, Titans, Titans, Titans, Titans, Titans, Titans, Titans, Titans, Titans, Titans, Titans, Titans, Titans, Titans, Titans, Titans, Titans, Titans, Titans, Titans, Titans, Titans, Titans, Titans, Titans, Titans, Titans, Titans, Titans, Titans, Titans, Titans, Titans, Titans, Titans, Titans, Titans, Titans, Titans, Titans, Titans, Titans, Titans, Titans, Titans, Titans, Titans, Titans, Titans, Titans, Titans, Titans, Titans, Titans, Titans, Titans, Titans, Titans, Titans, Titans, Titans, Titans, Titans, Titans, Titans, Titans, Titans, Titans, Titans, Titans, Titans, Titans, Titans, Titans, Titans, Titans, Titans, Titans, Titans
Storm, 0.014930944382232175, 0.0266844563042028, 0.008897588753447816, 0.021314008632173496, 0.0, 0.032237266279819474, 0.007040270346381301, 0.0, 0.02069108214359611, 0.018986140117714066, 0.00825150589982672, 0.0, 0.023529411764705882, 0.0, 0.00977803852547179, 0.0, 0.015132026935007944, 0.0, 0.005980503558399617, 0.0053867700926524455, 0.017873100983020553, 0.0326797385620915, 0.0070492034400112796, 0.012956724540036279, 0.010569707219110032, 0.018871485185884128, 0.004223508045782827, 0.015048908954100828, 0.0, 0.0, 0.0, 0.0, 0.0, 0.0, 0.0, 0.0, 0.0, 0.0, 0.014086491055078181, 0.025157232704402514, 0.0, 0.0, 0.0, 0.0, 0.0, 0.0, 0.0, 0.0, 0.015119443604475355, 0.02627430373095113, 0.0, 0.0212021626205873, 0.0716075904045829, 0.0, 0.013999720005599889, 0.0, 0.02077706212341575, 0.0, 0.008291873963515755, 0.014852220406950839, 0.0, 0.0, 0.0, 0.0, 0.0, 0.0, 0.036641221374045796, 0.011052166224580016, 0.0, 0.0, 0.014394702749388226, 0.0, 0.0, 0.0, 0.025584171925635342, 0.04643244079863798, 0.0, 0.0, 0.04114379757251594, 0.0, 0.01538935056940597, 0.055141990625861594, 0.012306934957848749, 0.0, 0.03707823507601038, 0.0, 0.014423770373575654, 0.027314941272876262, 0.021677866897897247, 0.0, 0.02598077422707197, 0.031377470975839344, 0.05094243504839531, 0.0, 0.02037905033625433, 0.0, 0.0, 0.0, 0.012348728081007655, 0.021800741225201654, 0.0, 0.0, 0.0, 0.0, 0.04450378282153983, 0.15723270440251574, 0.0169061707523246, 0.06097560975609756, 0.0, 0.0, 0.0, 0.0, 0.0, 0.05452562704471102, 0.0, 0.044004400440044, 0.0, 0.0, 0.02927400468384075, 0.0, 0.0, 0.0, 0.0, 0.0, 0.0, 0.0, 0.0, 0.0, 0.028555111364934323, 0.05327650506126798, 0.03480278422273782, 0.0, 0.0, 0.0, 0.0, 0.0, 0.0, 0.0, 0.0, 0.0, 0.0, 0.0, 0.03727171077152441, 0.0, 0.02983293556085919, 0.0, 0.035236081747709654, 0.0, 0.0, 0.0, 0.0, 0.0, 0.0, 0.0, 0.0, 0.0, 0.09784735812133072, 0.0, 0.037439161362785474, 0.0, 0.0, 0.0, 0.0, 0.0, 0.0, 0.0, 0.0, 0.0, 0.0, 0.0, 0.030712530712530713, 0.11337868480725624, 0.0, 0.0, 0.0, 0.0, 0.0, 0.0, 0.04521817770743839, 0.0, 0.0, 0.0, 0.0, 0.0, 0.0, 0.0, 0.03189792663476874, 0.0, 0.0, 0.0, 0.07633587786259542, 0.0, 0.0, 0.0, 0.023798191337458353, 0.0, 0.0, 0.0, 0.0, 0.0, 0.0, 0.0, 0.0, 0.0, 0.0, 0.0, 0.0, 0.0, 0.0, 0.10649627263045794, 0.023769907297361538, 0.0, 0.0, 0.0, 0.0, 0.0, 0.0, 0.0, 0.0, 0.0, 0.0, 0.0, 0.0, 0.0, 0.0, 0.0, 0.0, 0.08143322475570033, 0.0, 0.0, 0.0, 0.0, 0.0, 0.3048780487804878, 0.0, 0.0, 0.0, 0.0, 0.0, 0.0, 0.1176470588235294, 0.0, 0.04570383912248629, 0.0, 0.0, 0.0, 0.0, 0.0, 0.0, 0.0, 0.0, 0.0, 0.0, 0.0, 0.0, 0.0
Panthers, 0.044792833146696534, 0.06671114076050699, 0.08601002461666221, 0.10657004316086748, 0.4426345609065156, 0.4190844616376531, 0.35201351731906505, 0.43141733282578354, 0.07241878750258639, 0.0569584203531422, 0.03713177654922023, 0.045300113250283124, 0.6352941176470588, 0.49151027703306527, 0.41067761806981523, 0.4442075337597726, 0.03783006733751986, 0.1762950908597776, 0.0358830213503977, 0.09157509157509157, 0.5361930294906166, 0.29411764705882354, 0.4934442408007895, 0.466442083441306, 0.07398795053377022, 0.11322891111530478, 0.08024665286987372, 0.08276899924755454, 0.396235760277365, 0.611189468735308, 0.35218156916454707, 0.5733739473212686, 0.10326006785661601, 0.15915119363395225, 0.07670974213725143, 0.0635862653666808, 0.2456140350877193, 0.3209242618741977, 0.46485420481757994, 0.4025157232704402, 0.125, 0.11393847322445878, 0.09082652134423251, 0.11901219875037192, 0.4094165813715456, 0.2613240418118467, 0.45757864632983797, 0.43383947939262474, 0.12095554883580284, 0.02627430373095113, 0.07117015598125853, 0.0424043252411746, 0.322234156820623, 0.32552083333333337, 0.37799244015119693, 0.5984907624251886, 0.12466237274049449, 0.07249003262051468, 0.05804311774461028, 0.0742611020347542, 0.40691759918616477, 0.6081668114682884, 0.4747774480712166, 0.4235792446170138, 0.091324200913242, 0.08006405124099279, 0.10381679389312977, 0.08841732979664013, 0.5430847212165097, 0.6635700066357001, 0.5038145962285878, 0.5507474429583006, 0.062124663491406086, 0.03881987577639751, 0.09380863039399624, 0.061909921064850645, 0.5578093306288032, 0.1813236627379873, 0.7405883563052871, 0.5034856700232379, 0.06155740227762388, 0.055141990625861594, 0.10460894714171437, 0.1675790414478829, 0.8898776418242491, 0.5198180636777128, 0.38944180008654267, 0.3824091778202677, 0.08671146759158899, 0.1970831690973591, 0.09526283883259722, 0.10982114841543772, 0.3056546102903719, 0.26455026455026454, 0.550234359078867, 0.3935599284436494, 0.06056935190793458, 0.17421602787456447, 0.09878982464806124, 0.08720296490080662, 0.4166666666666667, 0.6377551020408163, 0.6586483390607102, 0.5065856129685917, 0.08900756564307966, 0.07861635220125787, 0.1014370245139476, 0.09146341463414635, 0.5165289256198348, 0.1851851851851852, 0.4500818330605565, 0.44150110375275936, 0.12311480455524776, 0.3271537622682661, 0.07318858258111735, 0.066006600660066, 0.36845983787767134, 0.40431266846361186, 0.468384074941452, 0.38084874863982593, 0.17101325352714836, 0.234192037470726, 0.11870442597931151, 0.09121313469139557, 1.002004008016032, 0.7352941176470588, 0.4880032533550223, 0.6535947712418301, 0.2855511136493432, 0.05327650506126798, 0.058004640371229696, 0.04146796599626788, 0.6164383561643836, 1.645123384253819, 0.29085140137493387, 0.78125, 0.11695906432748539, 0.07168458781362007, 0.049003593596863765, 0.05788712011577424, 0.6937561942517344, 0.5128205128205128, 0.6708907938874394, 0.4707464694014795, 0.05966587112171838, 0.1034126163391934, 0.07047216349541931, 0.1051967178624027, 0.48143053645116923, 0.48661800486618007, 0.4747277296844457, 0.4547751389590703, 0.12264922322158626, 0.1400560224089636, 0.13099721630915342, 0.028604118993135013, 0.5870841487279843, 0.5385996409335727, 0.3743916136278547, 0.27548209366391185, 0.2229654403567447, 0.0, 0.14061401453011485, 0.08288437629506838, 0.42979942693409745, 0.49261083743842365, 0.5443658138268916, 0.6109979633401221, 0.2288329519450801, 0.0, 0.06142506142506143, 0.05668934240362812, 0.9174311926605505, 1.7793594306049825, 0.6880733944954129, 0.6459948320413437, 0.05595970900951316, 0.10405827263267431, 0.09043635541487678, 0.2004008016032064, 0.2805049088359046, 1.0389610389610389, 0.32733224222585927, 0.6930693069306931, 0.07942811755361398, 0.2976190476190476, 0.22328548644338117, 0.11344299489506524, 0.1937984496124031, 0.3558718861209964, 0.38167938931297707, 0.9873060648801129, 0.057736720554272515, 0.10752688172043011, 0.047596382674916705, 0.08572653236176596, 1.349527665317139, 0.53475935828877, 0.34944670937682004, 0.3264417845484222, 0.08244023083264633, 0.0, 0.13218770654329146, 0.05924170616113744, 0.998003992015968, 0.78125, 0.395882818685669, 0.4172461752433936, 0.23923444976076555, 0.0, 0.09507962918944615, 0.04314063848144953, 0.42796005706134094, 0.24096385542168677, 0.23282887077997672, 0.28680688336520077, 0.0851063829787234, 0.15698587127158556, 0.23801428085685142, 0.18148820326678766, 0.6122448979591837, 0.0, 0.3139717425431711, 0.1392757660167131, 0.12345679012345678, 0.0, 0.0, 0.08143322475570033, 1.4326647564469914, 0.5128205128205128, 0.5694760820045558, 0.6185567010309279, 0.17271157167530224, 0.0, 0.19946808510638298, 0.12239902080783352, 0.3787878787878788, 1.3986013986013985, 0.4464285714285714, 0.0, 0.0, 0.0, 0.09140767824497258, 0.17196904557179707, 0.0, 0.0, 0.6756756756756757, 0.3976143141153081, 0.0, 0.0, 0.0, 0.0, 0.38910505836575876, 0.0, 0.964630225080386, 0.5509641873278237
