, Panthers, Bulldogs, Panthers, Bulldogs, Panthers, Bulldogs, Panthers, Bulldogs, Panthers, Bulldogs, Panthers, Bulldogs, Panthers, Bulldogs, Panthers, Bulldogs, Panthers, Bulldogs, Panthers, Bulldogs, Panthers, Bulldogs, Panthers, Bulldogs, Panthers, Bulldogs, Panthers, Bulldogs, Panthers, Bulldogs, Panthers, Bulldogs, Panthers, Bulldogs, Panthers, Bulldogs, Panthers, Bulldogs, Panthers, Bulldogs, Panthers, Bulldogs, Panthers, Bulldogs, Panthers, Bulldogs, Panthers, Bulldogs, Panthers, Bulldogs, Panthers, Bulldogs, Panthers, Bulldogs, Panthers, Bulldogs, Panthers, Bulldogs, Panthers, Bulldogs, Panthers, Bulldogs, Panthers, Bulldogs, Panthers, Bulldogs, Panthers, Bulldogs, Panthers, Bulldogs, Panthers, Bulldogs, Panthers, Bulldogs, Panthers, Bulldogs, Panthers, Bulldogs, Panthers, Bulldogs, Panthers, Bulldogs, Panthers, Bulldogs, Panthers, Bulldogs, Panthers, Bulldogs, Panthers, Bulldogs, Panthers, Bulldogs, Panthers, Bulldogs, Panthers, Bulldogs, Panthers, Bulldogs, Panthers, Bulldogs, Panthers, Bulldogs, Panthers, Bulldogs, Panthers, Bulldogs, Panthers, Bulldogs, Panthers, Bulldogs, Panthers, Bulldogs, Panthers, Bulldogs, Panthers, Bulldogs, Panthers, Bulldogs, Panthers, Bulldogs, Panthers, Bulldogs, Panthers, Bulldogs, Panthers, Bulldogs, Panthers, Bulldogs, Panthers, Bulldogs, Panthers, Bulldogs, Panthers, Bulldogs, Panthers, Bulldogs, Panthers, Bulldogs, Panthers, Bulldogs, Panthers, Bulldogs, Panthers, Bulldogs, Panthers, Bulldogs, Panthers, Bulldogs, Panthers, Bulldogs, Panthers, Bulldogs, Panthers, Bulldogs, Panthers, Bulldogs, Panthers, Bulldogs, Panthers, Bulldogs, Panthers, Bulldogs, Panthers, Bulldogs, Panthers, Bulldogs, Panthers, Bulldogs, Panthers, Bulldogs, Panthers, Bulldogs, Panthers, Bulldogs, Panthers, Bulldogs, Panthers, Bulldogs, Panthers, Bulldogs, Panthers, Bulldogs, Panthers, Bulldogs, Panthers, Bulldogs, Panthers, Bulldogs, Panthers, Bulldogs, Panthers, Bulldogs, Panthers, Bulldogs, Panthers, Bulldogs, Panthers, Bulldogs, Panthers, Bulldogs, Panthers, Bulldogs, Panthers, Bulldogs, Panthers, Bulldogs, Panthers, Bulldogs, Panthers, Bulldogs, Panthers, Bulldogs, Panthers, Bulldogs, Panthers, Bulldogs, Panthers, Bulldogs, Panthers, Bulldogs, Panthers, Bulldogs, Panthers, Bulldogs, Panthers, Bulldogs, Panthers, Bulldogs, Panthers, Bulldogs, Panthers, Bulldogs, Panthers, Bulldogs, Panthers, Bulldogs, Panthers, Bulldogs, Panthers, Bulldogs, Panthers, Bulldogs, Panthers, Bulldogs, Panthers, Bulldogs, Panthers, Bulldogs, Panthers, Bulldogs, Panthers, Bulldogs, Panthers, Bulldogs, Panthers, Bulldogs
, Manly, Manly, Tigers, Tigers, Manly, Manly, Tigers, Tigers, Manly, Manly, Tigers, Tigers, Manly, Manly, Tigers, Tigers, Manly, Manly, Tigers, Tigers, Manly, Manly, Tigers, Tigers, Manly, Manly, Tigers, Tigers, Manly, Manly, Tigers, Tigers, Manly, Manly, Tigers, Tigers, Manly, Manly, Tigers, Tigers, Manly, Manly, Tigers, Tigers, Manly, Manly, Tigers, Tigers, Manly, Manly, Tigers, Tigers, Manly, Manly, Tigers, Tigers, Manly, Manly, Tigers, Tigers, Manly, Manly, Tigers, Tigers, Manly, Manly, Tigers, Tigers, Manly, Manly, Tigers, Tigers, Manly, Manly, Tigers, Tigers, Manly, Manly, Tigers, Tigers, Manly, Manly, Tigers, Tigers, Manly, Manly, Tigers, Tigers, Manly, Manly, Tigers, Tigers, Manly, Manly, Tigers, Tigers, Manly, Manly, Tigers, Tigers, Manly, Manly, Tigers, Tigers, Manly, Manly, Tigers, Tigers, Manly, Manly, Tigers, Tigers, Manly, Manly, Tigers, Tigers, Manly, Manly, Tigers, Tigers, Manly, Manly, Tigers, Tigers, Manly, Manly, Tigers, Tigers, Manly, Manly, Tigers, Tigers, Manly, Manly, Tigers, Tigers, Manly, Manly, Tigers, Tigers, Manly, Manly, Tigers, Tigers, Manly, Manly, Tigers, Tigers, Manly, Manly, Tigers, Tigers, Manly, Manly, Tigers, Tigers, Manly, Manly, Tigers, Tigers, Manly, Manly, Tigers, Tigers, Manly, Manly, Tigers, Tigers, Manly, Manly, Tigers, Tigers, Manly, Manly, Tigers, Tigers, Manly, Manly, Tigers, Tigers, Manly, Manly, Tigers, Tigers, Manly, Manly, Tigers, Tigers, Manly, Manly, Tigers, Tigers, Manly, Manly, Tigers, Tigers, Manly, Manly, Tigers, Tigers, Manly, Manly, Tigers, Tigers, Manly, Manly, Tigers, Tigers, Manly, Manly, Tigers, Tigers, Manly, Manly, Tigers, Tigers, Manly, Manly, Tigers, Tigers, Manly, Manly, Tigers, Tigers, Manly, Manly, Tigers, Tigers, Manly, Manly, Tigers, Tigers, Manly, Manly, Tigers, Tigers, Manly, Manly, Tigers, Tigers, Manly, Manly, Tigers, Tigers, Manly, Manly, Tigers, Tigers, Manly, Manly, Tigers, Tigers, Manly, Manly, Tigers, Tigers
, Knights, Knights, Knights, Knights, Raiders, Raiders, Raiders, Raiders, Knights, Knights, Knights, Knights, Raiders, Raiders, Raiders, Raiders, Knights, Knights, Knights, Knights, Raiders, Raiders, Raiders, Raiders, Knights, Knights, Knights, Knights, Raiders, Raiders, Raiders, Raiders, Knights, Knights, Knights, Knights, Raiders, Raiders, Raiders, Raiders, Knights, Knights, Knights, Knights, Raiders, Raiders, Raiders, Raiders, Knights, Knights, Knights, Knights, Raiders, Raiders, Raiders, Raiders, Knights, Knights, Knights, Knights, Raiders, Raiders, Raiders, Raiders, Knights, Knights, Knights, Knights, Raiders, Raiders, Raiders, Raiders, Knights, Knights, Knights, Knights, Raiders, Raiders, Raiders, Raiders, Knights, Knights, Knights, Knights, Raiders, Raiders, Raiders, Raiders, Knights, Knights, Knights, Knights, Raiders, Raiders, Raiders, Raiders, Knights, Knights, Knights, Knights, Raiders, Raiders, Raiders, Raiders, Knights, Knights, Knights, Knights, Raiders, Raiders, Raiders, Raiders, Knights, Knights, Knights, Knights, Raiders, Raiders, Raiders, Raiders, Knights, Knights, Knights, Knights, Raiders, Raiders, Raiders, Raiders, Knights, Knights, Knights, Knights, Raiders, Raiders, Raiders, Raiders, Knights, Knights, Knights, Knights, Raiders, Raiders, Raiders, Raiders, Knights, Knights, Knights, Knights, Raiders, Raiders, Raiders, Raiders, Knights, Knights, Knights, Knights, Raiders, Raiders, Raiders, Raiders, Knights, Knights, Knights, Knights, Raiders, Raiders, Raiders, Raiders, Knights, Knights, Knights, Knights, Raiders, Raiders, Raiders, Raiders, Knights, Knights, Knights, Knights, Raiders, Raiders, Raiders, Raiders, Knights, Knights, Knights, Knights, Raiders, Raiders, Raiders, Raiders, Knights, Knights, Knights, Knights, Raiders, Raiders, Raiders, Raiders, Knights, Knights, Knights, Knights, Raiders, Raiders, Raiders, Raiders, Knights, Knights, Knights, Knights, Raiders, Raiders, Raiders, Raiders, Knights, Knights, Knights, Knights, Raiders, Raiders, Raiders, Raiders, Knights, Knights, Knights, Knights, Raiders, Raiders, Raiders, Raiders, Knights, Knights, Knights, Knights, Raiders, Raiders, Raiders, Raiders, Knights, Knights, Knights, Knights, Raiders, Raiders, Raiders, Raiders, Knights, Knights, Knights, Knights, Raiders, Raiders, Raiders, Raiders
, Broncos, Broncos, Broncos, Broncos, Broncos, Broncos, Broncos, Broncos, Warriors, Warriors, Warriors, Warriors, Warriors, Warriors, Warriors, Warriors, Broncos, Broncos, Broncos, Broncos, Broncos, Broncos, Broncos, Broncos, Warriors, Warriors, Warriors, Warriors, Warriors, Warriors, Warriors, Warriors, Broncos, Broncos, Broncos, Broncos, Broncos, Broncos, Broncos, Broncos, Warriors, Warriors, Warriors, Warriors, Warriors, Warriors, Warriors, Warriors, Broncos, Broncos, Broncos, Broncos, Broncos, Broncos, Broncos, Broncos, Warriors, Warriors, Warriors, Warriors, Warriors, Warriors, Warriors, Warriors, Broncos, Broncos, Broncos, Broncos, Broncos, Broncos, Broncos, Broncos, Warriors, Warriors, Warriors, Warriors, Warriors, Warriors, Warriors, Warriors, Broncos, Broncos, Broncos, Broncos, Broncos, Broncos, Broncos, Broncos, Warriors, Warriors, Warriors, Warriors, Warriors, Warriors, Warriors, Warriors, Broncos, Broncos, Broncos, Broncos, Broncos, Broncos, Broncos, Broncos, Warriors, Warriors, Warriors, Warriors, Warriors, Warriors, Warriors, Warriors, Broncos, Broncos, Broncos, Broncos, Broncos, Broncos, Broncos, Broncos, Warriors, Warriors, Warriors, Warriors, Warriors, Warriors, Warriors, Warriors, Broncos, Broncos, Broncos, Broncos, Broncos, Broncos, Broncos, Broncos, Warriors, Warriors, Warriors, Warriors, Warriors, Warriors, Warriors, Warriors, Broncos, Broncos, Broncos, Broncos, Broncos, Broncos, Broncos, Broncos, Warriors, Warriors, Warriors, Warriors, Warriors, Warriors, Warriors, Warriors, Broncos, Broncos, Broncos, Broncos, Broncos, Broncos, Broncos, Broncos, Warriors, Warriors, Warriors, Warriors, Warriors, Warriors, Warriors, Warriors, Broncos, Broncos, Broncos, Broncos, Broncos, Broncos, Broncos, Broncos, Warriors, Warriors, Warriors, Warriors, Warriors, Warriors, Warriors, Warriors, Broncos, Broncos, Broncos, Broncos, Broncos, Broncos, Broncos, Broncos, Warriors, Warriors, Warriors, Warriors, Warriors, Warriors, Warriors, Warriors, Broncos, Broncos, Broncos, Broncos, Broncos, Broncos, Broncos, Broncos, Warriors, Warriors, Warriors, Warriors, Warriors, Warriors, Warriors, Warriors, Broncos, Broncos, Broncos, Broncos, Broncos, Broncos, Broncos, Broncos, Warriors, Warriors, Warriors, Warriors, Warriors, Warriors, Warriors, Warriors, Broncos, Broncos, Broncos, Broncos, Broncos, Broncos, Broncos, Broncos, Warriors, Warriors, Warriors, Warriors, Warriors, Warriors, Warriors, Warriors
, Dragons, Dragons, Dragons, Dragons, Dragons, Dragons, Dragons, Dragons, Dragons, Dragons, Dragons, Dragons, Dragons, Dragons, Dragons, Dragons, Eels, Eels, Eels, Eels, Eels, Eels, Eels, Eels, Eels, Eels, Eels, Eels, Eels, Eels, Eels, Eels, Dragons, Dragons, Dragons, Dragons, Dragons, Dragons, Dragons, Dragons, Dragons, Dragons, Dragons, Dragons, Dragons, Dragons, Dragons, Dragons, Eels, Eels, Eels, Eels, Eels, Eels, Eels, Eels, Eels, Eels, Eels, Eels, Eels, Eels, Eels, Eels, Dragons, Dragons, Dragons, Dragons, Dragons, Dragons, Dragons, Dragons, Dragons, Dragons, Dragons, Dragons, Dragons, Dragons, Dragons, Dragons, Eels, Eels, Eels, Eels, Eels, Eels, Eels, Eels, Eels, Eels, Eels, Eels, Eels, Eels, Eels, Eels, Dragons, Dragons, Dragons, Dragons, Dragons, Dragons, Dragons, Dragons, Dragons, Dragons, Dragons, Dragons, Dragons, Dragons, Dragons, Dragons, Eels, Eels, Eels, Eels, Eels, Eels, Eels, Eels, Eels, Eels, Eels, Eels, Eels, Eels, Eels, Eels, Dragons, Dragons, Dragons, Dragons, Dragons, Dragons, Dragons, Dragons, Dragons, Dragons, Dragons, Dragons, Dragons, Dragons, Dragons, Dragons, Eels, Eels, Eels, Eels, Eels, Eels, Eels, Eels, Eels, Eels, Eels, Eels, Eels, Eels, Eels, Eels, Dragons, Dragons, Dragons, Dragons, Dragons, Dragons, Dragons, Dragons, Dragons, Dragons, Dragons, Dragons, Dragons, Dragons, Dragons, Dragons, Eels, Eels, Eels, Eels, Eels, Eels, Eels, Eels, Eels, Eels, Eels, Eels, Eels, Eels, Eels, Eels, Dragons, Dragons, Dragons, Dragons, Dragons, Dragons, Dragons, Dragons, Dragons, Dragons, Dragons, Dragons, Dragons, Dragons, Dragons, Dragons, Eels, Eels, Eels, Eels, Eels, Eels, Eels, Eels, Eels, Eels, Eels, Eels, Eels, Eels, Eels, Eels, Dragons, Dragons, Dragons, Dragons, Dragons, Dragons, Dragons, Dragons, Dragons, Dragons, Dragons, Dragons, Dragons, Dragons, Dragons, Dragons, Eels, Eels, Eels, Eels, Eels, Eels, Eels, Eels, Eels, Eels, Eels, Eels, Eels, Eels, Eels, Eels
, Dolphins, Dolphins, Dolphins, Dolphins, Dolphins, Dolphins, Dolphins, Dolphins, Dolphins, Dolphins, Dolphins, Dolphins, Dolphins, Dolphins, Dolphins, Dolphins, Dolphins, Dolphins, Dolphins, Dolphins, Dolphins, Dolphins, Dolphins, Dolphins, Dolphins, Dolphins, Dolphins, Dolphins, Dolphins, Dolphins, Dolphins, Dolphins, Rabbitohs, Rabbitohs, Rabbitohs, Rabbitohs, Rabbitohs, Rabbitohs, Rabbitohs, Rabbitohs, Rabbitohs, Rabbitohs, Rabbitohs, Rabbitohs, Rabbitohs, Rabbitohs, Rabbitohs, Rabbitohs, Rabbitohs, Rabbitohs, Rabbitohs, Rabbitohs, Rabbitohs, Rabbitohs, Rabbitohs, Rabbitohs, Rabbitohs, Rabbitohs, Rabbitohs, Rabbitohs, Rabbitohs, Rabbitohs, Rabbitohs, Rabbitohs, Dolphins, Dolphins, Dolphins, Dolphins, Dolphins, Dolphins, Dolphins, Dolphins, Dolphins, Dolphins, Dolphins, Dolphins, Dolphins, Dolphins, Dolphins, Dolphins, Dolphins, Dolphins, Dolphins, Dolphins, Dolphins, Dolphins, Dolphins, Dolphins, Dolphins, Dolphins, Dolphins, Dolphins, Dolphins, Dolphins, Dolphins, Dolphins, Rabbitohs, Rabbitohs, Rabbitohs, Rabbitohs, Rabbitohs, Rabbitohs, Rabbitohs, Rabbitohs, Rabbitohs, Rabbitohs, Rabbitohs, Rabbitohs, Rabbitohs, Rabbitohs, Rabbitohs, Rabbitohs, Rabbitohs, Rabbitohs, Rabbitohs, Rabbitohs, Rabbitohs, Rabbitohs, Rabbitohs, Rabbitohs, Rabbitohs, Rabbitohs, Rabbitohs, Rabbitohs, Rabbitohs, Rabbitohs, Rabbitohs, Rabbitohs, Dolphins, Dolphins, Dolphins, Dolphins, Dolphins, Dolphins, Dolphins, Dolphins, Dolphins, Dolphins, Dolphins, Dolphins, Dolphins, Dolphins, Dolphins, Dolphins, Dolphins, Dolphins, Dolphins, Dolphins, Dolphins, Dolphins, Dolphins, Dolphins, Dolphins, Dolphins, Dolphins, Dolphins, Dolphins, Dolphins, Dolphins, Dolphins, Rabbitohs, Rabbitohs, Rabbitohs, Rabbitohs, Rabbitohs, Rabbitohs, Rabbitohs, Rabbitohs, Rabbitohs, Rabbitohs, Rabbitohs, Rabbitohs, Rabbitohs, Rabbitohs, Rabbitohs, Rabbitohs, Rabbitohs, Rabbitohs, Rabbitohs, Rabbitohs, Rabbitohs, Rabbitohs, Rabbitohs, Rabbitohs, Rabbitohs, Rabbitohs, Rabbitohs, Rabbitohs, Rabbitohs, Rabbitohs, Rabbitohs, Rabbitohs, Dolphins, Dolphins, Dolphins, Dolphins, Dolphins, Dolphins, Dolphins, Dolphins, Dolphins, Dolphins, Dolphins, Dolphins, Dolphins, Dolphins, Dolphins, Dolphins, Dolphins, Dolphins, Dolphins, Dolphins, Dolphins, Dolphins, Dolphins, Dolphins, Dolphins, Dolphins, Dolphins, Dolphins, Dolphins, Dolphins, Dolphins, Dolphins, Rabbitohs, Rabbitohs, Rabbitohs, Rabbitohs, Rabbitohs, Rabbitohs, Rabbitohs, Rabbitohs, Rabbitohs, Rabbitohs, Rabbitohs, Rabbitohs, Rabbitohs, Rabbitohs, Rabbitohs, Rabbitohs, Rabbitohs, Rabbitohs, Rabbitohs, Rabbitohs, Rabbitohs, Rabbitohs, Rabbitohs, Rabbitohs, Rabbitohs, Rabbitohs, Rabbitohs, Rabbitohs, Rabbitohs, Rabbitohs, Rabbitohs, Rabbitohs
, Storm, Storm, Storm, Storm, Storm, Storm, Storm, Storm, Storm, Storm, Storm, Storm, Storm, Storm, Storm, Storm, Storm, Storm, Storm, Storm, Storm, Storm, Storm, Storm, Storm, Storm, Storm, Storm, Storm, Storm, Storm, Storm, Storm, Storm, Storm, Storm, Storm, Storm, Storm, Storm, Storm, Storm, Storm, Storm, Storm, Storm, Storm, Storm, Storm, Storm, Storm, Storm, Storm, Storm, Storm, Storm, Storm, Storm, Storm, Storm, Storm, Storm, Storm, Storm, Sharks, Sharks, Sharks, Sharks, Sharks, Sharks, Sharks, Sharks, Sharks, Sharks, Sharks, Sharks, Sharks, Sharks, Sharks, Sharks, Sharks, Sharks, Sharks, Sharks, Sharks, Sharks, Sharks, Sharks, Sharks, Sharks, Sharks, Sharks, Sharks, Sharks, Sharks, Sharks, Sharks, Sharks, Sharks, Sharks, Sharks, Sharks, Sharks, Sharks, Sharks, Sharks, Sharks, Sharks, Sharks, Sharks, Sharks, Sharks, Sharks, Sharks, Sharks, Sharks, Sharks, Sharks, Sharks, Sharks, Sharks, Sharks, Sharks, Sharks, Sharks, Sharks, Sharks, Sharks, Storm, Storm, Storm, Storm, Storm, Storm, Storm, Storm, Storm, Storm, Storm, Storm, Storm, Storm, Storm, Storm, Storm, Storm, Storm, Storm, Storm, Storm, Storm, Storm, Storm, Storm, Storm, Storm, Storm, Storm, Storm, Storm, Storm, Storm, Storm, Storm, Storm, Storm, Storm, Storm, Storm, Storm, Storm, Storm, Storm, Storm, Storm, Storm, Storm, Storm, Storm, Storm, Storm, Storm, Storm, Storm, Storm, Storm, Storm, Storm, Storm, Storm, Storm, Storm, Sharks, Sharks, Sharks, Sharks, Sharks, Sharks, Sharks, Sharks, Sharks, Sharks, Sharks, Sharks, Sharks, Sharks, Sharks, Sharks, Sharks, Sharks, Sharks, Sharks, Sharks, Sharks, Sharks, Sharks, Sharks, Sharks, Sharks, Sharks, Sharks, Sharks, Sharks, Sharks, Sharks, Sharks, Sharks, Sharks, Sharks, Sharks, Sharks, Sharks, Sharks, Sharks, Sharks, Sharks, Sharks, Sharks, Sharks, Sharks, Sharks, Sharks, Sharks, Sharks, Sharks, Sharks, Sharks, Sharks, Sharks, Sharks, Sharks, Sharks, Sharks, Sharks, Sharks, Sharks
, Titans, Titans, Titans, Titans, Titans, Titans, Titans, Titans, Titans, Titans, Titans, Titans, Titans, Titans, Titans, Titans, Titans, Titans, Titans, Titans, Titans, Titans, Titans, Titans, Titans, Titans, Titans, Titans, Titans, Titans, Titans, Titans, Titans, Titans, Titans, Titans, Titans, Titans, Titans, Titans, Titans, Titans, Titans, Titans, Titans, Titans, Titans, Titans, Titans, Titans, Titans, Titans, Titans, Titans, Titans, Titans, Titans, Titans, Titans, Titans, Titans, Titans, Titans, Titans, Titans, Titans, Titans, Titans, Titans, Titans, Titans, Titans, Titans, Titans, Titans, Titans, Titans, Titans, Titans, Titans, Titans, Titans, Titans, Titans, Titans, Titans, Titans, Titans, Titans, Titans, Titans, Titans, Titans, Titans, Titans, Titans, Titans, Titans, Titans, Titans, Titans, Titans, Titans, Titans, Titans, Titans, Titans, Titans, Titans, Titans, Titans, Titans, Titans, Titans, Titans, Titans, Titans, Titans, Titans, Titans, Titans, Titans, Titans, Titans, Titans, Titans, Titans, Titans, Cowboys, Cowboys, Cowboys, Cowboys, Cowboys, Cowboys, Cowboys, Cowboys, Cowboys, Cowboys, Cowboys, Cowboys, Cowboys, Cowboys, Cowboys, Cowboys, Cowboys, Cowboys, Cowboys, Cowboys, Cowboys, Cowboys, Cowboys, Cowboys, Cowboys, Cowboys, Cowboys, Cowboys, Cowboys, Cowboys, Cowboys, Cowboys, Cowboys, Cowboys, Cowboys, Cowboys, Cowboys, Cowboys, Cowboys, Cowboys, Cowboys, Cowboys, Cowboys, Cowboys, Cowboys, Cowboys, Cowboys, Cowboys, Cowboys, Cowboys, Cowboys, Cowboys, Cowboys, Cowboys, Cowboys, Cowboys, Cowboys, Cowboys, Cowboys, Cowboys, Cowboys, Cowboys, Cowboys, Cowboys, Cowboys, Cowboys, Cowboys, Cowboys, Cowboys, Cowboys, Cowboys, Cowboys, Cowboys, Cowboys, Cowboys, Cowboys, Cowboys, Cowboys, Cowboys, Cowboys, Cowboys, Cowboys, Cowboys, Cowboys, Cowboys, Cowboys, Cowboys, Cowboys, Cowboys, Cowboys, Cowboys, Cowboys, Cowboys, Cowboys, Cowboys, Cowboys, Cowboys, Cowboys, Cowboys, Cowboys, Cowboys, Cowboys, Cowboys, Cowboys, Cowboys, Cowboys, Cowboys, Cowboys, Cowboys, Cowboys, Cowboys, Cowboys, Cowboys, Cowboys, Cowboys, Cowboys, Cowboys, Cowboys, Cowboys, Cowboys, Cowboys, Cowboys, Cowboys, Cowboys, Cowboys, Cowboys, Cowboys, Cowboys
Storm, 39.71664698937426, 25.35404294198264, 38.71670296532083, 26.08412836079792, 25.67499095186392, 17.842974444136914, 25.903013370584716, 18.04797563142531, 35.80295957890555, 22.94344473007712, 36.58264865617602, 24.761061946902654, 24.175890279114533, 16.367295222478944, 24.652547981469226, 18.329853862212943, 36.394225550852056, 24.00497512437811, 37.547892720306514, 23.586130168737252, 24.075510731833464, 16.201946873453227, 24.178192922579488, 16.80528654437735, 34.04566210045662, 22.950249333178707, 34.887236991306544, 22.941822173435785, 22.534162811719042, 16.217870257037944, 23.500484315624767, 16.089749736312207, 38.464324520101414, 25.608011444921313, 40.169660678642714, 24.150943396226417, 24.8980467911569, 17.437722419928825, 25.91391509433962, 18.993993993993993, 34.98222748815166, 24.171164225134927, 34.78437754271766, 25.598722724853644, 23.533671252715425, 15.61304836895388, 23.495486459378135, 16.94267515923567, 35.183968462549274, 23.5936188077246, 37.26027397260274, 25.688589094997187, 23.3531784136739, 15.00739280433711, 23.510292524377032, 16.091183372443847, 32.75954814416353, 20.357634112792297, 33.49624060150376, 22.074346030289124, 21.679098555784794, 15.00612494895876, 21.05612019443217, 16.27906976744186, 16.90929451287794, 8.697764820213798, 18.536324786324787, 8.963210702341136, 8.74166091557396, 4.481955762514551, 9.073724007561438, 4.1062801932367154, 13.294982422499203, 6.955810147299508, 13.500649069666812, 8.239277652370202, 7.469194312796208, 4.902912621359223, 7.476882430647292, 4.840302930523543, 14.275790204932267, 9.041835357624832, 14.66992665036675, 8.215818516247701, 7.538712306438468, 5.242668050869452, 7.676409802184825, 5.025125628140704, 12.719050310910118, 7.485673352435531, 13.67281475541299, 6.4418721690991445, 6.581925822740728, 3.9718129404228057, 7.068506414911643, 5.098634294385432, 17.740112994350284, 11.16005873715125, 17.24137931034483, 9.876543209876543, 7.031778228532792, 5.798394290811775, 7.721639656816015, 4.374240583232078, 12.406015037593985, 7.255139056831923, 13.797634691195796, 5.704697986577181, 7.209847596717468, 5.734767025089606, 8.54119425547997, 5.130687318489835, 13.24110671936759, 9.0, 15.905743740795286, 9.306569343065693, 7.667934093789606, 4.8374306106264875, 7.672634271099745, 3.619909502262444, 11.900532859680284, 6.594594594594596, 12.978986402966624, 7.714701601164483, 6.803401700850426, 3.377110694183865, 6.889050036258158, 4.1852181656277825, 38.51863306015154, 24.818077364994252, 39.54087105771294, 25.239107332624865, 25.242980561555072, 17.857966336177082, 25.32435129740519, 17.042366107114308, 34.58286002776726, 23.81027171352285, 36.7816091954023, 24.64614693327342, 23.719351188230856, 16.83774366701196, 23.2809127351218, 17.231638418079097, 36.86126466226237, 24.28054454592452, 37.34602463605823, 25.07695950745915, 23.414594638373696, 16.059351973352175, 23.43120322394934, 15.919828203292772, 33.21987746766508, 22.253801335796506, 33.45506510003175, 23.017292784734643, 22.4450811843362, 15.364294844482318, 22.389472687683423, 16.274089935760173, 37.02517162471396, 25.145518044237487, 35.82089552238806, 26.176713459950452, 25.141930251419303, 17.16546267629859, 23.84937238493724, 16.221374045801525, 33.996316758747696, 22.52747252747253, 34.25827107790822, 23.714652956298202, 21.79842810910772, 15.624123422159888, 23.676965432854082, 15.92079207920792, 35.88893493576461, 23.964053919121316, 36.14525139664804, 23.32597498160412, 22.756410256410255, 14.820544554455445, 22.722585080783773, 15.92384249242752, 30.865449628127113, 21.205821205821206, 32.936129647283124, 21.920289855072465, 20.870602265951103, 15.095785440613026, 22.49786142001711, 16.167448574521835, 16.42156862745098, 8.957952468007313, 16.434724983432737, 7.927927927927928, 8.24891461649783, 4.617657923900998, 9.459992116673236, 5.197401299350324, 13.568847852268165, 7.270029673590504, 12.82194848824188, 7.55813953488372, 7.4994029137807505, 4.440333024976873, 7.620006713662303, 4.543506215173596, 14.447839371453513, 8.477321814254859, 14.924471299093655, 8.489857250187828, 7.584935475375295, 4.582484725050916, 7.6479076479076475, 4.593639575971731, 11.812990720913632, 6.210335448776065, 12.409513960703206, 6.164828033744322, 6.270130985613055, 3.9150813344361732, 6.6547299313637716, 4.490566037735849, 14.792899408284024, 10.069444444444445, 16.99604743083004, 10.582010582010582, 8.27250608272506, 4.535637149028078, 8.303249097472925, 4.071661237785016, 9.759036144578314, 6.0278207109737245, 11.732851985559567, 7.905982905982905, 6.20384047267356, 4.185623293903549, 6.289308176100629, 4.955527318932655, 14.834437086092716, 6.4784053156146175, 15.641476274165203, 5.286343612334802, 6.7887109077040435, 3.6259541984732824, 7.18954248366013, 4.1005291005291005, 12.022471910112358, 6.03932584269663, 11.747430249632892, 6.60377358490566, 6.404565630944832, 3.6124794745484397, 6.525573192239858, 3.552206673842842
