, Cowboys, Manly, Cowboys, Manly, Cowboys, Manly, Cowboys, Manly, Cowboys, Manly, Cowboys, Manly, Cowboys, Manly, Cowboys, Manly, Cowboys, Manly, Cowboys, Manly, Cowboys, Manly, Cowboys, Manly, Cowboys, Manly, Cowboys, Manly, Cowboys, Manly, Cowboys, Manly, Cowboys, Manly, Cowboys, Manly, Cowboys, Manly, Cowboys, Manly, Cowboys, Manly, Cowboys, Manly, Cowboys, Manly, Cowboys, Manly, Cowboys, Manly, Cowboys, Manly, Cowboys, Manly, Cowboys, Manly, Cowboys, Manly, Cowboys, Manly, Cowboys, Manly, Cowboys, Manly, Cowboys, Manly, Cowboys, Manly, Cowboys, Manly, Cowboys, Manly, Cowboys, Manly, Cowboys, Manly, Cowboys, Manly, Cowboys, Manly, Cowboys, Manly, Cowboys, Manly, Cowboys, Manly, Cowboys, Manly, Cowboys, Manly, Cowboys, Manly, Cowboys, Manly, Cowboys, Manly, Cowboys, Manly, Cowboys, Manly, Cowboys, Manly, Cowboys, Manly, Cowboys, Manly, Cowboys, Manly, Cowboys, Manly, Cowboys, Manly, Cowboys, Manly, Cowboys, Manly, Cowboys, Manly, Cowboys, Manly, Cowboys, Manly, Cowboys, Manly, Cowboys, Manly, Cowboys, Manly, Cowboys, Manly, Cowboys, Manly, Cowboys, Manly, Cowboys, Manly, Cowboys, Manly, Cowboys, Manly, Cowboys, Manly, Cowboys, Manly, Cowboys, Manly, Cowboys, Manly, Cowboys, Manly, Cowboys, Manly, Cowboys, Manly, Cowboys, Manly, Cowboys, Manly, Cowboys, Manly, Cowboys, Manly, Cowboys, Manly, Cowboys, Manly, Cowboys, Manly, Cowboys, Manly, Cowboys, Manly, Cowboys, Manly, Cowboys, Manly, Cowboys, Manly, Cowboys, Manly, Cowboys, Manly, Cowboys, Manly, Cowboys, Manly, Cowboys, Manly, Cowboys, Manly, Cowboys, Manly, Cowboys, Manly, Cowboys, Manly, Cowboys, Manly, Cowboys, Manly, Cowboys, Manly, Cowboys, Manly, Cowboys, Manly, Cowboys, Manly, Cowboys, Manly, Cowboys, Manly, Cowboys, Manly, Cowboys, Manly, Cowboys, Manly, Cowboys, Manly, Cowboys, Manly, Cowboys, Manly, Cowboys, Manly, Cowboys, Manly, Cowboys, Manly, Cowboys, Manly, Cowboys, Manly, Cowboys, Manly, Cowboys, Manly, Cowboys, Manly, Cowboys, Manly, Cowboys, Manly, Cowboys, Manly, Cowboys, Manly, Cowboys, Manly, Cowboys, Manly, Cowboys, Manly, Cowboys, Manly
, Raiders, Raiders, Storm, Storm, Raiders, Raiders, Storm, Storm, Raiders, Raiders, Storm, Storm, Raiders, Raiders, Storm, Storm, Raiders, Raiders, Storm, Storm, Raiders, Raiders, Storm, Storm, Raiders, Raiders, Storm, Storm, Raiders, Raiders, Storm, Storm, Raiders, Raiders, Storm, Storm, Raiders, Raiders, Storm, Storm, Raiders, Raiders, Storm, Storm, Raiders, Raiders, Storm, Storm, Raiders, Raiders, Storm, Storm, Raiders, Raiders, Storm, Storm, Raiders, Raiders, Storm, Storm, Raiders, Raiders, Storm, Storm, Raiders, Raiders, Storm, Storm, Raiders, Raiders, Storm, Storm, Raiders, Raiders, Storm, Storm, Raiders, Raiders, Storm, Storm, Raiders, Raiders, Storm, Storm, Raiders, Raiders, Storm, Storm, Raiders, Raiders, Storm, Storm, Raiders, Raiders, Storm, Storm, Raiders, Raiders, Storm, Storm, Raiders, Raiders, Storm, Storm, Raiders, Raiders, Storm, Storm, Raiders, Raiders, Storm, Storm, Raiders, Raiders, Storm, Storm, Raiders, Raiders, Storm, Storm, Raiders, Raiders, Storm, Storm, Raiders, Raiders, Storm, Storm, Raiders, Raiders, Storm, Storm, Raiders, Raiders, Storm, Storm, Raiders, Raiders, Storm, Storm, Raiders, Raiders, Storm, Storm, Raiders, Raiders, Storm, Storm, Raiders, Raiders, Storm, Storm, Raiders, Raiders, Storm, Storm, Raiders, Raiders, Storm, Storm, Raiders, Raiders, Storm, Storm, Raiders, Raiders, Storm, Storm, Raiders, Raiders, Storm, Storm, Raiders, Raiders, Storm, Storm, Raiders, Raiders, Storm, Storm, Raiders, Raiders, Storm, Storm, Raiders, Raiders, Storm, Storm, Raiders, Raiders, Storm, Storm, Raiders, Raiders, Storm, Storm, Raiders, Raiders, Storm, Storm, Raiders, Raiders, Storm, Storm, Raiders, Raiders, Storm, Storm, Raiders, Raiders, Storm, Storm, Raiders, Raiders, Storm, Storm, Raiders, Raiders, Storm, Storm, Raiders, Raiders, Storm, Storm, Raiders, Raiders, Storm, Storm, Raiders, Raiders, Storm, Storm, Raiders, Raiders, Storm, Storm, Raiders, Raiders, Storm, Storm, Raiders, Raiders, Storm, Storm, Raiders, Raiders, Storm, Storm, Raiders, Raiders, Storm, Storm, Raiders, Raiders, Storm, Storm
, Dolphins, Dolphins, Dolphins, Dolphins, Panthers, Panthers, Panthers, Panthers, Dolphins, Dolphins, Dolphins, Dolphins, Panthers, Panthers, Panthers, Panthers, Dolphins, Dolphins, Dolphins, Dolphins, Panthers, Panthers, Panthers, Panthers, Dolphins, Dolphins, Dolphins, Dolphins, Panthers, Panthers, Panthers, Panthers, Dolphins, Dolphins, Dolphins, Dolphins, Panthers, Panthers, Panthers, Panthers, Dolphins, Dolphins, Dolphins, Dolphins, Panthers, Panthers, Panthers, Panthers, Dolphins, Dolphins, Dolphins, Dolphins, Panthers, Panthers, Panthers, Panthers, Dolphins, Dolphins, Dolphins, Dolphins, Panthers, Panthers, Panthers, Panthers, Dolphins, Dolphins, Dolphins, Dolphins, Panthers, Panthers, Panthers, Panthers, Dolphins, Dolphins, Dolphins, Dolphins, Panthers, Panthers, Panthers, Panthers, Dolphins, Dolphins, Dolphins, Dolphins, Panthers, Panthers, Panthers, Panthers, Dolphins, Dolphins, Dolphins, Dolphins, Panthers, Panthers, Panthers, Panthers, Dolphins, Dolphins, Dolphins, Dolphins, Panthers, Panthers, Panthers, Panthers, Dolphins, Dolphins, Dolphins, Dolphins, Panthers, Panthers, Panthers, Panthers, Dolphins, Dolphins, Dolphins, Dolphins, Panthers, Panthers, Panthers, Panthers, Dolphins, Dolphins, Dolphins, Dolphins, Panthers, Panthers, Panthers, Panthers, Dolphins, Dolphins, Dolphins, Dolphins, Panthers, Panthers, Panthers, Panthers, Dolphins, Dolphins, Dolphins, Dolphins, Panthers, Panthers, Panthers, Panthers, Dolphins, Dolphins, Dolphins, Dolphins, Panthers, Panthers, Panthers, Panthers, Dolphins, Dolphins, Dolphins, Dolphins, Panthers, Panthers, Panthers, Panthers, Dolphins, Dolphins, Dolphins, Dolphins, Panthers, Panthers, Panthers, Panthers, Dolphins, Dolphins, Dolphins, Dolphins, Panthers, Panthers, Panthers, Panthers, Dolphins, Dolphins, Dolphins, Dolphins, Panthers, Panthers, Panthers, Panthers, Dolphins, Dolphins, Dolphins, Dolphins, Panthers, Panthers, Panthers, Panthers, Dolphins, Dolphins, Dolphins, Dolphins, Panthers, Panthers, Panthers, Panthers, Dolphins, Dolphins, Dolphins, Dolphins, Panthers, Panthers, Panthers, Panthers, Dolphins, Dolphins, Dolphins, Dolphins, Panthers, Panthers, Panthers, Panthers, Dolphins, Dolphins, Dolphins, Dolphins, Panthers, Panthers, Panthers, Panthers, Dolphins, Dolphins, Dolphins, Dolphins, Panthers, Panthers, Panthers, Panthers, Dolphins, Dolphins, Dolphins, Dolphins, Panthers, Panthers, Panthers, Panthers, Dolphins, Dolphins, Dolphins, Dolphins, Panthers, Panthers, Panthers, Panthers, Dolphins, Dolphins, Dolphins, Dolphins, Panthers, Panthers, Panthers, Panthers
, Warriors, Warriors, Warriors, Warriors, Warriors, Warriors, Warriors, Warriors, Titans, Titans, Titans, Titans, Titans, Titans, Titans, Titans, Warriors, Warriors, Warriors, Warriors, Warriors, Warriors, Warriors, Warriors, Titans, Titans, Titans, Titans, Titans, Titans, Titans, Titans, Warriors, Warriors, Warriors, Warriors, Warriors, Warriors, Warriors, Warriors, Titans, Titans, Titans, Titans, Titans, Titans, Titans, Titans, Warriors, Warriors, Warriors, Warriors, Warriors, Warriors, Warriors, Warriors, Titans, Titans, Titans, Titans, Titans, Titans, Titans, Titans, Warriors, Warriors, Warriors, Warriors, Warriors, Warriors, Warriors, Warriors, Titans, Titans, Titans, Titans, Titans, Titans, Titans, Titans, Warriors, Warriors, Warriors, Warriors, Warriors, Warriors, Warriors, Warriors, Titans, Titans, Titans, Titans, Titans, Titans, Titans, Titans, Warriors, Warriors, Warriors, Warriors, Warriors, Warriors, Warriors, Warriors, Titans, Titans, Titans, Titans, Titans, Titans, Titans, Titans, Warriors, Warriors, Warriors, Warriors, Warriors, Warriors, Warriors, Warriors, Titans, Titans, Titans, Titans, Titans, Titans, Titans, Titans, Warriors, Warriors, Warriors, Warriors, Warriors, Warriors, Warriors, Warriors, Titans, Titans, Titans, Titans, Titans, Titans, Titans, Titans, Warriors, Warriors, Warriors, Warriors, Warriors, Warriors, Warriors, Warriors, Titans, Titans, Titans, Titans, Titans, Titans, Titans, Titans, Warriors, Warriors, Warriors, Warriors, Warriors, Warriors, Warriors, Warriors, Titans, Titans, Titans, Titans, Titans, Titans, Titans, Titans, Warriors, Warriors, Warriors, Warriors, Warriors, Warriors, Warriors, Warriors, Titans, Titans, Titans, Titans, Titans, Titans, Titans, Titans, Warriors, Warriors, Warriors, Warriors, Warriors, Warriors, Warriors, Warriors, Titans, Titans, Titans, Titans, Titans, Titans, Titans, Titans, Warriors, Warriors, Warriors, Warriors, Warriors, Warriors, Warriors, Warriors, Titans, Titans, Titans, Titans, Titans, Titans, Titans, Titans, Warriors, Warriors, Warriors, Warriors, Warriors, Warriors, Warriors, Warriors, Titans, Titans, Titans, Titans, Titans, Titans, Titans, Titans, Warriors, Warriors, Warriors, Warriors, Warriors, Warriors, Warriors, Warriors, Titans, Titans, Titans, Titans, Titans, Titans, Titans, Titans
, Rabbitohs, Rabbitohs, Rabbitohs, Rabbitohs, Rabbitohs, Rabbitohs, Rabbitohs, Rabbitohs, Rabbitohs, Rabbitohs, Rabbitohs, Rabbitohs, Rabbitohs, Rabbitohs, Rabbitohs, Rabbitohs, Dragons, Dragons, Dragons, Dragons, Dragons, Dragons, Dragons, Dragons, Dragons, Dragons, Dragons, Dragons, Dragons, Dragons, Dragons, Dragons, Rabbitohs, Rabbitohs, Rabbitohs, Rabbitohs, Rabbitohs, Rabbitohs, Rabbitohs, Rabbitohs, Rabbitohs, Rabbitohs, Rabbitohs, Rabbitohs, Rabbitohs, Rabbitohs, Rabbitohs, Rabbitohs, Dragons, Dragons, Dragons, Dragons, Dragons, Dragons, Dragons, Dragons, Dragons, Dragons, Dragons, Dragons, Dragons, Dragons, Dragons, Dragons, Rabbitohs, Rabbitohs, Rabbitohs, Rabbitohs, Rabbitohs, Rabbitohs, Rabbitohs, Rabbitohs, Rabbitohs, Rabbitohs, Rabbitohs, Rabbitohs, Rabbitohs, Rabbitohs, Rabbitohs, Rabbitohs, Dragons, Dragons, Dragons, Dragons, Dragons, Dragons, Dragons, Dragons, Dragons, Dragons, Dragons, Dragons, Dragons, Dragons, Dragons, Dragons, Rabbitohs, Rabbitohs, Rabbitohs, Rabbitohs, Rabbitohs, Rabbitohs, Rabbitohs, Rabbitohs, Rabbitohs, Rabbitohs, Rabbitohs, Rabbitohs, Rabbitohs, Rabbitohs, Rabbitohs, Rabbitohs, Dragons, Dragons, Dragons, Dragons, Dragons, Dragons, Dragons, Dragons, Dragons, Dragons, Dragons, Dragons, Dragons, Dragons, Dragons, Dragons, Rabbitohs, Rabbitohs, Rabbitohs, Rabbitohs, Rabbitohs, Rabbitohs, Rabbitohs, Rabbitohs, Rabbitohs, Rabbitohs, Rabbitohs, Rabbitohs, Rabbitohs, Rabbitohs, Rabbitohs, Rabbitohs, Dragons, Dragons, Dragons, Dragons, Dragons, Dragons, Dragons, Dragons, Dragons, Dragons, Dragons, Dragons, Dragons, Dragons, Dragons, Dragons, Rabbitohs, Rabbitohs, Rabbitohs, Rabbitohs, Rabbitohs, Rabbitohs, Rabbitohs, Rabbitohs, Rabbitohs, Rabbitohs, Rabbitohs, Rabbitohs, Rabbitohs, Rabbitohs, Rabbitohs, Rabbitohs, Dragons, Dragons, Dragons, Dragons, Dragons, Dragons, Dragons, Dragons, Dragons, Dragons, Dragons, Dragons, Dragons, Dragons, Dragons, Dragons, Rabbitohs, Rabbitohs, Rabbitohs, Rabbitohs, Rabbitohs, Rabbitohs, Rabbitohs, Rabbitohs, Rabbitohs, Rabbitohs, Rabbitohs, Rabbitohs, Rabbitohs, Rabbitohs, Rabbitohs, Rabbitohs, Dragons, Dragons, Dragons, Dragons, Dragons, Dragons, Dragons, Dragons, Dragons, Dragons, Dragons, Dragons, Dragons, Dragons, Dragons, Dragons, Rabbitohs, Rabbitohs, Rabbitohs, Rabbitohs, Rabbitohs, Rabbitohs, Rabbitohs, Rabbitohs, Rabbitohs, Rabbitohs, Rabbitohs, Rabbitohs, Rabbitohs, Rabbitohs, Rabbitohs, Rabbitohs, Dragons, Dragons, Dragons, Dragons, Dragons, Dragons, Dragons, Dragons, Dragons, Dragons, Dragons, Dragons, Dragons, Dragons, Dragons, Dragons
, Tigers, Tigers, Tigers, Tigers, Tigers, Tigers, Tigers, Tigers, Tigers, Tigers, Tigers, Tigers, Tigers, Tigers, Tigers, Tigers, Tigers, Tigers, Tigers, Tigers, Tigers, Tigers, Tigers, Tigers, Tigers, Tigers, Tigers, Tigers, Tigers, Tigers, Tigers, Tigers, Broncos, Broncos, Broncos, Broncos, Broncos, Broncos, Broncos, Broncos, Broncos, Broncos, Broncos, Broncos, Broncos, Broncos, Broncos, Broncos, Broncos, Broncos, Broncos, Broncos, Broncos, Broncos, Broncos, Broncos, Broncos, Broncos, Broncos, Broncos, Broncos, Broncos, Broncos, Broncos, Tigers, Tigers, Tigers, Tigers, Tigers, Tigers, Tigers, Tigers, Tigers, Tigers, Tigers, Tigers, Tigers, Tigers, Tigers, Tigers, Tigers, Tigers, Tigers, Tigers, Tigers, Tigers, Tigers, Tigers, Tigers, Tigers, Tigers, Tigers, Tigers, Tigers, Tigers, Tigers, Broncos, Broncos, Broncos, Broncos, Broncos, Broncos, Broncos, Broncos, Broncos, Broncos, Broncos, Broncos, Broncos, Broncos, Broncos, Broncos, Broncos, Broncos, Broncos, Broncos, Broncos, Broncos, Broncos, Broncos, Broncos, Broncos, Broncos, Broncos, Broncos, Broncos, Broncos, Broncos, Tigers, Tigers, Tigers, Tigers, Tigers, Tigers, Tigers, Tigers, Tigers, Tigers, Tigers, Tigers, Tigers, Tigers, Tigers, Tigers, Tigers, Tigers, Tigers, Tigers, Tigers, Tigers, Tigers, Tigers, Tigers, Tigers, Tigers, Tigers, Tigers, Tigers, Tigers, Tigers, Broncos, Broncos, Broncos, Broncos, Broncos, Broncos, Broncos, Broncos, Broncos, Broncos, Broncos, Broncos, Broncos, Broncos, Broncos, Broncos, Broncos, Broncos, Broncos, Broncos, Broncos, Broncos, Broncos, Broncos, Broncos, Broncos, Broncos, Broncos, Broncos, Broncos, Broncos, Broncos, Tigers, Tigers, Tigers, Tigers, Tigers, Tigers, Tigers, Tigers, Tigers, Tigers, Tigers, Tigers, Tigers, Tigers, Tigers, Tigers, Tigers, Tigers, Tigers, Tigers, Tigers, Tigers, Tigers, Tigers, Tigers, Tigers, Tigers, Tigers, Tigers, Tigers, Tigers, Tigers, Broncos, Broncos, Broncos, Broncos, Broncos, Broncos, Broncos, Broncos, Broncos, Broncos, Broncos, Broncos, Broncos, Broncos, Broncos, Broncos, Broncos, Broncos, Broncos, Broncos, Broncos, Broncos, Broncos, Broncos, Broncos, Broncos, Broncos, Broncos, Broncos, Broncos, Broncos, Broncos
, Roosters, Roosters, Roosters, Roosters, Roosters, Roosters, Roosters, Roosters, Roosters, Roosters, Roosters, Roosters, Roosters, Roosters, Roosters, Roosters, Roosters, Roosters, Roosters, Roosters, Roosters, Roosters, Roosters, Roosters, Roosters, Roosters, Roosters, Roosters, Roosters, Roosters, Roosters, Roosters, Roosters, Roosters, Roosters, Roosters, Roosters, Roosters, Roosters, Roosters, Roosters, Roosters, Roosters, Roosters, Roosters, Roosters, Roosters, Roosters, Roosters, Roosters, Roosters, Roosters, Roosters, Roosters, Roosters, Roosters, Roosters, Roosters, Roosters, Roosters, Roosters, Roosters, Roosters, Roosters, Knights, Knights, Knights, Knights, Knights, Knights, Knights, Knights, Knights, Knights, Knights, Knights, Knights, Knights, Knights, Knights, Knights, Knights, Knights, Knights, Knights, Knights, Knights, Knights, Knights, Knights, Knights, Knights, Knights, Knights, Knights, Knights, Knights, Knights, Knights, Knights, Knights, Knights, Knights, Knights, Knights, Knights, Knights, Knights, Knights, Knights, Knights, Knights, Knights, Knights, Knights, Knights, Knights, Knights, Knights, Knights, Knights, Knights, Knights, Knights, Knights, Knights, Knights, Knights, Roosters, Roosters, Roosters, Roosters, Roosters, Roosters, Roosters, Roosters, Roosters, Roosters, Roosters, Roosters, Roosters, Roosters, Roosters, Roosters, Roosters, Roosters, Roosters, Roosters, Roosters, Roosters, Roosters, Roosters, Roosters, Roosters, Roosters, Roosters, Roosters, Roosters, Roosters, Roosters, Roosters, Roosters, Roosters, Roosters, Roosters, Roosters, Roosters, Roosters, Roosters, Roosters, Roosters, Roosters, Roosters, Roosters, Roosters, Roosters, Roosters, Roosters, Roosters, Roosters, Roosters, Roosters, Roosters, Roosters, Roosters, Roosters, Roosters, Roosters, Roosters, Roosters, Roosters, Roosters, Knights, Knights, Knights, Knights, Knights, Knights, Knights, Knights, Knights, Knights, Knights, Knights, Knights, Knights, Knights, Knights, Knights, Knights, Knights, Knights, Knights, Knights, Knights, Knights, Knights, Knights, Knights, Knights, Knights, Knights, Knights, Knights, Knights, Knights, Knights, Knights, Knights, Knights, Knights, Knights, Knights, Knights, Knights, Knights, Knights, Knights, Knights, Knights, Knights, Knights, Knights, Knights, Knights, Knights, Knights, Knights, Knights, Knights, Knights, Knights, Knights, Knights, Knights, Knights
, Eels, Eels, Eels, Eels, Eels, Eels, Eels, Eels, Eels, Eels, Eels, Eels, Eels, Eels, Eels, Eels, Eels, Eels, Eels, Eels, Eels, Eels, Eels, Eels, Eels, Eels, Eels, Eels, Eels, Eels, Eels, Eels, Eels, Eels, Eels, Eels, Eels, Eels, Eels, Eels, Eels, Eels, Eels, Eels, Eels, Eels, Eels, Eels, Eels, Eels, Eels, Eels, Eels, Eels, Eels, Eels, Eels, Eels, Eels, Eels, Eels, Eels, Eels, Eels, Eels, Eels, Eels, Eels, Eels, Eels, Eels, Eels, Eels, Eels, Eels, Eels, Eels, Eels, Eels, Eels, Eels, Eels, Eels, Eels, Eels, Eels, Eels, Eels, Eels, Eels, Eels, Eels, Eels, Eels, Eels, Eels, Eels, Eels, Eels, Eels, Eels, Eels, Eels, Eels, Eels, Eels, Eels, Eels, Eels, Eels, Eels, Eels, Eels, Eels, Eels, Eels, Eels, Eels, Eels, Eels, Eels, Eels, Eels, Eels, Eels, Eels, Eels, Eels, Bulldogs, Bulldogs, Bulldogs, Bulldogs, Bulldogs, Bulldogs, Bulldogs, Bulldogs, Bulldogs, Bulldogs, Bulldogs, Bulldogs, Bulldogs, Bulldogs, Bulldogs, Bulldogs, Bulldogs, Bulldogs, Bulldogs, Bulldogs, Bulldogs, Bulldogs, Bulldogs, Bulldogs, Bulldogs, Bulldogs, Bulldogs, Bulldogs, Bulldogs, Bulldogs, Bulldogs, Bulldogs, Bulldogs, Bulldogs, Bulldogs, Bulldogs, Bulldogs, Bulldogs, Bulldogs, Bulldogs, Bulldogs, Bulldogs, Bulldogs, Bulldogs, Bulldogs, Bulldogs, Bulldogs, Bulldogs, Bulldogs, Bulldogs, Bulldogs, Bulldogs, Bulldogs, Bulldogs, Bulldogs, Bulldogs, Bulldogs, Bulldogs, Bulldogs, Bulldogs, Bulldogs, Bulldogs, Bulldogs, Bulldogs, Bulldogs, Bulldogs, Bulldogs, Bulldogs, Bulldogs, Bulldogs, Bulldogs, Bulldogs, Bulldogs, Bulldogs, Bulldogs, Bulldogs, Bulldogs, Bulldogs, Bulldogs, Bulldogs, Bulldogs, Bulldogs, Bulldogs, Bulldogs, Bulldogs, Bulldogs, Bulldogs, Bulldogs, Bulldogs, Bulldogs, Bulldogs, Bulldogs, Bulldogs, Bulldogs, Bulldogs, Bulldogs, Bulldogs, Bulldogs, Bulldogs, Bulldogs, Bulldogs, Bulldogs, Bulldogs, Bulldogs, Bulldogs, Bulldogs, Bulldogs, Bulldogs, Bulldogs, Bulldogs, Bulldogs, Bulldogs, Bulldogs, Bulldogs, Bulldogs, Bulldogs, Bulldogs, Bulldogs, Bulldogs, Bulldogs, Bulldogs, Bulldogs, Bulldogs, Bulldogs, Bulldogs, Bulldogs, Bulldogs, Bulldogs
Panthers, 99.86876640419948, 99.93556701030928, 99.91368893492145, 99.91769547325103, 99.98587703606063, 99.97747494087173, 99.97225989397116, 99.97822773786197, 99.87021414665801, 99.83416252072969, 99.87129987129987, 99.89429175475686, 99.98816287878788, 100.0, 99.96866677111076, 100.0, 100.0, 100.0, 99.94266055045871, 100.0, 100.0, 100.0, 99.970469534403, 99.97596731554914, 100.0, 100.0, 100.0, 100.0, 100.0, 100.0, 100.0, 100.0, 99.82913284920973, 99.79869149471565, 99.85831680362709, 99.93399339933994, 99.99613436932235, 99.97181510710259, 99.96500962235385, 99.96998258990214, 99.8914223669924, 99.74715549936789, 99.89258861439313, 99.65986394557824, 99.961307796479, 99.95588883987648, 99.97481584083611, 99.98478161619236, 99.85795454545455, 99.54268292682927, 100.0, 99.89327641408752, 99.97584249305471, 100.0, 99.9918712404487, 99.96184662342617, 99.66832504145937, 99.59016393442623, 99.77578475336323, 100.0, 100.0, 100.0, 99.95979091274629, 100.0, 99.92395437262357, 99.68, 99.77698483496877, 99.88610478359908, 99.95031055900621, 100.0, 99.94259942599426, 99.98074330829964, 99.49579831932773, 100.0, 99.5475113122172, 100.0, 100.0, 100.0, 99.98007174172977, 99.95213020584012, 99.57894736842105, 100.0, 99.71711456859971, 100.0, 100.0, 100.0, 100.0, 100.0, 100.0, 100.0, 100.0, 100.0, 100.0, 99.76133651551312, 99.93394980184941, 100.0, 99.88649262202043, 99.86559139784946, 99.84779299847793, 99.915611814346, 99.96959254003649, 100.0, 99.98696473962067, 100.0, 99.86859395532196, 100.0, 99.91134751773049, 99.79879275653923, 100.0, 99.88505747126437, 99.96659428762318, 100.0, 100.0, 100.0, 100.0, 99.71671388101983, 100.0, 100.0, 100.0, 100.0, 100.0, 100.0, 100.0, 100.0, 99.92057188244638, 99.81818181818181, 99.89727786337956, 100.0, 99.83484723369116, 99.65588437715073, 99.74838245866283, 99.74715549936789, 99.97538885607403, 99.97654234107436, 99.96169193934557, 99.9694423223835, 99.93519118600129, 99.39024390243902, 99.87057808455565, 99.78768577494692, 100.0, 100.0, 99.96801023672425, 99.96224990562477, 99.8262380538662, 99.78448275862068, 99.82944855031268, 99.86468200270636, 99.96870109546165, 100.0, 99.98978966714314, 99.97522913054249, 99.78494623655914, 100.0, 99.71870604781998, 99.68944099378882, 99.96187571483036, 99.90108803165182, 100.0, 99.93972272453286, 99.89130434782608, 99.84185556141276, 99.78705281090289, 99.73054900639946, 99.9682590065069, 99.9813398022019, 99.99218078035813, 99.96898263027295, 100.0, 99.60159362549801, 99.88990825688073, 99.91496598639455, 99.97086530057298, 100.0, 99.99359343968224, 100.0, 99.92619926199262, 100.0, 99.95327102803738, 100.0, 99.91108853042043, 99.9405646359584, 99.94957559458778, 99.98069498069498, 100.0, 100.0, 99.76798143851508, 100.0, 99.9687597625742, 100.0, 99.97957516339869, 100.0, 99.85974754558204, 99.44649446494465, 99.86175115207374, 100.0, 99.96193859426542, 99.9690594059406, 99.99160298933579, 99.9407231772377, 99.82578397212544, 100.0, 100.0, 100.0, 100.0, 99.84951091045899, 99.97931747673216, 100.0, 99.77973568281938, 100.0, 99.85250737463127, 100.0, 99.91714995857498, 99.90421455938697, 99.97306760032319, 99.93726474278544, 100.0, 100.0, 100.0, 100.0, 100.0, 100.0, 99.93197278911565, 100.0, 99.88249118683902, 99.73753280839895, 99.77125428898208, 99.71988795518207, 99.97979593898374, 100.0, 99.97305308542171, 99.98390989541433, 100.0, 100.0, 99.72477064220183, 99.54648526077098, 99.97416020671834, 100.0, 99.9833138661772, 100.0, 99.80879541108987, 100.0, 99.77246871444824, 100.0, 100.0, 100.0, 99.95643650620781, 99.94837377387714, 100.0, 97.75280898876404, 99.6951219512195, 100.0, 99.92205767731879, 100.0, 99.94683678894205, 100.0
