, Manly, Dragons, Manly, Dragons, Manly, Dragons, Manly, Dragons, Manly, Dragons, Manly, Dragons, Manly, Dragons, Manly, Dragons, Manly, Dragons, Manly, Dragons, Manly, Dragons, Manly, Dragons, Manly, Dragons, Manly, Dragons, Manly, Dragons, Manly, Dragons, Manly, Dragons, Manly, Dragons, Manly, Dragons, Manly, Dragons, Manly, Dragons, Manly, Dragons, Manly, Dragons, Manly, Dragons, Manly, Dragons, Manly, Dragons, Manly, Dragons, Manly, Dragons, Manly, Dragons, Manly, Dragons, Manly, Dragons, Manly, Dragons, Manly, Dragons, Manly, Dragons, Manly, Dragons, Manly, Dragons, Manly, Dragons, Manly, Dragons, Manly, Dragons, Manly, Dragons, Manly, Dragons, Manly, Dragons, Manly, Dragons, Manly, Dragons, Manly, Dragons, Manly, Dragons, Manly, Dragons, Manly, Dragons, Manly, Dragons, Manly, Dragons, Manly, Dragons, Manly, Dragons, Manly, Dragons, Manly, Dragons, Manly, Dragons, Manly, Dragons, Manly, Dragons, Manly, Dragons, Manly, Dragons, Manly, Dragons, Manly, Dragons, Manly, Dragons, Manly, Dragons, Manly, Dragons, Manly, Dragons, Manly, Dragons, Manly, Dragons, Manly, Dragons, Manly, Dragons, Manly, Dragons, Manly, Dragons, Manly, Dragons, Manly, Dragons, Manly, Dragons, Manly, Dragons, Manly, Dragons, Manly, Dragons, Manly, Dragons, Manly, Dragons, Manly, Dragons, Manly, Dragons, Manly, Dragons, Manly, Dragons, Manly, Dragons, Manly, Dragons, Manly, Dragons, Manly, Dragons, Manly, Dragons, Manly, Dragons, Manly, Dragons, Manly, Dragons, Manly, Dragons, Manly, Dragons, Manly, Dragons, Manly, Dragons, Manly, Dragons, Manly, Dragons, Manly, Dragons, Manly, Dragons, Manly, Dragons, Manly, Dragons, Manly, Dragons, Manly, Dragons, Manly, Dragons, Manly, Dragons, Manly, Dragons, Manly, Dragons, Manly, Dragons, Manly, Dragons, Manly, Dragons, Manly, Dragons, Manly, Dragons, Manly, Dragons, Manly, Dragons, Manly, Dragons, Manly, Dragons, Manly, Dragons, Manly, Dragons, Manly, Dragons, Manly, Dragons, Manly, Dragons, Manly, Dragons, Manly, Dragons, Manly, Dragons, Manly, Dragons, Manly, Dragons, Manly, Dragons, Manly, Dragons
, Bulldogs, Bulldogs, Rabbitohs, Rabbitohs, Bulldogs, Bulldogs, Rabbitohs, Rabbitohs, Bulldogs, Bulldogs, Rabbitohs, Rabbitohs, Bulldogs, Bulldogs, Rabbitohs, Rabbitohs, Bulldogs, Bulldogs, Rabbitohs, Rabbitohs, Bulldogs, Bulldogs, Rabbitohs, Rabbitohs, Bulldogs, Bulldogs, Rabbitohs, Rabbitohs, Bulldogs, Bulldogs, Rabbitohs, Rabbitohs, Bulldogs, Bulldogs, Rabbitohs, Rabbitohs, Bulldogs, Bulldogs, Rabbitohs, Rabbitohs, Bulldogs, Bulldogs, Rabbitohs, Rabbitohs, Bulldogs, Bulldogs, Rabbitohs, Rabbitohs, Bulldogs, Bulldogs, Rabbitohs, Rabbitohs, Bulldogs, Bulldogs, Rabbitohs, Rabbitohs, Bulldogs, Bulldogs, Rabbitohs, Rabbitohs, Bulldogs, Bulldogs, Rabbitohs, Rabbitohs, Bulldogs, Bulldogs, Rabbitohs, Rabbitohs, Bulldogs, Bulldogs, Rabbitohs, Rabbitohs, Bulldogs, Bulldogs, Rabbitohs, Rabbitohs, Bulldogs, Bulldogs, Rabbitohs, Rabbitohs, Bulldogs, Bulldogs, Rabbitohs, Rabbitohs, Bulldogs, Bulldogs, Rabbitohs, Rabbitohs, Bulldogs, Bulldogs, Rabbitohs, Rabbitohs, Bulldogs, Bulldogs, Rabbitohs, Rabbitohs, Bulldogs, Bulldogs, Rabbitohs, Rabbitohs, Bulldogs, Bulldogs, Rabbitohs, Rabbitohs, Bulldogs, Bulldogs, Rabbitohs, Rabbitohs, Bulldogs, Bulldogs, Rabbitohs, Rabbitohs, Bulldogs, Bulldogs, Rabbitohs, Rabbitohs, Bulldogs, Bulldogs, Rabbitohs, Rabbitohs, Bulldogs, Bulldogs, Rabbitohs, Rabbitohs, Bulldogs, Bulldogs, Rabbitohs, Rabbitohs, Bulldogs, Bulldogs, Rabbitohs, Rabbitohs, Bulldogs, Bulldogs, Rabbitohs, Rabbitohs, Bulldogs, Bulldogs, Rabbitohs, Rabbitohs, Bulldogs, Bulldogs, Rabbitohs, Rabbitohs, Bulldogs, Bulldogs, Rabbitohs, Rabbitohs, Bulldogs, Bulldogs, Rabbitohs, Rabbitohs, Bulldogs, Bulldogs, Rabbitohs, Rabbitohs, Bulldogs, Bulldogs, Rabbitohs, Rabbitohs, Bulldogs, Bulldogs, Rabbitohs, Rabbitohs, Bulldogs, Bulldogs, Rabbitohs, Rabbitohs, Bulldogs, Bulldogs, Rabbitohs, Rabbitohs, Bulldogs, Bulldogs, Rabbitohs, Rabbitohs, Bulldogs, Bulldogs, Rabbitohs, Rabbitohs, Bulldogs, Bulldogs, Rabbitohs, Rabbitohs, Bulldogs, Bulldogs, Rabbitohs, Rabbitohs, Bulldogs, Bulldogs, Rabbitohs, Rabbitohs, Bulldogs, Bulldogs, Rabbitohs, Rabbitohs, Bulldogs, Bulldogs, Rabbitohs, Rabbitohs, Bulldogs, Bulldogs, Rabbitohs, Rabbitohs, Bulldogs, Bulldogs, Rabbitohs, Rabbitohs, Bulldogs, Bulldogs, Rabbitohs, Rabbitohs, Bulldogs, Bulldogs, Rabbitohs, Rabbitohs, Bulldogs, Bulldogs, Rabbitohs, Rabbitohs, Bulldogs, Bulldogs, Rabbitohs, Rabbitohs, Bulldogs, Bulldogs, Rabbitohs, Rabbitohs, Bulldogs, Bulldogs, Rabbitohs, Rabbitohs, Bulldogs, Bulldogs, Rabbitohs, Rabbitohs, Bulldogs, Bulldogs, Rabbitohs, Rabbitohs, Bulldogs, Bulldogs, Rabbitohs, Rabbitohs, Bulldogs, Bulldogs, Rabbitohs, Rabbitohs, Bulldogs, Bulldogs, Rabbitohs, Rabbitohs, Bulldogs, Bulldogs, Rabbitohs, Rabbitohs
, Dolphins, Dolphins, Dolphins, Dolphins, Storm, Storm, Storm, Storm, Dolphins, Dolphins, Dolphins, Dolphins, Storm, Storm, Storm, Storm, Dolphins, Dolphins, Dolphins, Dolphins, Storm, Storm, Storm, Storm, Dolphins, Dolphins, Dolphins, Dolphins, Storm, Storm, Storm, Storm, Dolphins, Dolphins, Dolphins, Dolphins, Storm, Storm, Storm, Storm, Dolphins, Dolphins, Dolphins, Dolphins, Storm, Storm, Storm, Storm, Dolphins, Dolphins, Dolphins, Dolphins, Storm, Storm, Storm, Storm, Dolphins, Dolphins, Dolphins, Dolphins, Storm, Storm, Storm, Storm, Dolphins, Dolphins, Dolphins, Dolphins, Storm, Storm, Storm, Storm, Dolphins, Dolphins, Dolphins, Dolphins, Storm, Storm, Storm, Storm, Dolphins, Dolphins, Dolphins, Dolphins, Storm, Storm, Storm, Storm, Dolphins, Dolphins, Dolphins, Dolphins, Storm, Storm, Storm, Storm, Dolphins, Dolphins, Dolphins, Dolphins, Storm, Storm, Storm, Storm, Dolphins, Dolphins, Dolphins, Dolphins, Storm, Storm, Storm, Storm, Dolphins, Dolphins, Dolphins, Dolphins, Storm, Storm, Storm, Storm, Dolphins, Dolphins, Dolphins, Dolphins, Storm, Storm, Storm, Storm, Dolphins, Dolphins, Dolphins, Dolphins, Storm, Storm, Storm, Storm, Dolphins, Dolphins, Dolphins, Dolphins, Storm, Storm, Storm, Storm, Dolphins, Dolphins, Dolphins, Dolphins, Storm, Storm, Storm, Storm, Dolphins, Dolphins, Dolphins, Dolphins, Storm, Storm, Storm, Storm, Dolphins, Dolphins, Dolphins, Dolphins, Storm, Storm, Storm, Storm, Dolphins, Dolphins, Dolphins, Dolphins, Storm, Storm, Storm, Storm, Dolphins, Dolphins, Dolphins, Dolphins, Storm, Storm, Storm, Storm, Dolphins, Dolphins, Dolphins, Dolphins, Storm, Storm, Storm, Storm, Dolphins, Dolphins, Dolphins, Dolphins, Storm, Storm, Storm, Storm, Dolphins, Dolphins, Dolphins, Dolphins, Storm, Storm, Storm, Storm, Dolphins, Dolphins, Dolphins, Dolphins, Storm, Storm, Storm, Storm, Dolphins, Dolphins, Dolphins, Dolphins, Storm, Storm, Storm, Storm, Dolphins, Dolphins, Dolphins, Dolphins, Storm, Storm, Storm, Storm, Dolphins, Dolphins, Dolphins, Dolphins, Storm, Storm, Storm, Storm, Dolphins, Dolphins, Dolphins, Dolphins, Storm, Storm, Storm, Storm, Dolphins, Dolphins, Dolphins, Dolphins, Storm, Storm, Storm, Storm
, Warriors, Warriors, Warriors, Warriors, Warriors, Warriors, Warriors, Warriors, Broncos, Broncos, Broncos, Broncos, Broncos, Broncos, Broncos, Broncos, Warriors, Warriors, Warriors, Warriors, Warriors, Warriors, Warriors, Warriors, Broncos, Broncos, Broncos, Broncos, Broncos, Broncos, Broncos, Broncos, Warriors, Warriors, Warriors, Warriors, Warriors, Warriors, Warriors, Warriors, Broncos, Broncos, Broncos, Broncos, Broncos, Broncos, Broncos, Broncos, Warriors, Warriors, Warriors, Warriors, Warriors, Warriors, Warriors, Warriors, Broncos, Broncos, Broncos, Broncos, Broncos, Broncos, Broncos, Broncos, Warriors, Warriors, Warriors, Warriors, Warriors, Warriors, Warriors, Warriors, Broncos, Broncos, Broncos, Broncos, Broncos, Broncos, Broncos, Broncos, Warriors, Warriors, Warriors, Warriors, Warriors, Warriors, Warriors, Warriors, Broncos, Broncos, Broncos, Broncos, Broncos, Broncos, Broncos, Broncos, Warriors, Warriors, Warriors, Warriors, Warriors, Warriors, Warriors, Warriors, Broncos, Broncos, Broncos, Broncos, Broncos, Broncos, Broncos, Broncos, Warriors, Warriors, Warriors, Warriors, Warriors, Warriors, Warriors, Warriors, Broncos, Broncos, Broncos, Broncos, Broncos, Broncos, Broncos, Broncos, Warriors, Warriors, Warriors, Warriors, Warriors, Warriors, Warriors, Warriors, Broncos, Broncos, Broncos, Broncos, Broncos, Broncos, Broncos, Broncos, Warriors, Warriors, Warriors, Warriors, Warriors, Warriors, Warriors, Warriors, Broncos, Broncos, Broncos, Broncos, Broncos, Broncos, Broncos, Broncos, Warriors, Warriors, Warriors, Warriors, Warriors, Warriors, Warriors, Warriors, Broncos, Broncos, Broncos, Broncos, Broncos, Broncos, Broncos, Broncos, Warriors, Warriors, Warriors, Warriors, Warriors, Warriors, Warriors, Warriors, Broncos, Broncos, Broncos, Broncos, Broncos, Broncos, Broncos, Broncos, Warriors, Warriors, Warriors, Warriors, Warriors, Warriors, Warriors, Warriors, Broncos, Broncos, Broncos, Broncos, Broncos, Broncos, Broncos, Broncos, Warriors, Warriors, Warriors, Warriors, Warriors, Warriors, Warriors, Warriors, Broncos, Broncos, Broncos, Broncos, Broncos, Broncos, Broncos, Broncos, Warriors, Warriors, Warriors, Warriors, Warriors, Warriors, Warriors, Warriors, Broncos, Broncos, Broncos, Broncos, Broncos, Broncos, Broncos, Broncos, Warriors, Warriors, Warriors, Warriors, Warriors, Warriors, Warriors, Warriors, Broncos, Broncos, Broncos, Broncos, Broncos, Broncos, Broncos, Broncos
, Roosters, Roosters, Roosters, Roosters, Roosters, Roosters, Roosters, Roosters, Roosters, Roosters, Roosters, Roosters, Roosters, Roosters, Roosters, Roosters, Panthers, Panthers, Panthers, Panthers, Panthers, Panthers, Panthers, Panthers, Panthers, Panthers, Panthers, Panthers, Panthers, Panthers, Panthers, Panthers, Roosters, Roosters, Roosters, Roosters, Roosters, Roosters, Roosters, Roosters, Roosters, Roosters, Roosters, Roosters, Roosters, Roosters, Roosters, Roosters, Panthers, Panthers, Panthers, Panthers, Panthers, Panthers, Panthers, Panthers, Panthers, Panthers, Panthers, Panthers, Panthers, Panthers, Panthers, Panthers, Roosters, Roosters, Roosters, Roosters, Roosters, Roosters, Roosters, Roosters, Roosters, Roosters, Roosters, Roosters, Roosters, Roosters, Roosters, Roosters, Panthers, Panthers, Panthers, Panthers, Panthers, Panthers, Panthers, Panthers, Panthers, Panthers, Panthers, Panthers, Panthers, Panthers, Panthers, Panthers, Roosters, Roosters, Roosters, Roosters, Roosters, Roosters, Roosters, Roosters, Roosters, Roosters, Roosters, Roosters, Roosters, Roosters, Roosters, Roosters, Panthers, Panthers, Panthers, Panthers, Panthers, Panthers, Panthers, Panthers, Panthers, Panthers, Panthers, Panthers, Panthers, Panthers, Panthers, Panthers, Roosters, Roosters, Roosters, Roosters, Roosters, Roosters, Roosters, Roosters, Roosters, Roosters, Roosters, Roosters, Roosters, Roosters, Roosters, Roosters, Panthers, Panthers, Panthers, Panthers, Panthers, Panthers, Panthers, Panthers, Panthers, Panthers, Panthers, Panthers, Panthers, Panthers, Panthers, Panthers, Roosters, Roosters, Roosters, Roosters, Roosters, Roosters, Roosters, Roosters, Roosters, Roosters, Roosters, Roosters, Roosters, Roosters, Roosters, Roosters, Panthers, Panthers, Panthers, Panthers, Panthers, Panthers, Panthers, Panthers, Panthers, Panthers, Panthers, Panthers, Panthers, Panthers, Panthers, Panthers, Roosters, Roosters, Roosters, Roosters, Roosters, Roosters, Roosters, Roosters, Roosters, Roosters, Roosters, Roosters, Roosters, Roosters, Roosters, Roosters, Panthers, Panthers, Panthers, Panthers, Panthers, Panthers, Panthers, Panthers, Panthers, Panthers, Panthers, Panthers, Panthers, Panthers, Panthers, Panthers, Roosters, Roosters, Roosters, Roosters, Roosters, Roosters, Roosters, Roosters, Roosters, Roosters, Roosters, Roosters, Roosters, Roosters, Roosters, Roosters, Panthers, Panthers, Panthers, Panthers, Panthers, Panthers, Panthers, Panthers, Panthers, Panthers, Panthers, Panthers, Panthers, Panthers, Panthers, Panthers
, Titans, Titans, Titans, Titans, Titans, Titans, Titans, Titans, Titans, Titans, Titans, Titans, Titans, Titans, Titans, Titans, Titans, Titans, Titans, Titans, Titans, Titans, Titans, Titans, Titans, Titans, Titans, Titans, Titans, Titans, Titans, Titans, Raiders, Raiders, Raiders, Raiders, Raiders, Raiders, Raiders, Raiders, Raiders, Raiders, Raiders, Raiders, Raiders, Raiders, Raiders, Raiders, Raiders, Raiders, Raiders, Raiders, Raiders, Raiders, Raiders, Raiders, Raiders, Raiders, Raiders, Raiders, Raiders, Raiders, Raiders, Raiders, Titans, Titans, Titans, Titans, Titans, Titans, Titans, Titans, Titans, Titans, Titans, Titans, Titans, Titans, Titans, Titans, Titans, Titans, Titans, Titans, Titans, Titans, Titans, Titans, Titans, Titans, Titans, Titans, Titans, Titans, Titans, Titans, Raiders, Raiders, Raiders, Raiders, Raiders, Raiders, Raiders, Raiders, Raiders, Raiders, Raiders, Raiders, Raiders, Raiders, Raiders, Raiders, Raiders, Raiders, Raiders, Raiders, Raiders, Raiders, Raiders, Raiders, Raiders, Raiders, Raiders, Raiders, Raiders, Raiders, Raiders, Raiders, Titans, Titans, Titans, Titans, Titans, Titans, Titans, Titans, Titans, Titans, Titans, Titans, Titans, Titans, Titans, Titans, Titans, Titans, Titans, Titans, Titans, Titans, Titans, Titans, Titans, Titans, Titans, Titans, Titans, Titans, Titans, Titans, Raiders, Raiders, Raiders, Raiders, Raiders, Raiders, Raiders, Raiders, Raiders, Raiders, Raiders, Raiders, Raiders, Raiders, Raiders, Raiders, Raiders, Raiders, Raiders, Raiders, Raiders, Raiders, Raiders, Raiders, Raiders, Raiders, Raiders, Raiders, Raiders, Raiders, Raiders, Raiders, Titans, Titans, Titans, Titans, Titans, Titans, Titans, Titans, Titans, Titans, Titans, Titans, Titans, Titans, Titans, Titans, Titans, Titans, Titans, Titans, Titans, Titans, Titans, Titans, Titans, Titans, Titans, Titans, Titans, Titans, Titans, Titans, Raiders, Raiders, Raiders, Raiders, Raiders, Raiders, Raiders, Raiders, Raiders, Raiders, Raiders, Raiders, Raiders, Raiders, Raiders, Raiders, Raiders, Raiders, Raiders, Raiders, Raiders, Raiders, Raiders, Raiders, Raiders, Raiders, Raiders, Raiders, Raiders, Raiders, Raiders, Raiders
, Knights, Knights, Knights, Knights, Knights, Knights, Knights, Knights, Knights, Knights, Knights, Knights, Knights, Knights, Knights, Knights, Knights, Knights, Knights, Knights, Knights, Knights, Knights, Knights, Knights, Knights, Knights, Knights, Knights, Knights, Knights, Knights, Knights, Knights, Knights, Knights, Knights, Knights, Knights, Knights, Knights, Knights, Knights, Knights, Knights, Knights, Knights, Knights, Knights, Knights, Knights, Knights, Knights, Knights, Knights, Knights, Knights, Knights, Knights, Knights, Knights, Knights, Knights, Knights, Sharks, Sharks, Sharks, Sharks, Sharks, Sharks, Sharks, Sharks, Sharks, Sharks, Sharks, Sharks, Sharks, Sharks, Sharks, Sharks, Sharks, Sharks, Sharks, Sharks, Sharks, Sharks, Sharks, Sharks, Sharks, Sharks, Sharks, Sharks, Sharks, Sharks, Sharks, Sharks, Sharks, Sharks, Sharks, Sharks, Sharks, Sharks, Sharks, Sharks, Sharks, Sharks, Sharks, Sharks, Sharks, Sharks, Sharks, Sharks, Sharks, Sharks, Sharks, Sharks, Sharks, Sharks, Sharks, Sharks, Sharks, Sharks, Sharks, Sharks, Sharks, Sharks, Sharks, Sharks, Knights, Knights, Knights, Knights, Knights, Knights, Knights, Knights, Knights, Knights, Knights, Knights, Knights, Knights, Knights, Knights, Knights, Knights, Knights, Knights, Knights, Knights, Knights, Knights, Knights, Knights, Knights, Knights, Knights, Knights, Knights, Knights, Knights, Knights, Knights, Knights, Knights, Knights, Knights, Knights, Knights, Knights, Knights, Knights, Knights, Knights, Knights, Knights, Knights, Knights, Knights, Knights, Knights, Knights, Knights, Knights, Knights, Knights, Knights, Knights, Knights, Knights, Knights, Knights, Sharks, Sharks, Sharks, Sharks, Sharks, Sharks, Sharks, Sharks, Sharks, Sharks, Sharks, Sharks, Sharks, Sharks, Sharks, Sharks, Sharks, Sharks, Sharks, Sharks, Sharks, Sharks, Sharks, Sharks, Sharks, Sharks, Sharks, Sharks, Sharks, Sharks, Sharks, Sharks, Sharks, Sharks, Sharks, Sharks, Sharks, Sharks, Sharks, Sharks, Sharks, Sharks, Sharks, Sharks, Sharks, Sharks, Sharks, Sharks, Sharks, Sharks, Sharks, Sharks, Sharks, Sharks, Sharks, Sharks, Sharks, Sharks, Sharks, Sharks, Sharks, Sharks, Sharks, Sharks
, Tigers, Tigers, Tigers, Tigers, Tigers, Tigers, Tigers, Tigers, Tigers, Tigers, Tigers, Tigers, Tigers, Tigers, Tigers, Tigers, Tigers, Tigers, Tigers, Tigers, Tigers, Tigers, Tigers, Tigers, Tigers, Tigers, Tigers, Tigers, Tigers, Tigers, Tigers, Tigers, Tigers, Tigers, Tigers, Tigers, Tigers, Tigers, Tigers, Tigers, Tigers, Tigers, Tigers, Tigers, Tigers, Tigers, Tigers, Tigers, Tigers, Tigers, Tigers, Tigers, Tigers, Tigers, Tigers, Tigers, Tigers, Tigers, Tigers, Tigers, Tigers, Tigers, Tigers, Tigers, Tigers, Tigers, Tigers, Tigers, Tigers, Tigers, Tigers, Tigers, Tigers, Tigers, Tigers, Tigers, Tigers, Tigers, Tigers, Tigers, Tigers, Tigers, Tigers, Tigers, Tigers, Tigers, Tigers, Tigers, Tigers, Tigers, Tigers, Tigers, Tigers, Tigers, Tigers, Tigers, Tigers, Tigers, Tigers, Tigers, Tigers, Tigers, Tigers, Tigers, Tigers, Tigers, Tigers, Tigers, Tigers, Tigers, Tigers, Tigers, Tigers, Tigers, Tigers, Tigers, Tigers, Tigers, Tigers, Tigers, Tigers, Tigers, Tigers, Tigers, Tigers, Tigers, Tigers, Tigers, Eels, Eels, Eels, Eels, Eels, Eels, Eels, Eels, Eels, Eels, Eels, Eels, Eels, Eels, Eels, Eels, Eels, Eels, Eels, Eels, Eels, Eels, Eels, Eels, Eels, Eels, Eels, Eels, Eels, Eels, Eels, Eels, Eels, Eels, Eels, Eels, Eels, Eels, Eels, Eels, Eels, Eels, Eels, Eels, Eels, Eels, Eels, Eels, Eels, Eels, Eels, Eels, Eels, Eels, Eels, Eels, Eels, Eels, Eels, Eels, Eels, Eels, Eels, Eels, Eels, Eels, Eels, Eels, Eels, Eels, Eels, Eels, Eels, Eels, Eels, Eels, Eels, Eels, Eels, Eels, Eels, Eels, Eels, Eels, Eels, Eels, Eels, Eels, Eels, Eels, Eels, Eels, Eels, Eels, Eels, Eels, Eels, Eels, Eels, Eels, Eels, Eels, Eels, Eels, Eels, Eels, Eels, Eels, Eels, Eels, Eels, Eels, Eels, Eels, Eels, Eels, Eels, Eels, Eels, Eels, Eels, Eels, Eels, Eels, Eels, Eels, Eels, Eels
Storm, 79.95003123048095, 81.7717206132879, 84.4059405940594, 84.51178451178451, 93.55167579966867, 93.39777494072588, 93.11540366518078, 93.08588064046579, 81.12889637742208, 83.96334478808706, 80.78175895765473, 81.68316831683168, 92.01716738197425, 92.37247353224254, 92.22153080273802, 93.2139491046183, 83.41915550978372, 83.38192419825073, 75.93984962406014, 85.78680203045685, 93.09196837286726, 93.83844339622641, 92.32693911592995, 94.61279461279462, 81.125, 81.34328358208955, 80.10204081632652, 82.08955223880598, 92.69167126309983, 93.88846447669977, 92.83314669652856, 93.81598793363499, 80.93621149648314, 82.64887063655031, 84.77842003853564, 81.31868131868131, 92.03007518796993, 92.65404523860171, 92.80728964715006, 92.66055045871559, 77.62820512820512, 81.1217510259918, 79.07894736842105, 79.74910394265234, 91.10070257611241, 92.00115506786024, 91.1839430894309, 92.56732495511669, 81.18384947079576, 83.2445233866193, 83.55359765051395, 82.20338983050848, 92.17881660673423, 93.07239348804987, 92.04227541187441, 93.62166885102666, 80.55555555555556, 83.29501915708812, 80.46875, 80.9659090909091, 91.42734676382341, 92.05392545598731, 92.20146222583266, 92.50295159386069, 81.02885138813282, 81.75355450236967, 83.53591160220995, 82.18125960061444, 92.26532017443195, 93.07355733509452, 92.06036745406824, 92.0418516169943, 80.95410191543188, 80.74306645735217, 80.31496062992126, 81.89655172413794, 91.57776108189331, 91.54808106942647, 91.57830960315056, 92.75671069450362, 81.72566371681415, 83.17089018843404, 80.96947935368043, 83.6104513064133, 92.99208934388088, 93.0784442979565, 92.11444521981856, 93.45088161209067, 80.5408583186361, 82.48847926267281, 82.3913043478261, 83.76623376623377, 91.68482207697895, 92.6338102808691, 92.16454456415279, 92.89372599231754, 79.45309122351924, 80.18433179723502, 79.21535893155259, 81.61543098251958, 91.13938201493539, 91.78169125813105, 91.4954239336902, 91.95673794132273, 77.44916820702403, 79.97957099080695, 77.1595124536301, 81.51658767772511, 90.56047197640117, 91.14711654904582, 90.45300113250283, 91.4025678530798, 79.89808469513267, 81.68597485826966, 80.0941492938803, 80.5, 91.42990385995121, 92.23101428424623, 91.71853856562923, 93.16758026624902, 77.78551532033427, 79.5079313693752, 76.21035058430718, 77.70083102493075, 90.65813353710956, 91.6554054054054, 90.70666175929334, 91.38566912539515, 82.47162673392182, 80.88495575221238, 83.0, 80.95238095238095, 92.85714285714286, 93.95448079658605, 93.72509960159363, 91.86206896551724, 82.8393135725429, 83.82352941176471, 80.625, 89.74358974358975, 92.1990585070612, 92.70588235294117, 91.7948717948718, 92.86926994906621, 84.2, 82.41206030150754, 81.74603174603175, 82.95454545454545, 93.06553911205074, 92.91199054932073, 93.7394247038917, 93.45372460496614, 84.39716312056737, 79.70479704797047, 82.0, 89.28571428571429, 92.61891744122471, 93.17664897649735, 92.1443736730361, 94.76923076923077, 81.34642356241234, 82.0633850303439, 77.4597495527728, 84.44444444444444, 92.05200899403656, 92.99218194740583, 91.4020139426801, 92.83819628647215, 81.26925446703636, 80.73234524847427, 77.85888077858881, 84.2948717948718, 91.83032207384132, 92.79014162221813, 91.8407960199005, 91.68443496801706, 80.95605242868157, 82.61851015801355, 81.52492668621701, 82.66666666666667, 92.79547951655941, 93.42647732478241, 92.89617486338798, 93.20557491289199, 81.5068493150685, 81.05726872246696, 77.51004016064257, 86.04651162790698, 92.18483816013628, 92.73877673998192, 91.39700078926597, 93.27251995438996, 80.7796426637791, 82.57394084732215, 81.60676532769557, 80.1775147928994, 92.58309167967879, 93.04667519181585, 92.11087420042644, 92.05970149253731, 80.51027639971652, 80.66528066528068, 80.4733727810651, 81.06995884773663, 91.78000298908982, 92.07879295892707, 91.82498560736903, 91.66666666666666, 82.45299910474485, 82.27684346701164, 79.93920972644378, 80.56872037914692, 93.02242152466368, 92.98291721419186, 92.95874822190612, 93.48034515819751, 82.72189349112426, 81.51815181518151, 79.24528301886792, 84.78260869565217, 91.91489361702128, 93.01247771836007, 90.10600706713781, 92.66826923076923, 78.69330004161465, 80.91125670041691, 79.11646586345381, 78.64184008762322, 91.29415849318634, 92.34604836699077, 91.34695233349942, 92.2503008423586, 77.67241379310344, 79.34782608695652, 78.74186550976138, 81.12094395280236, 90.54154941710216, 91.73648759651716, 91.06217616580311, 91.38263665594856, 78.32647462277092, 81.95804195804196, 78.07692307692308, 82.56704980842912, 91.76651951510055, 92.3525273841825, 91.90720258969517, 92.26864506052324, 78.45584835876099, 79.40397350993378, 81.18466898954703, 80.1864801864802, 90.90482006952926, 91.58227015651717, 91.24457308248914, 90.69408740359897
