, Storm, Panthers, Storm, Panthers, Storm, Panthers, Storm, Panthers, Storm, Panthers, Storm, Panthers, Storm, Panthers, Storm, Panthers, Storm, Panthers, Storm, Panthers, Storm, Panthers, Storm, Panthers, Storm, Panthers, Storm, Panthers, Storm, Panthers, Storm, Panthers, Storm, Panthers, Storm, Panthers, Storm, Panthers, Storm, Panthers, Storm, Panthers, Storm, Panthers, Storm, Panthers, Storm, Panthers, Storm, Panthers, Storm, Panthers, Storm, Panthers, Storm, Panthers, Storm, Panthers, Storm, Panthers, Storm, Panthers, Storm, Panthers, Storm, Panthers, Storm, Panthers, Storm, Panthers, Storm, Panthers, Storm, Panthers, Storm, Panthers, Storm, Panthers, Storm, Panthers, Storm, Panthers, Storm, Panthers, Storm, Panthers, Storm, Panthers, Storm, Panthers, Storm, Panthers, Storm, Panthers, Storm, Panthers, Storm, Panthers, Storm, Panthers, Storm, Panthers, Storm, Panthers, Storm, Panthers, Storm, Panthers, Storm, Panthers, Storm, Panthers, Storm, Panthers, Storm, Panthers, Storm, Panthers, Storm, Panthers, Storm, Panthers, Storm, Panthers, Storm, Panthers, Storm, Panthers, Storm, Panthers, Storm, Panthers, Storm, Panthers, Storm, Panthers, Storm, Panthers, Storm, Panthers, Storm, Panthers, Storm, Panthers, Storm, Panthers, Storm, Panthers, Storm, Panthers, Storm, Panthers, Storm, Panthers, Storm, Panthers, Storm, Panthers, Storm, Panthers, Storm, Panthers, Storm, Panthers, Storm, Panthers, Storm, Panthers, Storm, Panthers, Storm, Panthers, Storm, Panthers, Storm, Panthers, Storm, Panthers, Storm, Panthers, Storm, Panthers, Storm, Panthers, Storm, Panthers, Storm, Panthers, Storm, Panthers, Storm, Panthers, Storm, Panthers, Storm, Panthers, Storm, Panthers, Storm, Panthers, Storm, Panthers, Storm, Panthers, Storm, Panthers, Storm, Panthers, Storm, Panthers, Storm, Panthers, Storm, Panthers, Storm, Panthers, Storm, Panthers, Storm, Panthers, Storm, Panthers, Storm, Panthers, Storm, Panthers, Storm, Panthers, Storm, Panthers, Storm, Panthers, Storm, Panthers, Storm, Panthers, Storm, Panthers, Storm, Panthers, Storm, Panthers, Storm, Panthers, Storm, Panthers, Storm, Panthers, Storm, Panthers, Storm, Panthers, Storm, Panthers, Storm, Panthers
, Warriors, Warriors, Roosters, Roosters, Warriors, Warriors, Roosters, Roosters, Warriors, Warriors, Roosters, Roosters, Warriors, Warriors, Roosters, Roosters, Warriors, Warriors, Roosters, Roosters, Warriors, Warriors, Roosters, Roosters, Warriors, Warriors, Roosters, Roosters, Warriors, Warriors, Roosters, Roosters, Warriors, Warriors, Roosters, Roosters, Warriors, Warriors, Roosters, Roosters, Warriors, Warriors, Roosters, Roosters, Warriors, Warriors, Roosters, Roosters, Warriors, Warriors, Roosters, Roosters, Warriors, Warriors, Roosters, Roosters, Warriors, Warriors, Roosters, Roosters, Warriors, Warriors, Roosters, Roosters, Warriors, Warriors, Roosters, Roosters, Warriors, Warriors, Roosters, Roosters, Warriors, Warriors, Roosters, Roosters, Warriors, Warriors, Roosters, Roosters, Warriors, Warriors, Roosters, Roosters, Warriors, Warriors, Roosters, Roosters, Warriors, Warriors, Roosters, Roosters, Warriors, Warriors, Roosters, Roosters, Warriors, Warriors, Roosters, Roosters, Warriors, Warriors, Roosters, Roosters, Warriors, Warriors, Roosters, Roosters, Warriors, Warriors, Roosters, Roosters, Warriors, Warriors, Roosters, Roosters, Warriors, Warriors, Roosters, Roosters, Warriors, Warriors, Roosters, Roosters, Warriors, Warriors, Roosters, Roosters, Warriors, Warriors, Roosters, Roosters, Warriors, Warriors, Roosters, Roosters, Warriors, Warriors, Roosters, Roosters, Warriors, Warriors, Roosters, Roosters, Warriors, Warriors, Roosters, Roosters, Warriors, Warriors, Roosters, Roosters, Warriors, Warriors, Roosters, Roosters, Warriors, Warriors, Roosters, Roosters, Warriors, Warriors, Roosters, Roosters, Warriors, Warriors, Roosters, Roosters, Warriors, Warriors, Roosters, Roosters, Warriors, Warriors, Roosters, Roosters, Warriors, Warriors, Roosters, Roosters, Warriors, Warriors, Roosters, Roosters, Warriors, Warriors, Roosters, Roosters, Warriors, Warriors, Roosters, Roosters, Warriors, Warriors, Roosters, Roosters, Warriors, Warriors, Roosters, Roosters, Warriors, Warriors, Roosters, Roosters, Warriors, Warriors, Roosters, Roosters, Warriors, Warriors, Roosters, Roosters, Warriors, Warriors, Roosters, Roosters, Warriors, Warriors, Roosters, Roosters, Warriors, Warriors, Roosters, Roosters, Warriors, Warriors, Roosters, Roosters, Warriors, Warriors, Roosters, Roosters, Warriors, Warriors, Roosters, Roosters, Warriors, Warriors, Roosters, Roosters, Warriors, Warriors, Roosters, Roosters, Warriors, Warriors, Roosters, Roosters, Warriors, Warriors, Roosters, Roosters, Warriors, Warriors, Roosters, Roosters
, Broncos, Broncos, Broncos, Broncos, Cowboys, Cowboys, Cowboys, Cowboys, Broncos, Broncos, Broncos, Broncos, Cowboys, Cowboys, Cowboys, Cowboys, Broncos, Broncos, Broncos, Broncos, Cowboys, Cowboys, Cowboys, Cowboys, Broncos, Broncos, Broncos, Broncos, Cowboys, Cowboys, Cowboys, Cowboys, Broncos, Broncos, Broncos, Broncos, Cowboys, Cowboys, Cowboys, Cowboys, Broncos, Broncos, Broncos, Broncos, Cowboys, Cowboys, Cowboys, Cowboys, Broncos, Broncos, Broncos, Broncos, Cowboys, Cowboys, Cowboys, Cowboys, Broncos, Broncos, Broncos, Broncos, Cowboys, Cowboys, Cowboys, Cowboys, Broncos, Broncos, Broncos, Broncos, Cowboys, Cowboys, Cowboys, Cowboys, Broncos, Broncos, Broncos, Broncos, Cowboys, Cowboys, Cowboys, Cowboys, Broncos, Broncos, Broncos, Broncos, Cowboys, Cowboys, Cowboys, Cowboys, Broncos, Broncos, Broncos, Broncos, Cowboys, Cowboys, Cowboys, Cowboys, Broncos, Broncos, Broncos, Broncos, Cowboys, Cowboys, Cowboys, Cowboys, Broncos, Broncos, Broncos, Broncos, Cowboys, Cowboys, Cowboys, Cowboys, Broncos, Broncos, Broncos, Broncos, Cowboys, Cowboys, Cowboys, Cowboys, Broncos, Broncos, Broncos, Broncos, Cowboys, Cowboys, Cowboys, Cowboys, Broncos, Broncos, Broncos, Broncos, Cowboys, Cowboys, Cowboys, Cowboys, Broncos, Broncos, Broncos, Broncos, Cowboys, Cowboys, Cowboys, Cowboys, Broncos, Broncos, Broncos, Broncos, Cowboys, Cowboys, Cowboys, Cowboys, Broncos, Broncos, Broncos, Broncos, Cowboys, Cowboys, Cowboys, Cowboys, Broncos, Broncos, Broncos, Broncos, Cowboys, Cowboys, Cowboys, Cowboys, Broncos, Broncos, Broncos, Broncos, Cowboys, Cowboys, Cowboys, Cowboys, Broncos, Broncos, Broncos, Broncos, Cowboys, Cowboys, Cowboys, Cowboys, Broncos, Broncos, Broncos, Broncos, Cowboys, Cowboys, Cowboys, Cowboys, Broncos, Broncos, Broncos, Broncos, Cowboys, Cowboys, Cowboys, Cowboys, Broncos, Broncos, Broncos, Broncos, Cowboys, Cowboys, Cowboys, Cowboys, Broncos, Broncos, Broncos, Broncos, Cowboys, Cowboys, Cowboys, Cowboys, Broncos, Broncos, Broncos, Broncos, Cowboys, Cowboys, Cowboys, Cowboys, Broncos, Broncos, Broncos, Broncos, Cowboys, Cowboys, Cowboys, Cowboys, Broncos, Broncos, Broncos, Broncos, Cowboys, Cowboys, Cowboys, Cowboys, Broncos, Broncos, Broncos, Broncos, Cowboys, Cowboys, Cowboys, Cowboys, Broncos, Broncos, Broncos, Broncos, Cowboys, Cowboys, Cowboys, Cowboys
, Sharks, Sharks, Sharks, Sharks, Sharks, Sharks, Sharks, Sharks, Rabbitohs, Rabbitohs, Rabbitohs, Rabbitohs, Rabbitohs, Rabbitohs, Rabbitohs, Rabbitohs, Sharks, Sharks, Sharks, Sharks, Sharks, Sharks, Sharks, Sharks, Rabbitohs, Rabbitohs, Rabbitohs, Rabbitohs, Rabbitohs, Rabbitohs, Rabbitohs, Rabbitohs, Sharks, Sharks, Sharks, Sharks, Sharks, Sharks, Sharks, Sharks, Rabbitohs, Rabbitohs, Rabbitohs, Rabbitohs, Rabbitohs, Rabbitohs, Rabbitohs, Rabbitohs, Sharks, Sharks, Sharks, Sharks, Sharks, Sharks, Sharks, Sharks, Rabbitohs, Rabbitohs, Rabbitohs, Rabbitohs, Rabbitohs, Rabbitohs, Rabbitohs, Rabbitohs, Sharks, Sharks, Sharks, Sharks, Sharks, Sharks, Sharks, Sharks, Rabbitohs, Rabbitohs, Rabbitohs, Rabbitohs, Rabbitohs, Rabbitohs, Rabbitohs, Rabbitohs, Sharks, Sharks, Sharks, Sharks, Sharks, Sharks, Sharks, Sharks, Rabbitohs, Rabbitohs, Rabbitohs, Rabbitohs, Rabbitohs, Rabbitohs, Rabbitohs, Rabbitohs, Sharks, Sharks, Sharks, Sharks, Sharks, Sharks, Sharks, Sharks, Rabbitohs, Rabbitohs, Rabbitohs, Rabbitohs, Rabbitohs, Rabbitohs, Rabbitohs, Rabbitohs, Sharks, Sharks, Sharks, Sharks, Sharks, Sharks, Sharks, Sharks, Rabbitohs, Rabbitohs, Rabbitohs, Rabbitohs, Rabbitohs, Rabbitohs, Rabbitohs, Rabbitohs, Sharks, Sharks, Sharks, Sharks, Sharks, Sharks, Sharks, Sharks, Rabbitohs, Rabbitohs, Rabbitohs, Rabbitohs, Rabbitohs, Rabbitohs, Rabbitohs, Rabbitohs, Sharks, Sharks, Sharks, Sharks, Sharks, Sharks, Sharks, Sharks, Rabbitohs, Rabbitohs, Rabbitohs, Rabbitohs, Rabbitohs, Rabbitohs, Rabbitohs, Rabbitohs, Sharks, Sharks, Sharks, Sharks, Sharks, Sharks, Sharks, Sharks, Rabbitohs, Rabbitohs, Rabbitohs, Rabbitohs, Rabbitohs, Rabbitohs, Rabbitohs, Rabbitohs, Sharks, Sharks, Sharks, Sharks, Sharks, Sharks, Sharks, Sharks, Rabbitohs, Rabbitohs, Rabbitohs, Rabbitohs, Rabbitohs, Rabbitohs, Rabbitohs, Rabbitohs, Sharks, Sharks, Sharks, Sharks, Sharks, Sharks, Sharks, Sharks, Rabbitohs, Rabbitohs, Rabbitohs, Rabbitohs, Rabbitohs, Rabbitohs, Rabbitohs, Rabbitohs, Sharks, Sharks, Sharks, Sharks, Sharks, Sharks, Sharks, Sharks, Rabbitohs, Rabbitohs, Rabbitohs, Rabbitohs, Rabbitohs, Rabbitohs, Rabbitohs, Rabbitohs, Sharks, Sharks, Sharks, Sharks, Sharks, Sharks, Sharks, Sharks, Rabbitohs, Rabbitohs, Rabbitohs, Rabbitohs, Rabbitohs, Rabbitohs, Rabbitohs, Rabbitohs, Sharks, Sharks, Sharks, Sharks, Sharks, Sharks, Sharks, Sharks, Rabbitohs, Rabbitohs, Rabbitohs, Rabbitohs, Rabbitohs, Rabbitohs, Rabbitohs, Rabbitohs
, Dolphins, Dolphins, Dolphins, Dolphins, Dolphins, Dolphins, Dolphins, Dolphins, Dolphins, Dolphins, Dolphins, Dolphins, Dolphins, Dolphins, Dolphins, Dolphins, Tigers, Tigers, Tigers, Tigers, Tigers, Tigers, Tigers, Tigers, Tigers, Tigers, Tigers, Tigers, Tigers, Tigers, Tigers, Tigers, Dolphins, Dolphins, Dolphins, Dolphins, Dolphins, Dolphins, Dolphins, Dolphins, Dolphins, Dolphins, Dolphins, Dolphins, Dolphins, Dolphins, Dolphins, Dolphins, Tigers, Tigers, Tigers, Tigers, Tigers, Tigers, Tigers, Tigers, Tigers, Tigers, Tigers, Tigers, Tigers, Tigers, Tigers, Tigers, Dolphins, Dolphins, Dolphins, Dolphins, Dolphins, Dolphins, Dolphins, Dolphins, Dolphins, Dolphins, Dolphins, Dolphins, Dolphins, Dolphins, Dolphins, Dolphins, Tigers, Tigers, Tigers, Tigers, Tigers, Tigers, Tigers, Tigers, Tigers, Tigers, Tigers, Tigers, Tigers, Tigers, Tigers, Tigers, Dolphins, Dolphins, Dolphins, Dolphins, Dolphins, Dolphins, Dolphins, Dolphins, Dolphins, Dolphins, Dolphins, Dolphins, Dolphins, Dolphins, Dolphins, Dolphins, Tigers, Tigers, Tigers, Tigers, Tigers, Tigers, Tigers, Tigers, Tigers, Tigers, Tigers, Tigers, Tigers, Tigers, Tigers, Tigers, Dolphins, Dolphins, Dolphins, Dolphins, Dolphins, Dolphins, Dolphins, Dolphins, Dolphins, Dolphins, Dolphins, Dolphins, Dolphins, Dolphins, Dolphins, Dolphins, Tigers, Tigers, Tigers, Tigers, Tigers, Tigers, Tigers, Tigers, Tigers, Tigers, Tigers, Tigers, Tigers, Tigers, Tigers, Tigers, Dolphins, Dolphins, Dolphins, Dolphins, Dolphins, Dolphins, Dolphins, Dolphins, Dolphins, Dolphins, Dolphins, Dolphins, Dolphins, Dolphins, Dolphins, Dolphins, Tigers, Tigers, Tigers, Tigers, Tigers, Tigers, Tigers, Tigers, Tigers, Tigers, Tigers, Tigers, Tigers, Tigers, Tigers, Tigers, Dolphins, Dolphins, Dolphins, Dolphins, Dolphins, Dolphins, Dolphins, Dolphins, Dolphins, Dolphins, Dolphins, Dolphins, Dolphins, Dolphins, Dolphins, Dolphins, Tigers, Tigers, Tigers, Tigers, Tigers, Tigers, Tigers, Tigers, Tigers, Tigers, Tigers, Tigers, Tigers, Tigers, Tigers, Tigers, Dolphins, Dolphins, Dolphins, Dolphins, Dolphins, Dolphins, Dolphins, Dolphins, Dolphins, Dolphins, Dolphins, Dolphins, Dolphins, Dolphins, Dolphins, Dolphins, Tigers, Tigers, Tigers, Tigers, Tigers, Tigers, Tigers, Tigers, Tigers, Tigers, Tigers, Tigers, Tigers, Tigers, Tigers, Tigers
, Titans, Titans, Titans, Titans, Titans, Titans, Titans, Titans, Titans, Titans, Titans, Titans, Titans, Titans, Titans, Titans, Titans, Titans, Titans, Titans, Titans, Titans, Titans, Titans, Titans, Titans, Titans, Titans, Titans, Titans, Titans, Titans, Knights, Knights, Knights, Knights, Knights, Knights, Knights, Knights, Knights, Knights, Knights, Knights, Knights, Knights, Knights, Knights, Knights, Knights, Knights, Knights, Knights, Knights, Knights, Knights, Knights, Knights, Knights, Knights, Knights, Knights, Knights, Knights, Titans, Titans, Titans, Titans, Titans, Titans, Titans, Titans, Titans, Titans, Titans, Titans, Titans, Titans, Titans, Titans, Titans, Titans, Titans, Titans, Titans, Titans, Titans, Titans, Titans, Titans, Titans, Titans, Titans, Titans, Titans, Titans, Knights, Knights, Knights, Knights, Knights, Knights, Knights, Knights, Knights, Knights, Knights, Knights, Knights, Knights, Knights, Knights, Knights, Knights, Knights, Knights, Knights, Knights, Knights, Knights, Knights, Knights, Knights, Knights, Knights, Knights, Knights, Knights, Titans, Titans, Titans, Titans, Titans, Titans, Titans, Titans, Titans, Titans, Titans, Titans, Titans, Titans, Titans, Titans, Titans, Titans, Titans, Titans, Titans, Titans, Titans, Titans, Titans, Titans, Titans, Titans, Titans, Titans, Titans, Titans, Knights, Knights, Knights, Knights, Knights, Knights, Knights, Knights, Knights, Knights, Knights, Knights, Knights, Knights, Knights, Knights, Knights, Knights, Knights, Knights, Knights, Knights, Knights, Knights, Knights, Knights, Knights, Knights, Knights, Knights, Knights, Knights, Titans, Titans, Titans, Titans, Titans, Titans, Titans, Titans, Titans, Titans, Titans, Titans, Titans, Titans, Titans, Titans, Titans, Titans, Titans, Titans, Titans, Titans, Titans, Titans, Titans, Titans, Titans, Titans, Titans, Titans, Titans, Titans, Knights, Knights, Knights, Knights, Knights, Knights, Knights, Knights, Knights, Knights, Knights, Knights, Knights, Knights, Knights, Knights, Knights, Knights, Knights, Knights, Knights, Knights, Knights, Knights, Knights, Knights, Knights, Knights, Knights, Knights, Knights, Knights
, Eels, Eels, Eels, Eels, Eels, Eels, Eels, Eels, Eels, Eels, Eels, Eels, Eels, Eels, Eels, Eels, Eels, Eels, Eels, Eels, Eels, Eels, Eels, Eels, Eels, Eels, Eels, Eels, Eels, Eels, Eels, Eels, Eels, Eels, Eels, Eels, Eels, Eels, Eels, Eels, Eels, Eels, Eels, Eels, Eels, Eels, Eels, Eels, Eels, Eels, Eels, Eels, Eels, Eels, Eels, Eels, Eels, Eels, Eels, Eels, Eels, Eels, Eels, Eels, Bulldogs, Bulldogs, Bulldogs, Bulldogs, Bulldogs, Bulldogs, Bulldogs, Bulldogs, Bulldogs, Bulldogs, Bulldogs, Bulldogs, Bulldogs, Bulldogs, Bulldogs, Bulldogs, Bulldogs, Bulldogs, Bulldogs, Bulldogs, Bulldogs, Bulldogs, Bulldogs, Bulldogs, Bulldogs, Bulldogs, Bulldogs, Bulldogs, Bulldogs, Bulldogs, Bulldogs, Bulldogs, Bulldogs, Bulldogs, Bulldogs, Bulldogs, Bulldogs, Bulldogs, Bulldogs, Bulldogs, Bulldogs, Bulldogs, Bulldogs, Bulldogs, Bulldogs, Bulldogs, Bulldogs, Bulldogs, Bulldogs, Bulldogs, Bulldogs, Bulldogs, Bulldogs, Bulldogs, Bulldogs, Bulldogs, Bulldogs, Bulldogs, Bulldogs, Bulldogs, Bulldogs, Bulldogs, Bulldogs, Bulldogs, Eels, Eels, Eels, Eels, Eels, Eels, Eels, Eels, Eels, Eels, Eels, Eels, Eels, Eels, Eels, Eels, Eels, Eels, Eels, Eels, Eels, Eels, Eels, Eels, Eels, Eels, Eels, Eels, Eels, Eels, Eels, Eels, Eels, Eels, Eels, Eels, Eels, Eels, Eels, Eels, Eels, Eels, Eels, Eels, Eels, Eels, Eels, Eels, Eels, Eels, Eels, Eels, Eels, Eels, Eels, Eels, Eels, Eels, Eels, Eels, Eels, Eels, Eels, Eels, Bulldogs, Bulldogs, Bulldogs, Bulldogs, Bulldogs, Bulldogs, Bulldogs, Bulldogs, Bulldogs, Bulldogs, Bulldogs, Bulldogs, Bulldogs, Bulldogs, Bulldogs, Bulldogs, Bulldogs, Bulldogs, Bulldogs, Bulldogs, Bulldogs, Bulldogs, Bulldogs, Bulldogs, Bulldogs, Bulldogs, Bulldogs, Bulldogs, Bulldogs, Bulldogs, Bulldogs, Bulldogs, Bulldogs, Bulldogs, Bulldogs, Bulldogs, Bulldogs, Bulldogs, Bulldogs, Bulldogs, Bulldogs, Bulldogs, Bulldogs, Bulldogs, Bulldogs, Bulldogs, Bulldogs, Bulldogs, Bulldogs, Bulldogs, Bulldogs, Bulldogs, Bulldogs, Bulldogs, Bulldogs, Bulldogs, Bulldogs, Bulldogs, Bulldogs, Bulldogs, Bulldogs, Bulldogs, Bulldogs, Bulldogs
, Manly, Manly, Manly, Manly, Manly, Manly, Manly, Manly, Manly, Manly, Manly, Manly, Manly, Manly, Manly, Manly, Manly, Manly, Manly, Manly, Manly, Manly, Manly, Manly, Manly, Manly, Manly, Manly, Manly, Manly, Manly, Manly, Manly, Manly, Manly, Manly, Manly, Manly, Manly, Manly, Manly, Manly, Manly, Manly, Manly, Manly, Manly, Manly, Manly, Manly, Manly, Manly, Manly, Manly, Manly, Manly, Manly, Manly, Manly, Manly, Manly, Manly, Manly, Manly, Manly, Manly, Manly, Manly, Manly, Manly, Manly, Manly, Manly, Manly, Manly, Manly, Manly, Manly, Manly, Manly, Manly, Manly, Manly, Manly, Manly, Manly, Manly, Manly, Manly, Manly, Manly, Manly, Manly, Manly, Manly, Manly, Manly, Manly, Manly, Manly, Manly, Manly, Manly, Manly, Manly, Manly, Manly, Manly, Manly, Manly, Manly, Manly, Manly, Manly, Manly, Manly, Manly, Manly, Manly, Manly, Manly, Manly, Manly, Manly, Manly, Manly, Manly, Manly, Raiders, Raiders, Raiders, Raiders, Raiders, Raiders, Raiders, Raiders, Raiders, Raiders, Raiders, Raiders, Raiders, Raiders, Raiders, Raiders, Raiders, Raiders, Raiders, Raiders, Raiders, Raiders, Raiders, Raiders, Raiders, Raiders, Raiders, Raiders, Raiders, Raiders, Raiders, Raiders, Raiders, Raiders, Raiders, Raiders, Raiders, Raiders, Raiders, Raiders, Raiders, Raiders, Raiders, Raiders, Raiders, Raiders, Raiders, Raiders, Raiders, Raiders, Raiders, Raiders, Raiders, Raiders, Raiders, Raiders, Raiders, Raiders, Raiders, Raiders, Raiders, Raiders, Raiders, Raiders, Raiders, Raiders, Raiders, Raiders, Raiders, Raiders, Raiders, Raiders, Raiders, Raiders, Raiders, Raiders, Raiders, Raiders, Raiders, Raiders, Raiders, Raiders, Raiders, Raiders, Raiders, Raiders, Raiders, Raiders, Raiders, Raiders, Raiders, Raiders, Raiders, Raiders, Raiders, Raiders, Raiders, Raiders, Raiders, Raiders, Raiders, Raiders, Raiders, Raiders, Raiders, Raiders, Raiders, Raiders, Raiders, Raiders, Raiders, Raiders, Raiders, Raiders, Raiders, Raiders, Raiders, Raiders, Raiders, Raiders, Raiders, Raiders, Raiders, Raiders, Raiders, Raiders, Raiders, Raiders
Storm, 85.36981847737741, 71.72557172557173, 86.56387665198237, 68.05970149253731, 85.52305404065443, 73.10606060606061, 85.445580715851, 69.33607118412046, 87.65625, 75.86206896551724, 86.63594470046083, 68.44444444444444, 85.61354019746122, 70.55555555555556, 87.8665318503539, 71.8213058419244, 85.68207440811724, 70.15781922525107, 85.28848783155591, 69.33333333333334, 87.27977448907681, 69.1156462585034, 85.65022421524664, 68.10102899906455, 90.02433090024331, 72.32142857142857, 87.36176935229068, 70.52023121387283, 85.82230623818525, 61.31386861313869, 85.57692307692307, 70.68062827225131, 86.81933164691785, 68.80387931034483, 85.71428571428571, 66.53255303584493, 85.17715112075199, 67.65999022960429, 84.33734939759037, 67.4802110817942, 85.83690987124464, 75.59523809523809, 85.79234972677595, 67.1259842519685, 87.21088435374149, 70.28423772609818, 85.60111835973905, 65.69872958257713, 86.70520231213872, 68.99501069137563, 85.31296877130778, 68.77828054298642, 86.18841832324978, 69.51140065146579, 85.09644919523282, 67.68944676894468, 87.69389865563598, 76.01626016260163, 86.98315467075038, 68.65671641791045, 87.51173708920189, 69.14498141263941, 86.89355539464157, 69.48228882833789, 85.44045337111426, 68.62113402061856, 85.22670961347869, 68.02656546489564, 85.41555775226219, 67.45579007415859, 85.01015113918339, 67.1828595672465, 87.20874940561103, 69.30147058823529, 86.14703880190606, 69.19254658385093, 85.97041685342896, 69.04376012965965, 85.53668890236507, 68.11764705882352, 85.78080229226362, 68.7381404174573, 85.02820030763972, 68.56133590237636, 85.17831824626458, 67.43341404358354, 83.97520340953119, 66.62718389102754, 86.49900727994707, 76.21483375959079, 85.06616257088847, 69.92337164750958, 84.97005988023952, 70.26378896882494, 86.3677130044843, 67.0774647887324, 84.86612339930151, 66.9927421899653, 84.10884108841088, 66.5229232864276, 84.63813695757985, 67.03343207786712, 83.76492942453855, 65.72375919593824, 86.43135457254184, 71.10300820419326, 86.44237175216523, 68.60693263570961, 85.56083453831853, 68.53846153846153, 84.90477677177645, 66.89151208544126, 85.32893574415455, 67.38038016167795, 84.22902638377165, 66.17381304419254, 84.54631379962193, 66.21351459416233, 84.0314335851072, 65.98119858989423, 86.1146907216495, 67.64705882352942, 84.88151658767774, 65.71691176470588, 85.16594516594516, 68.3585313174946, 85.26091586794462, 65.3658536585366, 87.81094527363184, 70.01594896331738, 86.72174682797285, 71.74163783160323, 85.36493604213695, 72.75320970042796, 85.80161155876633, 72.45206861755801, 88.22115384615384, 75.53956834532374, 87.34402852049911, 68.42105263157895, 88.29174664107485, 71.65354330708661, 86.9983948635634, 70.35175879396985, 86.89159292035397, 69.28406466512702, 85.77549271636676, 71.63695299837926, 86.13659531090724, 69.48453608247422, 86.36363636363636, 73.7467018469657, 83.38762214983714, 75.67567567567568, 88.16120906801007, 66.95652173913044, 90.0874635568513, 70.11494252873564, 85.86497890295358, 68.59504132231406, 86.51097241795853, 69.4060211554109, 85.8938340972941, 69.64006259780908, 86.03620243812338, 67.4293405114401, 85.93708344441482, 68.14024390243902, 86.79458239277652, 74.29718875502009, 85.3233830845771, 70.1863354037267, 87.8125, 67.27272727272727, 84.59280997798973, 70.0, 86.46153846153845, 70.4968944099379, 86.40912730184147, 67.84638554216868, 86.94114675423087, 68.73727087576374, 85.86671658554849, 67.21078779276083, 86.9983948635634, 63.35403726708074, 88.60911270983213, 71.70731707317073, 85.0140056022409, 72.12121212121212, 86.97435897435898, 68.42105263157895, 86.7786336658669, 70.02022244691608, 85.94808126410835, 67.7638640429338, 85.83751019932393, 67.3651359786001, 85.66910785619174, 66.51480637813212, 88.08479532163743, 75.8530183727034, 85.1460221550856, 70.14613778705638, 87.14754098360655, 69.01041666666666, 86.14081996434938, 69.64285714285714, 85.27629233511587, 68.68131868131869, 85.83183337618925, 69.05965621840244, 86.47527910685805, 70.48977061376317, 85.2901023890785, 67.37120211360634, 88.51674641148325, 77.32342007434944, 88.62190812720848, 70.25495750708215, 87.74978279756733, 76.53846153846153, 87.54914809960681, 68.42105263157895, 85.76330401147919, 67.22649871705156, 84.33889602053915, 67.76991150442477, 85.27028527028527, 67.20119734872782, 84.38851587922726, 66.62509742790336, 86.10430521526077, 70.91152815013405, 86.18320610687023, 69.79472140762464, 86.7619639527657, 69.18392204628502, 85.3641777370591, 70.3672075149445, 85.46352650613038, 67.4025974025974, 84.68355225944315, 67.98543689320388, 85.02254925231426, 68.45697329376854, 84.94654557995172, 65.99468320779796, 86.81906614785993, 73.44632768361582, 85.91549295774648, 67.5177304964539, 86.15123194562447, 69.00175131348512, 85.0925625202988, 67.99065420560748
