, Raiders, Sharks, Raiders, Sharks, Raiders, Sharks, Raiders, Sharks, Raiders, Sharks, Raiders, Sharks, Raiders, Sharks, Raiders, Sharks, Raiders, Sharks, Raiders, Sharks, Raiders, Sharks, Raiders, Sharks, Raiders, Sharks, Raiders, Sharks, Raiders, Sharks, Raiders, Sharks, Raiders, Sharks, Raiders, Sharks, Raiders, Sharks, Raiders, Sharks, Raiders, Sharks, Raiders, Sharks, Raiders, Sharks, Raiders, Sharks, Raiders, Sharks, Raiders, Sharks, Raiders, Sharks, Raiders, Sharks, Raiders, Sharks, Raiders, Sharks, Raiders, Sharks, Raiders, Sharks, Raiders, Sharks, Raiders, Sharks, Raiders, Sharks, Raiders, Sharks, Raiders, Sharks, Raiders, Sharks, Raiders, Sharks, Raiders, Sharks, Raiders, Sharks, Raiders, Sharks, Raiders, Sharks, Raiders, Sharks, Raiders, Sharks, Raiders, Sharks, Raiders, Sharks, Raiders, Sharks, Raiders, Sharks, Raiders, Sharks, Raiders, Sharks, Raiders, Sharks, Raiders, Sharks, Raiders, Sharks, Raiders, Sharks, Raiders, Sharks, Raiders, Sharks, Raiders, Sharks, Raiders, Sharks, Raiders, Sharks, Raiders, Sharks, Raiders, Sharks, Raiders, Sharks, Raiders, Sharks, Raiders, Sharks, Raiders, Sharks, Raiders, Sharks, Raiders, Sharks, Raiders, Sharks, Raiders, Sharks, Raiders, Sharks, Raiders, Sharks, Raiders, Sharks, Raiders, Sharks, Raiders, Sharks, Raiders, Sharks, Raiders, Sharks, Raiders, Sharks, Raiders, Sharks, Raiders, Sharks, Raiders, Sharks, Raiders, Sharks, Raiders, Sharks, Raiders, Sharks, Raiders, Sharks, Raiders, Sharks, Raiders, Sharks, Raiders, Sharks, Raiders, Sharks, Raiders, Sharks, Raiders, Sharks, Raiders, Sharks, Raiders, Sharks, Raiders, Sharks, Raiders, Sharks, Raiders, Sharks, Raiders, Sharks, Raiders, Sharks, Raiders, Sharks, Raiders, Sharks, Raiders, Sharks, Raiders, Sharks, Raiders, Sharks, Raiders, Sharks, Raiders, Sharks, Raiders, Sharks, Raiders, Sharks, Raiders, Sharks, Raiders, Sharks, Raiders, Sharks, Raiders, Sharks, Raiders, Sharks, Raiders, Sharks, Raiders, Sharks, Raiders, Sharks, Raiders, Sharks, Raiders, Sharks, Raiders, Sharks, Raiders, Sharks, Raiders, Sharks, Raiders, Sharks, Raiders, Sharks, Raiders, Sharks, Raiders, Sharks, Raiders, Sharks, Raiders, Sharks, Raiders, Sharks, Raiders, Sharks
, Panthers, Panthers, Cowboys, Cowboys, Panthers, Panthers, Cowboys, Cowboys, Panthers, Panthers, Cowboys, Cowboys, Panthers, Panthers, Cowboys, Cowboys, Panthers, Panthers, Cowboys, Cowboys, Panthers, Panthers, Cowboys, Cowboys, Panthers, Panthers, Cowboys, Cowboys, Panthers, Panthers, Cowboys, Cowboys, Panthers, Panthers, Cowboys, Cowboys, Panthers, Panthers, Cowboys, Cowboys, Panthers, Panthers, Cowboys, Cowboys, Panthers, Panthers, Cowboys, Cowboys, Panthers, Panthers, Cowboys, Cowboys, Panthers, Panthers, Cowboys, Cowboys, Panthers, Panthers, Cowboys, Cowboys, Panthers, Panthers, Cowboys, Cowboys, Panthers, Panthers, Cowboys, Cowboys, Panthers, Panthers, Cowboys, Cowboys, Panthers, Panthers, Cowboys, Cowboys, Panthers, Panthers, Cowboys, Cowboys, Panthers, Panthers, Cowboys, Cowboys, Panthers, Panthers, Cowboys, Cowboys, Panthers, Panthers, Cowboys, Cowboys, Panthers, Panthers, Cowboys, Cowboys, Panthers, Panthers, Cowboys, Cowboys, Panthers, Panthers, Cowboys, Cowboys, Panthers, Panthers, Cowboys, Cowboys, Panthers, Panthers, Cowboys, Cowboys, Panthers, Panthers, Cowboys, Cowboys, Panthers, Panthers, Cowboys, Cowboys, Panthers, Panthers, Cowboys, Cowboys, Panthers, Panthers, Cowboys, Cowboys, Panthers, Panthers, Cowboys, Cowboys, Panthers, Panthers, Cowboys, Cowboys, Panthers, Panthers, Cowboys, Cowboys, Panthers, Panthers, Cowboys, Cowboys, Panthers, Panthers, Cowboys, Cowboys, Panthers, Panthers, Cowboys, Cowboys, Panthers, Panthers, Cowboys, Cowboys, Panthers, Panthers, Cowboys, Cowboys, Panthers, Panthers, Cowboys, Cowboys, Panthers, Panthers, Cowboys, Cowboys, Panthers, Panthers, Cowboys, Cowboys, Panthers, Panthers, Cowboys, Cowboys, Panthers, Panthers, Cowboys, Cowboys, Panthers, Panthers, Cowboys, Cowboys, Panthers, Panthers, Cowboys, Cowboys, Panthers, Panthers, Cowboys, Cowboys, Panthers, Panthers, Cowboys, Cowboys, Panthers, Panthers, Cowboys, Cowboys, Panthers, Panthers, Cowboys, Cowboys, Panthers, Panthers, Cowboys, Cowboys, Panthers, Panthers, Cowboys, Cowboys, Panthers, Panthers, Cowboys, Cowboys, Panthers, Panthers, Cowboys, Cowboys, Panthers, Panthers, Cowboys, Cowboys, Panthers, Panthers, Cowboys, Cowboys, Panthers, Panthers, Cowboys, Cowboys, Panthers, Panthers, Cowboys, Cowboys, Panthers, Panthers, Cowboys, Cowboys, Panthers, Panthers, Cowboys, Cowboys, Panthers, Panthers, Cowboys, Cowboys, Panthers, Panthers, Cowboys, Cowboys, Panthers, Panthers, Cowboys, Cowboys
, Rabbitohs, Rabbitohs, Rabbitohs, Rabbitohs, Roosters, Roosters, Roosters, Roosters, Rabbitohs, Rabbitohs, Rabbitohs, Rabbitohs, Roosters, Roosters, Roosters, Roosters, Rabbitohs, Rabbitohs, Rabbitohs, Rabbitohs, Roosters, Roosters, Roosters, Roosters, Rabbitohs, Rabbitohs, Rabbitohs, Rabbitohs, Roosters, Roosters, Roosters, Roosters, Rabbitohs, Rabbitohs, Rabbitohs, Rabbitohs, Roosters, Roosters, Roosters, Roosters, Rabbitohs, Rabbitohs, Rabbitohs, Rabbitohs, Roosters, Roosters, Roosters, Roosters, Rabbitohs, Rabbitohs, Rabbitohs, Rabbitohs, Roosters, Roosters, Roosters, Roosters, Rabbitohs, Rabbitohs, Rabbitohs, Rabbitohs, Roosters, Roosters, Roosters, Roosters, Rabbitohs, Rabbitohs, Rabbitohs, Rabbitohs, Roosters, Roosters, Roosters, Roosters, Rabbitohs, Rabbitohs, Rabbitohs, Rabbitohs, Roosters, Roosters, Roosters, Roosters, Rabbitohs, Rabbitohs, Rabbitohs, Rabbitohs, Roosters, Roosters, Roosters, Roosters, Rabbitohs, Rabbitohs, Rabbitohs, Rabbitohs, Roosters, Roosters, Roosters, Roosters, Rabbitohs, Rabbitohs, Rabbitohs, Rabbitohs, Roosters, Roosters, Roosters, Roosters, Rabbitohs, Rabbitohs, Rabbitohs, Rabbitohs, Roosters, Roosters, Roosters, Roosters, Rabbitohs, Rabbitohs, Rabbitohs, Rabbitohs, Roosters, Roosters, Roosters, Roosters, Rabbitohs, Rabbitohs, Rabbitohs, Rabbitohs, Roosters, Roosters, Roosters, Roosters, Rabbitohs, Rabbitohs, Rabbitohs, Rabbitohs, Roosters, Roosters, Roosters, Roosters, Rabbitohs, Rabbitohs, Rabbitohs, Rabbitohs, Roosters, Roosters, Roosters, Roosters, Rabbitohs, Rabbitohs, Rabbitohs, Rabbitohs, Roosters, Roosters, Roosters, Roosters, Rabbitohs, Rabbitohs, Rabbitohs, Rabbitohs, Roosters, Roosters, Roosters, Roosters, Rabbitohs, Rabbitohs, Rabbitohs, Rabbitohs, Roosters, Roosters, Roosters, Roosters, Rabbitohs, Rabbitohs, Rabbitohs, Rabbitohs, Roosters, Roosters, Roosters, Roosters, Rabbitohs, Rabbitohs, Rabbitohs, Rabbitohs, Roosters, Roosters, Roosters, Roosters, Rabbitohs, Rabbitohs, Rabbitohs, Rabbitohs, Roosters, Roosters, Roosters, Roosters, Rabbitohs, Rabbitohs, Rabbitohs, Rabbitohs, Roosters, Roosters, Roosters, Roosters, Rabbitohs, Rabbitohs, Rabbitohs, Rabbitohs, Roosters, Roosters, Roosters, Roosters, Rabbitohs, Rabbitohs, Rabbitohs, Rabbitohs, Roosters, Roosters, Roosters, Roosters, Rabbitohs, Rabbitohs, Rabbitohs, Rabbitohs, Roosters, Roosters, Roosters, Roosters, Rabbitohs, Rabbitohs, Rabbitohs, Rabbitohs, Roosters, Roosters, Roosters, Roosters, Rabbitohs, Rabbitohs, Rabbitohs, Rabbitohs, Roosters, Roosters, Roosters, Roosters, Rabbitohs, Rabbitohs, Rabbitohs, Rabbitohs, Roosters, Roosters, Roosters, Roosters, Rabbitohs, Rabbitohs, Rabbitohs, Rabbitohs, Roosters, Roosters, Roosters, Roosters
, Eels, Eels, Eels, Eels, Eels, Eels, Eels, Eels, Dragons, Dragons, Dragons, Dragons, Dragons, Dragons, Dragons, Dragons, Eels, Eels, Eels, Eels, Eels, Eels, Eels, Eels, Dragons, Dragons, Dragons, Dragons, Dragons, Dragons, Dragons, Dragons, Eels, Eels, Eels, Eels, Eels, Eels, Eels, Eels, Dragons, Dragons, Dragons, Dragons, Dragons, Dragons, Dragons, Dragons, Eels, Eels, Eels, Eels, Eels, Eels, Eels, Eels, Dragons, Dragons, Dragons, Dragons, Dragons, Dragons, Dragons, Dragons, Eels, Eels, Eels, Eels, Eels, Eels, Eels, Eels, Dragons, Dragons, Dragons, Dragons, Dragons, Dragons, Dragons, Dragons, Eels, Eels, Eels, Eels, Eels, Eels, Eels, Eels, Dragons, Dragons, Dragons, Dragons, Dragons, Dragons, Dragons, Dragons, Eels, Eels, Eels, Eels, Eels, Eels, Eels, Eels, Dragons, Dragons, Dragons, Dragons, Dragons, Dragons, Dragons, Dragons, Eels, Eels, Eels, Eels, Eels, Eels, Eels, Eels, Dragons, Dragons, Dragons, Dragons, Dragons, Dragons, Dragons, Dragons, Eels, Eels, Eels, Eels, Eels, Eels, Eels, Eels, Dragons, Dragons, Dragons, Dragons, Dragons, Dragons, Dragons, Dragons, Eels, Eels, Eels, Eels, Eels, Eels, Eels, Eels, Dragons, Dragons, Dragons, Dragons, Dragons, Dragons, Dragons, Dragons, Eels, Eels, Eels, Eels, Eels, Eels, Eels, Eels, Dragons, Dragons, Dragons, Dragons, Dragons, Dragons, Dragons, Dragons, Eels, Eels, Eels, Eels, Eels, Eels, Eels, Eels, Dragons, Dragons, Dragons, Dragons, Dragons, Dragons, Dragons, Dragons, Eels, Eels, Eels, Eels, Eels, Eels, Eels, Eels, Dragons, Dragons, Dragons, Dragons, Dragons, Dragons, Dragons, Dragons, Eels, Eels, Eels, Eels, Eels, Eels, Eels, Eels, Dragons, Dragons, Dragons, Dragons, Dragons, Dragons, Dragons, Dragons, Eels, Eels, Eels, Eels, Eels, Eels, Eels, Eels, Dragons, Dragons, Dragons, Dragons, Dragons, Dragons, Dragons, Dragons, Eels, Eels, Eels, Eels, Eels, Eels, Eels, Eels, Dragons, Dragons, Dragons, Dragons, Dragons, Dragons, Dragons, Dragons
, Titans, Titans, Titans, Titans, Titans, Titans, Titans, Titans, Titans, Titans, Titans, Titans, Titans, Titans, Titans, Titans, Dolphins, Dolphins, Dolphins, Dolphins, Dolphins, Dolphins, Dolphins, Dolphins, Dolphins, Dolphins, Dolphins, Dolphins, Dolphins, Dolphins, Dolphins, Dolphins, Titans, Titans, Titans, Titans, Titans, Titans, Titans, Titans, Titans, Titans, Titans, Titans, Titans, Titans, Titans, Titans, Dolphins, Dolphins, Dolphins, Dolphins, Dolphins, Dolphins, Dolphins, Dolphins, Dolphins, Dolphins, Dolphins, Dolphins, Dolphins, Dolphins, Dolphins, Dolphins, Titans, Titans, Titans, Titans, Titans, Titans, Titans, Titans, Titans, Titans, Titans, Titans, Titans, Titans, Titans, Titans, Dolphins, Dolphins, Dolphins, Dolphins, Dolphins, Dolphins, Dolphins, Dolphins, Dolphins, Dolphins, Dolphins, Dolphins, Dolphins, Dolphins, Dolphins, Dolphins, Titans, Titans, Titans, Titans, Titans, Titans, Titans, Titans, Titans, Titans, Titans, Titans, Titans, Titans, Titans, Titans, Dolphins, Dolphins, Dolphins, Dolphins, Dolphins, Dolphins, Dolphins, Dolphins, Dolphins, Dolphins, Dolphins, Dolphins, Dolphins, Dolphins, Dolphins, Dolphins, Titans, Titans, Titans, Titans, Titans, Titans, Titans, Titans, Titans, Titans, Titans, Titans, Titans, Titans, Titans, Titans, Dolphins, Dolphins, Dolphins, Dolphins, Dolphins, Dolphins, Dolphins, Dolphins, Dolphins, Dolphins, Dolphins, Dolphins, Dolphins, Dolphins, Dolphins, Dolphins, Titans, Titans, Titans, Titans, Titans, Titans, Titans, Titans, Titans, Titans, Titans, Titans, Titans, Titans, Titans, Titans, Dolphins, Dolphins, Dolphins, Dolphins, Dolphins, Dolphins, Dolphins, Dolphins, Dolphins, Dolphins, Dolphins, Dolphins, Dolphins, Dolphins, Dolphins, Dolphins, Titans, Titans, Titans, Titans, Titans, Titans, Titans, Titans, Titans, Titans, Titans, Titans, Titans, Titans, Titans, Titans, Dolphins, Dolphins, Dolphins, Dolphins, Dolphins, Dolphins, Dolphins, Dolphins, Dolphins, Dolphins, Dolphins, Dolphins, Dolphins, Dolphins, Dolphins, Dolphins, Titans, Titans, Titans, Titans, Titans, Titans, Titans, Titans, Titans, Titans, Titans, Titans, Titans, Titans, Titans, Titans, Dolphins, Dolphins, Dolphins, Dolphins, Dolphins, Dolphins, Dolphins, Dolphins, Dolphins, Dolphins, Dolphins, Dolphins, Dolphins, Dolphins, Dolphins, Dolphins
, Broncos, Broncos, Broncos, Broncos, Broncos, Broncos, Broncos, Broncos, Broncos, Broncos, Broncos, Broncos, Broncos, Broncos, Broncos, Broncos, Broncos, Broncos, Broncos, Broncos, Broncos, Broncos, Broncos, Broncos, Broncos, Broncos, Broncos, Broncos, Broncos, Broncos, Broncos, Broncos, Tigers, Tigers, Tigers, Tigers, Tigers, Tigers, Tigers, Tigers, Tigers, Tigers, Tigers, Tigers, Tigers, Tigers, Tigers, Tigers, Tigers, Tigers, Tigers, Tigers, Tigers, Tigers, Tigers, Tigers, Tigers, Tigers, Tigers, Tigers, Tigers, Tigers, Tigers, Tigers, Broncos, Broncos, Broncos, Broncos, Broncos, Broncos, Broncos, Broncos, Broncos, Broncos, Broncos, Broncos, Broncos, Broncos, Broncos, Broncos, Broncos, Broncos, Broncos, Broncos, Broncos, Broncos, Broncos, Broncos, Broncos, Broncos, Broncos, Broncos, Broncos, Broncos, Broncos, Broncos, Tigers, Tigers, Tigers, Tigers, Tigers, Tigers, Tigers, Tigers, Tigers, Tigers, Tigers, Tigers, Tigers, Tigers, Tigers, Tigers, Tigers, Tigers, Tigers, Tigers, Tigers, Tigers, Tigers, Tigers, Tigers, Tigers, Tigers, Tigers, Tigers, Tigers, Tigers, Tigers, Broncos, Broncos, Broncos, Broncos, Broncos, Broncos, Broncos, Broncos, Broncos, Broncos, Broncos, Broncos, Broncos, Broncos, Broncos, Broncos, Broncos, Broncos, Broncos, Broncos, Broncos, Broncos, Broncos, Broncos, Broncos, Broncos, Broncos, Broncos, Broncos, Broncos, Broncos, Broncos, Tigers, Tigers, Tigers, Tigers, Tigers, Tigers, Tigers, Tigers, Tigers, Tigers, Tigers, Tigers, Tigers, Tigers, Tigers, Tigers, Tigers, Tigers, Tigers, Tigers, Tigers, Tigers, Tigers, Tigers, Tigers, Tigers, Tigers, Tigers, Tigers, Tigers, Tigers, Tigers, Broncos, Broncos, Broncos, Broncos, Broncos, Broncos, Broncos, Broncos, Broncos, Broncos, Broncos, Broncos, Broncos, Broncos, Broncos, Broncos, Broncos, Broncos, Broncos, Broncos, Broncos, Broncos, Broncos, Broncos, Broncos, Broncos, Broncos, Broncos, Broncos, Broncos, Broncos, Broncos, Tigers, Tigers, Tigers, Tigers, Tigers, Tigers, Tigers, Tigers, Tigers, Tigers, Tigers, Tigers, Tigers, Tigers, Tigers, Tigers, Tigers, Tigers, Tigers, Tigers, Tigers, Tigers, Tigers, Tigers, Tigers, Tigers, Tigers, Tigers, Tigers, Tigers, Tigers, Tigers
, Manly, Manly, Manly, Manly, Manly, Manly, Manly, Manly, Manly, Manly, Manly, Manly, Manly, Manly, Manly, Manly, Manly, Manly, Manly, Manly, Manly, Manly, Manly, Manly, Manly, Manly, Manly, Manly, Manly, Manly, Manly, Manly, Manly, Manly, Manly, Manly, Manly, Manly, Manly, Manly, Manly, Manly, Manly, Manly, Manly, Manly, Manly, Manly, Manly, Manly, Manly, Manly, Manly, Manly, Manly, Manly, Manly, Manly, Manly, Manly, Manly, Manly, Manly, Manly, Storm, Storm, Storm, Storm, Storm, Storm, Storm, Storm, Storm, Storm, Storm, Storm, Storm, Storm, Storm, Storm, Storm, Storm, Storm, Storm, Storm, Storm, Storm, Storm, Storm, Storm, Storm, Storm, Storm, Storm, Storm, Storm, Storm, Storm, Storm, Storm, Storm, Storm, Storm, Storm, Storm, Storm, Storm, Storm, Storm, Storm, Storm, Storm, Storm, Storm, Storm, Storm, Storm, Storm, Storm, Storm, Storm, Storm, Storm, Storm, Storm, Storm, Storm, Storm, Manly, Manly, Manly, Manly, Manly, Manly, Manly, Manly, Manly, Manly, Manly, Manly, Manly, Manly, Manly, Manly, Manly, Manly, Manly, Manly, Manly, Manly, Manly, Manly, Manly, Manly, Manly, Manly, Manly, Manly, Manly, Manly, Manly, Manly, Manly, Manly, Manly, Manly, Manly, Manly, Manly, Manly, Manly, Manly, Manly, Manly, Manly, Manly, Manly, Manly, Manly, Manly, Manly, Manly, Manly, Manly, Manly, Manly, Manly, Manly, Manly, Manly, Manly, Manly, Storm, Storm, Storm, Storm, Storm, Storm, Storm, Storm, Storm, Storm, Storm, Storm, Storm, Storm, Storm, Storm, Storm, Storm, Storm, Storm, Storm, Storm, Storm, Storm, Storm, Storm, Storm, Storm, Storm, Storm, Storm, Storm, Storm, Storm, Storm, Storm, Storm, Storm, Storm, Storm, Storm, Storm, Storm, Storm, Storm, Storm, Storm, Storm, Storm, Storm, Storm, Storm, Storm, Storm, Storm, Storm, Storm, Storm, Storm, Storm, Storm, Storm, Storm, Storm
, Bulldogs, Bulldogs, Bulldogs, Bulldogs, Bulldogs, Bulldogs, Bulldogs, Bulldogs, Bulldogs, Bulldogs, Bulldogs, Bulldogs, Bulldogs, Bulldogs, Bulldogs, Bulldogs, Bulldogs, Bulldogs, Bulldogs, Bulldogs, Bulldogs, Bulldogs, Bulldogs, Bulldogs, Bulldogs, Bulldogs, Bulldogs, Bulldogs, Bulldogs, Bulldogs, Bulldogs, Bulldogs, Bulldogs, Bulldogs, Bulldogs, Bulldogs, Bulldogs, Bulldogs, Bulldogs, Bulldogs, Bulldogs, Bulldogs, Bulldogs, Bulldogs, Bulldogs, Bulldogs, Bulldogs, Bulldogs, Bulldogs, Bulldogs, Bulldogs, Bulldogs, Bulldogs, Bulldogs, Bulldogs, Bulldogs, Bulldogs, Bulldogs, Bulldogs, Bulldogs, Bulldogs, Bulldogs, Bulldogs, Bulldogs, Bulldogs, Bulldogs, Bulldogs, Bulldogs, Bulldogs, Bulldogs, Bulldogs, Bulldogs, Bulldogs, Bulldogs, Bulldogs, Bulldogs, Bulldogs, Bulldogs, Bulldogs, Bulldogs, Bulldogs, Bulldogs, Bulldogs, Bulldogs, Bulldogs, Bulldogs, Bulldogs, Bulldogs, Bulldogs, Bulldogs, Bulldogs, Bulldogs, Bulldogs, Bulldogs, Bulldogs, Bulldogs, Bulldogs, Bulldogs, Bulldogs, Bulldogs, Bulldogs, Bulldogs, Bulldogs, Bulldogs, Bulldogs, Bulldogs, Bulldogs, Bulldogs, Bulldogs, Bulldogs, Bulldogs, Bulldogs, Bulldogs, Bulldogs, Bulldogs, Bulldogs, Bulldogs, Bulldogs, Bulldogs, Bulldogs, Bulldogs, Bulldogs, Bulldogs, Bulldogs, Bulldogs, Bulldogs, Bulldogs, Bulldogs, Knights, Knights, Knights, Knights, Knights, Knights, Knights, Knights, Knights, Knights, Knights, Knights, Knights, Knights, Knights, Knights, Knights, Knights, Knights, Knights, Knights, Knights, Knights, Knights, Knights, Knights, Knights, Knights, Knights, Knights, Knights, Knights, Knights, Knights, Knights, Knights, Knights, Knights, Knights, Knights, Knights, Knights, Knights, Knights, Knights, Knights, Knights, Knights, Knights, Knights, Knights, Knights, Knights, Knights, Knights, Knights, Knights, Knights, Knights, Knights, Knights, Knights, Knights, Knights, Knights, Knights, Knights, Knights, Knights, Knights, Knights, Knights, Knights, Knights, Knights, Knights, Knights, Knights, Knights, Knights, Knights, Knights, Knights, Knights, Knights, Knights, Knights, Knights, Knights, Knights, Knights, Knights, Knights, Knights, Knights, Knights, Knights, Knights, Knights, Knights, Knights, Knights, Knights, Knights, Knights, Knights, Knights, Knights, Knights, Knights, Knights, Knights, Knights, Knights, Knights, Knights, Knights, Knights, Knights, Knights, Knights, Knights, Knights, Knights, Knights, Knights, Knights, Knights
Storm, 82.40100565681962, 82.56468615237182, 82.55465066438063, 82.71799854262812, 82.48060390018873, 82.06765301737369, 82.40699238009861, 81.96824596774194, 83.18149124910093, 82.59077004920867, 82.6097930338213, 80.66822494156469, 83.62406550373798, 82.96906640597723, 81.92270058708415, 82.20268006700168, 82.46670894102726, 82.76235124413992, 82.62879788639366, 82.81954887218045, 83.85214007782102, 82.86643773721309, 82.96885354539431, 81.3774528664871, 83.60995850622407, 83.43159178694857, 82.26148409893993, 82.48145094806264, 81.6865725660514, 83.668543845535, 82.25806451612904, 81.06895144838842, 83.41850220264317, 83.15872702115043, 81.89900426742533, 82.03015075376885, 83.1222123104371, 82.89606458123107, 82.34448040273283, 82.01560193970062, 83.9001376056615, 83.06029579067122, 83.04597701149426, 83.12159709618875, 84.20221169036336, 82.89221759207118, 82.20981252493019, 83.92474398666349, 84.1343669250646, 82.1186190616701, 84.64912280701753, 82.98013245033113, 82.74960794563513, 83.38442673206622, 83.44370860927152, 82.33082706766918, 82.82657657657657, 83.2010582010582, 83.53808353808354, 82.59668508287292, 85.03203261502621, 84.67081559122175, 84.68033775633293, 83.16618911174784, 93.87174108480671, 93.89887878146817, 93.83017715332926, 93.34350886118884, 93.93708584050574, 93.98419141209143, 93.55875152998776, 93.75439212930429, 93.93839019542895, 94.10424380518371, 93.35616438356165, 93.65487250444751, 94.20387531592249, 93.9761373557086, 94.21915444348576, 93.89442231075698, 94.17020326111235, 93.91514227642277, 93.65671641791045, 93.336698637052, 94.29491603404647, 94.31310743367482, 93.86991109031352, 94.05419626414101, 94.63240905621979, 94.31069074233305, 93.71833839918946, 93.85329080893013, 94.07665505226481, 94.69567690557452, 93.32264957264957, 94.18672930123311, 94.52137998056365, 94.25817555938038, 94.39859964991247, 93.87110664561504, 94.54590943207405, 94.40504892922989, 93.90085647547366, 93.84885764499121, 94.49754232659748, 94.16790781531708, 94.5433658816772, 94.21513944223108, 94.09872745070619, 94.46438541915929, 94.40255220417633, 93.91628812459442, 94.82014388489208, 93.94063459570113, 95.15108924806746, 93.97849462365592, 94.84038604305864, 94.23736075407027, 94.71608832807571, 94.29347826086956, 94.97005988023952, 93.97874852420307, 94.21965317919076, 94.02985074626866, 94.0813810110974, 94.7468504872831, 94.82312338222606, 94.78131212723659, 81.45053475935828, 81.65768444527039, 81.34680134680134, 81.30699088145896, 82.0945945945946, 82.12375859434682, 82.38519533927348, 81.08643933386202, 83.89360916143332, 82.51938796897925, 82.18562874251496, 80.95446584938703, 82.71604938271605, 81.09769018859929, 81.81126331811264, 82.6334208223972, 84.92890995260663, 81.17519042437432, 82.4847250509165, 82.67898383371825, 83.90342052313883, 82.82548476454294, 82.75154004106776, 82.06583427922814, 83.69942196531792, 82.58221680876979, 81.23620309050773, 82.35294117647058, 82.12226066897347, 83.57827476038338, 82.49400479616307, 82.25, 82.847533632287, 83.34820101100208, 83.35195530726257, 81.51629072681705, 83.65758754863813, 83.10618066561014, 82.29398663697106, 81.10964332892999, 83.44291691572026, 82.6393789696542, 81.65467625899281, 81.87290969899665, 82.91062801932367, 83.71198881509962, 82.77571251548946, 82.14285714285714, 81.65784832451499, 84.4106463878327, 86.28048780487805, 81.73076923076923, 84.60291734197732, 83.50230414746544, 79.16666666666666, 83.36557059961315, 84.45692883895131, 83.56605800214822, 82.87937743190662, 84.79657387580299, 85.14285714285714, 85.42713567839196, 81.20567375886525, 79.82062780269058, 93.87613082811413, 93.54336833916764, 92.75500476644424, 94.15064102564102, 93.84996620860554, 94.09237379162191, 93.86991109031352, 93.1423850179014, 94.28645294725956, 93.70812700262161, 93.34043686734151, 93.05473808122426, 93.68919274257166, 93.93115942028986, 93.02702702702703, 93.45998131423232, 94.30727023319616, 93.28, 93.30357142857143, 92.96939619520265, 93.51585014409221, 94.1640378548896, 94.39655172413794, 95.11184755592377, 94.60547504025764, 93.72256365232661, 94.5945945945946, 94.1952506596306, 94.75839475839476, 94.3278249218401, 93.47826086956522, 93.71011850501367, 94.20970266040689, 94.44204152249135, 94.41587068332109, 93.9524838012959, 94.40389294403893, 94.22907488986783, 93.80753138075313, 94.6866485013624, 94.62505418292155, 94.44174757281554, 94.96738117427772, 93.66583541147132, 94.00437636761488, 94.02226524685382, 93.3740191804708, 94.41368897835933, 93.27036599763872, 94.31818181818183, 94.92273730684326, 92.47572815533981, 94.37125748502993, 94.2948717948718, 91.94805194805194, 93.66106080206987, 93.67245657568239, 94.19869470630891, 95.47872340425532, 94.46022727272727, 95.25, 94.121969140338, 94.05405405405406, 94.60708782742681
