, Knights, Eels, Knights, Eels, Knights, Eels, Knights, Eels, Knights, Eels, Knights, Eels, Knights, Eels, Knights, Eels, Knights, Eels, Knights, Eels, Knights, Eels, Knights, Eels, Knights, Eels, Knights, Eels, Knights, Eels, Knights, Eels, Knights, Eels, Knights, Eels, Knights, Eels, Knights, Eels, Knights, Eels, Knights, Eels, Knights, Eels, Knights, Eels, Knights, Eels, Knights, Eels, Knights, Eels, Knights, Eels, Knights, Eels, Knights, Eels, Knights, Eels, Knights, Eels, Knights, Eels, Knights, Eels, Knights, Eels, Knights, Eels, Knights, Eels, Knights, Eels, Knights, Eels, Knights, Eels, Knights, Eels, Knights, Eels, Knights, Eels, Knights, Eels, Knights, Eels, Knights, Eels, Knights, Eels, Knights, Eels, Knights, Eels, Knights, Eels, Knights, Eels, Knights, Eels, Knights, Eels, Knights, Eels, Knights, Eels, Knights, Eels, Knights, Eels, Knights, Eels, Knights, Eels, Knights, Eels, Knights, Eels, Knights, Eels, Knights, Eels, Knights, Eels, Knights, Eels, Knights, Eels, Knights, Eels, Knights, Eels, Knights, Eels, Knights, Eels, Knights, Eels, Knights, Eels, Knights, Eels, Knights, Eels, Knights, Eels, Knights, Eels, Knights, Eels, Knights, Eels, Knights, Eels, Knights, Eels, Knights, Eels, Knights, Eels, Knights, Eels, Knights, Eels, Knights, Eels, Knights, Eels, Knights, Eels, Knights, Eels, Knights, Eels, Knights, Eels, Knights, Eels, Knights, Eels, Knights, Eels, Knights, Eels, Knights, Eels, Knights, Eels, Knights, Eels, Knights, Eels, Knights, Eels, Knights, Eels, Knights, Eels, Knights, Eels, Knights, Eels, Knights, Eels, Knights, Eels, Knights, Eels, Knights, Eels, Knights, Eels, Knights, Eels, Knights, Eels, Knights, Eels, Knights, Eels, Knights, Eels, Knights, Eels, Knights, Eels, Knights, Eels, Knights, Eels, Knights, Eels, Knights, Eels, Knights, Eels, Knights, Eels, Knights, Eels, Knights, Eels, Knights, Eels, Knights, Eels, Knights, Eels, Knights, Eels, Knights, Eels
, Bulldogs, Bulldogs, Roosters, Roosters, Bulldogs, Bulldogs, Roosters, Roosters, Bulldogs, Bulldogs, Roosters, Roosters, Bulldogs, Bulldogs, Roosters, Roosters, Bulldogs, Bulldogs, Roosters, Roosters, Bulldogs, Bulldogs, Roosters, Roosters, Bulldogs, Bulldogs, Roosters, Roosters, Bulldogs, Bulldogs, Roosters, Roosters, Bulldogs, Bulldogs, Roosters, Roosters, Bulldogs, Bulldogs, Roosters, Roosters, Bulldogs, Bulldogs, Roosters, Roosters, Bulldogs, Bulldogs, Roosters, Roosters, Bulldogs, Bulldogs, Roosters, Roosters, Bulldogs, Bulldogs, Roosters, Roosters, Bulldogs, Bulldogs, Roosters, Roosters, Bulldogs, Bulldogs, Roosters, Roosters, Bulldogs, Bulldogs, Roosters, Roosters, Bulldogs, Bulldogs, Roosters, Roosters, Bulldogs, Bulldogs, Roosters, Roosters, Bulldogs, Bulldogs, Roosters, Roosters, Bulldogs, Bulldogs, Roosters, Roosters, Bulldogs, Bulldogs, Roosters, Roosters, Bulldogs, Bulldogs, Roosters, Roosters, Bulldogs, Bulldogs, Roosters, Roosters, Bulldogs, Bulldogs, Roosters, Roosters, Bulldogs, Bulldogs, Roosters, Roosters, Bulldogs, Bulldogs, Roosters, Roosters, Bulldogs, Bulldogs, Roosters, Roosters, Bulldogs, Bulldogs, Roosters, Roosters, Bulldogs, Bulldogs, Roosters, Roosters, Bulldogs, Bulldogs, Roosters, Roosters, Bulldogs, Bulldogs, Roosters, Roosters, Bulldogs, Bulldogs, Roosters, Roosters, Bulldogs, Bulldogs, Roosters, Roosters, Bulldogs, Bulldogs, Roosters, Roosters, Bulldogs, Bulldogs, Roosters, Roosters, Bulldogs, Bulldogs, Roosters, Roosters, Bulldogs, Bulldogs, Roosters, Roosters, Bulldogs, Bulldogs, Roosters, Roosters, Bulldogs, Bulldogs, Roosters, Roosters, Bulldogs, Bulldogs, Roosters, Roosters, Bulldogs, Bulldogs, Roosters, Roosters, Bulldogs, Bulldogs, Roosters, Roosters, Bulldogs, Bulldogs, Roosters, Roosters, Bulldogs, Bulldogs, Roosters, Roosters, Bulldogs, Bulldogs, Roosters, Roosters, Bulldogs, Bulldogs, Roosters, Roosters, Bulldogs, Bulldogs, Roosters, Roosters, Bulldogs, Bulldogs, Roosters, Roosters, Bulldogs, Bulldogs, Roosters, Roosters, Bulldogs, Bulldogs, Roosters, Roosters, Bulldogs, Bulldogs, Roosters, Roosters, Bulldogs, Bulldogs, Roosters, Roosters, Bulldogs, Bulldogs, Roosters, Roosters, Bulldogs, Bulldogs, Roosters, Roosters, Bulldogs, Bulldogs, Roosters, Roosters, Bulldogs, Bulldogs, Roosters, Roosters, Bulldogs, Bulldogs, Roosters, Roosters, Bulldogs, Bulldogs, Roosters, Roosters, Bulldogs, Bulldogs, Roosters, Roosters, Bulldogs, Bulldogs, Roosters, Roosters, Bulldogs, Bulldogs, Roosters, Roosters, Bulldogs, Bulldogs, Roosters, Roosters, Bulldogs, Bulldogs, Roosters, Roosters
, Dolphins, Dolphins, Dolphins, Dolphins, Warriors, Warriors, Warriors, Warriors, Dolphins, Dolphins, Dolphins, Dolphins, Warriors, Warriors, Warriors, Warriors, Dolphins, Dolphins, Dolphins, Dolphins, Warriors, Warriors, Warriors, Warriors, Dolphins, Dolphins, Dolphins, Dolphins, Warriors, Warriors, Warriors, Warriors, Dolphins, Dolphins, Dolphins, Dolphins, Warriors, Warriors, Warriors, Warriors, Dolphins, Dolphins, Dolphins, Dolphins, Warriors, Warriors, Warriors, Warriors, Dolphins, Dolphins, Dolphins, Dolphins, Warriors, Warriors, Warriors, Warriors, Dolphins, Dolphins, Dolphins, Dolphins, Warriors, Warriors, Warriors, Warriors, Dolphins, Dolphins, Dolphins, Dolphins, Warriors, Warriors, Warriors, Warriors, Dolphins, Dolphins, Dolphins, Dolphins, Warriors, Warriors, Warriors, Warriors, Dolphins, Dolphins, Dolphins, Dolphins, Warriors, Warriors, Warriors, Warriors, Dolphins, Dolphins, Dolphins, Dolphins, Warriors, Warriors, Warriors, Warriors, Dolphins, Dolphins, Dolphins, Dolphins, Warriors, Warriors, Warriors, Warriors, Dolphins, Dolphins, Dolphins, Dolphins, Warriors, Warriors, Warriors, Warriors, Dolphins, Dolphins, Dolphins, Dolphins, Warriors, Warriors, Warriors, Warriors, Dolphins, Dolphins, Dolphins, Dolphins, Warriors, Warriors, Warriors, Warriors, Dolphins, Dolphins, Dolphins, Dolphins, Warriors, Warriors, Warriors, Warriors, Dolphins, Dolphins, Dolphins, Dolphins, Warriors, Warriors, Warriors, Warriors, Dolphins, Dolphins, Dolphins, Dolphins, Warriors, Warriors, Warriors, Warriors, Dolphins, Dolphins, Dolphins, Dolphins, Warriors, Warriors, Warriors, Warriors, Dolphins, Dolphins, Dolphins, Dolphins, Warriors, Warriors, Warriors, Warriors, Dolphins, Dolphins, Dolphins, Dolphins, Warriors, Warriors, Warriors, Warriors, Dolphins, Dolphins, Dolphins, Dolphins, Warriors, Warriors, Warriors, Warriors, Dolphins, Dolphins, Dolphins, Dolphins, Warriors, Warriors, Warriors, Warriors, Dolphins, Dolphins, Dolphins, Dolphins, Warriors, Warriors, Warriors, Warriors, Dolphins, Dolphins, Dolphins, Dolphins, Warriors, Warriors, Warriors, Warriors, Dolphins, Dolphins, Dolphins, Dolphins, Warriors, Warriors, Warriors, Warriors, Dolphins, Dolphins, Dolphins, Dolphins, Warriors, Warriors, Warriors, Warriors, Dolphins, Dolphins, Dolphins, Dolphins, Warriors, Warriors, Warriors, Warriors, Dolphins, Dolphins, Dolphins, Dolphins, Warriors, Warriors, Warriors, Warriors, Dolphins, Dolphins, Dolphins, Dolphins, Warriors, Warriors, Warriors, Warriors, Dolphins, Dolphins, Dolphins, Dolphins, Warriors, Warriors, Warriors, Warriors
, Cowboys, Cowboys, Cowboys, Cowboys, Cowboys, Cowboys, Cowboys, Cowboys, Manly, Manly, Manly, Manly, Manly, Manly, Manly, Manly, Cowboys, Cowboys, Cowboys, Cowboys, Cowboys, Cowboys, Cowboys, Cowboys, Manly, Manly, Manly, Manly, Manly, Manly, Manly, Manly, Cowboys, Cowboys, Cowboys, Cowboys, Cowboys, Cowboys, Cowboys, Cowboys, Manly, Manly, Manly, Manly, Manly, Manly, Manly, Manly, Cowboys, Cowboys, Cowboys, Cowboys, Cowboys, Cowboys, Cowboys, Cowboys, Manly, Manly, Manly, Manly, Manly, Manly, Manly, Manly, Cowboys, Cowboys, Cowboys, Cowboys, Cowboys, Cowboys, Cowboys, Cowboys, Manly, Manly, Manly, Manly, Manly, Manly, Manly, Manly, Cowboys, Cowboys, Cowboys, Cowboys, Cowboys, Cowboys, Cowboys, Cowboys, Manly, Manly, Manly, Manly, Manly, Manly, Manly, Manly, Cowboys, Cowboys, Cowboys, Cowboys, Cowboys, Cowboys, Cowboys, Cowboys, Manly, Manly, Manly, Manly, Manly, Manly, Manly, Manly, Cowboys, Cowboys, Cowboys, Cowboys, Cowboys, Cowboys, Cowboys, Cowboys, Manly, Manly, Manly, Manly, Manly, Manly, Manly, Manly, Cowboys, Cowboys, Cowboys, Cowboys, Cowboys, Cowboys, Cowboys, Cowboys, Manly, Manly, Manly, Manly, Manly, Manly, Manly, Manly, Cowboys, Cowboys, Cowboys, Cowboys, Cowboys, Cowboys, Cowboys, Cowboys, Manly, Manly, Manly, Manly, Manly, Manly, Manly, Manly, Cowboys, Cowboys, Cowboys, Cowboys, Cowboys, Cowboys, Cowboys, Cowboys, Manly, Manly, Manly, Manly, Manly, Manly, Manly, Manly, Cowboys, Cowboys, Cowboys, Cowboys, Cowboys, Cowboys, Cowboys, Cowboys, Manly, Manly, Manly, Manly, Manly, Manly, Manly, Manly, Cowboys, Cowboys, Cowboys, Cowboys, Cowboys, Cowboys, Cowboys, Cowboys, Manly, Manly, Manly, Manly, Manly, Manly, Manly, Manly, Cowboys, Cowboys, Cowboys, Cowboys, Cowboys, Cowboys, Cowboys, Cowboys, Manly, Manly, Manly, Manly, Manly, Manly, Manly, Manly, Cowboys, Cowboys, Cowboys, Cowboys, Cowboys, Cowboys, Cowboys, Cowboys, Manly, Manly, Manly, Manly, Manly, Manly, Manly, Manly, Cowboys, Cowboys, Cowboys, Cowboys, Cowboys, Cowboys, Cowboys, Cowboys, Manly, Manly, Manly, Manly, Manly, Manly, Manly, Manly
, Sharks, Sharks, Sharks, Sharks, Sharks, Sharks, Sharks, Sharks, Sharks, Sharks, Sharks, Sharks, Sharks, Sharks, Sharks, Sharks, Storm, Storm, Storm, Storm, Storm, Storm, Storm, Storm, Storm, Storm, Storm, Storm, Storm, Storm, Storm, Storm, Sharks, Sharks, Sharks, Sharks, Sharks, Sharks, Sharks, Sharks, Sharks, Sharks, Sharks, Sharks, Sharks, Sharks, Sharks, Sharks, Storm, Storm, Storm, Storm, Storm, Storm, Storm, Storm, Storm, Storm, Storm, Storm, Storm, Storm, Storm, Storm, Sharks, Sharks, Sharks, Sharks, Sharks, Sharks, Sharks, Sharks, Sharks, Sharks, Sharks, Sharks, Sharks, Sharks, Sharks, Sharks, Storm, Storm, Storm, Storm, Storm, Storm, Storm, Storm, Storm, Storm, Storm, Storm, Storm, Storm, Storm, Storm, Sharks, Sharks, Sharks, Sharks, Sharks, Sharks, Sharks, Sharks, Sharks, Sharks, Sharks, Sharks, Sharks, Sharks, Sharks, Sharks, Storm, Storm, Storm, Storm, Storm, Storm, Storm, Storm, Storm, Storm, Storm, Storm, Storm, Storm, Storm, Storm, Sharks, Sharks, Sharks, Sharks, Sharks, Sharks, Sharks, Sharks, Sharks, Sharks, Sharks, Sharks, Sharks, Sharks, Sharks, Sharks, Storm, Storm, Storm, Storm, Storm, Storm, Storm, Storm, Storm, Storm, Storm, Storm, Storm, Storm, Storm, Storm, Sharks, Sharks, Sharks, Sharks, Sharks, Sharks, Sharks, Sharks, Sharks, Sharks, Sharks, Sharks, Sharks, Sharks, Sharks, Sharks, Storm, Storm, Storm, Storm, Storm, Storm, Storm, Storm, Storm, Storm, Storm, Storm, Storm, Storm, Storm, Storm, Sharks, Sharks, Sharks, Sharks, Sharks, Sharks, Sharks, Sharks, Sharks, Sharks, Sharks, Sharks, Sharks, Sharks, Sharks, Sharks, Storm, Storm, Storm, Storm, Storm, Storm, Storm, Storm, Storm, Storm, Storm, Storm, Storm, Storm, Storm, Storm, Sharks, Sharks, Sharks, Sharks, Sharks, Sharks, Sharks, Sharks, Sharks, Sharks, Sharks, Sharks, Sharks, Sharks, Sharks, Sharks, Storm, Storm, Storm, Storm, Storm, Storm, Storm, Storm, Storm, Storm, Storm, Storm, Storm, Storm, Storm, Storm
, Broncos, Broncos, Broncos, Broncos, Broncos, Broncos, Broncos, Broncos, Broncos, Broncos, Broncos, Broncos, Broncos, Broncos, Broncos, Broncos, Broncos, Broncos, Broncos, Broncos, Broncos, Broncos, Broncos, Broncos, Broncos, Broncos, Broncos, Broncos, Broncos, Broncos, Broncos, Broncos, Dragons, Dragons, Dragons, Dragons, Dragons, Dragons, Dragons, Dragons, Dragons, Dragons, Dragons, Dragons, Dragons, Dragons, Dragons, Dragons, Dragons, Dragons, Dragons, Dragons, Dragons, Dragons, Dragons, Dragons, Dragons, Dragons, Dragons, Dragons, Dragons, Dragons, Dragons, Dragons, Broncos, Broncos, Broncos, Broncos, Broncos, Broncos, Broncos, Broncos, Broncos, Broncos, Broncos, Broncos, Broncos, Broncos, Broncos, Broncos, Broncos, Broncos, Broncos, Broncos, Broncos, Broncos, Broncos, Broncos, Broncos, Broncos, Broncos, Broncos, Broncos, Broncos, Broncos, Broncos, Dragons, Dragons, Dragons, Dragons, Dragons, Dragons, Dragons, Dragons, Dragons, Dragons, Dragons, Dragons, Dragons, Dragons, Dragons, Dragons, Dragons, Dragons, Dragons, Dragons, Dragons, Dragons, Dragons, Dragons, Dragons, Dragons, Dragons, Dragons, Dragons, Dragons, Dragons, Dragons, Broncos, Broncos, Broncos, Broncos, Broncos, Broncos, Broncos, Broncos, Broncos, Broncos, Broncos, Broncos, Broncos, Broncos, Broncos, Broncos, Broncos, Broncos, Broncos, Broncos, Broncos, Broncos, Broncos, Broncos, Broncos, Broncos, Broncos, Broncos, Broncos, Broncos, Broncos, Broncos, Dragons, Dragons, Dragons, Dragons, Dragons, Dragons, Dragons, Dragons, Dragons, Dragons, Dragons, Dragons, Dragons, Dragons, Dragons, Dragons, Dragons, Dragons, Dragons, Dragons, Dragons, Dragons, Dragons, Dragons, Dragons, Dragons, Dragons, Dragons, Dragons, Dragons, Dragons, Dragons, Broncos, Broncos, Broncos, Broncos, Broncos, Broncos, Broncos, Broncos, Broncos, Broncos, Broncos, Broncos, Broncos, Broncos, Broncos, Broncos, Broncos, Broncos, Broncos, Broncos, Broncos, Broncos, Broncos, Broncos, Broncos, Broncos, Broncos, Broncos, Broncos, Broncos, Broncos, Broncos, Dragons, Dragons, Dragons, Dragons, Dragons, Dragons, Dragons, Dragons, Dragons, Dragons, Dragons, Dragons, Dragons, Dragons, Dragons, Dragons, Dragons, Dragons, Dragons, Dragons, Dragons, Dragons, Dragons, Dragons, Dragons, Dragons, Dragons, Dragons, Dragons, Dragons, Dragons, Dragons
, Raiders, Raiders, Raiders, Raiders, Raiders, Raiders, Raiders, Raiders, Raiders, Raiders, Raiders, Raiders, Raiders, Raiders, Raiders, Raiders, Raiders, Raiders, Raiders, Raiders, Raiders, Raiders, Raiders, Raiders, Raiders, Raiders, Raiders, Raiders, Raiders, Raiders, Raiders, Raiders, Raiders, Raiders, Raiders, Raiders, Raiders, Raiders, Raiders, Raiders, Raiders, Raiders, Raiders, Raiders, Raiders, Raiders, Raiders, Raiders, Raiders, Raiders, Raiders, Raiders, Raiders, Raiders, Raiders, Raiders, Raiders, Raiders, Raiders, Raiders, Raiders, Raiders, Raiders, Raiders, Titans, Titans, Titans, Titans, Titans, Titans, Titans, Titans, Titans, Titans, Titans, Titans, Titans, Titans, Titans, Titans, Titans, Titans, Titans, Titans, Titans, Titans, Titans, Titans, Titans, Titans, Titans, Titans, Titans, Titans, Titans, Titans, Titans, Titans, Titans, Titans, Titans, Titans, Titans, Titans, Titans, Titans, Titans, Titans, Titans, Titans, Titans, Titans, Titans, Titans, Titans, Titans, Titans, Titans, Titans, Titans, Titans, Titans, Titans, Titans, Titans, Titans, Titans, Titans, Raiders, Raiders, Raiders, Raiders, Raiders, Raiders, Raiders, Raiders, Raiders, Raiders, Raiders, Raiders, Raiders, Raiders, Raiders, Raiders, Raiders, Raiders, Raiders, Raiders, Raiders, Raiders, Raiders, Raiders, Raiders, Raiders, Raiders, Raiders, Raiders, Raiders, Raiders, Raiders, Raiders, Raiders, Raiders, Raiders, Raiders, Raiders, Raiders, Raiders, Raiders, Raiders, Raiders, Raiders, Raiders, Raiders, Raiders, Raiders, Raiders, Raiders, Raiders, Raiders, Raiders, Raiders, Raiders, Raiders, Raiders, Raiders, Raiders, Raiders, Raiders, Raiders, Raiders, Raiders, Titans, Titans, Titans, Titans, Titans, Titans, Titans, Titans, Titans, Titans, Titans, Titans, Titans, Titans, Titans, Titans, Titans, Titans, Titans, Titans, Titans, Titans, Titans, Titans, Titans, Titans, Titans, Titans, Titans, Titans, Titans, Titans, Titans, Titans, Titans, Titans, Titans, Titans, Titans, Titans, Titans, Titans, Titans, Titans, Titans, Titans, Titans, Titans, Titans, Titans, Titans, Titans, Titans, Titans, Titans, Titans, Titans, Titans, Titans, Titans, Titans, Titans, Titans, Titans
, Tigers, Tigers, Tigers, Tigers, Tigers, Tigers, Tigers, Tigers, Tigers, Tigers, Tigers, Tigers, Tigers, Tigers, Tigers, Tigers, Tigers, Tigers, Tigers, Tigers, Tigers, Tigers, Tigers, Tigers, Tigers, Tigers, Tigers, Tigers, Tigers, Tigers, Tigers, Tigers, Tigers, Tigers, Tigers, Tigers, Tigers, Tigers, Tigers, Tigers, Tigers, Tigers, Tigers, Tigers, Tigers, Tigers, Tigers, Tigers, Tigers, Tigers, Tigers, Tigers, Tigers, Tigers, Tigers, Tigers, Tigers, Tigers, Tigers, Tigers, Tigers, Tigers, Tigers, Tigers, Tigers, Tigers, Tigers, Tigers, Tigers, Tigers, Tigers, Tigers, Tigers, Tigers, Tigers, Tigers, Tigers, Tigers, Tigers, Tigers, Tigers, Tigers, Tigers, Tigers, Tigers, Tigers, Tigers, Tigers, Tigers, Tigers, Tigers, Tigers, Tigers, Tigers, Tigers, Tigers, Tigers, Tigers, Tigers, Tigers, Tigers, Tigers, Tigers, Tigers, Tigers, Tigers, Tigers, Tigers, Tigers, Tigers, Tigers, Tigers, Tigers, Tigers, Tigers, Tigers, Tigers, Tigers, Tigers, Tigers, Tigers, Tigers, Tigers, Tigers, Tigers, Tigers, Tigers, Tigers, Rabbitohs, Rabbitohs, Rabbitohs, Rabbitohs, Rabbitohs, Rabbitohs, Rabbitohs, Rabbitohs, Rabbitohs, Rabbitohs, Rabbitohs, Rabbitohs, Rabbitohs, Rabbitohs, Rabbitohs, Rabbitohs, Rabbitohs, Rabbitohs, Rabbitohs, Rabbitohs, Rabbitohs, Rabbitohs, Rabbitohs, Rabbitohs, Rabbitohs, Rabbitohs, Rabbitohs, Rabbitohs, Rabbitohs, Rabbitohs, Rabbitohs, Rabbitohs, Rabbitohs, Rabbitohs, Rabbitohs, Rabbitohs, Rabbitohs, Rabbitohs, Rabbitohs, Rabbitohs, Rabbitohs, Rabbitohs, Rabbitohs, Rabbitohs, Rabbitohs, Rabbitohs, Rabbitohs, Rabbitohs, Rabbitohs, Rabbitohs, Rabbitohs, Rabbitohs, Rabbitohs, Rabbitohs, Rabbitohs, Rabbitohs, Rabbitohs, Rabbitohs, Rabbitohs, Rabbitohs, Rabbitohs, Rabbitohs, Rabbitohs, Rabbitohs, Rabbitohs, Rabbitohs, Rabbitohs, Rabbitohs, Rabbitohs, Rabbitohs, Rabbitohs, Rabbitohs, Rabbitohs, Rabbitohs, Rabbitohs, Rabbitohs, Rabbitohs, Rabbitohs, Rabbitohs, Rabbitohs, Rabbitohs, Rabbitohs, Rabbitohs, Rabbitohs, Rabbitohs, Rabbitohs, Rabbitohs, Rabbitohs, Rabbitohs, Rabbitohs, Rabbitohs, Rabbitohs, Rabbitohs, Rabbitohs, Rabbitohs, Rabbitohs, Rabbitohs, Rabbitohs, Rabbitohs, Rabbitohs, Rabbitohs, Rabbitohs, Rabbitohs, Rabbitohs, Rabbitohs, Rabbitohs, Rabbitohs, Rabbitohs, Rabbitohs, Rabbitohs, Rabbitohs, Rabbitohs, Rabbitohs, Rabbitohs, Rabbitohs, Rabbitohs, Rabbitohs, Rabbitohs, Rabbitohs, Rabbitohs, Rabbitohs, Rabbitohs, Rabbitohs, Rabbitohs, Rabbitohs, Rabbitohs, Rabbitohs, Rabbitohs
Storm, 12.866465374500827, 13.473145780051151, 19.047619047619047, 19.64198136341344, 10.431963383236388, 11.045991854574352, 17.0064874884152, 16.924191211974893, 14.838597709128775, 14.190932546995946, 19.403630077787383, 23.287057769816393, 12.018826693561943, 12.027245025990322, 17.052023121387283, 16.587060356057318, 32.12020627111612, 32.56177666562402, 43.76992176180817, 44.327858880778585, 29.378363991246232, 29.767782044249408, 40.31741612139774, 39.34162399414777, 34.24331058390207, 34.140944794778186, 46.88221709006928, 44.81927710843374, 32.05328338016443, 30.538790738505433, 40.868681737363474, 42.0997920997921, 13.68826719954325, 13.490650044523598, 22.127514490282987, 21.272792277440114, 12.135922330097088, 11.640513552068473, 17.062562730010036, 17.34982332155477, 13.892365456821027, 14.813843733613005, 21.299188007495314, 21.873074553296366, 12.469850458273033, 12.898330804248861, 19.126328217237308, 19.12568306010929, 33.59993045292533, 33.984409999104024, 46.688879633486046, 45.65888056412516, 31.13858055835856, 31.06488011283498, 41.35814690160365, 40.797085922434114, 36.13816189896531, 36.09794628751975, 47.97773654916512, 50.231481481481474, 33.03021413904371, 32.9660096228465, 45.323221379559406, 42.86245353159852, 14.48382126348228, 13.14784506273868, 21.62849872773537, 21.038961038961038, 11.01566447700859, 13.10344827586207, 20.77922077922078, 17.843866171003718, 14.800759013282732, 16.85823754789272, 24.288840262582056, 28.08219178082192, 12.577502214348982, 12.465627864344638, 19.599109131403118, 21.68141592920354, 35.10835913312694, 35.15111695137976, 48.33456698741673, 46.437149719775825, 32.004981320049815, 31.4975845410628, 42.98375184638109, 42.028985507246375, 37.034980566352026, 36.77884615384615, 52.054794520547944, 49.327354260089685, 30.58690744920993, 34.58162668227033, 43.67666232073012, 45.507246376811594, 15.6158357771261, 14.98847040737894, 19.52861952861953, 25.6140350877193, 14.864864864864865, 13.948339483394834, 18.448275862068968, 21.428571428571427, 16.481994459833796, 18.620689655172416, 29.96941896024465, 24.085365853658537, 13.451776649746192, 13.537675606641125, 22.79202279202279, 24.675324675324674, 36.86514886164623, 37.04212454212454, 50.332594235033255, 50.21978021978022, 33.063139931740615, 32.08159480760315, 45.00525762355415, 44.12081984897519, 40.09942004971003, 38.89845094664372, 52.84552845528455, 54.24430641821946, 35.524372230428355, 32.926829268292686, 45.16129032258064, 45.28301886792453, 12.489934687304286, 12.690118503312494, 18.601190476190478, 19.753086419753085, 10.877434925012928, 10.999543587403013, 16.75977653631285, 16.405074177596216, 12.566975158304919, 13.20971447325238, 21.447928765001937, 20.82810539523212, 11.37947050627032, 11.157556270096464, 18.17512877115526, 18.80539499036609, 32.72458045409674, 32.59491864116472, 44.07008086253369, 44.38685036147865, 29.099515983192383, 30.10571300044984, 38.93326462251997, 39.69789320259706, 33.115338882283, 35.07970352320032, 46.146549679867206, 44.96870486278286, 30.382026732391697, 30.902879453391897, 41.89891355692017, 40.75374531835206, 12.648425400103253, 13.96030371653124, 19.576399394856278, 20.27027027027027, 11.581067472306144, 11.775385812475685, 17.529165420281185, 17.451523545706372, 13.648648648648647, 13.636363636363635, 22.154696132596683, 21.76759410801964, 12.197778261816598, 12.686738680763042, 18.196371398078977, 17.277200656096227, 33.798017348203224, 34.418604651162795, 44.299614466678904, 44.292415949960905, 31.017350760528934, 31.348110751755147, 40.98478066248881, 41.79307662388176, 35.50097683505442, 36.55536028119508, 47.17863105175292, 46.44483362521891, 31.54471544715447, 30.92375366568915, 41.629104958145525, 44.056891296986116, 14.827096162955943, 13.164193393968407, 21.896162528216703, 21.980413492927095, 12.982296867907401, 11.852207293666027, 19.37639198218263, 18.50613154960981, 15.144032921810698, 13.386524822695037, 23.89937106918239, 23.060796645702304, 12.470588235294118, 14.332247557003258, 20.650095602294456, 21.042471042471043, 34.77043673012318, 34.16965352449223, 48.63636363636364, 48.67647058823529, 32.611080636313766, 32.312535775615345, 43.51145038167939, 44.44444444444444, 36.41912512716175, 35.78378378378378, 51.01265822784811, 50.24691358024691, 32.640232108317214, 33.80281690140845, 47.97687861271676, 44.30844553243574, 14.682539682539684, 15.030885380919697, 21.69230769230769, 24.579124579124578, 13.4640522875817, 13.35131490222522, 18.865030674846626, 17.731629392971247, 17.84869976359338, 17.425227568270483, 23.229461756373937, 25.14450867052023, 13.85135135135135, 14.34108527131783, 20.679012345679013, 19.273743016759777, 36.879139072847686, 36.60675142481368, 48.18763326226013, 47.30417090539166, 31.699477701888306, 31.818181818181817, 44.896030245746694, 43.641618497109825, 37.08751793400287, 35.38219070133964, 52.38938053097345, 50.901803607214426, 32.97872340425532, 34.99267935578331, 46.478873239436616, 49.81818181818182
